"No.","Time","Source","Destination","Protocol","Length","Info"
"1","0.000000","100.86.87.79","104.18.35.30","TCP","66","60994  >  443 [SYN] Seq=0 Win=64240 Len=0 MSS=1460 WS=256 SACK_PERM"
"2","0.074987","104.18.35.30","100.86.87.79","TCP","66","443  >  60994 [SYN, ACK] Seq=0 Ack=1 Win=65535 Len=0 MSS=1400 SACK_PERM WS=8192"
"3","0.075384","100.86.87.79","104.18.35.30","TCP","54","60994  >  443 [ACK] Seq=1 Ack=1 Win=131584 Len=0"
"4","0.076392","100.86.87.79","104.18.35.30","TLSv1.3","1809","Client Hello (SNI=423b12fd7b819ec52acafed4ef462cb2.doordash.com)"
"5","0.109870","104.18.35.30","100.86.87.79","TCP","56","443  >  60994 [ACK] Seq=1 Ack=1756 Win=40960 Len=0"
"6","0.134949","104.18.35.30","100.86.87.79","TLSv1.3","1514","Server Hello, Change Cipher Spec"
"7","0.134949","104.18.35.30","100.86.87.79","TCP","1514","443  >  60994 [PSH, ACK] Seq=1461 Ack=1756 Win=40960 Len=1460 [TCP segment of a reassembled PDU]"
"8","0.134949","104.18.35.30","100.86.87.79","TCP","1514","443  >  60994 [ACK] Seq=2921 Ack=1756 Win=40960 Len=1460 [TCP segment of a reassembled PDU]"
"9","0.134949","104.18.35.30","100.86.87.79","TLSv1.3","1015","Application Data"
"10","0.135771","100.86.87.79","104.18.35.30","TCP","54","60994  >  443 [ACK] Seq=1756 Ack=5342 Win=131584 Len=0"
"11","0.138806","100.86.87.79","104.18.35.30","TLSv1.3","118","Change Cipher Spec, Application Data"
"12","0.139544","100.86.87.79","104.18.35.30","TLSv1.3","146","Application Data"
"13","0.140748","100.86.87.79","104.18.35.30","TLSv1.3","445","Application Data"
"14","0.189022","104.18.35.30","100.86.87.79","TLSv1.3","582","Application Data, Application Data"
"15","0.190111","100.86.87.79","104.18.35.30","TLSv1.3","85","Application Data"
"16","0.203484","104.18.35.30","100.86.87.79","TLSv1.3","85","Application Data"
"17","0.230773","104.18.35.30","100.86.87.79","TCP","56","443  >  60994 [ACK] Seq=5901 Ack=2303 Win=40960 Len=0"
"18","0.235819","104.18.35.30","100.86.87.79","TCP","56","443  >  60994 [ACK] Seq=5901 Ack=2334 Win=40960 Len=0"
"19","0.252409","100.86.87.79","104.18.35.30","TCP","54","60994  >  443 [ACK] Seq=2334 Ack=5901 Win=130816 Len=0"
"20","0.267921","104.18.35.30","100.86.87.79","TLSv1.3","812","Application Data"
"21","0.272268","100.86.87.79","104.18.35.30","TCP","66","60997  >  443 [SYN] Seq=0 Win=64240 Len=0 MSS=1460 WS=256 SACK_PERM"
"22","0.316780","104.18.35.30","100.86.87.79","TCP","66","443  >  60997 [SYN, ACK] Seq=0 Ack=1 Win=65535 Len=0 MSS=1400 SACK_PERM WS=8192"
"23","0.317315","100.86.87.79","104.18.35.30","TCP","54","60997  >  443 [ACK] Seq=1 Ack=1 Win=131584 Len=0"
"24","0.317638","100.86.87.79","104.18.35.30","TLSv1.3","1809","Client Hello (SNI=423b12fd7b819ec52acafed4ef462cb2.doordash.com)"
"25","0.322339","100.86.87.79","104.18.35.30","TCP","54","60994  >  443 [ACK] Seq=2334 Ack=6659 Win=130048 Len=0"
"26","0.391736","104.18.35.30","100.86.87.79","TCP","56","443  >  60997 [ACK] Seq=1 Ack=1756 Win=65536 Len=0"
"27","0.426255","104.18.35.30","100.86.87.79","TLSv1.3","4434","Server Hello, Change Cipher Spec"
"28","0.426255","104.18.35.30","100.86.87.79","TLSv1.3","1015","Application Data"
"29","0.427003","100.86.87.79","104.18.35.30","TCP","54","60997  >  443 [ACK] Seq=1756 Ack=5342 Win=131584 Len=0"
"30","0.427038","100.86.87.79","104.18.35.30","TLSv1.3","118","Change Cipher Spec, Application Data"
"31","0.427208","100.86.87.79","104.18.35.30","TLSv1.3","146","Application Data"
"32","0.427622","100.86.87.79","104.18.35.30","TLSv1.3","754","Application Data"
"33","0.427753","100.86.87.79","104.18.35.30","TLSv1.3","3538","Application Data"
"34","0.509455","104.18.35.30","100.86.87.79","TCP","1015","[TCP Spurious Retransmission] 443  >  60997 [PSH, ACK] Seq=4381 Ack=1756 Win=65536 Len=961 [TCP segment of a reassembled PDU]"
"35","0.509629","100.86.87.79","104.18.35.30","TCP","66","[TCP Dup ACK 29#1] 60997  >  443 [ACK] Seq=6096 Ack=5342 Win=131584 Len=0 SLE=4381 SRE=5342"
"36","0.614413","104.18.35.30","100.86.87.79","TLSv1.3","591","Application Data, Application Data"
"37","0.616294","100.86.87.79","104.18.35.30","TLSv1.3","85","Application Data"
"38","0.619259","104.18.35.30","100.86.87.79","TCP","56","443  >  60997 [ACK] Seq=5879 Ack=2612 Win=65536 Len=0"
"39","0.626703","104.18.35.30","100.86.87.79","TCP","56","443  >  60997 [ACK] Seq=5879 Ack=6096 Win=65536 Len=0"
"40","0.741559","104.18.35.30","100.86.87.79","TCP","56","443  >  60997 [ACK] Seq=5879 Ack=6127 Win=65536 Len=0"
"41","0.779787","104.18.35.30","100.86.87.79","TLSv1.3","105","[TCP Previous segment not captured] , Application Data"
"42","0.779787","104.18.35.30","100.86.87.79","TLSv1.3","85","Application Data"
"43","0.779864","100.86.87.79","104.18.35.30","TCP","66","[TCP Dup ACK 37#1] 60997  >  443 [ACK] Seq=6127 Ack=5879 Win=130816 Len=0 SLE=6541 SRE=6592"
"44","0.779904","100.86.87.79","104.18.35.30","TCP","66","[TCP Dup ACK 37#2] 60997  >  443 [ACK] Seq=6127 Ack=5879 Win=130816 Len=0 SLE=6541 SRE=6623"
"45","0.813360","104.18.35.30","100.86.87.79","TCP","716","[TCP Out-Of-Order] 443  >  60997 [PSH, ACK] Seq=5879 Ack=6127 Win=65536 Len=662"
"46","0.813501","100.86.87.79","104.18.35.30","TCP","54","60997  >  443 [ACK] Seq=6127 Ack=6623 Win=130304 Len=0"
"47","1.929670","100.86.87.79","104.18.35.30","TLSv1.3","283","Application Data"
"48","1.929839","100.86.87.79","104.18.35.30","TCP","15454","60994  >  443 [ACK] Seq=2563 Ack=6659 Win=130048 Len=15400 [TCP segment of a reassembled PDU]"
"49","1.946083","104.18.35.30","100.86.87.79","TCP","56","443  >  60994 [ACK] Seq=6659 Ack=3963 Win=40960 Len=0"
"50","1.946083","104.18.35.30","100.86.87.79","TCP","56","443  >  60994 [ACK] Seq=6659 Ack=6763 Win=40960 Len=0"
"51","1.946202","100.86.87.79","104.18.35.30","TLSv1.3","8454","Application Data"
"52","1.946401","104.18.35.30","100.86.87.79","TCP","56","443  >  60994 [ACK] Seq=6659 Ack=16563 Win=40960 Len=0"
"53","1.946440","100.86.87.79","104.18.35.30","TLSv1.3","6975","Application Data"
"54","1.963464","104.18.35.30","100.86.87.79","TCP","56","443  >  60994 [ACK] Seq=6659 Ack=19363 Win=40960 Len=0"
"55","1.970138","104.18.35.30","100.86.87.79","TLSv1.3","89","Application Data"
"56","1.970138","104.18.35.30","100.86.87.79","TCP","56","443  >  60994 [ACK] Seq=6694 Ack=29163 Win=40960 Len=0"
"57","1.970138","104.18.35.30","100.86.87.79","TCP","56","443  >  60994 [ACK] Seq=6694 Ack=31963 Win=40960 Len=0"
"58","2.012325","100.86.87.79","104.18.35.30","TCP","54","60994  >  443 [ACK] Seq=33284 Ack=6694 Win=130048 Len=0"
"59","2.019976","104.18.35.30","100.86.87.79","TCP","56","443  >  60994 [ACK] Seq=6694 Ack=33284 Win=40960 Len=0"
"60","2.116281","104.18.35.30","100.86.87.79","TLSv1.3","525","Application Data"
"61","2.116281","104.18.35.30","100.86.87.79","TLSv1.3","136","Application Data, Application Data"
"62","2.116421","100.86.87.79","104.18.35.30","TCP","54","60994  >  443 [ACK] Seq=33284 Ack=7247 Win=131584 Len=0"
"63","4.477540","100.86.87.79","104.18.35.30","TLSv1.3","126","Application Data"
"64","4.477677","100.86.87.79","104.18.35.30","TLSv1.3","4126","Application Data"
"65","4.519914","104.18.35.30","100.86.87.79","TCP","56","443  >  60994 [ACK] Seq=7247 Ack=37428 Win=40960 Len=0"
"66","4.622185","104.18.35.30","100.86.87.79","TLSv1.3","482","Application Data"
"67","4.622483","104.18.35.30","100.86.87.79","TLSv1.3","136","Application Data, Application Data"
"68","4.622557","100.86.87.79","104.18.35.30","TCP","54","60994  >  443 [ACK] Seq=37428 Ack=7757 Win=131072 Len=0"
"69","5.044511","100.86.87.79","104.18.35.30","TLSv1.3","126","Application Data"
"70","5.044683","100.86.87.79","104.18.35.30","TLSv1.3","4092","Application Data"
"71","5.065928","104.18.35.30","100.86.87.79","TCP","56","443  >  60994 [ACK] Seq=7757 Ack=37500 Win=40960 Len=0"
"72","5.065928","104.18.35.30","100.86.87.79","TCP","56","443  >  60994 [ACK] Seq=7757 Ack=40300 Win=40960 Len=0"
"73","5.065928","104.18.35.30","100.86.87.79","TCP","56","443  >  60994 [ACK] Seq=7757 Ack=41538 Win=40960 Len=0"
"74","5.184689","104.18.35.30","100.86.87.79","TLSv1.3","483","Application Data"
"75","5.184689","104.18.35.30","100.86.87.79","TLSv1.3","136","Application Data, Application Data"
"76","5.184796","100.86.87.79","104.18.35.30","TCP","54","60994  >  443 [ACK] Seq=41538 Ack=8268 Win=130560 Len=0"
"77","5.186306","100.86.87.79","104.18.35.30","TLSv1.3","89","Application Data"
"78","5.205573","104.18.35.30","100.86.87.79","TCP","56","443  >  60994 [ACK] Seq=8268 Ack=41573 Win=40960 Len=0"
"79","13.036680","100.86.87.79","104.18.35.30","TLSv1.3","127","Application Data"
"80","13.036824","100.86.87.79","104.18.35.30","TLSv1.3","16460","Application Data"
"81","13.036919","100.86.87.79","104.18.35.30","TLSv1.3","5920","Application Data"
"82","13.054504","104.18.35.30","100.86.87.79","TCP","56","443  >  60994 [ACK] Seq=8268 Ack=41646 Win=40960 Len=0"
"83","13.054504","104.18.35.30","100.86.87.79","TCP","56","443  >  60994 [ACK] Seq=8268 Ack=47246 Win=40960 Len=0"
"84","13.056191","104.18.35.30","100.86.87.79","TCP","56","443  >  60994 [ACK] Seq=8268 Ack=54246 Win=40960 Len=0"
"85","13.056191","104.18.35.30","100.86.87.79","TCP","56","443  >  60994 [ACK] Seq=8268 Ack=58052 Win=40960 Len=0"
"86","13.056191","104.18.35.30","100.86.87.79","TLSv1.3","89","Application Data"
"87","13.056191","104.18.35.30","100.86.87.79","TCP","56","443  >  60994 [ACK] Seq=8303 Ack=63918 Win=40960 Len=0"
"88","13.098605","100.86.87.79","104.18.35.30","TCP","54","60994  >  443 [ACK] Seq=63918 Ack=8303 Win=130304 Len=0"
"89","13.215232","104.18.35.30","100.86.87.79","TLSv1.3","485","Application Data"
"90","13.216048","104.18.35.30","100.86.87.79","TLSv1.3","136","Application Data, Application Data"
"91","13.216191","100.86.87.79","104.18.35.30","TCP","54","60994  >  443 [ACK] Seq=63918 Ack=8816 Win=131584 Len=0"
"92","13.217042","100.86.87.79","104.18.35.30","TLSv1.3","89","Application Data"
"93","13.274060","104.18.35.30","100.86.87.79","TCP","56","443  >  60994 [ACK] Seq=8816 Ack=63953 Win=40960 Len=0"
"94","17.885878","100.86.87.79","104.18.35.30","TLSv1.3","126","Application Data"
"95","17.886101","100.86.87.79","104.18.35.30","TLSv1.3","7537","Application Data"
"96","17.904355","104.18.35.30","100.86.87.79","TCP","56","443  >  60994 [ACK] Seq=8816 Ack=64025 Win=40960 Len=0"
"97","17.904706","104.18.35.30","100.86.87.79","TCP","56","443  >  60994 [ACK] Seq=8816 Ack=71508 Win=40960 Len=0"
"98","18.013753","104.18.35.30","100.86.87.79","TLSv1.3","631","Application Data"
"99","18.014015","104.18.35.30","100.86.87.79","TLSv1.3","136","Application Data, Application Data"
"100","18.014036","100.86.87.79","104.18.35.30","TCP","54","60994  >  443 [ACK] Seq=71508 Ack=9475 Win=130816 Len=0"
"101","30.460803","100.86.87.79","104.18.35.30","TLSv1.3","126","Application Data"
"102","30.461156","100.86.87.79","104.18.35.30","TLSv1.3","93","Application Data"
"103","30.461611","100.86.87.79","104.18.35.30","TLSv1.3","4066","Application Data"
"104","30.482539","104.18.35.30","100.86.87.79","TCP","56","443  >  60994 [ACK] Seq=9475 Ack=71619 Win=65536 Len=0"
"105","30.482539","104.18.35.30","100.86.87.79","TLSv1.3","93","Application Data"
"106","30.483134","104.18.35.30","100.86.87.79","TCP","56","443  >  60994 [ACK] Seq=9514 Ack=75631 Win=73728 Len=0"
"107","30.525470","100.86.87.79","104.18.35.30","TCP","54","60994  >  443 [ACK] Seq=75631 Ack=9514 Win=130816 Len=0"
"108","30.605408","104.18.35.30","100.86.87.79","TLSv1.3","520","Application Data"
"109","30.605408","104.18.35.30","100.86.87.79","TLSv1.3","136","Application Data, Application Data"
"110","30.605522","100.86.87.79","104.18.35.30","TCP","54","60994  >  443 [ACK] Seq=75631 Ack=10062 Win=130304 Len=0"
"111","30.606275","100.86.87.79","104.18.35.30","TLSv1.3","89","Application Data"
"112","30.663601","104.18.35.30","100.86.87.79","TCP","56","443  >  60994 [ACK] Seq=10062 Ack=75666 Win=73728 Len=0"
"113","30.666599","100.86.87.79","104.18.35.30","TLSv1.3","122","Application Data"
"114","30.666763","100.86.87.79","104.18.35.30","TLSv1.3","4066","Application Data"
"115","30.682507","104.18.35.30","100.86.87.79","TCP","56","443  >  60994 [ACK] Seq=10062 Ack=75734 Win=73728 Len=0"
"116","30.682507","104.18.35.30","100.86.87.79","TCP","56","443  >  60994 [ACK] Seq=10062 Ack=77134 Win=81920 Len=0"
"117","30.682815","104.18.35.30","100.86.87.79","TCP","56","443  >  60994 [ACK] Seq=10062 Ack=79746 Win=90112 Len=0"
"118","30.799591","104.18.35.30","100.86.87.79","TLSv1.3","459","Application Data"
"119","30.799591","104.18.35.30","100.86.87.79","TLSv1.3","105","Application Data"
"120","30.799591","104.18.35.30","100.86.87.79","TLSv1.3","85","Application Data"
"121","30.799758","100.86.87.79","104.18.35.30","TCP","54","60994  >  443 [ACK] Seq=79746 Ack=10549 Win=131584 Len=0"
"122","30.812656","100.86.87.79","104.18.35.30","TLSv1.3","122","Application Data"
"123","30.812878","100.86.87.79","104.18.35.30","TLSv1.3","4066","Application Data"
"124","30.830122","104.18.35.30","100.86.87.79","TCP","56","443  >  60994 [ACK] Seq=10549 Ack=79814 Win=90112 Len=0"
"125","30.830467","104.18.35.30","100.86.87.79","TCP","56","443  >  60994 [ACK] Seq=10549 Ack=83826 Win=98304 Len=0"
"126","30.942822","100.86.87.79","104.18.35.30","TLSv1.3","126","Application Data"
"127","30.943067","100.86.87.79","104.18.35.30","TLSv1.3","4067","Application Data"
"128","30.945274","104.18.35.30","100.86.87.79","TLSv1.3","482","Application Data"
"129","30.946053","104.18.35.30","100.86.87.79","TLSv1.3","136","Application Data, Application Data"
"130","30.946138","100.86.87.79","104.18.35.30","TCP","54","60994  >  443 [ACK] Seq=87911 Ack=11059 Win=131072 Len=0"
"131","30.962564","104.18.35.30","100.86.87.79","TCP","56","443  >  60994 [ACK] Seq=11059 Ack=83898 Win=98304 Len=0"
"132","30.962564","104.18.35.30","100.86.87.79","TCP","56","443  >  60994 [ACK] Seq=11059 Ack=85298 Win=98304 Len=0"
"133","30.962951","104.18.35.30","100.86.87.79","TCP","56","443  >  60994 [ACK] Seq=11059 Ack=87911 Win=106496 Len=0"
"134","31.067011","104.18.35.30","100.86.87.79","TLSv1.3","455","Application Data"
"135","31.069847","104.18.35.30","100.86.87.79","TLSv1.3","136","Application Data, Application Data"
"136","31.069971","100.86.87.79","104.18.35.30","TCP","54","60994  >  443 [ACK] Seq=87911 Ack=11542 Win=130560 Len=0"
"137","31.150751","100.86.87.79","104.18.35.30","TLSv1.3","126","Application Data"
"138","31.150935","100.86.87.79","104.18.35.30","TLSv1.3","7616","Application Data"
"139","31.166748","104.18.35.30","100.86.87.79","TCP","56","443  >  60994 [ACK] Seq=11542 Ack=87983 Win=106496 Len=0"
"140","31.166748","104.18.35.30","100.86.87.79","TCP","56","443  >  60994 [ACK] Seq=11542 Ack=89383 Win=106496 Len=0"
"141","31.166748","104.18.35.30","100.86.87.79","TCP","56","443  >  60994 [ACK] Seq=11542 Ack=95545 Win=114688 Len=0"
"142","31.285147","100.86.87.79","104.18.35.30","TLSv1.3","126","Application Data"
"143","31.285236","100.86.87.79","104.18.35.30","TLSv1.3","4069","Application Data"
"144","31.303377","104.18.35.30","100.86.87.79","TLSv1.3","457","Application Data"
"145","31.303377","104.18.35.30","100.86.87.79","TLSv1.3","136","Application Data, Application Data"
"146","31.303602","100.86.87.79","104.18.35.30","TCP","54","60994  >  443 [ACK] Seq=99632 Ack=12027 Win=131584 Len=0"
"147","31.304988","104.18.35.30","100.86.87.79","TCP","56","443  >  60994 [ACK] Seq=12027 Ack=95617 Win=114688 Len=0"
"148","31.304988","104.18.35.30","100.86.87.79","TCP","56","443  >  60994 [ACK] Seq=12027 Ack=99632 Win=122880 Len=0"
"149","31.416742","104.18.35.30","100.86.87.79","TLSv1.3","612","Application Data"
"150","31.417389","104.18.35.30","100.86.87.79","TLSv1.3","136","Application Data, Application Data"
"151","31.417494","100.86.87.79","104.18.35.30","TCP","54","60994  >  443 [ACK] Seq=99632 Ack=12667 Win=130816 Len=0"
"152","31.465531","100.86.87.79","104.18.35.30","TLSv1.3","126","Application Data"
"153","31.465788","100.86.87.79","104.18.35.30","TLSv1.3","4070","Application Data"
"154","31.481659","104.18.35.30","100.86.87.79","TCP","56","443  >  60994 [ACK] Seq=12667 Ack=99704 Win=122880 Len=0"
"155","31.481659","104.18.35.30","100.86.87.79","TCP","56","443  >  60994 [ACK] Seq=12667 Ack=103720 Win=131072 Len=0"
"156","31.606539","104.18.35.30","100.86.87.79","TLSv1.3","500","Application Data"
"157","31.606902","104.18.35.30","100.86.87.79","TLSv1.3","136","Application Data, Application Data"
"158","31.607057","100.86.87.79","104.18.35.30","TCP","54","60994  >  443 [ACK] Seq=103720 Ack=13195 Win=130304 Len=0"
"159","31.615578","100.86.87.79","104.18.35.30","TLSv1.3","126","Application Data"
"160","31.615709","100.86.87.79","104.18.35.30","TLSv1.3","4071","Application Data"
"161","31.631211","104.18.35.30","100.86.87.79","TCP","56","443  >  60994 [ACK] Seq=13195 Ack=103792 Win=131072 Len=0"
"162","31.631808","104.18.35.30","100.86.87.79","TCP","56","443  >  60994 [ACK] Seq=13195 Ack=106592 Win=139264 Len=0"
"163","31.632098","104.18.35.30","100.86.87.79","TCP","56","443  >  60994 [ACK] Seq=13195 Ack=107809 Win=147456 Len=0"
"164","31.732767","100.86.87.79","104.18.35.30","TLSv1.3","126","Application Data"
"165","31.732859","100.86.87.79","104.18.35.30","TLSv1.3","9825","Application Data"
"166","31.752213","104.18.35.30","100.86.87.79","TCP","56","443  >  60994 [ACK] Seq=13195 Ack=112081 Win=155648 Len=0"
"167","31.752213","104.18.35.30","100.86.87.79","TCP","56","443  >  60994 [ACK] Seq=13195 Ack=113481 Win=155648 Len=0"
"168","31.759768","104.18.35.30","100.86.87.79","TCP","56","443  >  60994 [ACK] Seq=13195 Ack=117652 Win=163840 Len=0"
"169","31.759768","104.18.35.30","100.86.87.79","TLSv1.3","454","Application Data"
"170","31.759768","104.18.35.30","100.86.87.79","TLSv1.3","136","Application Data, Application Data"
"171","31.760107","100.86.87.79","104.18.35.30","TCP","54","60994  >  443 [ACK] Seq=117652 Ack=13677 Win=131584 Len=0"
"172","31.873616","100.86.87.79","104.18.35.30","TLSv1.3","122","Application Data"
"173","31.873846","100.86.87.79","104.18.35.30","TLSv1.3","4071","Application Data"
"174","31.881122","104.18.35.30","100.86.87.79","TLSv1.3","482","Application Data"
"175","31.881309","104.18.35.30","100.86.87.79","TLSv1.3","136","Application Data, Application Data"
"176","31.881412","100.86.87.79","104.18.35.30","TCP","54","60994  >  443 [ACK] Seq=121737 Ack=14187 Win=131072 Len=0"
"177","31.889445","104.18.35.30","100.86.87.79","TCP","56","443  >  60994 [ACK] Seq=14187 Ack=119120 Win=163840 Len=0"
"178","31.889926","104.18.35.30","100.86.87.79","TCP","56","443  >  60994 [ACK] Seq=14187 Ack=121737 Win=172032 Len=0"
"179","32.109920","104.18.35.30","100.86.87.79","TLSv1.3","479","Application Data"
"180","32.109920","104.18.35.30","100.86.87.79","TLSv1.3","105","Application Data"
"181","32.109920","104.18.35.30","100.86.87.79","TLSv1.3","85","Application Data"
"182","32.110146","100.86.87.79","104.18.35.30","TCP","54","60994  >  443 [ACK] Seq=121737 Ack=14694 Win=130560 Len=0"
"183","32.110504","104.18.35.30","100.86.87.79","TCP","85","[TCP Spurious Retransmission] 443  >  60994 [PSH, ACK] Seq=14663 Ack=121737 Win=172032 Len=31"
"184","32.110553","100.86.87.79","104.18.35.30","TCP","66","[TCP Dup ACK 182#1] 60994  >  443 [ACK] Seq=121737 Ack=14694 Win=130560 Len=0 SLE=14663 SRE=14694"
"185","32.801640","100.86.87.79","104.18.35.30","TLSv1.3","126","Application Data"
"186","32.801726","100.86.87.79","104.18.35.30","TLSv1.3","5838","Application Data"
"187","32.818235","104.18.35.30","100.86.87.79","TCP","56","443  >  60994 [ACK] Seq=14694 Ack=123209 Win=172032 Len=0"
"188","32.818235","104.18.35.30","100.86.87.79","TCP","56","443  >  60994 [ACK] Seq=14694 Ack=126009 Win=180224 Len=0"
"189","32.818235","104.18.35.30","100.86.87.79","TCP","56","443  >  60994 [ACK] Seq=14694 Ack=127593 Win=180224 Len=0"
"190","32.950350","104.18.35.30","100.86.87.79","TLSv1.3","635","Application Data"
"191","32.950922","104.18.35.30","100.86.87.79","TLSv1.3","136","Application Data, Application Data"
"192","32.951057","100.86.87.79","104.18.35.30","TCP","54","60994  >  443 [ACK] Seq=127593 Ack=15357 Win=131584 Len=0"
"193","33.229105","100.86.87.79","104.18.35.30","TLSv1.3","156","Application Data"
"194","33.290201","104.18.35.30","100.86.87.79","TCP","56","443  >  60994 [ACK] Seq=15357 Ack=127695 Win=180224 Len=0"
"195","33.361657","104.18.35.30","100.86.87.79","TLSv1.3","574","Application Data"
"196","33.363285","100.86.87.79","104.18.35.30","TLSv1.3","161","Application Data"
"197","33.363447","100.86.87.79","104.18.35.30","TLSv1.3","726","Application Data"
"198","33.380187","104.18.35.30","100.86.87.79","TCP","56","443  >  60994 [ACK] Seq=15877 Ack=128474 Win=188416 Len=0"
"199","33.421809","100.86.87.79","104.18.35.30","TLSv1.3","127","Application Data"
"200","33.422227","100.86.87.79","104.18.35.30","TLSv1.3","16460","Application Data"
"201","33.422398","100.86.87.79","104.18.35.30","TLSv1.3","2910","Application Data"
"202","33.438157","104.18.35.30","100.86.87.79","TCP","56","443  >  60994 [ACK] Seq=15877 Ack=128547 Win=188416 Len=0"
"203","33.438157","104.18.35.30","100.86.87.79","TCP","56","443  >  60994 [ACK] Seq=15877 Ack=131347 Win=196608 Len=0"
"204","33.438394","104.18.35.30","100.86.87.79","TCP","56","443  >  60994 [ACK] Seq=15877 Ack=132747 Win=196608 Len=0"
"205","33.438725","104.18.35.30","100.86.87.79","TCP","56","443  >  60994 [ACK] Seq=15877 Ack=138347 Win=204800 Len=0"
"206","33.438725","104.18.35.30","100.86.87.79","TCP","56","443  >  60994 [ACK] Seq=15877 Ack=142547 Win=212992 Len=0"
"207","33.440381","104.18.35.30","100.86.87.79","TCP","56","443  >  60994 [ACK] Seq=15877 Ack=144953 Win=221184 Len=0"
"208","33.440381","104.18.35.30","100.86.87.79","TLSv1.3","89","Application Data"
"209","33.440381","104.18.35.30","100.86.87.79","TCP","56","443  >  60994 [ACK] Seq=15912 Ack=147809 Win=229376 Len=0"
"210","33.490280","100.86.87.79","104.18.35.30","TCP","54","60994  >  443 [ACK] Seq=147809 Ack=15912 Win=130816 Len=0"
"211","33.512447","104.18.35.30","100.86.87.79","TLSv1.3","487","Application Data"
"212","33.515188","104.18.35.30","100.86.87.79","TCP","1514","443  >  60994 [ACK] Seq=16345 Ack=147809 Win=229376 Len=1460 [TCP segment of a reassembled PDU]"
"213","33.515188","104.18.35.30","100.86.87.79","TCP","1514","443  >  60994 [PSH, ACK] Seq=17805 Ack=147809 Win=229376 Len=1460 [TCP segment of a reassembled PDU]"
"214","33.515293","100.86.87.79","104.18.35.30","TCP","54","60994  >  443 [ACK] Seq=147809 Ack=19265 Win=131584 Len=0"
"215","33.516957","104.18.35.30","100.86.87.79","TLSv1.3","1385","Application Data"
"216","33.516957","104.18.35.30","100.86.87.79","TCP","1514","443  >  60994 [ACK] Seq=20596 Ack=147809 Win=229376 Len=1460 [TCP segment of a reassembled PDU]"
"217","33.517040","100.86.87.79","104.18.35.30","TCP","54","60994  >  443 [ACK] Seq=147809 Ack=22056 Win=131584 Len=0"
"218","33.517772","104.18.35.30","100.86.87.79","TLSv1.3","2974","Application Data"
"219","33.517796","100.86.87.79","104.18.35.30","TCP","54","60994  >  443 [ACK] Seq=147809 Ack=24976 Win=131584 Len=0"
"220","33.520043","104.18.35.30","100.86.87.79","TCP","1514","443  >  60994 [PSH, ACK] Seq=24976 Ack=147809 Win=229376 Len=1460 [TCP segment of a reassembled PDU]"
"221","33.520090","100.86.87.79","104.18.35.30","TCP","54","60994  >  443 [ACK] Seq=147809 Ack=26436 Win=131584 Len=0"
"222","33.521327","104.18.35.30","100.86.87.79","TLSv1.3","2974","Application Data"
"223","33.521517","100.86.87.79","104.18.35.30","TCP","54","60994  >  443 [ACK] Seq=147809 Ack=29356 Win=131584 Len=0"
"224","33.521782","104.18.35.30","100.86.87.79","TCP","2974","443  >  60994 [PSH, ACK] Seq=29356 Ack=147809 Win=229376 Len=2920 [TCP segment of a reassembled PDU]"
"225","33.521852","100.86.87.79","104.18.35.30","TCP","54","60994  >  443 [ACK] Seq=147809 Ack=32276 Win=131584 Len=0"
"226","33.524316","104.18.35.30","100.86.87.79","TLSv1.3","1514","Application Data"
"227","33.524992","104.18.35.30","100.86.87.79","TCP","1514","443  >  60994 [PSH, ACK] Seq=33736 Ack=147809 Win=229376 Len=1460 [TCP segment of a reassembled PDU]"
"228","33.525027","100.86.87.79","104.18.35.30","TCP","54","60994  >  443 [ACK] Seq=147809 Ack=35196 Win=131584 Len=0"
"229","33.525448","104.18.35.30","100.86.87.79","TLSv1.3","2974","Application Data"
"230","33.525499","100.86.87.79","104.18.35.30","TCP","54","60994  >  443 [ACK] Seq=147809 Ack=38116 Win=131584 Len=0"
"231","33.527254","104.18.35.30","100.86.87.79","TCP","1514","443  >  60994 [ACK] Seq=38116 Ack=147809 Win=229376 Len=1460 [TCP segment of a reassembled PDU]"
"232","33.527656","104.18.35.30","100.86.87.79","TCP","1514","443  >  60994 [PSH, ACK] Seq=39576 Ack=147809 Win=229376 Len=1460 [TCP segment of a reassembled PDU]"
"233","33.527702","100.86.87.79","104.18.35.30","TCP","54","60994  >  443 [ACK] Seq=147809 Ack=41036 Win=131584 Len=0"
"234","33.529240","104.18.35.30","100.86.87.79","TLSv1.3","1514","Application Data"
"235","33.529698","104.18.35.30","100.86.87.79","TCP","1514","443  >  60994 [PSH, ACK] Seq=42496 Ack=147809 Win=229376 Len=1460 [TCP segment of a reassembled PDU]"
"236","33.529757","100.86.87.79","104.18.35.30","TCP","54","60994  >  443 [ACK] Seq=147809 Ack=43956 Win=131584 Len=0"
"237","33.531261","104.18.35.30","100.86.87.79","TCP","1514","443  >  60994 [ACK] Seq=43956 Ack=147809 Win=229376 Len=1460 [TCP segment of a reassembled PDU]"
"238","33.531577","104.18.35.30","100.86.87.79","TLSv1.3","1514","Application Data"
"239","33.531622","100.86.87.79","104.18.35.30","TCP","54","60994  >  443 [ACK] Seq=147809 Ack=46876 Win=131584 Len=0"
"240","33.533362","104.18.35.30","100.86.87.79","TLSv1.3","1514","Application Data"
"241","33.534197","104.18.35.30","100.86.87.79","TCP","1514","443  >  60994 [PSH, ACK] Seq=48336 Ack=147809 Win=229376 Len=1460 [TCP segment of a reassembled PDU]"
"242","33.534226","100.86.87.79","104.18.35.30","TCP","54","60994  >  443 [ACK] Seq=147809 Ack=49796 Win=131584 Len=0"
"243","33.535740","104.18.35.30","100.86.87.79","TCP","1514","443  >  60994 [ACK] Seq=49796 Ack=147809 Win=229376 Len=1460 [TCP segment of a reassembled PDU]"
"244","33.536532","104.18.35.30","100.86.87.79","TLSv1.3","1514","Application Data"
"245","33.536706","100.86.87.79","104.18.35.30","TCP","54","60994  >  443 [ACK] Seq=147809 Ack=52716 Win=131584 Len=0"
"246","33.537534","104.18.35.30","100.86.87.79","TCP","1514","443  >  60994 [ACK] Seq=52716 Ack=147809 Win=229376 Len=1460 [TCP segment of a reassembled PDU]"
"247","33.538233","104.18.35.30","100.86.87.79","TCP","1514","443  >  60994 [PSH, ACK] Seq=54176 Ack=147809 Win=229376 Len=1460 [TCP segment of a reassembled PDU]"
"248","33.538271","100.86.87.79","104.18.35.30","TCP","54","60994  >  443 [ACK] Seq=147809 Ack=55636 Win=131584 Len=0"
"249","33.539706","104.18.35.30","100.86.87.79","TLSv1.3","1514","Application Data"
"250","33.540166","104.18.35.30","100.86.87.79","TCP","1514","443  >  60994 [PSH, ACK] Seq=57096 Ack=147809 Win=229376 Len=1460 [TCP segment of a reassembled PDU]"
"251","33.540231","100.86.87.79","104.18.35.30","TCP","54","60994  >  443 [ACK] Seq=147809 Ack=58556 Win=131584 Len=0"
"252","33.541552","104.18.35.30","100.86.87.79","TLSv1.3","628","Application Data, Application Data"
"253","33.587813","100.86.87.79","104.18.35.30","TCP","54","60994  >  443 [ACK] Seq=147809 Ack=59130 Win=130816 Len=0"
"254","33.605020","104.18.35.30","100.86.87.79","TLSv1.3","500","Application Data"
"255","33.608954","104.18.35.30","100.86.87.79","TLSv1.3","136","Application Data, Application Data"
"256","33.609060","100.86.87.79","104.18.35.30","TCP","54","60994  >  443 [ACK] Seq=147809 Ack=59658 Win=130304 Len=0"
"257","33.656018","100.86.87.79","104.18.35.30","TLSv1.3","127","Application Data"
"258","33.656206","100.86.87.79","104.18.35.30","TLSv1.3","10282","Application Data"
"259","33.673624","104.18.35.30","100.86.87.79","TCP","56","443  >  60994 [ACK] Seq=59658 Ack=154882 Win=237568 Len=0"
"260","33.673624","104.18.35.30","100.86.87.79","TCP","56","443  >  60994 [ACK] Seq=59658 Ack=157682 Win=245760 Len=0"
"261","33.715229","104.18.35.30","100.86.87.79","TCP","56","443  >  60994 [ACK] Seq=59658 Ack=158110 Win=245760 Len=0"
"262","33.805183","104.18.35.30","100.86.87.79","TLSv1.3","456","Application Data"
"263","33.805609","104.18.35.30","100.86.87.79","TLSv1.3","136","Application Data, Application Data"
"264","33.805785","100.86.87.79","104.18.35.30","TCP","54","60994  >  443 [ACK] Seq=158110 Ack=60142 Win=131584 Len=0"
"265","34.906392","100.86.87.79","104.18.35.30","TLSv1.3","2178","Application Data"
"266","34.906467","100.86.87.79","104.18.35.30","TLSv1.3","93","Application Data"
"267","34.906543","100.86.87.79","104.18.35.30","TLSv1.3","4110","Application Data"
"268","34.926986","104.18.35.30","100.86.87.79","TCP","56","443  >  60997 [ACK] Seq=6623 Ack=12346 Win=65536 Len=0"
"269","34.926986","104.18.35.30","100.86.87.79","TLSv1.3","93","Application Data"
"270","34.973923","100.86.87.79","104.18.35.30","TCP","54","60997  >  443 [ACK] Seq=12346 Ack=6662 Win=130048 Len=0"
"271","35.020396","100.86.87.79","104.18.35.30","TLSv1.3","2754","Application Data"
"272","35.020559","100.86.87.79","104.18.35.30","TLSv1.3","4719","Application Data"
"273","35.038455","104.18.35.30","100.86.87.79","TCP","56","443  >  60997 [ACK] Seq=6662 Ack=19711 Win=65536 Len=0"
"274","35.054011","104.18.35.30","100.86.87.79","TLSv1.3","168","Application Data"
"275","35.054011","104.18.35.30","100.86.87.79","TLSv1.3","105","Application Data"
"276","35.054244","100.86.87.79","104.18.35.30","TCP","54","60997  >  443 [ACK] Seq=19711 Ack=6827 Win=131584 Len=0"
"277","35.057217","104.18.35.30","100.86.87.79","TLSv1.3","85","Application Data"
"278","35.057970","100.86.87.79","104.18.35.30","TLSv1.3","89","Application Data"
"279","35.139767","104.18.35.30","100.86.87.79","TCP","56","443  >  60997 [ACK] Seq=6858 Ack=19746 Win=65536 Len=0"
"280","35.159086","104.18.35.30","100.86.87.79","TLSv1.3","148","Application Data"
"281","35.159086","104.18.35.30","100.86.87.79","TLSv1.3","105","Application Data"
"282","35.159185","100.86.87.79","104.18.35.30","TCP","54","60997  >  443 [ACK] Seq=19746 Ack=7003 Win=131328 Len=0"
"283","35.160028","104.18.35.30","100.86.87.79","TLSv1.3","85","Application Data"
"284","35.200882","100.86.87.79","104.18.35.30","TCP","54","60997  >  443 [ACK] Seq=19746 Ack=7034 Win=131328 Len=0"
"285","37.270116","100.86.87.79","104.18.35.30","TLSv1.3","127","Application Data"
"286","37.270316","100.86.87.79","104.18.35.30","TLSv1.3","16460","Application Data"
"287","37.270375","100.86.87.79","104.18.35.30","TLSv1.3","16460","Application Data"
"288","37.270415","100.86.87.79","104.18.35.30","TLSv1.3","16460","Application Data"
"289","37.270453","100.86.87.79","104.18.35.30","TLSv1.3","9143","Application Data"
"290","37.294768","104.18.35.30","100.86.87.79","TCP","56","443  >  60994 [ACK] Seq=60142 Ack=158183 Win=245760 Len=0"
"291","37.299218","104.18.35.30","100.86.87.79","TCP","56","443  >  60994 [ACK] Seq=60142 Ack=159583 Win=253952 Len=0"
"292","37.299218","104.18.35.30","100.86.87.79","TCP","56","443  >  60994 [ACK] Seq=60142 Ack=160983 Win=253952 Len=0"
"293","37.301044","104.18.35.30","100.86.87.79","TCP","56","443  >  60994 [ACK] Seq=60142 Ack=162383 Win=253952 Len=0"
"294","37.302203","104.18.35.30","100.86.87.79","TCP","56","443  >  60994 [ACK] Seq=60142 Ack=174589 Win=278528 Len=0"
"295","37.303877","104.18.35.30","100.86.87.79","TLSv1.3","89","Application Data"
"296","37.303877","104.18.35.30","100.86.87.79","TCP","56","443  >  60994 [ACK] Seq=60177 Ack=190995 Win=311296 Len=0"
"297","37.303877","104.18.35.30","100.86.87.79","TLSv1.3","89","Application Data"
"298","37.303877","104.18.35.30","100.86.87.79","TCP","56","443  >  60994 [ACK] Seq=60212 Ack=216490 Win=368640 Len=0"
"299","37.304011","100.86.87.79","104.18.35.30","TCP","54","60994  >  443 [ACK] Seq=216490 Ack=60212 Win=131328 Len=0"
"300","37.482121","104.18.35.30","100.86.87.79","TLSv1.3","633","Application Data"
"301","37.482485","104.18.35.30","100.86.87.79","TLSv1.3","136","Application Data, Application Data"
"302","37.482550","100.86.87.79","104.18.35.30","TCP","54","60994  >  443 [ACK] Seq=216490 Ack=60873 Win=130816 Len=0"
"303","37.483070","100.86.87.79","104.18.35.30","TLSv1.3","89","Application Data"
"304","37.540173","104.18.35.30","100.86.87.79","TCP","56","443  >  60994 [ACK] Seq=60873 Ack=216525 Win=368640 Len=0"
"305","37.661324","100.86.87.79","104.18.35.30","TLSv1.3","127","Application Data"
"306","37.661402","100.86.87.79","104.18.35.30","TLSv1.3","16460","Application Data"
"307","37.661477","100.86.87.79","104.18.35.30","TLSv1.3","2001","Application Data"
"308","37.677584","104.18.35.30","100.86.87.79","TCP","56","443  >  60994 [ACK] Seq=60873 Ack=217998 Win=368640 Len=0"
"309","37.677880","104.18.35.30","100.86.87.79","TCP","56","443  >  60994 [ACK] Seq=60873 Ack=219398 Win=368640 Len=0"
"310","37.678583","104.18.35.30","100.86.87.79","TCP","56","443  >  60994 [ACK] Seq=60873 Ack=222198 Win=376832 Len=0"
"311","37.678783","104.18.35.30","100.86.87.79","TCP","56","443  >  60994 [ACK] Seq=60873 Ack=229198 Win=393216 Len=0"
"312","37.678783","104.18.35.30","100.86.87.79","TCP","56","443  >  60994 [ACK] Seq=60873 Ack=233004 Win=401408 Len=0"
"313","37.680825","104.18.35.30","100.86.87.79","TLSv1.3","89","Application Data"
"314","37.680825","104.18.35.30","100.86.87.79","TCP","56","443  >  60994 [ACK] Seq=60908 Ack=234951 Win=401408 Len=0"
"315","37.731137","100.86.87.79","104.18.35.30","TCP","54","60994  >  443 [ACK] Seq=234951 Ack=60908 Win=130816 Len=0"
"316","37.816795","104.18.35.30","100.86.87.79","TLSv1.3","461","Application Data"
"317","37.817420","104.18.35.30","100.86.87.79","TLSv1.3","136","Application Data, Application Data"
"318","37.817494","100.86.87.79","104.18.35.30","TCP","54","60994  >  443 [ACK] Seq=234951 Ack=61397 Win=130304 Len=0"
"319","38.265043","100.86.87.79","104.18.35.30","TLSv1.3","126","Application Data"
"320","38.265161","100.86.87.79","104.18.35.30","TLSv1.3","5371","Application Data"
"321","38.280860","104.18.35.30","100.86.87.79","TCP","56","443  >  60994 [ACK] Seq=61397 Ack=236423 Win=409600 Len=0"
"322","38.281072","104.18.35.30","100.86.87.79","TCP","56","443  >  60994 [ACK] Seq=61397 Ack=240340 Win=417792 Len=0"
"323","38.390827","104.18.35.30","100.86.87.79","TLSv1.3","478","Application Data"
"324","38.396242","104.18.35.30","100.86.87.79","TLSv1.3","136","Application Data, Application Data"
"325","38.396391","100.86.87.79","104.18.35.30","TCP","54","60994  >  443 [ACK] Seq=240340 Ack=61903 Win=131584 Len=0"
"326","38.528900","100.86.87.79","104.18.35.30","TLSv1.3","126","Application Data"
"327","38.529024","100.86.87.79","104.18.35.30","TLSv1.3","5486","Application Data"
"328","38.551657","104.18.35.30","100.86.87.79","TCP","56","443  >  60994 [ACK] Seq=61903 Ack=241812 Win=417792 Len=0"
"329","38.551657","104.18.35.30","100.86.87.79","TCP","56","443  >  60994 [ACK] Seq=61903 Ack=244612 Win=425984 Len=0"
"330","38.587256","104.18.35.30","100.86.87.79","TCP","56","443  >  60994 [ACK] Seq=61903 Ack=245844 Win=425984 Len=0"
"331","38.668239","104.18.35.30","100.86.87.79","TLSv1.3","461","Application Data"
"332","38.668514","104.18.35.30","100.86.87.79","TLSv1.3","105","Application Data"
"333","38.668514","104.18.35.30","100.86.87.79","TLSv1.3","85","Application Data"
"334","38.668771","100.86.87.79","104.18.35.30","TCP","54","60994  >  443 [ACK] Seq=245844 Ack=62392 Win=131072 Len=0"
"335","38.960888","100.86.87.79","104.18.35.30","TLSv1.3","126","Application Data"
"336","38.960984","100.86.87.79","104.18.35.30","TLSv1.3","5467","Application Data"
"337","38.976168","104.18.35.30","100.86.87.79","TCP","56","443  >  60994 [ACK] Seq=62392 Ack=247316 Win=425984 Len=0"
"338","38.976531","104.18.35.30","100.86.87.79","TCP","56","443  >  60994 [ACK] Seq=62392 Ack=248716 Win=434176 Len=0"
"339","38.977888","104.18.35.30","100.86.87.79","TCP","56","443  >  60994 [ACK] Seq=62392 Ack=250116 Win=434176 Len=0"
"340","38.977888","104.18.35.30","100.86.87.79","TCP","56","443  >  60994 [ACK] Seq=62392 Ack=251329 Win=434176 Len=0"
"341","39.142293","104.18.35.30","100.86.87.79","TLSv1.3","521","Application Data"
"342","39.144123","104.18.35.30","100.86.87.79","TLSv1.3","136","Application Data, Application Data"
"343","39.144332","100.86.87.79","104.18.35.30","TCP","54","60994  >  443 [ACK] Seq=251329 Ack=62941 Win=130560 Len=0"
"344","39.670369","100.86.87.79","104.18.35.30","TLSv1.3","127","Application Data"
"345","39.670468","100.86.87.79","104.18.35.30","TLSv1.3","13149","Application Data"
"346","39.745871","104.18.35.30","100.86.87.79","TCP","56","443  >  60994 [ACK] Seq=62941 Ack=251402 Win=434176 Len=0"
"347","39.745871","104.18.35.30","100.86.87.79","TCP","56","443  >  60994 [ACK] Seq=62941 Ack=258402 Win=450560 Len=0"
"348","39.745871","104.18.35.30","100.86.87.79","TCP","56","443  >  60994 [ACK] Seq=62941 Ack=264497 Win=466944 Len=0"
"349","39.833144","104.18.35.30","100.86.87.79","TLSv1.3","578","Application Data"
"350","39.833401","104.18.35.30","100.86.87.79","TLSv1.3","136","Application Data, Application Data"
"351","39.833440","100.86.87.79","104.18.35.30","TCP","54","60994  >  443 [ACK] Seq=264497 Ack=63547 Win=131584 Len=0"
"352","39.948993","100.86.87.79","104.18.35.30","TLSv1.3","127","Application Data"
"353","39.949124","100.86.87.79","104.18.35.30","TLSv1.3","12994","Application Data"
"354","39.966089","104.18.35.30","100.86.87.79","TCP","56","443  >  60994 [ACK] Seq=63547 Ack=264570 Win=466944 Len=0"
"355","39.966089","104.18.35.30","100.86.87.79","TCP","56","443  >  60994 [ACK] Seq=63547 Ack=265970 Win=466944 Len=0"
"356","39.966427","104.18.35.30","100.86.87.79","TCP","56","443  >  60994 [ACK] Seq=63547 Ack=270170 Win=475136 Len=0"
"357","39.966427","104.18.35.30","100.86.87.79","TCP","56","443  >  60994 [ACK] Seq=63547 Ack=277510 Win=491520 Len=0"
"358","40.058744","100.86.87.79","104.18.35.30","TLSv1.3","127","Application Data"
"359","40.058917","100.86.87.79","104.18.35.30","TLSv1.3","10839","Application Data"
"360","40.085624","104.18.35.30","100.86.87.79","TCP","56","443  >  60994 [ACK] Seq=63547 Ack=277583 Win=491520 Len=0"
"361","40.085624","104.18.35.30","100.86.87.79","TCP","56","443  >  60994 [ACK] Seq=63547 Ack=278983 Win=491520 Len=0"
"362","40.086175","104.18.35.30","100.86.87.79","TCP","56","443  >  60994 [ACK] Seq=63547 Ack=284583 Win=507904 Len=0"
"363","40.086175","104.18.35.30","100.86.87.79","TCP","56","443  >  60994 [ACK] Seq=63547 Ack=288368 Win=516096 Len=0"
"364","40.105412","104.18.35.30","100.86.87.79","TLSv1.3","512","Application Data"
"365","40.106159","104.18.35.30","100.86.87.79","TLSv1.3","136","Application Data, Application Data"
"366","40.106242","100.86.87.79","104.18.35.30","TCP","54","60994  >  443 [ACK] Seq=288368 Ack=64087 Win=130816 Len=0"
"367","40.171992","100.86.87.79","104.18.35.30","TLSv1.3","127","Application Data"
"368","40.172129","100.86.87.79","104.18.35.30","TLSv1.3","15264","Application Data"
"369","40.193639","104.18.35.30","100.86.87.79","TCP","56","443  >  60994 [ACK] Seq=64087 Ack=289841 Win=516096 Len=0"
"370","40.193639","104.18.35.30","100.86.87.79","TCP","56","443  >  60994 [ACK] Seq=64087 Ack=294041 Win=524288 Len=0"
"371","40.193886","104.18.35.30","100.86.87.79","TCP","56","443  >  60994 [ACK] Seq=64087 Ack=303651 Win=548864 Len=0"
"372","40.227743","104.18.35.30","100.86.87.79","TLSv1.3","462","Application Data"
"373","40.227743","104.18.35.30","100.86.87.79","TLSv1.3","136","Application Data, Application Data"
"374","40.227812","100.86.87.79","104.18.35.30","TCP","54","60994  >  443 [ACK] Seq=303651 Ack=64577 Win=130560 Len=0"
"375","40.323878","104.18.35.30","100.86.87.79","TLSv1.3","456","Application Data"
"376","40.324253","104.18.35.30","100.86.87.79","TLSv1.3","136","Application Data, Application Data"
"377","40.324308","100.86.87.79","104.18.35.30","TCP","54","60994  >  443 [ACK] Seq=303651 Ack=65061 Win=131584 Len=0"
"378","40.382259","100.86.87.79","104.18.35.30","TLSv1.3","127","Application Data"
