No.,Time,Source,Destination,Protocol,Length,Info
1,0,100.86.73.172,140.82.114.3,TCP,66,62473  >  443 [SYN] Seq=0 Win=64240 Len=0 MSS=1460 WS=256 SACK_PERM
2,0.011812,140.82.114.3,100.86.73.172,TCP,66,"443  >  62473 [SYN, ACK] Seq=0 Ack=1 Win=65535 Len=0 MSS=1436 SACK_PERM WS=1024"
3,0.011996,100.86.73.172,140.82.114.3,TCP,54,62473  >  443 [ACK] Seq=1 Ack=1 Win=132096 Len=0
4,0.012979,100.86.73.172,140.82.114.3,TLSv1.3,695,Client Hello (SNI=github.com)
5,0.024032,140.82.114.3,100.86.73.172,TLSv1.3,1490,"Server Hello, Change Cipher Spec, Application Data"
6,0.024429,140.82.114.3,100.86.73.172,TCP,1490,443  >  62473 [ACK] Seq=1437 Ack=642 Win=67584 Len=1436 [TCP segment of a reassembled PDU]
7,0.024429,140.82.114.3,100.86.73.172,TLSv1.3,674,"Application Data, Application Data, Application Data"
8,0.024518,100.86.73.172,140.82.114.3,TCP,54,62473  >  443 [ACK] Seq=642 Ack=3493 Win=132096 Len=0
9,0.032407,100.86.73.172,140.82.114.3,TLSv1.3,118,"Change Cipher Spec, Application Data"
10,0.032924,100.86.73.172,140.82.114.3,TLSv1.3,146,Application Data
11,0.033403,100.86.73.172,140.82.114.3,TLSv1.3,1579,Application Data
12,0.043944,140.82.114.3,100.86.73.172,TLSv1.3,133,Application Data
13,0.044431,140.82.114.3,100.86.73.172,TLSv1.3,133,Application Data
14,0.044431,140.82.114.3,100.86.73.172,TLSv1.3,118,Application Data
15,0.044546,100.86.73.172,140.82.114.3,TCP,54,62473  >  443 [ACK] Seq=2323 Ack=3715 Win=131840 Len=0
16,0.044992,100.86.73.172,140.82.114.3,TLSv1.3,85,Application Data
17,0.100096,140.82.114.3,100.86.73.172,TCP,56,443  >  62473 [ACK] Seq=3715 Ack=2354 Win=70656 Len=0
18,0.472143,140.82.114.3,100.86.73.172,TLSv1.3,4362,"Application Data, Application Data, Application Data"
19,0.472143,140.82.114.3,100.86.73.172,TLSv1.3,1490,Application Data
20,0.472143,140.82.114.3,100.86.73.172,TLSv1.3,1490,Application Data
21,0.472143,140.82.114.3,100.86.73.172,TLSv1.3,1490,Application Data
22,0.472143,140.82.114.3,100.86.73.172,TLSv1.3,1490,Application Data
23,0.472143,140.82.114.3,100.86.73.172,TLSv1.3,1490,Application Data
24,0.472143,140.82.114.3,100.86.73.172,TLSv1.3,1490,Application Data
25,0.472143,140.82.114.3,100.86.73.172,TLSv1.3,2926,"Application Data, Application Data"
26,0.472297,100.86.73.172,140.82.114.3,TCP,54,62473  >  443 [ACK] Seq=2354 Ack=19511 Win=132096 Len=0
27,0.482507,140.82.114.3,100.86.73.172,TLSv1.3,1490,Application Data
28,0.48256,100.86.73.172,140.82.114.3,TCP,54,62473  >  443 [ACK] Seq=2354 Ack=20947 Win=132096 Len=0
29,0.482883,140.82.114.3,100.86.73.172,TLSv1.3,2926,"Application Data, Application Data"
30,0.482921,100.86.73.172,140.82.114.3,TCP,54,62473  >  443 [ACK] Seq=2354 Ack=23819 Win=132096 Len=0
31,0.484962,140.82.114.3,100.86.73.172,TLSv1.3,23030,"Application Data, Application Data, Application Data, Application Data, Application Data, Application Data, Application Data, Application Data, Application Data, Application Data, Application Data, Application Data, Application Data, Application Data, Application Data, Application Data, Application Data, Application Data"
32,0.485031,100.86.73.172,140.82.114.3,TCP,54,62473  >  443 [ACK] Seq=2354 Ack=46795 Win=132096 Len=0
33,0.486862,140.82.114.3,100.86.73.172,TLSv1.3,2926,"Application Data, Application Data"
34,0.486909,100.86.73.172,140.82.114.3,TCP,54,62473  >  443 [ACK] Seq=2354 Ack=49667 Win=132096 Len=0
35,0.492701,140.82.114.3,100.86.73.172,TLSv1.3,1490,Application Data
36,0.493631,140.82.114.3,100.86.73.172,TLSv1.3,5798,"Application Data, Application Data, Application Data, Application Data, Application Data"
37,0.493677,100.86.73.172,140.82.114.3,TCP,54,62473  >  443 [ACK] Seq=2354 Ack=56847 Win=132096 Len=0
38,0.494812,140.82.114.3,100.86.73.172,TLSv1.3,1490,Application Data
39,0.494855,100.86.73.172,140.82.114.3,TCP,54,62473  >  443 [ACK] Seq=2354 Ack=58283 Win=132096 Len=0
40,0.495171,140.82.114.3,100.86.73.172,TLSv1.3,1490,Application Data
41,0.495639,140.82.114.3,100.86.73.172,TLSv1.3,2926,"Application Data, Application Data"
42,0.495688,100.86.73.172,140.82.114.3,TCP,54,62473  >  443 [ACK] Seq=2354 Ack=62591 Win=132096 Len=0
43,0.496949,140.82.114.3,100.86.73.172,TLSv1.3,11542,"Application Data, Application Data, Application Data, Application Data, Application Data, Application Data, Application Data, Application Data"
44,0.49699,100.86.73.172,140.82.114.3,TCP,54,62473  >  443 [ACK] Seq=2354 Ack=74079 Win=132096 Len=0
45,0.497375,140.82.114.3,100.86.73.172,TLSv1.3,1490,Application Data
46,0.497375,140.82.114.3,100.86.73.172,TLSv1.3,1208,"Application Data, Application Data"
47,0.497417,100.86.73.172,140.82.114.3,TCP,54,62473  >  443 [ACK] Seq=2354 Ack=76669 Win=132096 Len=0
48,0.773623,100.86.73.172,140.82.114.3,TLSv1.3,799,Application Data
49,0.785996,140.82.114.3,100.86.73.172,TCP,56,443  >  62473 [ACK] Seq=76669 Ack=3099 Win=73728 Len=0
50,0.884665,100.86.73.172,140.82.114.3,TLSv1.3,176,Application Data
51,0.894623,140.82.114.3,100.86.73.172,TCP,56,443  >  62473 [ACK] Seq=76669 Ack=3221 Win=73728 Len=0
52,0.926498,140.82.114.3,100.86.73.172,TLSv1.3,1490,Application Data
53,0.926923,140.82.114.3,100.86.73.172,TLSv1.3,1490,Application Data
54,0.926923,140.82.114.3,100.86.73.172,TLSv1.3,1405,"Application Data, Application Data"
55,0.926962,100.86.73.172,140.82.114.3,TCP,54,62473  >  443 [ACK] Seq=3221 Ack=80892 Win=132096 Len=0
56,1.046966,140.82.114.3,100.86.73.172,TLSv1.3,1490,Application Data
57,1.047428,140.82.114.3,100.86.73.172,TLSv1.3,1490,Application Data
58,1.047459,100.86.73.172,140.82.114.3,TCP,54,62473  >  443 [ACK] Seq=3221 Ack=83764 Win=132096 Len=0
59,1.047976,140.82.114.3,100.86.73.172,TLSv1.3,2926,"Application Data, Application Data"
60,1.04801,100.86.73.172,140.82.114.3,TCP,54,62473  >  443 [ACK] Seq=3221 Ack=86636 Win=132096 Len=0
61,1.050078,140.82.114.3,100.86.73.172,TLSv1.3,14414,"Application Data, Application Data, Application Data, Application Data, Application Data, Application Data, Application Data, Application Data, Application Data, Application Data"
62,1.050078,140.82.114.3,100.86.73.172,TLSv1.3,946,"Application Data, Application Data"
63,1.050078,140.82.114.3,100.86.73.172,TLSv1.3,10106,"Application Data, Application Data, Application Data, Application Data, Application Data, Application Data, Application Data"
64,1.050149,100.86.73.172,140.82.114.3,TCP,54,62473  >  443 [ACK] Seq=3221 Ack=111940 Win=132096 Len=0
65,1.050594,140.82.114.3,100.86.73.172,TLSv1.3,227,Application Data
66,1.090347,100.86.73.172,140.82.114.3,TCP,54,62473  >  443 [ACK] Seq=3221 Ack=112113 Win=131840 Len=0
67,3.107498,100.86.73.172,140.82.114.3,TLSv1.3,734,Application Data
68,3.163775,140.82.114.3,100.86.73.172,TCP,56,443  >  62473 [ACK] Seq=112113 Ack=3901 Win=75776 Len=0
69,3.327229,140.82.114.3,100.86.73.172,TLSv1.3,4362,"Application Data, Application Data, Application Data"
70,3.327346,100.86.73.172,140.82.114.3,TCP,54,62473  >  443 [ACK] Seq=3901 Ack=116421 Win=132096 Len=0
71,3.330046,140.82.114.3,100.86.73.172,TLSv1.3,15850,"Application Data, Application Data, Application Data, Application Data, Application Data, Application Data, Application Data, Application Data, Application Data, Application Data, Application Data"
72,3.330046,140.82.114.3,100.86.73.172,TLSv1.3,948,"Application Data, Application Data"
73,3.330046,140.82.114.3,100.86.73.172,TLSv1.3,11542,"Application Data, Application Data, Application Data, Application Data, Application Data, Application Data, Application Data, Application Data"
74,3.330046,140.82.114.3,100.86.73.172,TLSv1.3,1145,"Application Data, Application Data"
75,3.330046,140.82.114.3,100.86.73.172,TLSv1.3,7234,"Application Data, Application Data, Application Data, Application Data, Application Data"
76,3.330046,140.82.114.3,100.86.73.172,TCP,7234,"[TCP Previous segment not captured] 443  >  62473 [ACK] Seq=154306 Ack=3901 Win=75776 Len=7180 [TCP segment of a reassembled PDU], Application Data, Application Data, Application Data, Application Data"
77,3.330046,140.82.114.3,100.86.73.172,TLSv1.3,915,Continuation Data
78,3.330046,140.82.114.3,100.86.73.172,TLSv1.3,11542,"Application Data, Application Data, Application Data, Application Data, Application Data, Application Data, Application Data, Application Data"
79,3.330318,100.86.73.172,140.82.114.3,TCP,66,62473  >  443 [ACK] Seq=3901 Ack=152870 Win=132096 Len=0 SLE=154306 SRE=161486
80,3.330419,100.86.73.172,140.82.114.3,TCP,66,[TCP Dup ACK 79#1] 62473  >  443 [ACK] Seq=3901 Ack=152870 Win=132096 Len=0 SLE=154306 SRE=162347
81,3.330492,100.86.73.172,140.82.114.3,TCP,66,[TCP Dup ACK 79#2] 62473  >  443 [ACK] Seq=3901 Ack=152870 Win=132096 Len=0 SLE=154306 SRE=173835
82,3.330691,140.82.114.3,100.86.73.172,TLSv1.3,2926,"Application Data, Application Data"
83,3.330749,100.86.73.172,140.82.114.3,TCP,66,[TCP Dup ACK 79#3] 62473  >  443 [ACK] Seq=3901 Ack=152870 Win=132096 Len=0 SLE=154306 SRE=176707
84,3.330938,140.82.114.3,100.86.73.172,TLSv1.3,1490,Application Data
85,3.330938,140.82.114.3,100.86.73.172,TLSv1.3,915,Application Data
86,3.331,100.86.73.172,140.82.114.3,TCP,66,[TCP Dup ACK 79#4] 62473  >  443 [ACK] Seq=3901 Ack=152870 Win=132096 Len=0 SLE=154306 SRE=178143
87,3.331093,100.86.73.172,140.82.114.3,TCP,66,[TCP Dup ACK 79#5] 62473  >  443 [ACK] Seq=3901 Ack=152870 Win=132096 Len=0 SLE=154306 SRE=179004
88,3.339794,140.82.114.3,100.86.73.172,TLSv1.3,1490,Application Data
89,3.339886,100.86.73.172,140.82.114.3,TCP,66,[TCP Dup ACK 79#6] 62473  >  443 [ACK] Seq=3901 Ack=152870 Win=132096 Len=0 SLE=154306 SRE=180440
90,3.340209,140.82.114.3,100.86.73.172,TLSv1.3,2926,"Application Data, Application Data"
91,3.340263,100.86.73.172,140.82.114.3,TCP,66,[TCP Dup ACK 79#7] 62473  >  443 [ACK] Seq=3901 Ack=152870 Win=132096 Len=0 SLE=154306 SRE=183312
92,3.340541,140.82.114.3,100.86.73.172,TLSv1.3,1490,Application Data
93,3.340541,140.82.114.3,100.86.73.172,TLSv1.3,110,Application Data
94,3.340586,100.86.73.172,140.82.114.3,TCP,66,[TCP Dup ACK 79#8] 62473  >  443 [ACK] Seq=3901 Ack=152870 Win=132096 Len=0 SLE=154306 SRE=184748
95,3.340666,100.86.73.172,140.82.114.3,TCP,66,[TCP Dup ACK 79#9] 62473  >  443 [ACK] Seq=3901 Ack=152870 Win=132096 Len=0 SLE=154306 SRE=184804
96,3.342382,140.82.114.3,100.86.73.172,TLSv1.3,1490,"[TCP Fast Retransmission] , Application Data"
97,3.342547,100.86.73.172,140.82.114.3,TCP,54,62473  >  443 [ACK] Seq=3901 Ack=184804 Win=132096 Len=0
98,3.749187,100.86.73.172,140.82.114.3,TLSv1.3,1374,Application Data
99,3.749292,100.86.73.172,140.82.114.3,TLSv1.3,282,Application Data
100,3.759167,140.82.114.3,100.86.73.172,TCP,56,443  >  62473 [ACK] Seq=184804 Ack=5221 Win=78848 Len=0
101,3.759469,140.82.114.3,100.86.73.172,TCP,56,443  >  62473 [ACK] Seq=184804 Ack=5449 Win=81920 Len=0
102,3.789756,140.82.114.3,100.86.73.172,TLSv1.3,1490,Application Data
103,3.790162,140.82.114.3,100.86.73.172,TLSv1.3,1490,Application Data
104,3.790162,140.82.114.3,100.86.73.172,TLSv1.3,1407,"Application Data, Application Data"
105,3.790201,100.86.73.172,140.82.114.3,TCP,54,62473  >  443 [ACK] Seq=5449 Ack=189029 Win=132096 Len=0
106,3.927398,100.86.73.172,140.82.114.3,TLSv1.3,721,Application Data
107,3.98382,140.82.114.3,100.86.73.172,TCP,56,443  >  62473 [ACK] Seq=189029 Ack=6116 Win=84992 Len=0
108,3.996332,140.82.114.3,100.86.73.172,TLSv1.3,1490,Application Data
109,3.997991,140.82.114.3,100.86.73.172,TLSv1.3,18722,"Application Data, Application Data, Application Data, Application Data, Application Data, Application Data, Application Data, Application Data, Application Data, Application Data, Application Data, Application Data, Application Data"
110,3.997991,140.82.114.3,100.86.73.172,TLSv1.3,944,"Application Data, Application Data"
111,3.997991,140.82.114.3,100.86.73.172,TLSv1.3,8670,"Application Data, Application Data, Application Data, Application Data, Application Data, Application Data"
112,3.998135,100.86.73.172,140.82.114.3,TCP,54,62473  >  443 [ACK] Seq=6116 Ack=218639 Win=132096 Len=0
113,3.998366,140.82.114.3,100.86.73.172,TLSv1.3,1490,Application Data
114,3.998366,140.82.114.3,100.86.73.172,TLSv1.3,249,Application Data
115,3.99842,100.86.73.172,140.82.114.3,TCP,54,62473  >  443 [ACK] Seq=6116 Ack=220270 Win=132096 Len=0
116,4.121758,140.82.114.3,100.86.73.172,TLSv1.3,1490,Application Data
117,4.122211,140.82.114.3,100.86.73.172,TLSv1.3,2926,"Application Data, Application Data"
118,4.122247,100.86.73.172,140.82.114.3,TCP,54,62473  >  443 [ACK] Seq=6116 Ack=224578 Win=132096 Len=0
119,4.124194,140.82.114.3,100.86.73.172,TLSv1.3,15850,"Application Data, Application Data, Application Data, Application Data, Application Data, Application Data, Application Data, Application Data, Application Data, Application Data, Application Data"
120,4.124194,140.82.114.3,100.86.73.172,TLSv1.3,916,"Application Data, Application Data"
121,4.124194,140.82.114.3,100.86.73.172,TLSv1.3,11542,"Application Data, Application Data, Application Data, Application Data, Application Data, Application Data, Application Data, Application Data"
122,4.124194,140.82.114.3,100.86.73.172,TLSv1.3,229,Application Data
123,4.124194,140.82.114.3,100.86.73.172,TLSv1.3,1490,Application Data
124,4.124194,140.82.114.3,100.86.73.172,TCP,2926,"[TCP Previous segment not captured] 443  >  62473 [ACK] Seq=255771 Ack=6116 Win=84992 Len=2872 [TCP segment of a reassembled PDU], Application Data"
125,4.124194,140.82.114.3,100.86.73.172,TLSv1.3,2926,"[TCP Previous segment not captured] , Continuation Data"
126,4.124276,100.86.73.172,140.82.114.3,TCP,66,62473  >  443 [ACK] Seq=6116 Ack=254335 Win=132096 Len=0 SLE=255771 SRE=258643
127,4.124307,100.86.73.172,140.82.114.3,TCP,74,[TCP Dup ACK 126#1] 62473  >  443 [ACK] Seq=6116 Ack=254335 Win=132096 Len=0 SLE=260079 SRE=262951 SLE=255771 SRE=258643
128,4.124929,140.82.114.3,100.86.73.172,TLSv1.3,1490,Continuation Data
129,4.124929,140.82.114.3,100.86.73.172,TLSv1.3,955,Continuation Data
130,4.124949,100.86.73.172,140.82.114.3,TCP,74,[TCP Dup ACK 126#2] 62473  >  443 [ACK] Seq=6116 Ack=254335 Win=132096 Len=0 SLE=260079 SRE=264387 SLE=255771 SRE=258643
131,4.124977,100.86.73.172,140.82.114.3,TCP,74,[TCP Dup ACK 126#3] 62473  >  443 [ACK] Seq=6116 Ack=254335 Win=132096 Len=0 SLE=260079 SRE=265288 SLE=255771 SRE=258643
132,4.135994,140.82.114.3,100.86.73.172,TLSv1.3,1490,"[TCP Fast Retransmission] , Application Data"
133,4.135994,140.82.114.3,100.86.73.172,TCP,1490,[TCP Out-Of-Order] 443  >  62473 [ACK] Seq=258643 Ack=6116 Win=84992 Len=1436
134,4.136044,100.86.73.172,140.82.114.3,TCP,66,62473  >  443 [ACK] Seq=6116 Ack=258643 Win=132096 Len=0 SLE=260079 SRE=265288
135,4.136099,100.86.73.172,140.82.114.3,TCP,54,62473  >  443 [ACK] Seq=6116 Ack=265288 Win=132096 Len=0
136,4.323783,100.86.73.172,140.82.114.3,TLSv1.3,776,Application Data
137,4.32484,100.86.73.172,140.82.114.3,TLSv1.3,903,Application Data
138,4.324914,100.86.73.172,140.82.114.3,TLSv1.3,198,Application Data
139,4.324963,100.86.73.172,140.82.114.3,TLSv1.3,198,Application Data
140,4.32501,100.86.73.172,140.82.114.3,TLSv1.3,205,Application Data
141,4.333888,140.82.114.3,100.86.73.172,TCP,56,443  >  62473 [ACK] Seq=265288 Ack=6838 Win=88064 Len=0
142,4.334795,140.82.114.3,100.86.73.172,TCP,56,443  >  62473 [ACK] Seq=265288 Ack=7687 Win=90112 Len=0
143,4.335148,140.82.114.3,100.86.73.172,TCP,56,443  >  62473 [ACK] Seq=265288 Ack=7831 Win=93184 Len=0
144,4.335576,140.82.114.3,100.86.73.172,TCP,56,443  >  62473 [ACK] Seq=265288 Ack=8126 Win=99328 Len=0
145,4.389682,140.82.114.3,100.86.73.172,TLSv1.3,1490,Application Data
146,4.390682,140.82.114.3,100.86.73.172,TLSv1.3,1490,Application Data
147,4.390682,140.82.114.3,100.86.73.172,TLSv1.3,1483,"Application Data, Application Data"
148,4.390682,140.82.114.3,100.86.73.172,TLSv1.3,2926,"Application Data, Application Data"
149,4.390746,100.86.73.172,140.82.114.3,TCP,54,62473  >  443 [ACK] Seq=8126 Ack=272461 Win=132096 Len=0
150,4.391236,140.82.114.3,100.86.73.172,TLSv1.3,1483,"Application Data, Application Data"
151,4.391236,140.82.114.3,100.86.73.172,TLSv1.3,4362,"Application Data, Application Data, Application Data"
152,4.391296,100.86.73.172,140.82.114.3,TCP,54,62473  >  443 [ACK] Seq=8126 Ack=278198 Win=132096 Len=0
153,4.39184,140.82.114.3,100.86.73.172,TLSv1.3,65,Application Data
154,4.391873,100.86.73.172,140.82.114.3,TCP,54,62473  >  443 [ACK] Seq=8126 Ack=278209 Win=132096 Len=0
155,4.398173,140.82.114.3,100.86.73.172,TLSv1.3,1490,Application Data
156,4.398644,140.82.114.3,100.86.73.172,TLSv1.3,1490,Application Data
157,4.398644,140.82.114.3,100.86.73.172,TLSv1.3,1481,"Application Data, Application Data"
158,4.398691,100.86.73.172,140.82.114.3,TCP,54,62473  >  443 [ACK] Seq=8126 Ack=282508 Win=132096 Len=0
159,4.428971,140.82.114.3,100.86.73.172,TLSv1.3,1490,Application Data
160,4.429016,100.86.73.172,140.82.114.3,TCP,54,62473  >  443 [ACK] Seq=8126 Ack=283944 Win=132096 Len=0
161,4.429627,140.82.114.3,100.86.73.172,TLSv1.3,1490,Application Data
162,4.429627,140.82.114.3,100.86.73.172,TLSv1.3,1481,"Application Data, Application Data"
163,4.429669,100.86.73.172,140.82.114.3,TCP,54,62473  >  443 [ACK] Seq=8126 Ack=286807 Win=132096 Len=0
164,6.177232,100.86.73.172,140.82.114.3,TLSv1.3,684,Application Data
165,6.187439,140.82.114.3,100.86.73.172,TCP,56,443  >  62473 [ACK] Seq=286807 Ack=8756 Win=102400 Len=0
166,6.275684,140.82.114.3,100.86.73.172,TLSv1.3,1490,Application Data
167,6.275684,140.82.114.3,100.86.73.172,TLSv1.3,1490,Application Data
168,6.275684,140.82.114.3,100.86.73.172,TLSv1.3,1490,Application Data
169,6.275827,100.86.73.172,140.82.114.3,TCP,54,62473  >  443 [ACK] Seq=8756 Ack=291115 Win=132096 Len=0
170,6.278707,140.82.114.3,100.86.73.172,TLSv1.3,1490,Application Data
171,6.278707,140.82.114.3,100.86.73.172,TLSv1.3,1490,Application Data
172,6.278707,140.82.114.3,100.86.73.172,TLSv1.3,1490,Application Data
173,6.278707,140.82.114.3,100.86.73.172,TLSv1.3,1490,Application Data
174,6.278707,140.82.114.3,100.86.73.172,TLSv1.3,1490,Application Data
175,6.278707,140.82.114.3,100.86.73.172,TLSv1.3,1490,Application Data
176,6.278707,140.82.114.3,100.86.73.172,TLSv1.3,1490,Application Data
177,6.278707,140.82.114.3,100.86.73.172,TLSv1.3,1490,Application Data
178,6.278707,140.82.114.3,100.86.73.172,TLSv1.3,1490,Application Data
179,6.278707,140.82.114.3,100.86.73.172,TLSv1.3,1490,Application Data
180,6.27899,100.86.73.172,140.82.114.3,TCP,54,62473  >  443 [ACK] Seq=8756 Ack=305475 Win=132096 Len=0
181,6.279333,140.82.114.3,100.86.73.172,TLSv1.3,210,Application Data
182,6.279384,100.86.73.172,140.82.114.3,TCP,54,62473  >  443 [ACK] Seq=8756 Ack=305631 Win=131840 Len=0
183,6.282114,100.86.73.172,140.82.114.3,TLSv1.3,89,Application Data
184,6.292691,140.82.114.3,100.86.73.172,TCP,56,443  >  62473 [ACK] Seq=305631 Ack=8791 Win=102400 Len=0
185,6.394923,100.86.73.172,140.82.114.3,TLSv1.3,755,Application Data
186,6.409772,140.82.114.3,100.86.73.172,TCP,56,443  >  62473 [ACK] Seq=305631 Ack=9492 Win=104448 Len=0
187,6.473353,140.82.114.3,100.86.73.172,TLSv1.3,1490,Application Data
188,6.47357,140.82.114.3,100.86.73.172,TLSv1.3,2926,"Application Data, Application Data"
189,6.473626,100.86.73.172,140.82.114.3,TCP,54,62473  >  443 [ACK] Seq=9492 Ack=309939 Win=132096 Len=0
190,6.474031,140.82.114.3,100.86.73.172,TLSv1.3,1490,Application Data
191,6.474031,140.82.114.3,100.86.73.172,TLSv1.3,1218,Application Data
192,6.474074,100.86.73.172,140.82.114.3,TCP,54,62473  >  443 [ACK] Seq=9492 Ack=312539 Win=132096 Len=0
193,7.400261,100.86.73.172,140.82.114.3,TLSv1.3,758,Application Data
194,7.410794,140.82.114.3,100.86.73.172,TCP,56,443  >  62473 [ACK] Seq=312539 Ack=10196 Win=107520 Len=0
195,7.730432,140.82.114.3,100.86.73.172,TLSv1.3,1490,Application Data
196,7.731131,140.82.114.3,100.86.73.172,TLSv1.3,2926,"Application Data, Application Data"
197,7.731192,100.86.73.172,140.82.114.3,TCP,54,62473  >  443 [ACK] Seq=10196 Ack=316847 Win=132096 Len=0
198,7.733728,140.82.114.3,100.86.73.172,TLSv1.3,15850,"Application Data, Application Data, Application Data, Application Data, Application Data, Application Data, Application Data, Application Data, Application Data, Application Data, Application Data"
199,7.733728,140.82.114.3,100.86.73.172,TLSv1.3,950,"Application Data, Application Data"
200,7.733728,140.82.114.3,100.86.73.172,TLSv1.3,15850,"Application Data, Application Data, Application Data, Application Data, Application Data, Application Data, Application Data, Application Data, Application Data, Application Data, Application Data"
201,7.733728,140.82.114.3,100.86.73.172,TLSv1.3,915,Application Data
202,7.733728,140.82.114.3,100.86.73.172,TLSv1.3,15850,"Application Data, Application Data, Application Data, Application Data, Application Data, Application Data, Application Data, Application Data, Application Data, Application Data, Application Data"
203,7.733728,140.82.114.3,100.86.73.172,TLSv1.3,915,Application Data
204,7.733868,100.86.73.172,140.82.114.3,TCP,54,62473  >  443 [ACK] Seq=10196 Ack=366853 Win=132096 Len=0
205,7.735221,140.82.114.3,100.86.73.172,TLSv1.3,1490,Application Data
206,7.735264,100.86.73.172,140.82.114.3,TCP,54,62473  >  443 [ACK] Seq=10196 Ack=368289 Win=132096 Len=0
207,7.745064,140.82.114.3,100.86.73.172,TLSv1.3,1490,"Application Data, Application Data"
208,7.745429,140.82.114.3,100.86.73.172,TLSv1.3,1490,Application Data
209,7.745483,100.86.73.172,140.82.114.3,TCP,54,62473  >  443 [ACK] Seq=10196 Ack=371161 Win=132096 Len=0
210,7.745921,140.82.114.3,100.86.73.172,TLSv1.3,2926,"Application Data, Application Data"
211,7.745971,100.86.73.172,140.82.114.3,TCP,54,62473  >  443 [ACK] Seq=10196 Ack=374033 Win=132096 Len=0
212,7.7471,140.82.114.3,100.86.73.172,TLSv1.3,8670,"Application Data, Application Data, Application Data, Application Data, Application Data, Application Data"
213,7.747165,100.86.73.172,140.82.114.3,TCP,54,62473  >  443 [ACK] Seq=10196 Ack=382649 Win=132096 Len=0
214,7.751608,140.82.114.3,100.86.73.172,TLSv1.3,1490,Application Data
215,7.751608,140.82.114.3,100.86.73.172,TLSv1.3,899,Application Data
216,7.751676,100.86.73.172,140.82.114.3,TCP,54,62473  >  443 [ACK] Seq=10196 Ack=384930 Win=132096 Len=0
217,8.039668,100.86.73.172,140.82.114.3,TLSv1.3,1435,Application Data
218,8.041466,100.86.73.172,140.82.114.3,TLSv1.3,264,Application Data
219,8.051158,140.82.114.3,100.86.73.172,TCP,56,443  >  62473 [ACK] Seq=384930 Ack=11577 Win=110592 Len=0
220,8.053255,140.82.114.3,100.86.73.172,TCP,56,443  >  62473 [ACK] Seq=384930 Ack=11787 Win=113664 Len=0
221,8.084443,140.82.114.3,100.86.73.172,TLSv1.3,1490,Application Data
222,8.084904,140.82.114.3,100.86.73.172,TLSv1.3,1490,Application Data
223,8.084904,140.82.114.3,100.86.73.172,TLSv1.3,1397,"Application Data, Application Data"
224,8.084939,100.86.73.172,140.82.114.3,TCP,54,62473  >  443 [ACK] Seq=11787 Ack=389145 Win=132096 Len=0
225,8.462312,140.82.114.3,100.86.73.172,TLSv1.3,1490,Application Data
226,8.46434,140.82.114.3,100.86.73.172,TLSv1.3,1490,Application Data
227,8.46434,140.82.114.3,100.86.73.172,TLSv1.3,1490,Application Data
228,8.46434,140.82.114.3,100.86.73.172,TLSv1.3,15850,"Application Data, Application Data, Application Data, Application Data, Application Data, Application Data, Application Data, Application Data, Application Data, Application Data, Application Data"
229,8.46434,140.82.114.3,100.86.73.172,TLSv1.3,942,"Application Data, Application Data"
230,8.46434,140.82.114.3,100.86.73.172,TLSv1.3,5798,"Application Data, Application Data, Application Data, Application Data"
231,8.464539,100.86.73.172,140.82.114.3,TCP,54,62473  >  443 [ACK] Seq=11787 Ack=415881 Win=132096 Len=0
232,8.46479,140.82.114.3,100.86.73.172,TLSv1.3,2926,"Application Data, Application Data"
233,8.464859,100.86.73.172,140.82.114.3,TCP,54,62473  >  443 [ACK] Seq=11787 Ack=418753 Win=132096 Len=0
234,8.46509,140.82.114.3,100.86.73.172,TLSv1.3,1490,Application Data
235,8.46509,140.82.114.3,100.86.73.172,TLSv1.3,103,Application Data
236,8.465161,100.86.73.172,140.82.114.3,TCP,54,62473  >  443 [ACK] Seq=11787 Ack=420238 Win=132096 Len=0
237,12.899393,100.86.73.172,140.82.114.3,TLSv1.3,714,Application Data
238,12.956616,140.82.114.3,100.86.73.172,TCP,56,443  >  62473 [ACK] Seq=420238 Ack=12447 Win=116736 Len=0
239,13.088914,140.82.114.3,100.86.73.172,TLSv1.3,1490,Application Data
240,13.089451,140.82.114.3,100.86.73.172,TLSv1.3,2926,"Application Data, Application Data"
241,13.089546,100.86.73.172,140.82.114.3,TCP,54,62473  >  443 [ACK] Seq=12447 Ack=424546 Win=132096 Len=0
242,13.092834,140.82.114.3,100.86.73.172,TLSv1.3,1490,Application Data
243,13.092834,140.82.114.3,100.86.73.172,TLSv1.3,1490,Application Data
244,13.092834,140.82.114.3,100.86.73.172,TLSv1.3,1490,Application Data
245,13.092834,140.82.114.3,100.86.73.172,TLSv1.3,1490,Application Data
246,13.092834,140.82.114.3,100.86.73.172,TLSv1.3,1490,Application Data
247,13.092834,140.82.114.3,100.86.73.172,TLSv1.3,1490,Application Data
248,13.092834,140.82.114.3,100.86.73.172,TLSv1.3,1490,Application Data
249,13.092834,140.82.114.3,100.86.73.172,TLSv1.3,1490,Application Data
250,13.092834,140.82.114.3,100.86.73.172,TLSv1.3,1490,Application Data
251,13.092834,140.82.114.3,100.86.73.172,TLSv1.3,1490,Application Data
252,13.093181,100.86.73.172,140.82.114.3,TCP,54,62473  >  443 [ACK] Seq=12447 Ack=438906 Win=132096 Len=0
253,13.093819,140.82.114.3,100.86.73.172,TLSv1.3,252,Application Data
254,13.093898,100.86.73.172,140.82.114.3,TCP,54,62473  >  443 [ACK] Seq=12447 Ack=439104 Win=131840 Len=0
255,13.101528,100.86.73.172,140.82.114.3,TLSv1.3,89,Application Data
256,13.112335,140.82.114.3,100.86.73.172,TCP,56,443  >  62473 [ACK] Seq=439104 Ack=12482 Win=116736 Len=0
257,13.213577,100.86.73.172,140.82.114.3,TLSv1.3,708,Application Data
258,13.223597,140.82.114.3,100.86.73.172,TCP,56,443  >  62473 [ACK] Seq=439104 Ack=13136 Win=118784 Len=0
259,13.285561,140.82.114.3,100.86.73.172,TLSv1.3,1490,Application Data
260,13.285561,140.82.114.3,100.86.73.172,TLSv1.3,1490,Application Data
261,13.285561,140.82.114.3,100.86.73.172,TLSv1.3,1490,Application Data
262,13.28564,100.86.73.172,140.82.114.3,TCP,54,62473  >  443 [ACK] Seq=13136 Ack=443412 Win=132096 Len=0
263,13.287205,140.82.114.3,100.86.73.172,TLSv1.3,1490,Application Data
264,13.287205,140.82.114.3,100.86.73.172,TLSv1.3,1228,Application Data
265,13.287253,100.86.73.172,140.82.114.3,TCP,54,62473  >  443 [ACK] Seq=13136 Ack=446022 Win=132096 Len=0
266,14.095057,100.86.73.172,140.82.114.3,TLSv1.3,1466,Application Data
267,14.105218,140.82.114.3,100.86.73.172,TCP,56,443  >  62473 [ACK] Seq=446022 Ack=14548 Win=121856 Len=0
268,14.434656,140.82.114.3,100.86.73.172,TLSv1.3,1490,Application Data
269,14.436739,140.82.114.3,100.86.73.172,TLSv1.3,18722,"Application Data, Application Data, Application Data, Application Data, Application Data, Application Data, Application Data, Application Data, Application Data, Application Data, Application Data, Application Data, Application Data"
270,14.436739,140.82.114.3,100.86.73.172,TLSv1.3,912,"Application Data, Application Data"
271,14.436739,140.82.114.3,100.86.73.172,TCP,5798,"[TCP Previous segment not captured] 443  >  62473 [ACK] Seq=468420 Ack=14548 Win=121856 Len=5744 [TCP segment of a reassembled PDU], Application Data, Application Data, Application Data"
272,14.436924,100.86.73.172,140.82.114.3,TCP,66,62473  >  443 [ACK] Seq=14548 Ack=466984 Win=132096 Len=0 SLE=468420 SRE=474164
273,14.438469,140.82.114.3,100.86.73.172,TLSv1.3,4362,Continuation Data
274,14.438469,140.82.114.3,100.86.73.172,TLSv1.3,224,Continuation Data
275,14.438469,140.82.114.3,100.86.73.172,TLSv1.3,984,Application Data
276,14.438469,140.82.114.3,100.86.73.172,TLSv1.3,15850,"Application Data, Application Data, Application Data, Application Data, Application Data, Application Data, Application Data, Application Data, Application Data, Application Data, Application Data"
277,14.438469,140.82.114.3,100.86.73.172,TLSv1.3,915,Application Data
278,14.438469,140.82.114.3,100.86.73.172,TLSv1.3,1490,Application Data
279,14.438521,100.86.73.172,140.82.114.3,TCP,66,[TCP Dup ACK 272#1] 62473  >  443 [ACK] Seq=14548 Ack=466984 Win=132096 Len=0 SLE=468420 SRE=478472
280,14.438557,100.86.73.172,140.82.114.3,TCP,66,[TCP Dup ACK 272#2] 62473  >  443 [ACK] Seq=14548 Ack=466984 Win=132096 Len=0 SLE=468420 SRE=478642
281,14.438579,100.86.73.172,140.82.114.3,TCP,66,[TCP Dup ACK 272#3] 62473  >  443 [ACK] Seq=14548 Ack=466984 Win=132096 Len=0 SLE=468420 SRE=479572
282,14.438598,100.86.73.172,140.82.114.3,TCP,66,[TCP Dup ACK 272#4] 62473  >  443 [ACK] Seq=14548 Ack=466984 Win=132096 Len=0 SLE=468420 SRE=495368
283,14.438626,100.86.73.172,140.82.114.3,TCP,66,[TCP Dup ACK 272#5] 62473  >  443 [ACK] Seq=14548 Ack=466984 Win=132096 Len=0 SLE=468420 SRE=496229
284,14.438644,100.86.73.172,140.82.114.3,TCP,66,[TCP Dup ACK 272#6] 62473  >  443 [ACK] Seq=14548 Ack=466984 Win=132096 Len=0 SLE=468420 SRE=497665
285,14.438769,140.82.114.3,100.86.73.172,TLSv1.3,1490,Application Data
286,14.438769,140.82.114.3,100.86.73.172,TLSv1.3,1291,Application Data
287,14.4388,100.86.73.172,140.82.114.3,TCP,66,[TCP Dup ACK 272#7] 62473  >  443 [ACK] Seq=14548 Ack=466984 Win=132096 Len=0 SLE=468420 SRE=499101
288,14.43883,100.86.73.172,140.82.114.3,TCP,66,[TCP Dup ACK 272#8] 62473  >  443 [ACK] Seq=14548 Ack=466984 Win=132096 Len=0 SLE=468420 SRE=500338
289,14.44951,140.82.114.3,100.86.73.172,TLSv1.3,1490,Application Data
290,14.449553,100.86.73.172,140.82.114.3,TCP,66,[TCP Dup ACK 272#9] 62473  >  443 [ACK] Seq=14548 Ack=466984 Win=132096 Len=0 SLE=468420 SRE=501774
291,14.450028,140.82.114.3,100.86.73.172,TLSv1.3,2926,"Application Data, Application Data"
292,14.450057,100.86.73.172,140.82.114.3,TCP,66,[TCP Dup ACK 272#10] 62473  >  443 [ACK] Seq=14548 Ack=466984 Win=132096 Len=0 SLE=468420 SRE=504646
293,14.451342,140.82.114.3,100.86.73.172,TLSv1.3,5798,"Application Data, Application Data, Application Data, Application Data"
294,14.451342,140.82.114.3,100.86.73.172,TLSv1.3,11542,"[TCP Previous segment not captured] , Continuation Data"
295,14.451378,100.86.73.172,140.82.114.3,TCP,66,[TCP Dup ACK 272#11] 62473  >  443 [ACK] Seq=14548 Ack=466984 Win=132096 Len=0 SLE=468420 SRE=510390
296,14.451423,100.86.73.172,140.82.114.3,TCP,74,[TCP Dup ACK 272#12] 62473  >  443 [ACK] Seq=14548 Ack=466984 Win=132096 Len=0 SLE=511826 SRE=523314 SLE=468420 SRE=510390
297,14.452162,140.82.114.3,100.86.73.172,TLSv1.3,885,Continuation Data
298,14.452162,140.82.114.3,100.86.73.172,TLSv1.3,1490,"[TCP Fast Retransmission] , Application Data"
299,14.452186,100.86.73.172,140.82.114.3,TCP,74,[TCP Dup ACK 272#13] 62473  >  443 [ACK] Seq=14548 Ack=466984 Win=132096 Len=0 SLE=511826 SRE=524145 SLE=468420 SRE=510390
300,14.452273,100.86.73.172,140.82.114.3,TCP,66,62473  >  443 [ACK] Seq=14548 Ack=510390 Win=132096 Len=0 SLE=511826 SRE=524145
301,14.463566,140.82.114.3,100.86.73.172,TCP,1490,[TCP Out-Of-Order] 443  >  62473 [ACK] Seq=510390 Ack=14548 Win=121856 Len=1436
302,14.463634,100.86.73.172,140.82.114.3,TCP,54,62473  >  443 [ACK] Seq=14548 Ack=524145 Win=132096 Len=0
303,14.769389,100.86.73.172,140.82.114.3,TLSv1.3,801,Application Data
304,14.779322,140.82.114.3,100.86.73.172,TCP,56,443  >  62473 [ACK] Seq=524145 Ack=15295 Win=124928 Len=0
305,14.780443,100.86.73.172,140.82.114.3,TLSv1.3,209,Application Data
306,14.781398,100.86.73.172,140.82.114.3,TLSv1.3,200,Application Data
307,14.781466,100.86.73.172,140.82.114.3,TLSv1.3,198,Application Data
308,14.78152,100.86.73.172,140.82.114.3,TLSv1.3,198,Application Data
309,14.781567,100.86.73.172,140.82.114.3,TLSv1.3,205,Application Data
310,14.790503,140.82.114.3,100.86.73.172,TCP,56,443  >  62473 [ACK] Seq=524145 Ack=15450 Win=128000 Len=0
311,14.791161,140.82.114.3,100.86.73.172,TCP,56,443  >  62473 [ACK] Seq=524145 Ack=15596 Win=131072 Len=0
312,14.791603,140.82.114.3,100.86.73.172,TCP,56,443  >  62473 [ACK] Seq=524145 Ack=16035 Win=133120 Len=0
313,14.807113,140.82.114.3,100.86.73.172,TLSv1.3,1490,Application Data
314,14.807569,140.82.114.3,100.86.73.172,TLSv1.3,1490,Application Data
315,14.807569,140.82.114.3,100.86.73.172,TLSv1.3,1401,"Application Data, Application Data"
316,14.807623,100.86.73.172,140.82.114.3,TCP,54,62473  >  443 [ACK] Seq=16035 Ack=528364 Win=132096 Len=0
317,14.833345,140.82.114.3,100.86.73.172,TLSv1.3,1490,Application Data
318,14.833381,100.86.73.172,140.82.114.3,TCP,54,62473  >  443 [ACK] Seq=16035 Ack=529800 Win=132096 Len=0
319,14.833863,140.82.114.3,100.86.73.172,TLSv1.3,2926,"Application Data, Application Data"
320,14.833896,100.86.73.172,140.82.114.3,TCP,54,62473  >  443 [ACK] Seq=16035 Ack=532672 Win=132096 Len=0
321,14.834514,140.82.114.3,100.86.73.172,TLSv1.3,56,Application Data
322,14.838783,140.82.114.3,100.86.73.172,TLSv1.3,1490,Application Data
323,14.838832,100.86.73.172,140.82.114.3,TCP,54,62473  >  443 [ACK] Seq=16035 Ack=534109 Win=132096 Len=0
324,14.840768,140.82.114.3,100.86.73.172,TLSv1.3,1490,Application Data
325,14.840768,140.82.114.3,100.86.73.172,TLSv1.3,1473,"Application Data, Application Data"
326,14.840808,100.86.73.172,140.82.114.3,TCP,54,62473  >  443 [ACK] Seq=16035 Ack=536964 Win=132096 Len=0
327,14.841981,140.82.114.3,100.86.73.172,TLSv1.3,1490,Application Data
328,14.842466,140.82.114.3,100.86.73.172,TLSv1.3,1490,Application Data
329,14.842466,140.82.114.3,100.86.73.172,TLSv1.3,1477,"Application Data, Application Data"
330,14.842514,100.86.73.172,140.82.114.3,TCP,54,62473  >  443 [ACK] Seq=16035 Ack=541259 Win=132096 Len=0
331,14.849284,140.82.114.3,100.86.73.172,TLSv1.3,1490,Application Data
332,14.849331,100.86.73.172,140.82.114.3,TCP,54,62473  >  443 [ACK] Seq=16035 Ack=542695 Win=132096 Len=0
333,14.849804,140.82.114.3,100.86.73.172,TLSv1.3,2926,"Application Data, Application Data"
334,14.849837,100.86.73.172,140.82.114.3,TCP,54,62473  >  443 [ACK] Seq=16035 Ack=545567 Win=132096 Len=0
335,14.850364,140.82.114.3,100.86.73.172,TLSv1.3,56,Application Data
336,14.861548,140.82.114.3,100.86.73.172,TLSv1.3,1490,Application Data
337,14.861604,100.86.73.172,140.82.114.3,TCP,54,62473  >  443 [ACK] Seq=16035 Ack=547004 Win=132096 Len=0
338,14.861991,140.82.114.3,100.86.73.172,TLSv1.3,1490,Application Data
339,14.861991,140.82.114.3,100.86.73.172,TLSv1.3,1479,"Application Data, Application Data"
340,14.862031,100.86.73.172,140.82.114.3,TCP,54,62473  >  443 [ACK] Seq=16035 Ack=549865 Win=132096 Len=0
341,15.8177,100.86.73.172,140.82.114.3,TLSv1.3,784,Application Data
342,15.871751,140.82.114.3,100.86.73.172,TCP,56,443  >  62473 [ACK] Seq=549865 Ack=16765 Win=136192 Len=0
343,15.971562,140.82.114.3,100.86.73.172,TLSv1.3,1490,Application Data
344,15.971827,140.82.114.3,100.86.73.172,TLSv1.3,2926,"Application Data, Application Data"
345,15.971934,100.86.73.172,140.82.114.3,TCP,54,62473  >  443 [ACK] Seq=16765 Ack=554173 Win=132096 Len=0
346,15.973269,140.82.114.3,100.86.73.172,TLSv1.3,14414,"Application Data, Application Data, Application Data, Application Data, Application Data, Application Data, Application Data, Application Data, Application Data, Application Data"
347,15.973393,100.86.73.172,140.82.114.3,TCP,54,62473  >  443 [ACK] Seq=16765 Ack=568533 Win=132096 Len=0
348,15.974778,140.82.114.3,100.86.73.172,TLSv1.3,270,Application Data
349,15.974872,100.86.73.172,140.82.114.3,TCP,54,62473  >  443 [ACK] Seq=16765 Ack=568749 Win=131840 Len=0
350,16.106456,100.86.73.172,140.82.114.3,TLSv1.3,1329,Application Data
351,16.118547,140.82.114.3,100.86.73.172,TCP,56,443  >  62473 [ACK] Seq=568749 Ack=18040 Win=139264 Len=0
352,16.197644,140.82.114.3,100.86.73.172,TLSv1.3,1490,Application Data
353,16.198388,140.82.114.3,100.86.73.172,TLSv1.3,2926,"Application Data, Application Data"
354,16.198436,100.86.73.172,140.82.114.3,TCP,54,62473  >  443 [ACK] Seq=18040 Ack=573057 Win=132096 Len=0
355,16.199532,140.82.114.3,100.86.73.172,TLSv1.3,1490,Application Data
356,16.199582,100.86.73.172,140.82.114.3,TCP,54,62473  >  443 [ACK] Seq=18040 Ack=574493 Win=132096 Len=0
357,16.432017,140.82.114.3,100.86.73.172,TLSv1.3,1209,Application Data
358,16.482288,100.86.73.172,140.82.114.3,TCP,54,62473  >  443 [ACK] Seq=18040 Ack=575648 Win=130816 Len=0
359,17.013709,100.86.73.172,140.82.114.3,TLSv1.3,771,Application Data
360,17.025282,140.82.114.3,100.86.73.172,TCP,56,443  >  62473 [ACK] Seq=575648 Ack=18757 Win=142336 Len=0
361,17.229904,140.82.114.3,100.86.73.172,TLSv1.3,1490,Application Data
362,17.23215,140.82.114.3,100.86.73.172,TLSv1.3,18722,"Application Data, Application Data, Application Data, Application Data, Application Data, Application Data, Application Data, Application Data, Application Data, Application Data, Application Data, Application Data, Application Data"
363,17.23215,140.82.114.3,100.86.73.172,TLSv1.3,936,"Application Data, Application Data"
364,17.23215,140.82.114.3,100.86.73.172,TLSv1.3,11542,"Application Data, Application Data, Application Data, Application Data, Application Data, Application Data, Application Data, Application Data"
365,17.232341,100.86.73.172,140.82.114.3,TCP,54,62473  >  443 [ACK] Seq=18757 Ack=608122 Win=132096 Len=0
366,17.233431,140.82.114.3,100.86.73.172,TLSv1.3,1145,"Application Data, Application Data"
367,17.233431,140.82.114.3,100.86.73.172,TLSv1.3,1490,Application Data
368,17.233431,140.82.114.3,100.86.73.172,TLSv1.3,2926,"Application Data, Application Data"
369,17.233559,100.86.73.172,140.82.114.3,TCP,54,62473  >  443 [ACK] Seq=18757 Ack=613521 Win=132096 Len=0
370,17.233919,140.82.114.3,100.86.73.172,TLSv1.3,1490,Application Data
371,17.23399,100.86.73.172,140.82.114.3,TCP,54,62473  >  443 [ACK] Seq=18757 Ack=614957 Win=132096 Len=0
372,17.244173,140.82.114.3,100.86.73.172,TLSv1.3,1490,Application Data
373,17.245463,140.82.114.3,100.86.73.172,TCP,1490,[TCP Previous segment not captured] 443  >  62473 [ACK] Seq=617829 Ack=18757 Win=142336 Len=1436 [TCP segment of a reassembled PDU]
374,17.245463,140.82.114.3,100.86.73.172,TLSv1.3,1490,Continuation Data
375,17.245463,140.82.114.3,100.86.73.172,TLSv1.3,8670,Continuation Data
376,17.2456,100.86.73.172,140.82.114.3,TCP,66,62473  >  443 [ACK] Seq=18757 Ack=616393 Win=132096 Len=0 SLE=617829 SRE=619265
377,17.245696,100.86.73.172,140.82.114.3,TCP,66,[TCP Dup ACK 376#1] 62473  >  443 [ACK] Seq=18757 Ack=616393 Win=132096 Len=0 SLE=617829 SRE=620701
378,17.245752,100.86.73.172,140.82.114.3,TCP,66,[TCP Dup ACK 376#2] 62473  >  443 [ACK] Seq=18757 Ack=616393 Win=132096 Len=0 SLE=617829 SRE=629317
379,17.24689,140.82.114.3,100.86.73.172,TCP,1490,443  >  62473 [ACK] Seq=629317 Ack=18757 Win=142336 Len=1436
380,17.24689,140.82.114.3,100.86.73.172,TLSv1.3,1490,Continuation Data
381,17.246933,100.86.73.172,140.82.114.3,TCP,66,[TCP Dup ACK 376#3] 62473  >  443 [ACK] Seq=18757 Ack=616393 Win=132096 Len=0 SLE=617829 SRE=630753
382,17.247009,100.86.73.172,140.82.114.3,TCP,66,[TCP Dup ACK 376#4] 62473  >  443 [ACK] Seq=18757 Ack=616393 Win=132096 Len=0 SLE=617829 SRE=632189
383,17.247316,140.82.114.3,100.86.73.172,TLSv1.3,1490,Continuation Data
384,17.247316,140.82.114.3,100.86.73.172,TLSv1.3,1090,Continuation Data
385,17.247359,100.86.73.172,140.82.114.3,TCP,66,[TCP Dup ACK 376#5] 62473  >  443 [ACK] Seq=18757 Ack=616393 Win=132096 Len=0 SLE=617829 SRE=633625
386,17.247434,100.86.73.172,140.82.114.3,TCP,66,[TCP Dup ACK 376#6] 62473  >  443 [ACK] Seq=18757 Ack=616393 Win=132096 Len=0 SLE=617829 SRE=634661
387,17.257724,140.82.114.3,100.86.73.172,TLSv1.3,1490,"[TCP Fast Retransmission] , Application Data"
388,17.257872,100.86.73.172,140.82.114.3,TCP,54,62473  >  443 [ACK] Seq=18757 Ack=634661 Win=132096 Len=0
389,17.529509,100.86.73.172,140.82.114.3,TLSv1.3,837,Application Data
390,17.539937,140.82.114.3,100.86.73.172,TCP,56,443  >  62473 [ACK] Seq=634661 Ack=19540 Win=145408 Len=0
