No.,Time,Source,Destination,Protocol,Length,Info
1,0,100.86.73.172,140.82.114.3,TCP,66,57644  >  443 [SYN] Seq=0 Win=64240 Len=0 MSS=1460 WS=256 SACK_PERM
2,0.010289,140.82.114.3,100.86.73.172,TCP,66,"443  >  57644 [SYN, ACK] Seq=0 Ack=1 Win=65535 Len=0 MSS=1436 SACK_PERM WS=1024"
3,0.010463,100.86.73.172,140.82.114.3,TCP,54,57644  >  443 [ACK] Seq=1 Ack=1 Win=132096 Len=0
4,0.011267,100.86.73.172,140.82.114.3,TLSv1.3,663,Client Hello (SNI=github.com)
5,0.021652,140.82.114.3,100.86.73.172,TLSv1.3,1490,"Server Hello, Change Cipher Spec, Application Data"
6,0.022046,140.82.114.3,100.86.73.172,TCP,1490,"443  >  57644 [PSH, ACK] Seq=1437 Ack=610 Win=67584 Len=1436 [TCP segment of a reassembled PDU]"
7,0.022046,140.82.114.3,100.86.73.172,TLSv1.3,674,"Application Data, Application Data, Application Data"
8,0.022146,100.86.73.172,140.82.114.3,TCP,54,57644  >  443 [ACK] Seq=610 Ack=3493 Win=132096 Len=0
9,0.03046,100.86.73.172,140.82.114.3,TLSv1.3,118,"Change Cipher Spec, Application Data"
10,0.041286,140.82.114.3,100.86.73.172,TLSv1.3,212,"Application Data, Application Data"
11,0.041407,100.86.73.172,140.82.114.3,TCP,54,57644  >  443 [ACK] Seq=674 Ack=3651 Win=131840 Len=0
12,0.174158,100.86.73.172,140.82.114.3,TLSv1.3,146,Application Data
13,0.174351,100.86.73.172,140.82.114.3,TLSv1.3,1533,Application Data
14,0.184081,140.82.114.3,100.86.73.172,TLSv1.3,118,Application Data
15,0.18432,100.86.73.172,140.82.114.3,TLSv1.3,85,Application Data
16,0.184471,140.82.114.3,100.86.73.172,TCP,56,443  >  57644 [ACK] Seq=3715 Ack=2245 Win=70656 Len=0
17,0.242041,140.82.114.3,100.86.73.172,TCP,56,443  >  57644 [ACK] Seq=3715 Ack=2276 Win=70656 Len=0
18,0.654852,140.82.114.3,100.86.73.172,TLSv1.3,1490,Application Data
19,0.655125,140.82.114.3,100.86.73.172,TLSv1.3,2926,"Application Data, Application Data"
20,0.655208,100.86.73.172,140.82.114.3,TCP,54,57644  >  443 [ACK] Seq=2276 Ack=8023 Win=132096 Len=0
21,0.655697,140.82.114.3,100.86.73.172,TLSv1.3,8670,"Application Data, Application Data, Application Data, Application Data, Application Data, Application Data"
22,0.655817,100.86.73.172,140.82.114.3,TCP,54,57644  >  443 [ACK] Seq=2276 Ack=16639 Win=132096 Len=0
23,0.656384,140.82.114.3,100.86.73.172,TLSv1.3,1490,Application Data
24,0.656456,100.86.73.172,140.82.114.3,TCP,54,57644  >  443 [ACK] Seq=2276 Ack=18075 Win=132096 Len=0
25,0.665489,140.82.114.3,100.86.73.172,TLSv1.3,1490,Application Data
26,0.66586,140.82.114.3,100.86.73.172,TLSv1.3,2926,"Application Data, Application Data"
27,0.665935,100.86.73.172,140.82.114.3,TCP,54,57644  >  443 [ACK] Seq=2276 Ack=22383 Win=132096 Len=0
28,0.666313,140.82.114.3,100.86.73.172,TLSv1.3,2926,"Application Data, Application Data, Application Data"
29,0.666403,100.86.73.172,140.82.114.3,TCP,54,57644  >  443 [ACK] Seq=2276 Ack=25255 Win=132096 Len=0
30,0.670252,140.82.114.3,100.86.73.172,TLSv1.3,21594,"Application Data, Application Data, Application Data, Application Data, Application Data, Application Data, Application Data, Application Data, Application Data, Application Data, Application Data, Application Data, Application Data, Application Data, Application Data, Application Data"
31,0.670378,100.86.73.172,140.82.114.3,TCP,54,57644  >  443 [ACK] Seq=2276 Ack=46795 Win=132096 Len=0
32,0.676309,140.82.114.3,100.86.73.172,TLSv1.3,1490,Application Data
33,0.676947,140.82.114.3,100.86.73.172,TLSv1.3,2926,"Application Data, Application Data"
34,0.67702,100.86.73.172,140.82.114.3,TCP,54,57644  >  443 [ACK] Seq=2276 Ack=51103 Win=132096 Len=0
35,0.677112,140.82.114.3,100.86.73.172,TLSv1.3,1490,Application Data
36,0.677146,100.86.73.172,140.82.114.3,TCP,54,57644  >  443 [ACK] Seq=2276 Ack=52539 Win=132096 Len=0
37,0.679258,140.82.114.3,100.86.73.172,TLSv1.3,5798,"Application Data, Application Data, Application Data, Application Data, Application Data"
38,0.6794,100.86.73.172,140.82.114.3,TCP,54,57644  >  443 [ACK] Seq=2276 Ack=58283 Win=132096 Len=0
39,0.680496,140.82.114.3,100.86.73.172,TLSv1.3,1490,Application Data
40,0.680964,140.82.114.3,100.86.73.172,TLSv1.3,1037,Application Data
41,0.681033,100.86.73.172,140.82.114.3,TCP,54,57644  >  443 [ACK] Seq=2276 Ack=60702 Win=132096 Len=0
42,1.125639,100.86.73.172,140.82.114.3,TLSv1.3,754,Application Data
43,1.127144,100.86.73.172,140.82.114.3,TLSv1.3,174,Application Data
44,1.135973,140.82.114.3,100.86.73.172,TCP,56,443  >  57644 [ACK] Seq=60702 Ack=2976 Win=72704 Len=0
45,1.137127,140.82.114.3,100.86.73.172,TCP,56,443  >  57644 [ACK] Seq=60702 Ack=3096 Win=72704 Len=0
46,1.168227,100.86.73.172,140.82.114.3,TLSv1.3,232,Application Data
47,1.169953,100.86.73.172,140.82.114.3,TLSv1.3,182,Application Data
48,1.171038,100.86.73.172,140.82.114.3,TLSv1.3,184,Application Data
49,1.172136,140.82.114.3,100.86.73.172,TLSv1.3,1490,Application Data
50,1.172177,100.86.73.172,140.82.114.3,TCP,54,57644  >  443 [ACK] Seq=3532 Ack=62138 Win=132096 Len=0
51,1.172559,140.82.114.3,100.86.73.172,TLSv1.3,2926,"Application Data, Application Data"
52,1.172587,100.86.73.172,140.82.114.3,TCP,54,57644  >  443 [ACK] Seq=3532 Ack=65010 Win=132096 Len=0
53,1.172847,140.82.114.3,100.86.73.172,TLSv1.3,61,Application Data
54,1.172871,100.86.73.172,140.82.114.3,TCP,54,57644  >  443 [ACK] Seq=3532 Ack=65017 Win=132096 Len=0
55,1.17462,100.86.73.172,140.82.114.3,TLSv1.3,223,Application Data
56,1.180274,140.82.114.3,100.86.73.172,TCP,56,443  >  57644 [ACK] Seq=65017 Ack=3402 Win=78848 Len=0
57,1.185213,140.82.114.3,100.86.73.172,TCP,56,443  >  57644 [ACK] Seq=65017 Ack=3701 Win=84992 Len=0
58,1.197043,100.86.73.172,140.82.114.3,TLSv1.3,752,Application Data
59,1.197148,100.86.73.172,140.82.114.3,TLSv1.3,867,Application Data
60,1.208989,140.82.114.3,100.86.73.172,TCP,56,443  >  57644 [ACK] Seq=65017 Ack=5212 Win=90112 Len=0
61,1.222298,140.82.114.3,100.86.73.172,TLSv1.3,1490,Application Data
62,1.222536,100.86.73.172,140.82.114.3,TLSv1.3,227,Application Data
63,1.222792,140.82.114.3,100.86.73.172,TLSv1.3,2926,"Application Data, Application Data"
64,1.222839,100.86.73.172,140.82.114.3,TCP,54,57644  >  443 [ACK] Seq=5385 Ack=69325 Win=132096 Len=0
65,1.223078,140.82.114.3,100.86.73.172,TLSv1.3,57,Application Data
66,1.231425,140.82.114.3,100.86.73.172,TLSv1.3,1490,Application Data
67,1.231517,100.86.73.172,140.82.114.3,TCP,54,57644  >  443 [ACK] Seq=5385 Ack=70764 Win=132096 Len=0
68,1.23253,140.82.114.3,100.86.73.172,TLSv1.3,1490,Application Data
69,1.23253,140.82.114.3,100.86.73.172,TCP,230,"[TCP Previous segment not captured] 443  >  57644 [PSH, ACK] Seq=73636 Ack=5212 Win=90112 Len=176 [TCP segment of a reassembled PDU]"
70,1.232568,100.86.73.172,140.82.114.3,TCP,66,57644  >  443 [ACK] Seq=5385 Ack=72200 Win=132096 Len=0 SLE=73636 SRE=73812
71,1.242456,140.82.114.3,100.86.73.172,TLSv1.3,2926,"Application Data, Application Data"
72,1.242456,140.82.114.3,100.86.73.172,TLSv1.3,1423,"Application Data, Application Data"
73,1.242492,100.86.73.172,140.82.114.3,TCP,66,[TCP Dup ACK 70#1] 57644  >  443 [ACK] Seq=5385 Ack=72200 Win=132096 Len=0 SLE=73636 SRE=76684
74,1.242534,100.86.73.172,140.82.114.3,TCP,66,[TCP Dup ACK 70#2] 57644  >  443 [ACK] Seq=5385 Ack=72200 Win=132096 Len=0 SLE=73636 SRE=78053
75,1.252665,140.82.114.3,100.86.73.172,TLSv1.3,1490,"[TCP Fast Retransmission] , Application Data"
76,1.252725,100.86.73.172,140.82.114.3,TCP,54,57644  >  443 [ACK] Seq=5385 Ack=78053 Win=132096 Len=0
77,1.25853,140.82.114.3,100.86.73.172,TLSv1.3,1490,Application Data
78,1.258577,100.86.73.172,140.82.114.3,TCP,54,57644  >  443 [ACK] Seq=5385 Ack=79489 Win=132096 Len=0
79,1.263039,140.82.114.3,100.86.73.172,TLSv1.3,1490,Application Data
80,1.263168,140.82.114.3,100.86.73.172,TLSv1.3,1490,Application Data
81,1.263168,140.82.114.3,100.86.73.172,TLSv1.3,91,Application Data
82,1.263213,100.86.73.172,140.82.114.3,TCP,54,57644  >  443 [ACK] Seq=5385 Ack=82398 Win=132096 Len=0
83,1.265488,140.82.114.3,100.86.73.172,TLSv1.3,1490,Application Data
84,1.265522,100.86.73.172,140.82.114.3,TCP,54,57644  >  443 [ACK] Seq=5385 Ack=83834 Win=132096 Len=0
85,1.265924,140.82.114.3,100.86.73.172,TLSv1.3,1490,Application Data
86,1.265924,140.82.114.3,100.86.73.172,TLSv1.3,1413,"Application Data, Application Data"
87,1.265964,100.86.73.172,140.82.114.3,TCP,54,57644  >  443 [ACK] Seq=5385 Ack=86629 Win=132096 Len=0
88,1.271267,140.82.114.3,100.86.73.172,TLSv1.3,1490,Application Data
89,1.271755,140.82.114.3,100.86.73.172,TLSv1.3,2926,"Application Data, Application Data"
90,1.271788,100.86.73.172,140.82.114.3,TCP,54,57644  >  443 [ACK] Seq=5385 Ack=90937 Win=132096 Len=0
91,1.272138,140.82.114.3,100.86.73.172,TLSv1.3,69,Application Data
92,1.272158,100.86.73.172,140.82.114.3,TCP,54,57644  >  443 [ACK] Seq=5385 Ack=90952 Win=132096 Len=0
93,1.273755,100.86.73.172,140.82.114.3,TLSv1.3,747,Application Data
94,1.311344,140.82.114.3,100.86.73.172,TLSv1.3,2926,"Application Data, Application Data"
95,1.311344,140.82.114.3,100.86.73.172,TLSv1.3,1334,Application Data
96,1.311489,100.86.73.172,140.82.114.3,TCP,54,57644  >  443 [ACK] Seq=6078 Ack=95104 Win=132096 Len=0
97,1.330094,140.82.114.3,100.86.73.172,TLSv1.3,4362,"Application Data, Application Data, Application Data"
98,1.330094,140.82.114.3,100.86.73.172,TLSv1.3,77,Application Data
99,1.330162,100.86.73.172,140.82.114.3,TCP,54,57644  >  443 [ACK] Seq=6078 Ack=99435 Win=132096 Len=0
100,1.43179,140.82.114.3,100.86.73.172,TLSv1.3,1490,Application Data
101,1.432235,140.82.114.3,100.86.73.172,TLSv1.3,2926,"Application Data, Application Data"
102,1.432279,100.86.73.172,140.82.114.3,TCP,54,57644  >  443 [ACK] Seq=6078 Ack=103743 Win=132096 Len=0
103,1.432713,140.82.114.3,100.86.73.172,TLSv1.3,2926,"Application Data, Application Data"
104,1.432742,100.86.73.172,140.82.114.3,TCP,54,57644  >  443 [ACK] Seq=6078 Ack=106615 Win=132096 Len=0
105,1.433399,140.82.114.3,100.86.73.172,TLSv1.3,1490,Application Data
106,1.433399,140.82.114.3,100.86.73.172,TLSv1.3,307,Application Data
107,1.433435,100.86.73.172,140.82.114.3,TCP,54,57644  >  443 [ACK] Seq=6078 Ack=108304 Win=132096 Len=0
108,6.869173,100.86.73.172,140.82.114.3,TLSv1.3,737,Application Data
109,6.925687,140.82.114.3,100.86.73.172,TCP,56,443  >  57644 [ACK] Seq=108304 Ack=6761 Win=99328 Len=0
110,6.952786,140.82.114.3,100.86.73.172,TLSv1.3,4362,"Application Data, Application Data, Application Data"
111,6.952903,100.86.73.172,140.82.114.3,TCP,54,57644  >  443 [ACK] Seq=6761 Ack=112612 Win=132096 Len=0
112,6.954883,140.82.114.3,100.86.73.172,TLSv1.3,1471,"Application Data, Application Data"
113,6.954956,100.86.73.172,140.82.114.3,TCP,54,57644  >  443 [ACK] Seq=6761 Ack=114029 Win=130560 Len=0
114,6.958215,100.86.73.172,140.82.114.3,TLSv1.3,89,Application Data
115,6.968057,140.82.114.3,100.86.73.172,TCP,56,443  >  57644 [ACK] Seq=114029 Ack=6796 Win=99328 Len=0
116,7.441787,100.86.73.172,140.82.114.3,TLSv1.3,780,Application Data
117,7.452355,140.82.114.3,100.86.73.172,TCP,56,443  >  57644 [ACK] Seq=114029 Ack=7522 Win=101376 Len=0
118,7.729205,140.82.114.3,100.86.73.172,TLSv1.3,1490,Application Data
119,7.729574,140.82.114.3,100.86.73.172,TLSv1.3,2926,"Application Data, Application Data"
120,7.729653,100.86.73.172,140.82.114.3,TCP,54,57644  >  443 [ACK] Seq=7522 Ack=118337 Win=132096 Len=0
121,7.731957,140.82.114.3,100.86.73.172,TLSv1.3,28774,"Application Data, Application Data, Application Data, Application Data, Application Data, Application Data, Application Data, Application Data, Application Data, Application Data, Application Data, Application Data, Application Data, Application Data, Application Data, Application Data, Application Data, Application Data, Application Data, Application Data, Application Data"
122,7.731957,140.82.114.3,100.86.73.172,TLSv1.3,631,"Application Data, Application Data"
123,7.731957,140.82.114.3,100.86.73.172,TLSv1.3,12978,"Application Data, Application Data, Application Data, Application Data, Application Data, Application Data, Application Data, Application Data, Application Data"
124,7.732232,100.86.73.172,140.82.114.3,TCP,54,57644  >  443 [ACK] Seq=7522 Ack=160558 Win=132096 Len=0
125,7.736178,140.82.114.3,100.86.73.172,TLSv1.3,2926,"Application Data, Application Data"
126,7.736304,100.86.73.172,140.82.114.3,TCP,54,57644  >  443 [ACK] Seq=7522 Ack=163430 Win=132096 Len=0
127,7.742994,140.82.114.3,100.86.73.172,TLSv1.3,1490,Application Data
128,7.743098,100.86.73.172,140.82.114.3,TCP,54,57644  >  443 [ACK] Seq=7522 Ack=164866 Win=132096 Len=0
129,7.74332,140.82.114.3,100.86.73.172,TLSv1.3,2926,"Application Data, Application Data"
130,7.743406,100.86.73.172,140.82.114.3,TCP,54,57644  >  443 [ACK] Seq=7522 Ack=167738 Win=132096 Len=0
131,7.745461,140.82.114.3,100.86.73.172,TCP,1490,[TCP Previous segment not captured] 443  >  57644 [ACK] Seq=169174 Ack=7522 Win=101376 Len=1436 [TCP segment of a reassembled PDU]
132,7.745508,100.86.73.172,140.82.114.3,TCP,66,[TCP Dup ACK 130#1] 57644  >  443 [ACK] Seq=7522 Ack=167738 Win=132096 Len=0 SLE=169174 SRE=170610
133,7.745961,140.82.114.3,100.86.73.172,TLSv1.3,2926,Continuation Data
134,7.74603,100.86.73.172,140.82.114.3,TCP,66,[TCP Dup ACK 130#2] 57644  >  443 [ACK] Seq=7522 Ack=167738 Win=132096 Len=0 SLE=169174 SRE=173482
135,7.74707,140.82.114.3,100.86.73.172,TLSv1.3,4362,Continuation Data
136,7.74707,140.82.114.3,100.86.73.172,TLSv1.3,7234,"[TCP Previous segment not captured] , Continuation Data"
137,7.747167,100.86.73.172,140.82.114.3,TCP,66,[TCP Dup ACK 130#3] 57644  >  443 [ACK] Seq=7522 Ack=167738 Win=132096 Len=0 SLE=169174 SRE=177790
138,7.747257,100.86.73.172,140.82.114.3,TCP,74,[TCP Dup ACK 130#4] 57644  >  443 [ACK] Seq=7522 Ack=167738 Win=132096 Len=0 SLE=179226 SRE=186406 SLE=169174 SRE=177790
139,7.747391,140.82.114.3,100.86.73.172,TLSv1.3,368,Continuation Data
140,7.747436,100.86.73.172,140.82.114.3,TCP,74,[TCP Dup ACK 130#5] 57644  >  443 [ACK] Seq=7522 Ack=167738 Win=132096 Len=0 SLE=179226 SRE=186720 SLE=169174 SRE=177790
141,7.757792,140.82.114.3,100.86.73.172,TLSv1.3,1490,"[TCP Fast Retransmission] , Application Data"
142,7.757931,100.86.73.172,140.82.114.3,TCP,66,57644  >  443 [ACK] Seq=7522 Ack=177790 Win=132096 Len=0 SLE=179226 SRE=186720
143,7.758269,140.82.114.3,100.86.73.172,TCP,1490,[TCP Retransmission] 443  >  57644 [ACK] Seq=177790 Ack=7522 Win=101376 Len=1436
144,7.758399,100.86.73.172,140.82.114.3,TCP,54,57644  >  443 [ACK] Seq=7522 Ack=186720 Win=132096 Len=0
145,8.322017,100.86.73.172,140.82.114.3,TLSv1.3,1405,Application Data
146,8.322945,100.86.73.172,140.82.114.3,TLSv1.3,204,Application Data
147,8.332828,140.82.114.3,100.86.73.172,TCP,56,443  >  57644 [ACK] Seq=186720 Ack=8873 Win=104448 Len=0
148,8.333621,140.82.114.3,100.86.73.172,TCP,56,443  >  57644 [ACK] Seq=186720 Ack=9023 Win=107520 Len=0
149,8.366071,140.82.114.3,100.86.73.172,TCP,1490,[TCP Previous segment not captured] 443  >  57644 [ACK] Seq=188156 Ack=9023 Win=107520 Len=1436 [TCP segment of a reassembled PDU]
150,8.366104,100.86.73.172,140.82.114.3,TCP,66,[TCP Dup ACK 144#1] 57644  >  443 [ACK] Seq=9023 Ack=186720 Win=132096 Len=0 SLE=188156 SRE=189592
151,8.366581,140.82.114.3,100.86.73.172,TLSv1.3,1427,Continuation Data
152,8.366609,100.86.73.172,140.82.114.3,TCP,66,[TCP Dup ACK 144#2] 57644  >  443 [ACK] Seq=9023 Ack=186720 Win=132096 Len=0 SLE=188156 SRE=190965
153,8.386414,140.82.114.3,100.86.73.172,TLSv1.3,1490,"[TCP Fast Retransmission] , Application Data"
154,8.386465,100.86.73.172,140.82.114.3,TCP,54,57644  >  443 [ACK] Seq=9023 Ack=190965 Win=132096 Len=0
155,8.81564,140.82.114.3,100.86.73.172,TLSv1.3,1490,Application Data
156,8.816088,140.82.114.3,100.86.73.172,TLSv1.3,2926,"Application Data, Application Data"
157,8.816134,100.86.73.172,140.82.114.3,TCP,54,57644  >  443 [ACK] Seq=9023 Ack=195273 Win=132096 Len=0
158,8.817235,140.82.114.3,100.86.73.172,TLSv1.3,15850,"Application Data, Application Data, Application Data, Application Data, Application Data, Application Data, Application Data, Application Data, Application Data, Application Data, Application Data"
159,8.817235,140.82.114.3,100.86.73.172,TLSv1.3,964,"Application Data, Application Data"
160,8.817295,100.86.73.172,140.82.114.3,TCP,54,57644  >  443 [ACK] Seq=9023 Ack=211979 Win=132096 Len=0
161,8.817613,140.82.114.3,100.86.73.172,TLSv1.3,2926,"Application Data, Application Data"
162,8.817643,100.86.73.172,140.82.114.3,TCP,54,57644  >  443 [ACK] Seq=9023 Ack=214851 Win=132096 Len=0
163,8.828246,140.82.114.3,100.86.73.172,TLSv1.3,1490,Application Data
164,8.828296,100.86.73.172,140.82.114.3,TCP,54,57644  >  443 [ACK] Seq=9023 Ack=216287 Win=132096 Len=0
165,8.828641,140.82.114.3,100.86.73.172,TLSv1.3,2926,"Application Data, Application Data"
166,8.828678,100.86.73.172,140.82.114.3,TCP,54,57644  >  443 [ACK] Seq=9023 Ack=219159 Win=132096 Len=0
167,8.829703,140.82.114.3,100.86.73.172,TLSv1.3,2926,"Application Data, Application Data"
168,8.829758,100.86.73.172,140.82.114.3,TCP,54,57644  >  443 [ACK] Seq=9023 Ack=222031 Win=132096 Len=0
169,8.830061,140.82.114.3,100.86.73.172,TLSv1.3,216,Application Data
170,8.870678,100.86.73.172,140.82.114.3,TCP,54,57644  >  443 [ACK] Seq=9023 Ack=222193 Win=131840 Len=0
171,9.137898,100.86.73.172,140.82.114.3,TLSv1.3,683,Application Data
172,9.193632,140.82.114.3,100.86.73.172,TCP,56,443  >  57644 [ACK] Seq=222193 Ack=9652 Win=110592 Len=0
173,9.235001,140.82.114.3,100.86.73.172,TLSv1.3,1490,Application Data
174,9.235399,140.82.114.3,100.86.73.172,TLSv1.3,2926,"Application Data, Application Data"
175,9.235454,100.86.73.172,140.82.114.3,TCP,54,57644  >  443 [ACK] Seq=9652 Ack=226501 Win=132096 Len=0
176,9.236317,140.82.114.3,100.86.73.172,TLSv1.3,11542,"Application Data, Application Data, Application Data, Application Data, Application Data, Application Data, Application Data, Application Data"
177,9.236369,100.86.73.172,140.82.114.3,TCP,54,57644  >  443 [ACK] Seq=9652 Ack=237989 Win=132096 Len=0
178,9.237316,140.82.114.3,100.86.73.172,TLSv1.3,1490,Application Data
179,9.237316,140.82.114.3,100.86.73.172,TLSv1.3,544,Application Data
180,9.237373,100.86.73.172,140.82.114.3,TCP,54,57644  >  443 [ACK] Seq=9652 Ack=239915 Win=132096 Len=0
181,9.833404,100.86.73.172,140.82.114.3,TLSv1.3,815,Application Data
182,9.843381,140.82.114.3,100.86.73.172,TCP,56,443  >  57644 [ACK] Seq=239915 Ack=10413 Win=113664 Len=0
183,10.129474,140.82.114.3,100.86.73.172,TLSv1.3,1490,Application Data
184,10.12976,140.82.114.3,100.86.73.172,TLSv1.3,2926,"Application Data, Application Data"
185,10.12986,100.86.73.172,140.82.114.3,TCP,54,57644  >  443 [ACK] Seq=10413 Ack=244223 Win=132096 Len=0
186,10.131041,140.82.114.3,100.86.73.172,TLSv1.3,17286,"Application Data, Application Data, Application Data, Application Data, Application Data, Application Data, Application Data, Application Data, Application Data, Application Data, Application Data, Application Data, Application Data"
187,10.131188,100.86.73.172,140.82.114.3,TCP,54,57644  >  443 [ACK] Seq=10413 Ack=261455 Win=132096 Len=0
188,10.131448,140.82.114.3,100.86.73.172,TCP,2926,"[TCP Previous segment not captured] 443  >  57644 [PSH, ACK] Seq=262891 Ack=10413 Win=113664 Len=2872 [TCP segment of a reassembled PDU], Application Data"
189,10.131521,100.86.73.172,140.82.114.3,TCP,66,[TCP Dup ACK 187#1] 57644  >  443 [ACK] Seq=10413 Ack=261455 Win=132096 Len=0 SLE=262891 SRE=265763
190,10.14103,140.82.114.3,100.86.73.172,TLSv1.3,1490,Continuation Data
191,10.141134,100.86.73.172,140.82.114.3,TCP,66,[TCP Dup ACK 187#2] 57644  >  443 [ACK] Seq=10413 Ack=261455 Win=132096 Len=0 SLE=262891 SRE=267199
192,10.141361,140.82.114.3,100.86.73.172,TLSv1.3,1490,Continuation Data
193,10.14141,100.86.73.172,140.82.114.3,TCP,66,[TCP Dup ACK 187#3] 57644  >  443 [ACK] Seq=10413 Ack=261455 Win=132096 Len=0 SLE=262891 SRE=268635
194,10.141876,140.82.114.3,100.86.73.172,TLSv1.3,2926,Continuation Data
195,10.141923,100.86.73.172,140.82.114.3,TCP,66,[TCP Dup ACK 187#4] 57644  >  443 [ACK] Seq=10413 Ack=261455 Win=132096 Len=0 SLE=262891 SRE=271507
196,10.143005,140.82.114.3,100.86.73.172,TLSv1.3,11542,Continuation Data
197,10.143082,100.86.73.172,140.82.114.3,TCP,66,[TCP Dup ACK 187#5] 57644  >  443 [ACK] Seq=10413 Ack=261455 Win=132096 Len=0 SLE=262891 SRE=282995
198,10.144451,140.82.114.3,100.86.73.172,TLSv1.3,1490,Continuation Data
199,10.144451,140.82.114.3,100.86.73.172,TLSv1.3,1490,Continuation Data
200,10.144494,100.86.73.172,140.82.114.3,TCP,66,[TCP Dup ACK 187#6] 57644  >  443 [ACK] Seq=10413 Ack=261455 Win=132096 Len=0 SLE=262891 SRE=284431
201,10.144568,100.86.73.172,140.82.114.3,TCP,66,[TCP Dup ACK 187#7] 57644  >  443 [ACK] Seq=10413 Ack=261455 Win=132096 Len=0 SLE=262891 SRE=285867
202,10.144942,140.82.114.3,100.86.73.172,TLSv1.3,2926,Continuation Data
203,10.144997,100.86.73.172,140.82.114.3,TCP,66,[TCP Dup ACK 187#8] 57644  >  443 [ACK] Seq=10413 Ack=261455 Win=132096 Len=0 SLE=262891 SRE=288739
204,10.152084,140.82.114.3,100.86.73.172,TLSv1.3,1490,"[TCP Fast Retransmission] , Application Data"
205,10.152227,100.86.73.172,140.82.114.3,TCP,54,57644  >  443 [ACK] Seq=10413 Ack=288739 Win=132096 Len=0
206,10.15278,140.82.114.3,100.86.73.172,TLSv1.3,1490,Continuation Data
207,10.152856,100.86.73.172,140.82.114.3,TCP,54,57644  >  443 [ACK] Seq=10413 Ack=290175 Win=132096 Len=0
208,10.153597,140.82.114.3,100.86.73.172,TLSv1.3,1490,Continuation Data
209,10.155987,140.82.114.3,100.86.73.172,TLSv1.3,5798,"[TCP Previous segment not captured] , Continuation Data"
210,10.156087,100.86.73.172,140.82.114.3,TCP,66,57644  >  443 [ACK] Seq=10413 Ack=291611 Win=132096 Len=0 SLE=293047 SRE=298791
211,10.157069,140.82.114.3,100.86.73.172,TLSv1.3,1490,Continuation Data
212,10.157069,140.82.114.3,100.86.73.172,TLSv1.3,1490,Continuation Data
213,10.157118,100.86.73.172,140.82.114.3,TCP,66,[TCP Dup ACK 210#1] 57644  >  443 [ACK] Seq=10413 Ack=291611 Win=132096 Len=0 SLE=293047 SRE=300227
214,10.157198,100.86.73.172,140.82.114.3,TCP,66,[TCP Dup ACK 210#2] 57644  >  443 [ACK] Seq=10413 Ack=291611 Win=132096 Len=0 SLE=293047 SRE=301663
215,10.166571,140.82.114.3,100.86.73.172,TLSv1.3,5798,Continuation Data
216,10.166678,100.86.73.172,140.82.114.3,TCP,66,[TCP Dup ACK 210#3] 57644  >  443 [ACK] Seq=10413 Ack=291611 Win=132096 Len=0 SLE=293047 SRE=307407
217,10.167589,140.82.114.3,100.86.73.172,TLSv1.3,914,Continuation Data
218,10.167641,100.86.73.172,140.82.114.3,TCP,66,[TCP Dup ACK 210#4] 57644  >  443 [ACK] Seq=10413 Ack=291611 Win=132096 Len=0 SLE=293047 SRE=308267
219,10.167968,140.82.114.3,100.86.73.172,TLSv1.3,1490,"[TCP Fast Retransmission] , Continuation Data"
220,10.168073,100.86.73.172,140.82.114.3,TCP,54,57644  >  443 [ACK] Seq=10413 Ack=308267 Win=132096 Len=0
221,10.336112,100.86.73.172,140.82.114.3,TLSv1.3,1520,Application Data
222,10.347405,140.82.114.3,100.86.73.172,TCP,56,443  >  57644 [ACK] Seq=308267 Ack=11879 Win=116736 Len=0
223,10.579022,140.82.114.3,100.86.73.172,TLSv1.3,1490,Application Data
224,10.57941,140.82.114.3,100.86.73.172,TLSv1.3,2926,"Application Data, Application Data"
225,10.579513,100.86.73.172,140.82.114.3,TCP,54,57644  >  443 [ACK] Seq=11879 Ack=312575 Win=132096 Len=0
226,10.57999,140.82.114.3,100.86.73.172,TLSv1.3,5798,"Application Data, Application Data, Application Data, Application Data"
227,10.580083,100.86.73.172,140.82.114.3,TCP,54,57644  >  443 [ACK] Seq=11879 Ack=318319 Win=132096 Len=0
228,10.580622,140.82.114.3,100.86.73.172,TLSv1.3,1490,Application Data
229,10.58069,100.86.73.172,140.82.114.3,TCP,54,57644  >  443 [ACK] Seq=11879 Ack=319755 Win=132096 Len=0
230,10.590259,140.82.114.3,100.86.73.172,TLSv1.3,1490,Application Data
231,10.590863,140.82.114.3,100.86.73.172,TLSv1.3,2926,"Application Data, Application Data"
232,10.590968,100.86.73.172,140.82.114.3,TCP,54,57644  >  443 [ACK] Seq=11879 Ack=324063 Win=132096 Len=0
233,10.591212,140.82.114.3,100.86.73.172,TLSv1.3,5798,"Application Data, Application Data, Application Data, Application Data, Application Data"
234,10.591304,100.86.73.172,140.82.114.3,TCP,54,57644  >  443 [ACK] Seq=11879 Ack=329807 Win=132096 Len=0
235,10.592587,140.82.114.3,100.86.73.172,TLSv1.3,2926,"Application Data, Application Data"
236,10.592673,100.86.73.172,140.82.114.3,TCP,54,57644  >  443 [ACK] Seq=11879 Ack=332679 Win=132096 Len=0
237,10.60158,140.82.114.3,100.86.73.172,TLSv1.3,1490,Application Data
238,10.60168,100.86.73.172,140.82.114.3,TCP,54,57644  >  443 [ACK] Seq=11879 Ack=334115 Win=132096 Len=0
239,10.602116,140.82.114.3,100.86.73.172,TLSv1.3,2926,"Application Data, Application Data"
240,10.602226,100.86.73.172,140.82.114.3,TCP,54,57644  >  443 [ACK] Seq=11879 Ack=336987 Win=132096 Len=0
241,10.602876,140.82.114.3,100.86.73.172,TLSv1.3,2926,"Application Data, Application Data"
242,10.602966,100.86.73.172,140.82.114.3,TCP,54,57644  >  443 [ACK] Seq=11879 Ack=339859 Win=132096 Len=0
243,10.603622,140.82.114.3,100.86.73.172,TLSv1.3,2926,"Application Data, Application Data, Application Data"
244,10.603713,100.86.73.172,140.82.114.3,TCP,54,57644  >  443 [ACK] Seq=11879 Ack=342731 Win=132096 Len=0
245,10.604401,140.82.114.3,100.86.73.172,TLSv1.3,2926,"Application Data, Application Data"
246,10.604517,100.86.73.172,140.82.114.3,TCP,54,57644  >  443 [ACK] Seq=11879 Ack=345603 Win=132096 Len=0
247,10.6128,140.82.114.3,100.86.73.172,TLSv1.3,2926,"Application Data, Application Data"
248,10.612949,100.86.73.172,140.82.114.3,TCP,54,57644  >  443 [ACK] Seq=11879 Ack=348475 Win=132096 Len=0
249,10.613169,140.82.114.3,100.86.73.172,TLSv1.3,1490,Application Data
250,10.614311,140.82.114.3,100.86.73.172,TLSv1.3,1490,Application Data
251,10.614401,100.86.73.172,140.82.114.3,TCP,54,57644  >  443 [ACK] Seq=11879 Ack=351347 Win=132096 Len=0
252,10.614788,140.82.114.3,100.86.73.172,TLSv1.3,2926,"Application Data, Application Data"
253,10.614876,100.86.73.172,140.82.114.3,TCP,54,57644  >  443 [ACK] Seq=11879 Ack=354219 Win=132096 Len=0
254,10.615573,140.82.114.3,100.86.73.172,TLSv1.3,2926,"Application Data, Application Data"
255,10.615658,100.86.73.172,140.82.114.3,TCP,54,57644  >  443 [ACK] Seq=11879 Ack=357091 Win=132096 Len=0
256,10.616514,140.82.114.3,100.86.73.172,TLSv1.3,1490,"Application Data, Application Data"
257,10.623152,140.82.114.3,100.86.73.172,TLSv1.3,1490,Application Data
258,10.623248,100.86.73.172,140.82.114.3,TCP,54,57644  >  443 [ACK] Seq=11879 Ack=359963 Win=132096 Len=0
259,10.62348,140.82.114.3,100.86.73.172,TLSv1.3,1490,Application Data
260,10.624551,140.82.114.3,100.86.73.172,TLSv1.3,1490,Application Data
261,10.624642,100.86.73.172,140.82.114.3,TCP,54,57644  >  443 [ACK] Seq=11879 Ack=362835 Win=132096 Len=0
262,10.62498,140.82.114.3,100.86.73.172,TLSv1.3,1490,Application Data
263,10.625385,140.82.114.3,100.86.73.172,TLSv1.3,2926,"Application Data, Application Data"
264,10.625481,100.86.73.172,140.82.114.3,TCP,54,57644  >  443 [ACK] Seq=11879 Ack=367143 Win=132096 Len=0
265,10.626096,140.82.114.3,100.86.73.172,TLSv1.3,1490,Application Data
266,10.626168,100.86.73.172,140.82.114.3,TCP,54,57644  >  443 [ACK] Seq=11879 Ack=368579 Win=132096 Len=0
267,10.626777,140.82.114.3,100.86.73.172,TLSv1.3,1490,Application Data
268,10.634471,140.82.114.3,100.86.73.172,TLSv1.3,2926,"Application Data, Application Data"
269,10.634609,100.86.73.172,140.82.114.3,TCP,54,57644  >  443 [ACK] Seq=11879 Ack=372887 Win=132096 Len=0
270,10.635777,140.82.114.3,100.86.73.172,TLSv1.3,1490,Application Data
271,10.635876,100.86.73.172,140.82.114.3,TCP,54,57644  >  443 [ACK] Seq=11879 Ack=374323 Win=132096 Len=0
272,10.636188,140.82.114.3,100.86.73.172,TLSv1.3,1490,Application Data
273,10.636188,140.82.114.3,100.86.73.172,TLSv1.3,1281,"Application Data, Application Data"
274,10.636324,100.86.73.172,140.82.114.3,TCP,54,57644  >  443 [ACK] Seq=11879 Ack=376986 Win=132096 Len=0
275,11.096667,100.86.73.172,140.82.114.3,TLSv1.3,769,Application Data
276,11.100734,100.86.73.172,140.82.114.3,TLSv1.3,209,Application Data
277,11.100834,100.86.73.172,140.82.114.3,TLSv1.3,151,Application Data
278,11.100986,100.86.73.172,140.82.114.3,TLSv1.3,134,Application Data
279,11.101105,100.86.73.172,140.82.114.3,TLSv1.3,130,Application Data
280,11.107443,140.82.114.3,100.86.73.172,TCP,56,443  >  57644 [ACK] Seq=376986 Ack=12594 Win=118784 Len=0
281,11.111141,140.82.114.3,100.86.73.172,TCP,56,443  >  57644 [ACK] Seq=376986 Ack=12749 Win=121856 Len=0
282,11.111447,140.82.114.3,100.86.73.172,TCP,56,443  >  57644 [ACK] Seq=376986 Ack=12846 Win=121856 Len=0
283,11.111818,140.82.114.3,100.86.73.172,TCP,56,443  >  57644 [ACK] Seq=376986 Ack=13002 Win=121856 Len=0
284,11.145885,100.86.73.172,140.82.114.3,TLSv1.3,133,Application Data
285,11.152615,140.82.114.3,100.86.73.172,TLSv1.3,2926,"Application Data, Application Data"
286,11.152667,100.86.73.172,140.82.114.3,TCP,54,57644  >  443 [ACK] Seq=13081 Ack=379858 Win=132096 Len=0
287,11.153087,140.82.114.3,100.86.73.172,TLSv1.3,2926,"Application Data, Application Data"
288,11.153111,100.86.73.172,140.82.114.3,TCP,54,57644  >  443 [ACK] Seq=13081 Ack=382730 Win=132096 Len=0
289,11.153518,140.82.114.3,100.86.73.172,TLSv1.3,1490,Application Data
290,11.153518,140.82.114.3,100.86.73.172,TLSv1.3,1215,Application Data
291,11.153561,100.86.73.172,140.82.114.3,TCP,54,57644  >  443 [ACK] Seq=13081 Ack=385327 Win=132096 Len=0
292,11.155901,140.82.114.3,100.86.73.172,TCP,56,443  >  57644 [ACK] Seq=385327 Ack=13081 Win=121856 Len=0
293,11.166547,140.82.114.3,100.86.73.172,TLSv1.3,1490,Application Data
294,11.167403,140.82.114.3,100.86.73.172,TLSv1.3,1490,Application Data
295,11.167403,140.82.114.3,100.86.73.172,TLSv1.3,1490,Application Data
296,11.167452,100.86.73.172,140.82.114.3,TCP,54,57644  >  443 [ACK] Seq=13081 Ack=389635 Win=132096 Len=0
297,11.167847,140.82.114.3,100.86.73.172,TLSv1.3,276,Application Data
298,11.167873,100.86.73.172,140.82.114.3,TCP,54,57644  >  443 [ACK] Seq=13081 Ack=389857 Win=131840 Len=0
299,11.170068,100.86.73.172,140.82.114.3,TLSv1.3,166,Application Data
300,11.176401,100.86.73.172,140.82.114.3,TLSv1.3,718,Application Data
301,11.186423,140.82.114.3,100.86.73.172,TCP,56,443  >  57644 [ACK] Seq=389857 Ack=13857 Win=124928 Len=0
302,11.189346,140.82.114.3,100.86.73.172,TLSv1.3,1490,Application Data
303,11.189971,140.82.114.3,100.86.73.172,TLSv1.3,2926,"Application Data, Application Data"
304,11.190007,100.86.73.172,140.82.114.3,TCP,54,57644  >  443 [ACK] Seq=13857 Ack=394165 Win=132096 Len=0
305,11.190253,140.82.114.3,100.86.73.172,TLSv1.3,1490,Application Data
306,11.190253,140.82.114.3,100.86.73.172,TLSv1.3,957,Application Data
307,11.19031,100.86.73.172,140.82.114.3,TCP,54,57644  >  443 [ACK] Seq=13857 Ack=396504 Win=132096 Len=0
308,11.191637,140.82.114.3,100.86.73.172,TLSv1.3,1490,Application Data
309,11.191679,100.86.73.172,140.82.114.3,TCP,54,57644  >  443 [ACK] Seq=13857 Ack=397940 Win=132096 Len=0
310,11.192134,140.82.114.3,100.86.73.172,TLSv1.3,2926,"Application Data, Application Data"
311,11.192168,100.86.73.172,140.82.114.3,TCP,54,57644  >  443 [ACK] Seq=13857 Ack=400812 Win=132096 Len=0
312,11.192847,140.82.114.3,100.86.73.172,TLSv1.3,1098,Application Data
313,11.207058,140.82.114.3,100.86.73.172,TLSv1.3,5798,"Application Data, Application Data, Application Data, Application Data"
314,11.207058,140.82.114.3,100.86.73.172,TLSv1.3,922,Application Data
315,11.207118,100.86.73.172,140.82.114.3,TCP,54,57644  >  443 [ACK] Seq=13857 Ack=408468 Win=132096 Len=0
316,11.210767,140.82.114.3,100.86.73.172,TLSv1.3,1490,Application Data
317,11.211288,140.82.114.3,100.86.73.172,TLSv1.3,1490,Application Data
318,11.211288,140.82.114.3,100.86.73.172,TLSv1.3,1421,"Application Data, Application Data"
319,11.211325,100.86.73.172,140.82.114.3,TCP,54,57644  >  443 [ACK] Seq=13857 Ack=412707 Win=132096 Len=0
320,11.234811,140.82.114.3,100.86.73.172,TLSv1.3,1490,Application Data
321,11.234856,100.86.73.172,140.82.114.3,TCP,54,57644  >  443 [ACK] Seq=13857 Ack=414143 Win=132096 Len=0
322,11.235075,140.82.114.3,100.86.73.172,TLSv1.3,2926,"Application Data, Application Data"
323,11.235122,100.86.73.172,140.82.114.3,TCP,54,57644  >  443 [ACK] Seq=13857 Ack=417015 Win=132096 Len=0
324,11.235414,140.82.114.3,100.86.73.172,TLSv1.3,56,Application Data
325,11.277344,100.86.73.172,140.82.114.3,TCP,54,57644  >  443 [ACK] Seq=13857 Ack=417016 Win=132096 Len=0
326,11.450868,140.82.114.3,100.86.73.172,TLSv1.3,1490,Application Data
327,11.451947,140.82.114.3,100.86.73.172,TLSv1.3,11542,"Application Data, Application Data, Application Data, Application Data, Application Data, Application Data, Application Data, Application Data"
328,11.45204,100.86.73.172,140.82.114.3,TCP,54,57644  >  443 [ACK] Seq=13857 Ack=429940 Win=132096 Len=0
329,11.452255,140.82.114.3,100.86.73.172,TLSv1.3,1030,Application Data
330,11.452299,100.86.73.172,140.82.114.3,TCP,54,57644  >  443 [ACK] Seq=13857 Ack=430916 Win=131072 Len=0
331,12.084968,100.86.73.172,140.82.114.3,TLSv1.3,1349,Application Data
332,12.139072,140.82.114.3,100.86.73.172,TCP,56,443  >  57644 [ACK] Seq=430916 Ack=15152 Win=128000 Len=0
333,12.149772,140.82.114.3,100.86.73.172,TLSv1.3,1490,Application Data
334,12.149772,140.82.114.3,100.86.73.172,TLSv1.3,1490,Application Data
335,12.149772,140.82.114.3,100.86.73.172,TLSv1.3,1490,Application Data
336,12.14983,100.86.73.172,140.82.114.3,TCP,54,57644  >  443 [ACK] Seq=15152 Ack=435224 Win=132096 Len=0
337,12.152404,140.82.114.3,100.86.73.172,TLSv1.3,1475,"Application Data, Application Data"
338,12.152447,100.86.73.172,140.82.114.3,TCP,54,57644  >  443 [ACK] Seq=15152 Ack=436645 Win=130560 Len=0
339,12.155698,100.86.73.172,140.82.114.3,TLSv1.3,89,Application Data
340,12.166442,140.82.114.3,100.86.73.172,TCP,56,443  >  57644 [ACK] Seq=436645 Ack=15187 Win=128000 Len=0
341,13.134151,100.86.73.172,140.82.114.3,TLSv1.3,907,Application Data
342,13.144107,140.82.114.3,100.86.73.172,TCP,56,443  >  57644 [ACK] Seq=436645 Ack=16040 Win=131072 Len=0
343,13.916636,140.82.114.3,100.86.73.172,TLSv1.3,2926,"Application Data, Application Data"
344,13.916819,100.86.73.172,140.82.114.3,TCP,54,57644  >  443 [ACK] Seq=16040 Ack=439517 Win=132096 Len=0
345,13.919522,140.82.114.3,100.86.73.172,TLSv1.3,1490,Application Data
346,13.919522,140.82.114.3,100.86.73.172,TLSv1.3,1490,Application Data
347,13.919522,140.82.114.3,100.86.73.172,TLSv1.3,1490,Application Data
348,13.919522,140.82.114.3,100.86.73.172,TLSv1.3,1490,Application Data
349,13.919522,140.82.114.3,100.86.73.172,TLSv1.3,1490,Application Data
350,13.919522,140.82.114.3,100.86.73.172,TLSv1.3,1490,Application Data
351,13.919522,140.82.114.3,100.86.73.172,TLSv1.3,1490,Application Data
352,13.919522,140.82.114.3,100.86.73.172,TLSv1.3,1490,Application Data
353,13.919793,100.86.73.172,140.82.114.3,TCP,54,57644  >  443 [ACK] Seq=16040 Ack=451005 Win=132096 Len=0
354,13.920684,140.82.114.3,100.86.73.172,TLSv1.3,1490,Application Data
355,13.920684,140.82.114.3,100.86.73.172,TLSv1.3,1490,Application Data
356,13.920797,100.86.73.172,140.82.114.3,TCP,54,57644  >  443 [ACK] Seq=16040 Ack=453877 Win=132096 Len=0
357,13.927735,140.82.114.3,100.86.73.172,TCP,1490,[TCP Previous segment not captured] 443  >  57644 [ACK] Seq=455313 Ack=16040 Win=131072 Len=1436 [TCP segment of a reassembled PDU]
358,13.927781,100.86.73.172,140.82.114.3,TCP,66,[TCP Dup ACK 356#1] 57644  >  443 [ACK] Seq=16040 Ack=453877 Win=132096 Len=0 SLE=455313 SRE=456749
359,13.930346,140.82.114.3,100.86.73.172,TLSv1.3,1490,"[TCP Previous segment not captured] , Continuation Data"
360,13.930392,100.86.73.172,140.82.114.3,TCP,74,[TCP Dup ACK 356#2] 57644  >  443 [ACK] Seq=16040 Ack=453877 Win=132096 Len=0 SLE=458185 SRE=459621 SLE=455313 SRE=456749
361,13.930823,140.82.114.3,100.86.73.172,TLSv1.3,2926,Continuation Data
362,13.930867,100.86.73.172,140.82.114.3,TCP,74,[TCP Dup ACK 356#3] 57644  >  443 [ACK] Seq=16040 Ack=453877 Win=132096 Len=0 SLE=458185 SRE=462493 SLE=455313 SRE=456749
363,13.931998,140.82.114.3,100.86.73.172,TLSv1.3,5798,Continuation Data
364,13.932055,100.86.73.172,140.82.114.3,TCP,74,[TCP Dup ACK 356#4] 57644  >  443 [ACK] Seq=16040 Ack=453877 Win=132096 Len=0 SLE=458185 SRE=468237 SLE=455313 SRE=456749
365,13.932517,140.82.114.3,100.86.73.172,TLSv1.3,2926,Continuation Data
366,13.932556,100.86.73.172,140.82.114.3,TCP,74,[TCP Dup ACK 356#5] 57644  >  443 [ACK] Seq=16040 Ack=453877 Win=132096 Len=0 SLE=458185 SRE=471109 SLE=455313 SRE=456749
367,13.939172,140.82.114.3,100.86.73.172,TLSv1.3,1490,"[TCP Fast Retransmission] , Application Data"
368,13.939297,100.86.73.172,140.82.114.3,TCP,66,57644  >  443 [ACK] Seq=16040 Ack=456749 Win=132096 Len=0 SLE=458185 SRE=471109
369,13.940862,140.82.114.3,100.86.73.172,TCP,1490,[TCP Out-Of-Order] 443  >  57644 [ACK] Seq=456749 Ack=16040 Win=131072 Len=1436
370,13.940962,100.86.73.172,140.82.114.3,TCP,54,57644  >  443 [ACK] Seq=16040 Ack=471109 Win=132096 Len=0
371,13.942271,140.82.114.3,100.86.73.172,TLSv1.3,1490,Continuation Data
372,13.942774,140.82.114.3,100.86.73.172,TLSv1.3,2926,Continuation Data
373,13.94285,100.86.73.172,140.82.114.3,TCP,54,57644  >  443 [ACK] Seq=16040 Ack=475417 Win=132096 Len=0
374,13.943289,140.82.114.3,100.86.73.172,TLSv1.3,2926,Continuation Data
375,13.943367,100.86.73.172,140.82.114.3,TCP,54,57644  >  443 [ACK] Seq=16040 Ack=478289 Win=132096 Len=0
376,13.943612,140.82.114.3,100.86.73.172,TLSv1.3,1490,Continuation Data
377,13.94366,100.86.73.172,140.82.114.3,TCP,54,57644  >  443 [ACK] Seq=16040 Ack=479725 Win=132096 Len=0
378,13.94973,140.82.114.3,100.86.73.172,TLSv1.3,1490,Continuation Data
379,13.951037,140.82.114.3,100.86.73.172,TLSv1.3,1490,Continuation Data
380,13.951138,100.86.73.172,140.82.114.3,TCP,54,57644  >  443 [ACK] Seq=16040 Ack=482597 Win=132096 Len=0
381,13.953488,140.82.114.3,100.86.73.172,TLSv1.3,1490,Continuation Data
382,13.954465,140.82.114.3,100.86.73.172,TLSv1.3,5798,Continuation Data
383,13.95458,100.86.73.172,140.82.114.3,TCP,54,57644  >  443 [ACK] Seq=16040 Ack=489777 Win=132096 Len=0
384,13.954864,140.82.114.3,100.86.73.172,TLSv1.3,1490,Continuation Data
385,13.954956,100.86.73.172,140.82.114.3,TCP,54,57644  >  443 [ACK] Seq=16040 Ack=491213 Win=132096 Len=0
386,13.96129,140.82.114.3,100.86.73.172,TLSv1.3,1490,Continuation Data
387,13.961759,140.82.114.3,100.86.73.172,TLSv1.3,2926,Continuation Data
388,13.961841,100.86.73.172,140.82.114.3,TCP,54,57644  >  443 [ACK] Seq=16040 Ack=495521 Win=132096 Len=0
389,13.965034,140.82.114.3,100.86.73.172,TLSv1.3,4362,Continuation Data
390,13.965157,100.86.73.172,140.82.114.3,TCP,54,57644  >  443 [ACK] Seq=16040 Ack=499829 Win=132096 Len=0
391,13.965647,140.82.114.3,100.86.73.172,TLSv1.3,2926,Continuation Data
392,13.965747,100.86.73.172,140.82.114.3,TCP,54,57644  >  443 [ACK] Seq=16040 Ack=502701 Win=132096 Len=0
393,13.966901,140.82.114.3,100.86.73.172,TCP,1490,"443  >  57644 [PSH, ACK] Seq=502701 Ack=16040 Win=131072 Len=1436 [TCP segment of a reassembled PDU]"
394,13.971981,140.82.114.3,100.86.73.172,TCP,1490,443  >  57644 [ACK] Seq=504137 Ack=16040 Win=131072 Len=1436 [TCP segment of a reassembled PDU]
395,13.972095,100.86.73.172,140.82.114.3,TCP,54,57644  >  443 [ACK] Seq=16040 Ack=505573 Win=132096 Len=0
396,13.972639,140.82.114.3,100.86.73.172,TCP,2926,"443  >  57644 [PSH, ACK] Seq=505573 Ack=16040 Win=131072 Len=2872 [TCP segment of a reassembled PDU]"
397,13.972739,100.86.73.172,140.82.114.3,TCP,54,57644  >  443 [ACK] Seq=16040 Ack=508445 Win=132096 Len=0
398,13.9755,140.82.114.3,100.86.73.172,TCP,1490,443  >  57644 [ACK] Seq=508445 Ack=16040 Win=131072 Len=1436 [TCP segment of a reassembled PDU]
399,13.976143,140.82.114.3,100.86.73.172,TCP,2926,"443  >  57644 [PSH, ACK] Seq=509881 Ack=16040 Win=131072 Len=2872 [TCP segment of a reassembled PDU]"
400,13.976219,100.86.73.172,140.82.114.3,TCP,54,57644  >  443 [ACK] Seq=16040 Ack=512753 Win=132096 Len=0
