No.,Time,Source,Destination,Protocol,Length,Info
1,0,100.86.73.172,140.82.114.3,TCP,66,61046  >  443 [SYN] Seq=0 Win=64240 Len=0 MSS=1460 WS=256 SACK_PERM
2,0.01129,140.82.114.3,100.86.73.172,TCP,66,"443  >  61046 [SYN, ACK] Seq=0 Ack=1 Win=65535 Len=0 MSS=1436 SACK_PERM WS=1024"
3,0.011463,100.86.73.172,140.82.114.3,TCP,54,61046  >  443 [ACK] Seq=1 Ack=1 Win=132096 Len=0
4,0.012295,100.86.73.172,140.82.114.3,TLSv1.3,631,Client Hello (SNI=github.com)
5,0.023218,140.82.114.3,100.86.73.172,TLSv1.3,1490,"Server Hello, Change Cipher Spec, Application Data"
6,0.02363,140.82.114.3,100.86.73.172,TCP,1490,443  >  61046 [ACK] Seq=1437 Ack=578 Win=67584 Len=1436 [TCP segment of a reassembled PDU]
7,0.02363,140.82.114.3,100.86.73.172,TLSv1.3,672,"Application Data, Application Data, Application Data"
8,0.023721,100.86.73.172,140.82.114.3,TCP,54,61046  >  443 [ACK] Seq=578 Ack=3491 Win=132096 Len=0
9,0.032774,100.86.73.172,140.82.114.3,TLSv1.3,118,"Change Cipher Spec, Application Data"
10,0.033312,100.86.73.172,140.82.114.3,TLSv1.3,146,Application Data
11,0.033888,100.86.73.172,140.82.114.3,TLSv1.3,1598,Application Data
12,0.044008,140.82.114.3,100.86.73.172,TLSv1.3,133,Application Data
13,0.044352,140.82.114.3,100.86.73.172,TLSv1.3,133,Application Data
14,0.044352,140.82.114.3,100.86.73.172,TLSv1.3,118,Application Data
15,0.044431,100.86.73.172,140.82.114.3,TCP,54,61046  >  443 [ACK] Seq=2278 Ack=3713 Win=131840 Len=0
16,0.044679,100.86.73.172,140.82.114.3,TLSv1.3,85,Application Data
17,0.04468,140.82.114.3,100.86.73.172,TCP,56,443  >  61046 [ACK] Seq=3713 Ack=2278 Win=70656 Len=0
18,0.098807,140.82.114.3,100.86.73.172,TCP,56,443  >  61046 [ACK] Seq=3713 Ack=2309 Win=70656 Len=0
19,0.704333,140.82.114.3,100.86.73.172,TLSv1.3,4362,"Application Data, Application Data, Application Data"
20,0.704467,100.86.73.172,140.82.114.3,TCP,54,61046  >  443 [ACK] Seq=2309 Ack=8021 Win=132096 Len=0
21,0.705194,140.82.114.3,100.86.73.172,TLSv1.3,8670,"Application Data, Application Data, Application Data, Application Data, Application Data, Application Data"
22,0.705296,100.86.73.172,140.82.114.3,TCP,54,61046  >  443 [ACK] Seq=2309 Ack=16637 Win=132096 Len=0
23,0.705951,140.82.114.3,100.86.73.172,TLSv1.3,2926,"Application Data, Application Data"
24,0.706035,100.86.73.172,140.82.114.3,TCP,54,61046  >  443 [ACK] Seq=2309 Ack=19509 Win=132096 Len=0
25,0.715084,140.82.114.3,100.86.73.172,TLSv1.3,1490,Application Data
26,0.715201,100.86.73.172,140.82.114.3,TCP,54,61046  >  443 [ACK] Seq=2309 Ack=20945 Win=132096 Len=0
27,0.716136,140.82.114.3,100.86.73.172,TLSv1.3,1490,Application Data
28,0.716136,140.82.114.3,100.86.73.172,TLSv1.3,1490,Application Data
29,0.716136,140.82.114.3,100.86.73.172,TLSv1.3,2926,"Application Data, Application Data, Application Data"
30,0.716267,100.86.73.172,140.82.114.3,TCP,54,61046  >  443 [ACK] Seq=2309 Ack=26689 Win=132096 Len=0
31,0.717541,140.82.114.3,100.86.73.172,TLSv1.3,20158,"Application Data, Application Data, Application Data, Application Data, Application Data, Application Data, Application Data, Application Data, Application Data, Application Data, Application Data, Application Data, Application Data, Application Data"
32,0.717669,100.86.73.172,140.82.114.3,TCP,54,61046  >  443 [ACK] Seq=2309 Ack=46793 Win=132096 Len=0
33,0.719101,140.82.114.3,100.86.73.172,TLSv1.3,1490,Application Data
34,0.719101,140.82.114.3,100.86.73.172,TLSv1.3,1490,"Application Data, Application Data"
35,0.719211,100.86.73.172,140.82.114.3,TCP,54,61046  >  443 [ACK] Seq=2309 Ack=49665 Win=132096 Len=0
36,0.732391,140.82.114.3,100.86.73.172,TLSv1.3,40262,"Application Data, Application Data, Application Data, Application Data, Application Data, Application Data, Application Data, Application Data, Application Data, Application Data, Application Data, Application Data, Application Data, Application Data, Application Data, Application Data, Application Data, Application Data, Application Data, Application Data, Application Data, Application Data, Application Data, Application Data, Application Data, Application Data, Application Data, Application Data, Application Data"
37,0.732391,140.82.114.3,100.86.73.172,TLSv1.3,273,Application Data
38,0.732604,100.86.73.172,140.82.114.3,TCP,54,61046  >  443 [ACK] Seq=2309 Ack=90092 Win=132096 Len=0
39,1.323514,100.86.73.172,140.82.114.3,TLSv1.3,766,Application Data
40,1.325122,100.86.73.172,140.82.114.3,TLSv1.3,178,Application Data
41,1.32527,100.86.73.172,140.82.114.3,TLSv1.3,167,Application Data
42,1.325685,100.86.73.172,140.82.114.3,TLSv1.3,212,Application Data
43,1.325781,100.86.73.172,140.82.114.3,TLSv1.3,269,Application Data
44,1.325855,100.86.73.172,140.82.114.3,TLSv1.3,210,Application Data
45,1.333712,140.82.114.3,100.86.73.172,TCP,56,443  >  61046 [ACK] Seq=90092 Ack=3021 Win=72704 Len=0
46,1.335023,140.82.114.3,100.86.73.172,TCP,56,443  >  61046 [ACK] Seq=90092 Ack=3145 Win=72704 Len=0
47,1.335453,140.82.114.3,100.86.73.172,TCP,56,443  >  61046 [ACK] Seq=90092 Ack=3258 Win=72704 Len=0
48,1.335788,140.82.114.3,100.86.73.172,TCP,56,443  >  61046 [ACK] Seq=90092 Ack=3631 Win=78848 Len=0
49,1.3361,140.82.114.3,100.86.73.172,TCP,56,443  >  61046 [ACK] Seq=90092 Ack=3787 Win=81920 Len=0
50,1.377401,140.82.114.3,100.86.73.172,TLSv1.3,1490,Application Data
51,1.377909,140.82.114.3,100.86.73.172,TLSv1.3,2926,"Application Data, Application Data"
52,1.377948,100.86.73.172,140.82.114.3,TCP,54,61046  >  443 [ACK] Seq=3787 Ack=94400 Win=132096 Len=0
53,1.378283,140.82.114.3,100.86.73.172,TLSv1.3,65,Application Data
54,1.378309,100.86.73.172,140.82.114.3,TCP,54,61046  >  443 [ACK] Seq=3787 Ack=94411 Win=132096 Len=0
55,1.385055,140.82.114.3,100.86.73.172,TLSv1.3,1490,Application Data
56,1.385176,140.82.114.3,100.86.73.172,TLSv1.3,1490,Application Data
57,1.385176,140.82.114.3,100.86.73.172,TLSv1.3,1324,Application Data
58,1.385221,100.86.73.172,140.82.114.3,TCP,54,61046  >  443 [ACK] Seq=3787 Ack=98553 Win=132096 Len=0
59,1.386222,140.82.114.3,100.86.73.172,TLSv1.3,1490,Application Data
60,1.386253,100.86.73.172,140.82.114.3,TCP,54,61046  >  443 [ACK] Seq=3787 Ack=99989 Win=132096 Len=0
61,1.386653,140.82.114.3,100.86.73.172,TLSv1.3,1490,Application Data
62,1.386653,140.82.114.3,100.86.73.172,TLSv1.3,1429,"Application Data, Application Data"
63,1.386695,100.86.73.172,140.82.114.3,TCP,54,61046  >  443 [ACK] Seq=3787 Ack=102800 Win=132096 Len=0
64,1.394237,140.82.114.3,100.86.73.172,TLSv1.3,1490,Application Data
65,1.39478,140.82.114.3,100.86.73.172,TLSv1.3,2926,"Application Data, Application Data"
66,1.394819,100.86.73.172,140.82.114.3,TCP,54,61046  >  443 [ACK] Seq=3787 Ack=107108 Win=132096 Len=0
67,1.395111,140.82.114.3,100.86.73.172,TLSv1.3,67,Application Data
68,1.395137,100.86.73.172,140.82.114.3,TCP,54,61046  >  443 [ACK] Seq=3787 Ack=107121 Win=132096 Len=0
69,1.409693,140.82.114.3,100.86.73.172,TLSv1.3,1490,Application Data
70,1.41203,140.82.114.3,100.86.73.172,TLSv1.3,1490,Application Data
71,1.41203,140.82.114.3,100.86.73.172,TLSv1.3,1490,Application Data
72,1.412084,100.86.73.172,140.82.114.3,TCP,54,61046  >  443 [ACK] Seq=3787 Ack=111429 Win=132096 Len=0
73,1.412274,140.82.114.3,100.86.73.172,TLSv1.3,59,Application Data
74,1.412306,100.86.73.172,140.82.114.3,TCP,54,61046  >  443 [ACK] Seq=3787 Ack=111434 Win=132096 Len=0
75,1.43907,100.86.73.172,140.82.114.3,TLSv1.3,874,Application Data
76,1.439703,100.86.73.172,140.82.114.3,TLSv1.3,663,Application Data
77,1.439791,100.86.73.172,140.82.114.3,TLSv1.3,179,Application Data
78,1.440542,100.86.73.172,140.82.114.3,TLSv1.3,147,Application Data
79,1.440958,100.86.73.172,140.82.114.3,TLSv1.3,222,Application Data
80,1.442274,140.82.114.3,100.86.73.172,TLSv1.3,1490,Application Data
81,1.442317,100.86.73.172,140.82.114.3,TCP,54,61046  >  443 [ACK] Seq=5602 Ack=112870 Win=132096 Len=0
82,1.442741,140.82.114.3,100.86.73.172,TLSv1.3,2926,"Application Data, Application Data"
83,1.442782,100.86.73.172,140.82.114.3,TCP,54,61046  >  443 [ACK] Seq=5602 Ack=115742 Win=132096 Len=0
84,1.443109,140.82.114.3,100.86.73.172,TLSv1.3,73,Application Data
85,1.443136,100.86.73.172,140.82.114.3,TCP,54,61046  >  443 [ACK] Seq=5602 Ack=115761 Win=131840 Len=0
86,1.449581,140.82.114.3,100.86.73.172,TCP,56,443  >  61046 [ACK] Seq=115761 Ack=4607 Win=84992 Len=0
87,1.450861,140.82.114.3,100.86.73.172,TCP,56,443  >  61046 [ACK] Seq=115761 Ack=5216 Win=87040 Len=0
88,1.450861,140.82.114.3,100.86.73.172,TCP,56,443  >  61046 [ACK] Seq=115761 Ack=5602 Win=90112 Len=0
89,1.496427,140.82.114.3,100.86.73.172,TCP,1490,[TCP Previous segment not captured] 443  >  61046 [ACK] Seq=117197 Ack=5602 Win=90112 Len=1436 [TCP segment of a reassembled PDU]
90,1.496486,100.86.73.172,140.82.114.3,TCP,66,[TCP Dup ACK 85#1] 61046  >  443 [ACK] Seq=5602 Ack=115761 Win=131840 Len=0 SLE=117197 SRE=118633
91,1.496788,140.82.114.3,100.86.73.172,TLSv1.3,1490,Continuation Data
92,1.496788,140.82.114.3,100.86.73.172,TCP,56,"443  >  61046 [PSH, ACK] Seq=120069 Ack=5602 Win=90112 Len=1 [TCP segment of a reassembled PDU]"
93,1.49681,100.86.73.172,140.82.114.3,TCP,66,[TCP Dup ACK 85#2] 61046  >  443 [ACK] Seq=5602 Ack=115761 Win=131840 Len=0 SLE=117197 SRE=120069
94,1.496839,100.86.73.172,140.82.114.3,TCP,66,[TCP Dup ACK 85#3] 61046  >  443 [ACK] Seq=5602 Ack=115761 Win=131840 Len=0 SLE=117197 SRE=120070
95,1.500611,140.82.114.3,100.86.73.172,TLSv1.3,1490,Continuation Data
96,1.500636,100.86.73.172,140.82.114.3,TCP,66,[TCP Dup ACK 85#4] 61046  >  443 [ACK] Seq=5602 Ack=115761 Win=131840 Len=0 SLE=117197 SRE=121506
97,1.501153,140.82.114.3,100.86.73.172,TLSv1.3,2926,Continuation Data
98,1.501177,100.86.73.172,140.82.114.3,TCP,66,[TCP Dup ACK 85#5] 61046  >  443 [ACK] Seq=5602 Ack=115761 Win=131840 Len=0 SLE=117197 SRE=124378
99,1.5015,140.82.114.3,100.86.73.172,TLSv1.3,65,Continuation Data
100,1.501514,100.86.73.172,140.82.114.3,TCP,66,[TCP Dup ACK 85#6] 61046  >  443 [ACK] Seq=5602 Ack=115761 Win=131840 Len=0 SLE=117197 SRE=124389
101,1.507283,140.82.114.3,100.86.73.172,TLSv1.3,1490,"[TCP Fast Retransmission] , Application Data"
102,1.507332,100.86.73.172,140.82.114.3,TCP,54,61046  >  443 [ACK] Seq=5602 Ack=124389 Win=132096 Len=0
103,1.513757,140.82.114.3,100.86.73.172,TLSv1.3,4362,"Application Data, Application Data, Application Data"
104,1.513757,140.82.114.3,100.86.73.172,TLSv1.3,224,Application Data
105,1.513837,100.86.73.172,140.82.114.3,TCP,54,61046  >  443 [ACK] Seq=5602 Ack=128867 Win=132096 Len=0
106,1.51942,100.86.73.172,140.82.114.3,TLSv1.3,775,Application Data
107,1.527921,140.82.114.3,100.86.73.172,TLSv1.3,1490,Application Data
108,1.527974,100.86.73.172,140.82.114.3,TCP,54,61046  >  443 [ACK] Seq=6323 Ack=130303 Win=132096 Len=0
109,1.528436,140.82.114.3,100.86.73.172,TLSv1.3,1490,Application Data
110,1.528436,140.82.114.3,100.86.73.172,TLSv1.3,1413,"Application Data, Application Data"
111,1.528475,100.86.73.172,140.82.114.3,TCP,54,61046  >  443 [ACK] Seq=6323 Ack=133098 Win=132096 Len=0
112,1.529719,140.82.114.3,100.86.73.172,TCP,56,443  >  61046 [ACK] Seq=133098 Ack=6323 Win=93184 Len=0
113,1.556503,140.82.114.3,100.86.73.172,TLSv1.3,1490,Application Data
114,1.556552,100.86.73.172,140.82.114.3,TCP,54,61046  >  443 [ACK] Seq=6323 Ack=134534 Win=132096 Len=0
115,1.556913,140.82.114.3,100.86.73.172,TLSv1.3,1490,Application Data
116,1.556913,140.82.114.3,100.86.73.172,TLSv1.3,1411,"Application Data, Application Data"
117,1.556953,100.86.73.172,140.82.114.3,TCP,54,61046  >  443 [ACK] Seq=6323 Ack=137327 Win=132096 Len=0
118,1.579254,140.82.114.3,100.86.73.172,TLSv1.3,7234,"Application Data, Application Data, Application Data, Application Data, Application Data"
119,1.579306,100.86.73.172,140.82.114.3,TCP,54,61046  >  443 [ACK] Seq=6323 Ack=144507 Win=132096 Len=0
120,1.582063,140.82.114.3,100.86.73.172,TLSv1.3,1490,Application Data
121,1.582063,140.82.114.3,100.86.73.172,TLSv1.3,302,Application Data
122,1.582241,100.86.73.172,140.82.114.3,TCP,54,61046  >  443 [ACK] Seq=6323 Ack=146191 Win=132096 Len=0
123,1.639276,100.86.73.172,140.82.114.3,TLSv1.3,703,Application Data
124,1.678856,140.82.114.3,100.86.73.172,TLSv1.3,1490,Application Data
125,1.679771,140.82.114.3,100.86.73.172,TLSv1.3,1490,Application Data
126,1.679771,140.82.114.3,100.86.73.172,TLSv1.3,1429,"Application Data, Application Data"
127,1.679868,100.86.73.172,140.82.114.3,TCP,54,61046  >  443 [ACK] Seq=6972 Ack=150438 Win=132096 Len=0
128,5.000016,100.86.73.172,140.82.114.3,TLSv1.3,950,Application Data
129,5.054153,140.82.114.3,100.86.73.172,TCP,56,443  >  61046 [ACK] Seq=150438 Ack=7868 Win=99328 Len=0
130,5.094501,100.86.73.172,140.82.114.3,TLSv1.3,650,Application Data
131,5.099842,140.82.114.3,100.86.73.172,TLSv1.3,1490,Application Data
132,5.099887,100.86.73.172,140.82.114.3,TCP,54,61046  >  443 [ACK] Seq=8464 Ack=151874 Win=132096 Len=0
133,5.10016,140.82.114.3,100.86.73.172,TLSv1.3,2926,"Application Data, Application Data"
134,5.100193,100.86.73.172,140.82.114.3,TCP,54,61046  >  443 [ACK] Seq=8464 Ack=154746 Win=132096 Len=0
135,5.100872,140.82.114.3,100.86.73.172,TLSv1.3,1490,Application Data
136,5.100872,140.82.114.3,100.86.73.172,TLSv1.3,870,Application Data
137,5.100906,100.86.73.172,140.82.114.3,TCP,54,61046  >  443 [ACK] Seq=8464 Ack=156998 Win=132096 Len=0
138,5.102,100.86.73.172,140.82.114.3,TLSv1.3,89,Application Data
139,5.104804,140.82.114.3,100.86.73.172,TCP,56,443  >  61046 [ACK] Seq=156998 Ack=8464 Win=101376 Len=0
140,5.112527,140.82.114.3,100.86.73.172,TCP,56,443  >  61046 [ACK] Seq=156998 Ack=8499 Win=101376 Len=0
141,5.296951,140.82.114.3,100.86.73.172,TLSv1.3,1490,Application Data
142,5.297116,140.82.114.3,100.86.73.172,TLSv1.3,2926,"Application Data, Application Data"
143,5.297167,100.86.73.172,140.82.114.3,TCP,54,61046  >  443 [ACK] Seq=8499 Ack=161306 Win=132096 Len=0
144,5.299543,140.82.114.3,100.86.73.172,TLSv1.3,15850,"Application Data, Application Data, Application Data, Application Data, Application Data, Application Data, Application Data, Application Data, Application Data, Application Data, Application Data"
145,5.299543,140.82.114.3,100.86.73.172,TLSv1.3,956,"Application Data, Application Data"
146,5.299543,140.82.114.3,100.86.73.172,TLSv1.3,5798,"Application Data, Application Data, Application Data, Application Data"
147,5.299645,100.86.73.172,140.82.114.3,TCP,54,61046  >  443 [ACK] Seq=8499 Ack=183748 Win=132096 Len=0
148,5.301257,140.82.114.3,100.86.73.172,TLSv1.3,5798,"Application Data, Application Data, Application Data, Application Data"
149,5.301257,140.82.114.3,100.86.73.172,TLSv1.3,1145,"Application Data, Application Data"
150,5.301257,140.82.114.3,100.86.73.172,TLSv1.3,15850,"Application Data, Application Data, Application Data, Application Data, Application Data, Application Data, Application Data, Application Data, Application Data, Application Data, Application Data"
151,5.301257,140.82.114.3,100.86.73.172,TLSv1.3,915,Application Data
152,5.301257,140.82.114.3,100.86.73.172,TLSv1.3,4362,"Application Data, Application Data, Application Data"
153,5.301361,100.86.73.172,140.82.114.3,TCP,54,61046  >  443 [ACK] Seq=8499 Ack=211548 Win=132096 Len=0
154,5.302493,140.82.114.3,100.86.73.172,TLSv1.3,1490,Application Data
155,5.302493,140.82.114.3,100.86.73.172,TLSv1.3,136,"[TCP Previous segment not captured] , Continuation Data"
156,5.302534,100.86.73.172,140.82.114.3,TCP,66,61046  >  443 [ACK] Seq=8499 Ack=212984 Win=132096 Len=0 SLE=214420 SRE=214502
157,5.326371,140.82.114.3,100.86.73.172,TCP,1490,[TCP Retransmission] 443  >  61046 [ACK] Seq=212984 Ack=8499 Win=101376 Len=1436
158,5.326462,100.86.73.172,140.82.114.3,TCP,54,61046  >  443 [ACK] Seq=8499 Ack=214502 Win=132096 Len=0
159,5.634821,100.86.73.172,140.82.114.3,TLSv1.3,760,Application Data
160,5.635509,100.86.73.172,140.82.114.3,TLSv1.3,180,Application Data
161,5.645178,140.82.114.3,100.86.73.172,TCP,56,443  >  61046 [ACK] Seq=214502 Ack=9205 Win=104448 Len=0
162,5.646032,140.82.114.3,100.86.73.172,TCP,56,443  >  61046 [ACK] Seq=214502 Ack=9331 Win=104448 Len=0
163,5.672862,140.82.114.3,100.86.73.172,TLSv1.3,2926,"Application Data, Application Data"
164,5.672896,100.86.73.172,140.82.114.3,TCP,54,61046  >  443 [ACK] Seq=9331 Ack=217374 Win=132096 Len=0
165,5.673411,140.82.114.3,100.86.73.172,TLSv1.3,1419,"Application Data, Application Data"
166,5.715545,100.86.73.172,140.82.114.3,TCP,54,61046  >  443 [ACK] Seq=9331 Ack=218739 Win=130560 Len=0
167,6.005229,140.82.114.3,100.86.73.172,TLSv1.3,1490,Application Data
168,6.005671,140.82.114.3,100.86.73.172,TLSv1.3,2926,"Application Data, Application Data"
169,6.005731,100.86.73.172,140.82.114.3,TCP,54,61046  >  443 [ACK] Seq=9331 Ack=223047 Win=132096 Len=0
170,6.006982,140.82.114.3,100.86.73.172,TLSv1.3,15850,"Application Data, Application Data, Application Data, Application Data, Application Data, Application Data, Application Data, Application Data, Application Data, Application Data, Application Data"
171,6.006982,140.82.114.3,100.86.73.172,TLSv1.3,948,"Application Data, Application Data"
172,6.006982,140.82.114.3,100.86.73.172,TLSv1.3,2926,"Application Data, Application Data"
173,6.007105,100.86.73.172,140.82.114.3,TCP,54,61046  >  443 [ACK] Seq=9331 Ack=242609 Win=132096 Len=0
174,6.008148,140.82.114.3,100.86.73.172,TLSv1.3,1490,Application Data
175,6.008148,140.82.114.3,100.86.73.172,TLSv1.3,1490,Application Data
176,6.008148,140.82.114.3,100.86.73.172,TLSv1.3,1490,Application Data
177,6.008148,140.82.114.3,100.86.73.172,TLSv1.3,383,Application Data
178,6.008249,100.86.73.172,140.82.114.3,TCP,54,61046  >  443 [ACK] Seq=9331 Ack=247246 Win=132096 Len=0
179,6.56659,100.86.73.172,140.82.114.3,TLSv1.3,705,Application Data
180,6.618065,140.82.114.3,100.86.73.172,TCP,56,443  >  61046 [ACK] Seq=247246 Ack=9982 Win=107520 Len=0
181,6.65496,140.82.114.3,100.86.73.172,TLSv1.3,1490,Application Data
182,6.655266,140.82.114.3,100.86.73.172,TLSv1.3,2926,"Application Data, Application Data"
183,6.655348,100.86.73.172,140.82.114.3,TCP,54,61046  >  443 [ACK] Seq=9982 Ack=251554 Win=132096 Len=0
184,6.656185,140.82.114.3,100.86.73.172,TLSv1.3,11542,"Application Data, Application Data, Application Data, Application Data, Application Data, Application Data, Application Data, Application Data"
185,6.656296,100.86.73.172,140.82.114.3,TCP,54,61046  >  443 [ACK] Seq=9982 Ack=263042 Win=132096 Len=0
186,6.656816,140.82.114.3,100.86.73.172,TLSv1.3,1490,Application Data
187,6.656816,140.82.114.3,100.86.73.172,TLSv1.3,505,Application Data
188,6.656899,100.86.73.172,140.82.114.3,TCP,54,61046  >  443 [ACK] Seq=9982 Ack=264929 Win=132096 Len=0
189,7.284357,100.86.73.172,140.82.114.3,TLSv1.3,916,Application Data
190,7.308626,140.82.114.3,100.86.73.172,TCP,56,443  >  61046 [ACK] Seq=264929 Ack=10844 Win=110592 Len=0
191,7.547076,140.82.114.3,100.86.73.172,TLSv1.3,1490,Application Data
192,7.547549,140.82.114.3,100.86.73.172,TLSv1.3,2926,"Application Data, Application Data"
193,7.54765,100.86.73.172,140.82.114.3,TCP,54,61046  >  443 [ACK] Seq=10844 Ack=269237 Win=132096 Len=0
194,7.548417,140.82.114.3,100.86.73.172,TLSv1.3,11542,"Application Data, Application Data, Application Data, Application Data, Application Data, Application Data, Application Data, Application Data"
195,7.548525,100.86.73.172,140.82.114.3,TCP,54,61046  >  443 [ACK] Seq=10844 Ack=280725 Win=132096 Len=0
196,7.550961,140.82.114.3,100.86.73.172,TLSv1.3,4362,"Application Data, Application Data, Application Data"
197,7.550961,140.82.114.3,100.86.73.172,TLSv1.3,990,"Application Data, Application Data"
198,7.550961,140.82.114.3,100.86.73.172,TLSv1.3,15850,"Application Data, Application Data, Application Data, Application Data, Application Data, Application Data, Application Data, Application Data, Application Data, Application Data, Application Data"
199,7.550961,140.82.114.3,100.86.73.172,TLSv1.3,10106,"[TCP Previous segment not captured] , Application Data, Application Data, Application Data, Application Data, Application Data, Application Data, Application Data"
200,7.551256,100.86.73.172,140.82.114.3,TCP,66,61046  >  443 [ACK] Seq=10844 Ack=301765 Win=132096 Len=0 SLE=302626 SRE=312678
201,7.558428,140.82.114.3,100.86.73.172,TLSv1.3,1490,Application Data
202,7.558481,100.86.73.172,140.82.114.3,TCP,66,[TCP Dup ACK 200#1] 61046  >  443 [ACK] Seq=10844 Ack=301765 Win=132096 Len=0 SLE=302626 SRE=314114
203,7.558853,140.82.114.3,100.86.73.172,TLSv1.3,1490,Application Data
204,7.558892,100.86.73.172,140.82.114.3,TCP,66,[TCP Dup ACK 200#2] 61046  >  443 [ACK] Seq=10844 Ack=301765 Win=132096 Len=0 SLE=302626 SRE=315550
205,7.560595,140.82.114.3,100.86.73.172,TLSv1.3,1490,Application Data
206,7.560639,100.86.73.172,140.82.114.3,TCP,66,[TCP Dup ACK 200#3] 61046  >  443 [ACK] Seq=10844 Ack=301765 Win=132096 Len=0 SLE=302626 SRE=316986
207,7.561139,140.82.114.3,100.86.73.172,TLSv1.3,2926,"Application Data, Application Data"
208,7.561196,100.86.73.172,140.82.114.3,TCP,66,[TCP Dup ACK 200#4] 61046  >  443 [ACK] Seq=10844 Ack=301765 Win=132096 Len=0 SLE=302626 SRE=319858
209,7.562066,140.82.114.3,100.86.73.172,TLSv1.3,5798,"Application Data, Application Data, Application Data, Application Data"
210,7.562126,100.86.73.172,140.82.114.3,TCP,66,[TCP Dup ACK 200#5] 61046  >  443 [ACK] Seq=10844 Ack=301765 Win=132096 Len=0 SLE=302626 SRE=325602
211,7.563004,140.82.114.3,100.86.73.172,TLSv1.3,1490,Application Data
212,7.563004,140.82.114.3,100.86.73.172,TLSv1.3,915,"[TCP Fast Retransmission] , Application Data"
213,7.563004,140.82.114.3,100.86.73.172,TLSv1.3,5798,"Application Data, Application Data, Application Data, Application Data"
214,7.563082,100.86.73.172,140.82.114.3,TCP,66,[TCP Dup ACK 200#6] 61046  >  443 [ACK] Seq=10844 Ack=301765 Win=132096 Len=0 SLE=302626 SRE=327038
215,7.563254,100.86.73.172,140.82.114.3,TCP,54,61046  >  443 [ACK] Seq=10844 Ack=327038 Win=132096 Len=0
216,7.563334,100.86.73.172,140.82.114.3,TCP,54,61046  >  443 [ACK] Seq=10844 Ack=332782 Win=132096 Len=0
217,7.564377,140.82.114.3,100.86.73.172,TLSv1.3,648,"Application Data, Application Data"
218,7.618556,100.86.73.172,140.82.114.3,TCP,54,61046  >  443 [ACK] Seq=10844 Ack=333376 Win=131328 Len=0
219,7.741913,100.86.73.172,140.82.114.3,TLSv1.3,1334,Application Data
220,7.752027,140.82.114.3,100.86.73.172,TCP,56,443  >  61046 [ACK] Seq=333376 Ack=12124 Win=113664 Len=0
221,8.06756,140.82.114.3,100.86.73.172,TLSv1.3,1490,Application Data
222,8.068013,140.82.114.3,100.86.73.172,TLSv1.3,2926,"Application Data, Application Data"
223,8.068068,100.86.73.172,140.82.114.3,TCP,54,61046  >  443 [ACK] Seq=12124 Ack=337684 Win=132096 Len=0
224,8.069409,140.82.114.3,100.86.73.172,TLSv1.3,2926,"Application Data, Application Data"
225,8.069454,100.86.73.172,140.82.114.3,TCP,54,61046  >  443 [ACK] Seq=12124 Ack=340556 Win=132096 Len=0
226,8.07225,140.82.114.3,100.86.73.172,TLSv1.3,1490,Application Data
227,8.07225,140.82.114.3,100.86.73.172,TLSv1.3,1490,Application Data
228,8.07225,140.82.114.3,100.86.73.172,TLSv1.3,2926,"Application Data, Application Data"
229,8.07225,140.82.114.3,100.86.73.172,TLSv1.3,1490,Application Data
230,8.07225,140.82.114.3,100.86.73.172,TLSv1.3,1490,Application Data
231,8.07225,140.82.114.3,100.86.73.172,TLSv1.3,2926,"Application Data, Application Data"
232,8.07225,140.82.114.3,100.86.73.172,TLSv1.3,1490,Application Data
233,8.07225,140.82.114.3,100.86.73.172,TLSv1.3,936,"Application Data, Application Data"
234,8.07225,140.82.114.3,100.86.73.172,TLSv1.3,8670,"Application Data, Application Data, Application Data, Application Data, Application Data, Application Data"
235,8.07242,100.86.73.172,140.82.114.3,TCP,54,61046  >  443 [ACK] Seq=12124 Ack=362978 Win=132096 Len=0
236,8.073943,140.82.114.3,100.86.73.172,TLSv1.3,1490,Application Data
237,8.073943,140.82.114.3,100.86.73.172,TLSv1.3,1490,Application Data
238,8.074006,100.86.73.172,140.82.114.3,TCP,54,61046  >  443 [ACK] Seq=12124 Ack=365850 Win=132096 Len=0
239,8.080428,140.82.114.3,100.86.73.172,TLSv1.3,1490,Application Data
240,8.080492,100.86.73.172,140.82.114.3,TCP,54,61046  >  443 [ACK] Seq=12124 Ack=367286 Win=132096 Len=0
241,8.08181,140.82.114.3,100.86.73.172,TLSv1.3,1490,Application Data
242,8.082379,140.82.114.3,100.86.73.172,TLSv1.3,2926,"Application Data, Application Data"
243,8.082431,100.86.73.172,140.82.114.3,TCP,54,61046  >  443 [ACK] Seq=12124 Ack=371594 Win=132096 Len=0
244,8.083125,140.82.114.3,100.86.73.172,TLSv1.3,1490,Application Data
245,8.083168,100.86.73.172,140.82.114.3,TCP,54,61046  >  443 [ACK] Seq=12124 Ack=373030 Win=132096 Len=0
246,8.08529,140.82.114.3,100.86.73.172,TLSv1.3,20158,"Application Data, Application Data, Application Data, Application Data, Application Data, Application Data, Application Data, Application Data, Application Data, Application Data, Application Data, Application Data, Application Data, Application Data"
247,8.085364,100.86.73.172,140.82.114.3,TCP,54,61046  >  443 [ACK] Seq=12124 Ack=393134 Win=132096 Len=0
248,8.086975,140.82.114.3,100.86.73.172,TLSv1.3,1490,Application Data
249,8.086975,140.82.114.3,100.86.73.172,TLSv1.3,1490,Application Data
250,8.086975,140.82.114.3,100.86.73.172,TLSv1.3,2926,"Application Data, Application Data, Application Data"
251,8.087039,100.86.73.172,140.82.114.3,TCP,54,61046  >  443 [ACK] Seq=12124 Ack=398878 Win=132096 Len=0
252,8.087421,140.82.114.3,100.86.73.172,TLSv1.3,1490,Application Data
253,8.092774,140.82.114.3,100.86.73.172,TLSv1.3,1490,Application Data
254,8.092854,100.86.73.172,140.82.114.3,TCP,54,61046  >  443 [ACK] Seq=12124 Ack=401750 Win=132096 Len=0
255,8.095472,140.82.114.3,100.86.73.172,TLSv1.3,766,Application Data
256,8.141685,100.86.73.172,140.82.114.3,TCP,54,61046  >  443 [ACK] Seq=12124 Ack=402462 Win=131328 Len=0
257,8.306559,100.86.73.172,140.82.114.3,TLSv1.3,798,Application Data
258,8.307665,100.86.73.172,140.82.114.3,TLSv1.3,382,Application Data
259,8.30779,100.86.73.172,140.82.114.3,TLSv1.3,180,Application Data
260,8.307957,100.86.73.172,140.82.114.3,TLSv1.3,162,Application Data
261,8.316704,140.82.114.3,100.86.73.172,TCP,56,443  >  61046 [ACK] Seq=402462 Ack=12868 Win=116736 Len=0
262,8.317657,140.82.114.3,100.86.73.172,TCP,56,443  >  61046 [ACK] Seq=402462 Ack=13196 Win=118784 Len=0
263,8.31797,140.82.114.3,100.86.73.172,TCP,56,443  >  61046 [ACK] Seq=402462 Ack=13430 Win=118784 Len=0
264,8.367655,140.82.114.3,100.86.73.172,TLSv1.3,1490,Application Data
265,8.368081,140.82.114.3,100.86.73.172,TLSv1.3,2926,"Application Data, Application Data"
266,8.368129,100.86.73.172,140.82.114.3,TCP,54,61046  >  443 [ACK] Seq=13430 Ack=406770 Win=132096 Len=0
267,8.368489,140.82.114.3,100.86.73.172,TLSv1.3,69,Application Data
268,8.368521,100.86.73.172,140.82.114.3,TCP,54,61046  >  443 [ACK] Seq=13430 Ack=406785 Win=132096 Len=0
269,8.369667,100.86.73.172,140.82.114.3,TLSv1.3,138,Application Data
270,8.379609,140.82.114.3,100.86.73.172,TCP,56,443  >  61046 [ACK] Seq=406785 Ack=13514 Win=118784 Len=0
271,8.381135,140.82.114.3,100.86.73.172,TLSv1.3,1490,Application Data
272,8.38161,140.82.114.3,100.86.73.172,TLSv1.3,2926,"Application Data, Application Data"
273,8.381643,100.86.73.172,140.82.114.3,TCP,54,61046  >  443 [ACK] Seq=13514 Ack=411093 Win=132096 Len=0
274,8.381947,140.82.114.3,100.86.73.172,TLSv1.3,57,Application Data
275,8.381972,100.86.73.172,140.82.114.3,TCP,54,61046  >  443 [ACK] Seq=13514 Ack=411096 Win=132096 Len=0
276,8.383317,140.82.114.3,100.86.73.172,TLSv1.3,4362,"Application Data, Application Data, Application Data"
277,8.383357,100.86.73.172,140.82.114.3,TCP,54,61046  >  443 [ACK] Seq=13514 Ack=415404 Win=132096 Len=0
278,8.38361,140.82.114.3,100.86.73.172,TLSv1.3,59,Application Data
279,8.383636,100.86.73.172,140.82.114.3,TCP,54,61046  >  443 [ACK] Seq=13514 Ack=415409 Win=132096 Len=0
280,8.394113,100.86.73.172,140.82.114.3,TLSv1.3,720,Application Data
281,8.407918,100.86.73.172,140.82.114.3,TLSv1.3,649,Application Data
282,8.411759,100.86.73.172,140.82.114.3,TLSv1.3,159,Application Data
283,8.414148,140.82.114.3,100.86.73.172,TLSv1.3,1490,Application Data
284,8.414219,100.86.73.172,140.82.114.3,TCP,54,61046  >  443 [ACK] Seq=14880 Ack=416845 Win=132096 Len=0
285,8.416174,140.82.114.3,100.86.73.172,TLSv1.3,1490,Application Data
286,8.416174,140.82.114.3,100.86.73.172,TLSv1.3,1490,Application Data
287,8.416174,140.82.114.3,100.86.73.172,TLSv1.3,8670,"Application Data, Application Data, Application Data, Application Data, Application Data, Application Data"
288,8.416174,140.82.114.3,100.86.73.172,TLSv1.3,1003,Application Data
289,8.416258,100.86.73.172,140.82.114.3,TCP,54,61046  >  443 [ACK] Seq=14880 Ack=429282 Win=132096 Len=0
290,8.422119,140.82.114.3,100.86.73.172,TLSv1.3,1490,Application Data
291,8.422515,140.82.114.3,100.86.73.172,TLSv1.3,2926,"Application Data, Application Data"
292,8.422556,100.86.73.172,140.82.114.3,TCP,54,61046  >  443 [ACK] Seq=14880 Ack=433590 Win=132096 Len=0
293,8.422888,140.82.114.3,100.86.73.172,TLSv1.3,71,Application Data
294,8.422934,100.86.73.172,140.82.114.3,TCP,54,61046  >  443 [ACK] Seq=14880 Ack=433607 Win=131840 Len=0
295,8.434097,140.82.114.3,100.86.73.172,TLSv1.3,1490,Application Data
296,8.434361,140.82.114.3,100.86.73.172,TLSv1.3,1490,Application Data
297,8.434361,140.82.114.3,100.86.73.172,TLSv1.3,1415,"Application Data, Application Data"
298,8.434403,100.86.73.172,140.82.114.3,TCP,54,61046  >  443 [ACK] Seq=14880 Ack=437840 Win=132096 Len=0
299,8.447157,140.82.114.3,100.86.73.172,TLSv1.3,1490,Application Data
300,8.447209,100.86.73.172,140.82.114.3,TCP,54,61046  >  443 [ACK] Seq=14880 Ack=439276 Win=132096 Len=0
301,8.447669,140.82.114.3,100.86.73.172,TLSv1.3,2926,"Application Data, Application Data"
302,8.447727,100.86.73.172,140.82.114.3,TCP,54,61046  >  443 [ACK] Seq=14880 Ack=442148 Win=132096 Len=0
303,8.448045,140.82.114.3,100.86.73.172,TLSv1.3,2926,"Application Data, Application Data"
304,8.448078,100.86.73.172,140.82.114.3,TCP,54,61046  >  443 [ACK] Seq=14880 Ack=445020 Win=132096 Len=0
305,8.448714,140.82.114.3,100.86.73.172,TLSv1.3,1210,Application Data
306,8.461087,140.82.114.3,100.86.73.172,TLSv1.3,1490,Application Data
307,8.461121,100.86.73.172,140.82.114.3,TCP,54,61046  >  443 [ACK] Seq=14880 Ack=447612 Win=132096 Len=0
308,8.461507,140.82.114.3,100.86.73.172,TLSv1.3,2926,"Application Data, Application Data"
309,8.461546,100.86.73.172,140.82.114.3,TCP,54,61046  >  443 [ACK] Seq=14880 Ack=450484 Win=132096 Len=0
310,8.461804,140.82.114.3,100.86.73.172,TLSv1.3,65,Application Data
311,8.506145,100.86.73.172,140.82.114.3,TCP,54,61046  >  443 [ACK] Seq=14880 Ack=450495 Win=132096 Len=0
312,8.798423,100.86.73.172,140.82.114.3,TLSv1.3,706,Application Data
313,8.850272,140.82.114.3,100.86.73.172,TCP,56,443  >  61046 [ACK] Seq=450495 Ack=15532 Win=128000 Len=0
314,8.900266,140.82.114.3,100.86.73.172,TLSv1.3,1490,Application Data
315,8.901361,140.82.114.3,100.86.73.172,TLSv1.3,14414,"Application Data, Application Data, Application Data, Application Data, Application Data, Application Data, Application Data, Application Data, Application Data, Application Data"
316,8.901514,100.86.73.172,140.82.114.3,TCP,54,61046  >  443 [ACK] Seq=15532 Ack=466291 Win=132096 Len=0
317,8.902001,140.82.114.3,100.86.73.172,TLSv1.3,1490,Application Data
318,8.902001,140.82.114.3,100.86.73.172,TLSv1.3,520,Application Data
319,8.902125,100.86.73.172,140.82.114.3,TCP,54,61046  >  443 [ACK] Seq=15532 Ack=468193 Win=132096 Len=0
320,9.617068,100.86.73.172,140.82.114.3,TLSv1.3,749,Application Data
321,9.627756,140.82.114.3,100.86.73.172,TCP,56,443  >  61046 [ACK] Seq=468193 Ack=16227 Win=131072 Len=0
322,9.910609,140.82.114.3,100.86.73.172,TLSv1.3,4362,"Application Data, Application Data, Application Data"
323,9.910742,100.86.73.172,140.82.114.3,TCP,54,61046  >  443 [ACK] Seq=16227 Ack=472501 Win=132096 Len=0
324,9.912239,140.82.114.3,100.86.73.172,TLSv1.3,15850,"Application Data, Application Data, Application Data, Application Data, Application Data, Application Data, Application Data, Application Data, Application Data, Application Data, Application Data"
325,9.912239,140.82.114.3,100.86.73.172,TLSv1.3,954,"Application Data, Application Data"
326,9.912239,140.82.114.3,100.86.73.172,TLSv1.3,11542,"Application Data, Application Data, Application Data, Application Data, Application Data, Application Data, Application Data, Application Data"
327,9.912404,100.86.73.172,140.82.114.3,TCP,54,61046  >  443 [ACK] Seq=16227 Ack=500685 Win=132096 Len=0
328,9.913031,140.82.114.3,100.86.73.172,TLSv1.3,2926,"Application Data, Application Data"
329,9.913113,100.86.73.172,140.82.114.3,TCP,54,61046  >  443 [ACK] Seq=16227 Ack=503557 Win=132096 Len=0
330,9.922107,140.82.114.3,100.86.73.172,TLSv1.3,1490,Application Data
331,9.922237,100.86.73.172,140.82.114.3,TCP,54,61046  >  443 [ACK] Seq=16227 Ack=504993 Win=132096 Len=0
332,9.922473,140.82.114.3,100.86.73.172,TLSv1.3,2926,"Application Data, Application Data"
333,9.922535,100.86.73.172,140.82.114.3,TCP,54,61046  >  443 [ACK] Seq=16227 Ack=507865 Win=132096 Len=0
334,9.92294,140.82.114.3,100.86.73.172,TLSv1.3,1490,Application Data
335,9.923959,140.82.114.3,100.86.73.172,TLSv1.3,8670,"Application Data, Application Data, Application Data, Application Data, Application Data, Application Data"
336,9.924079,100.86.73.172,140.82.114.3,TCP,54,61046  >  443 [ACK] Seq=16227 Ack=517917 Win=132096 Len=0
337,9.924338,140.82.114.3,100.86.73.172,TLSv1.3,1220,"Application Data, Application Data"
338,9.924407,100.86.73.172,140.82.114.3,TCP,54,61046  >  443 [ACK] Seq=16227 Ack=519083 Win=130816 Len=0
339,10.100309,100.86.73.172,140.82.114.3,TLSv1.3,1068,Application Data
340,10.113107,140.82.114.3,100.86.73.172,TCP,56,443  >  61046 [ACK] Seq=519083 Ack=17241 Win=133120 Len=0
341,10.382978,140.82.114.3,100.86.73.172,TLSv1.3,1490,Application Data
342,10.385126,140.82.114.3,100.86.73.172,TLSv1.3,1490,Application Data
343,10.385126,140.82.114.3,100.86.73.172,TLSv1.3,1490,Application Data
344,10.385126,140.82.114.3,100.86.73.172,TLSv1.3,15850,"Application Data, Application Data, Application Data, Application Data, Application Data, Application Data, Application Data, Application Data, Application Data, Application Data, Application Data"
345,10.385126,140.82.114.3,100.86.73.172,TLSv1.3,878,"Application Data, Application Data"
346,10.385126,140.82.114.3,100.86.73.172,TLSv1.3,11542,"Application Data, Application Data, Application Data, Application Data, Application Data, Application Data, Application Data, Application Data"
347,10.385224,100.86.73.172,140.82.114.3,TCP,54,61046  >  443 [ACK] Seq=17241 Ack=551499 Win=132096 Len=0
348,10.386523,140.82.114.3,100.86.73.172,TLSv1.3,1145,"Application Data, Application Data"
349,10.386523,140.82.114.3,100.86.73.172,TLSv1.3,1490,Application Data
350,10.38657,100.86.73.172,140.82.114.3,TCP,54,61046  >  443 [ACK] Seq=17241 Ack=554026 Win=132096 Len=0
351,10.38747,100.86.73.172,140.82.114.3,TLSv1.3,89,Application Data
352,10.396124,140.82.114.3,100.86.73.172,TLSv1.3,1490,Application Data
353,10.396174,100.86.73.172,140.82.114.3,TCP,54,61046  >  443 [ACK] Seq=17276 Ack=555462 Win=132096 Len=0
354,10.396317,140.82.114.3,100.86.73.172,TLSv1.3,2926,"Application Data, Application Data"
355,10.396358,100.86.73.172,140.82.114.3,TCP,54,61046  >  443 [ACK] Seq=17276 Ack=558334 Win=132096 Len=0
356,10.397415,140.82.114.3,100.86.73.172,TLSv1.3,11542,"Application Data, Application Data, Application Data, Application Data, Application Data, Application Data, Application Data, Application Data"
357,10.397464,100.86.73.172,140.82.114.3,TCP,54,61046  >  443 [ACK] Seq=17276 Ack=569822 Win=132096 Len=0
358,10.399045,140.82.114.3,100.86.73.172,TLSv1.3,1075,"Application Data, Application Data"
359,10.399045,140.82.114.3,100.86.73.172,TCP,56,443  >  61046 [ACK] Seq=570843 Ack=17276 Win=133120 Len=0
360,10.399092,100.86.73.172,140.82.114.3,TCP,54,61046  >  443 [ACK] Seq=17276 Ack=570843 Win=131072 Len=0
361,10.646788,100.86.73.172,140.82.114.3,TLSv1.3,1251,Application Data
362,10.656945,140.82.114.3,100.86.73.172,TCP,56,443  >  61046 [ACK] Seq=570843 Ack=18473 Win=136192 Len=0
363,10.686572,140.82.114.3,100.86.73.172,TLSv1.3,1490,Application Data
364,10.687975,140.82.114.3,100.86.73.172,TLSv1.3,1423,"[TCP Previous segment not captured] , Continuation Data"
365,10.688009,100.86.73.172,140.82.114.3,TCP,66,61046  >  443 [ACK] Seq=18473 Ack=572279 Win=132096 Len=0 SLE=573715 SRE=575084
366,10.713971,140.82.114.3,100.86.73.172,TCP,1490,[TCP Retransmission] 443  >  61046 [ACK] Seq=572279 Ack=18473 Win=136192 Len=1436
367,10.714003,100.86.73.172,140.82.114.3,TCP,54,61046  >  443 [ACK] Seq=18473 Ack=575084 Win=132096 Len=0
368,12.534389,100.86.73.172,140.82.114.3,TLSv1.3,729,Application Data
369,12.586111,140.82.114.3,100.86.73.172,TCP,56,443  >  61046 [ACK] Seq=575084 Ack=19148 Win=139264 Len=0
370,12.619151,140.82.114.3,100.86.73.172,TLSv1.3,4362,"Application Data, Application Data, Application Data"
371,12.61931,100.86.73.172,140.82.114.3,TCP,54,61046  >  443 [ACK] Seq=19148 Ack=579392 Win=132096 Len=0
372,12.620104,140.82.114.3,100.86.73.172,TLSv1.3,11542,"Application Data, Application Data, Application Data, Application Data, Application Data, Application Data, Application Data, Application Data"
373,12.620233,100.86.73.172,140.82.114.3,TCP,54,61046  >  443 [ACK] Seq=19148 Ack=590880 Win=132096 Len=0
374,12.62074,140.82.114.3,100.86.73.172,TLSv1.3,1490,Application Data
375,12.62074,140.82.114.3,100.86.73.172,TLSv1.3,532,Application Data
376,12.62083,100.86.73.172,140.82.114.3,TCP,54,61046  >  443 [ACK] Seq=19148 Ack=592794 Win=132096 Len=0
377,13.620262,100.86.73.172,140.82.114.3,TLSv1.3,927,Application Data
378,13.640195,140.82.114.3,100.86.73.172,TCP,56,443  >  61046 [ACK] Seq=592794 Ack=20021 Win=142336 Len=0
379,13.767433,140.82.114.3,100.86.73.172,TLSv1.3,4362,"Application Data, Application Data, Application Data"
380,13.767568,100.86.73.172,140.82.114.3,TCP,54,61046  >  443 [ACK] Seq=20021 Ack=597102 Win=132096 Len=0
381,13.775384,140.82.114.3,100.86.73.172,TLSv1.3,15850,"Application Data, Application Data, Application Data, Application Data, Application Data, Application Data, Application Data, Application Data, Application Data, Application Data, Application Data"
382,13.775384,140.82.114.3,100.86.73.172,TLSv1.3,919,"Application Data, Application Data"
383,13.775384,140.82.114.3,100.86.73.172,TLSv1.3,2926,"Application Data, Application Data"
384,13.775568,100.86.73.172,140.82.114.3,TCP,54,61046  >  443 [ACK] Seq=20021 Ack=616635 Win=132096 Len=0
385,13.782849,140.82.114.3,100.86.73.172,TLSv1.3,1490,Application Data
386,13.782849,140.82.114.3,100.86.73.172,TLSv1.3,1490,Application Data
387,13.782959,100.86.73.172,140.82.114.3,TCP,54,61046  >  443 [ACK] Seq=20021 Ack=619507 Win=132096 Len=0
388,13.791569,140.82.114.3,100.86.73.172,TLSv1.3,1490,Application Data
389,13.791569,140.82.114.3,100.86.73.172,TLSv1.3,1490,Application Data
390,13.791569,140.82.114.3,100.86.73.172,TLSv1.3,1490,Application Data
391,13.791695,100.86.73.172,140.82.114.3,TCP,54,61046  >  443 [ACK] Seq=20021 Ack=623815 Win=132096 Len=0
392,13.798039,140.82.114.3,100.86.73.172,TLSv1.3,1490,Application Data
393,13.798039,140.82.114.3,100.86.73.172,TLSv1.3,1490,"Application Data, Application Data"
394,13.798039,140.82.114.3,100.86.73.172,TLSv1.3,1490,Application Data
395,13.798039,140.82.114.3,100.86.73.172,TLSv1.3,1490,Application Data
396,13.798039,140.82.114.3,100.86.73.172,TLSv1.3,1490,Application Data
397,13.798039,140.82.114.3,100.86.73.172,TLSv1.3,1490,Application Data
398,13.798039,140.82.114.3,100.86.73.172,TLSv1.3,5798,"Application Data, Application Data, Application Data, Application Data"
399,13.798039,140.82.114.3,100.86.73.172,TLSv1.3,1490,Application Data
