"No.","Time","Source","Destination","Protocol","Length","Info"
"1","0.000000","192.168.1.31","52.3.144.142","TLSv1.2","118","Application Data"
"2","0.000028","192.168.1.31","52.3.144.142","TLSv1.2","93","Application Data"
"3","0.016127","52.3.144.142","192.168.1.31","TCP","60","443  >  56483 [ACK] Seq=1 Ack=104 Win=68 Len=0"
"4","0.016873","52.3.144.142","192.168.1.31","TLSv1.2","93","Application Data"
"5","0.059521","192.168.1.31","52.3.144.142","TCP","54","56483  >  443 [ACK] Seq=104 Ack=40 Win=1025 Len=0"
"6","0.299244","52.3.144.142","192.168.1.31","TLSv1.2","301","Application Data"
"7","0.299791","52.3.144.142","192.168.1.31","TCP","1514","443  >  56483 [ACK] Seq=287 Ack=104 Win=68 Len=1460 [TCP segment of a reassembled PDU]"
"8","0.299791","52.3.144.142","192.168.1.31","TCP","1514","443  >  56483 [ACK] Seq=1747 Ack=104 Win=68 Len=1460 [TCP segment of a reassembled PDU]"
"9","0.299791","52.3.144.142","192.168.1.31","TCP","1514","443  >  56483 [PSH, ACK] Seq=3207 Ack=104 Win=68 Len=1460 [TCP segment of a reassembled PDU]"
"10","0.299805","192.168.1.31","52.3.144.142","TCP","54","56483  >  443 [ACK] Seq=104 Ack=4667 Win=1026 Len=0"
"11","0.300269","52.3.144.142","192.168.1.31","TLSv1.2","896","Application Data"
"12","0.300397","52.3.144.142","192.168.1.31","TCP","1514","443  >  56483 [ACK] Seq=5509 Ack=104 Win=68 Len=1460 [TCP segment of a reassembled PDU]"
"13","0.300397","52.3.144.142","192.168.1.31","TLSv1.2","1055","Application Data"
"14","0.300409","192.168.1.31","52.3.144.142","TCP","54","56483  >  443 [ACK] Seq=104 Ack=7970 Win=1026 Len=0"
"15","0.300897","52.3.144.142","192.168.1.31","TCP","1514","443  >  56483 [ACK] Seq=7970 Ack=104 Win=68 Len=1460 [TCP segment of a reassembled PDU]"
"16","0.300897","52.3.144.142","192.168.1.31","TCP","1514","443  >  56483 [ACK] Seq=9430 Ack=104 Win=68 Len=1460 [TCP segment of a reassembled PDU]"
"17","0.300911","192.168.1.31","52.3.144.142","TCP","54","56483  >  443 [ACK] Seq=104 Ack=10890 Win=1026 Len=0"
"18","0.301356","52.3.144.142","192.168.1.31","TLSv1.2","1198","Application Data"
"19","0.301367","192.168.1.31","52.3.144.142","TCP","54","56483  >  443 [ACK] Seq=104 Ack=12034 Win=1022 Len=0"
"20","0.301940","52.3.144.142","192.168.1.31","TCP","1514","443  >  56483 [ACK] Seq=12034 Ack=104 Win=68 Len=1460 [TCP segment of a reassembled PDU]"
"21","0.301958","52.3.144.142","192.168.1.31","TCP","1514","443  >  56483 [ACK] Seq=13494 Ack=104 Win=68 Len=1460 [TCP segment of a reassembled PDU]"
"22","0.301964","192.168.1.31","52.3.144.142","TCP","54","56483  >  443 [ACK] Seq=104 Ack=14954 Win=1026 Len=0"
"23","0.302424","52.3.144.142","192.168.1.31","TLSv1.2","1254","Application Data"
"24","0.302424","52.3.144.142","192.168.1.31","TLSv1.2","253","Application Data"
"25","0.302433","192.168.1.31","52.3.144.142","TCP","54","56483  >  443 [ACK] Seq=104 Ack=16353 Win=1021 Len=0"
"26","0.303380","52.3.144.142","192.168.1.31","TCP","1514","443  >  56483 [ACK] Seq=16353 Ack=104 Win=68 Len=1460 [TCP segment of a reassembled PDU]"
"27","0.303861","52.3.144.142","192.168.1.31","TCP","1514","443  >  56483 [ACK] Seq=17813 Ack=104 Win=68 Len=1460 [TCP segment of a reassembled PDU]"
"28","0.303861","52.3.144.142","192.168.1.31","TLSv1.2","249","Application Data"
"29","0.303873","192.168.1.31","52.3.144.142","TCP","54","56483  >  443 [ACK] Seq=104 Ack=19468 Win=1026 Len=0"
"30","0.304603","52.3.144.142","192.168.1.31","TCP","1514","443  >  56483 [ACK] Seq=19468 Ack=104 Win=68 Len=1460 [TCP segment of a reassembled PDU]"
"31","0.304627","192.168.1.31","52.3.144.142","TCP","54","56483  >  443 [ACK] Seq=104 Ack=20928 Win=1026 Len=0"
"32","0.305075","52.3.144.142","192.168.1.31","TCP","1514","443  >  56483 [ACK] Seq=20928 Ack=104 Win=68 Len=1460 [TCP segment of a reassembled PDU]"
"33","0.305075","52.3.144.142","192.168.1.31","TLSv1.2","913","Application Data"
"34","0.305102","192.168.1.31","52.3.144.142","TCP","54","56483  >  443 [ACK] Seq=104 Ack=23247 Win=1026 Len=0"
"35","0.305282","52.3.144.142","192.168.1.31","TCP","1514","443  >  56483 [ACK] Seq=23247 Ack=104 Win=68 Len=1460 [TCP segment of a reassembled PDU]"
"36","0.305282","52.3.144.142","192.168.1.31","TCP","1514","443  >  56483 [ACK] Seq=24707 Ack=104 Win=68 Len=1460 [TCP segment of a reassembled PDU]"
"37","0.305282","52.3.144.142","192.168.1.31","TLSv1.2","1100","Application Data"
"38","0.305296","192.168.1.31","52.3.144.142","TCP","54","56483  >  443 [ACK] Seq=104 Ack=27213 Win=1026 Len=0"
"39","0.306845","52.3.144.142","192.168.1.31","TCP","1514","443  >  56483 [ACK] Seq=27213 Ack=104 Win=68 Len=1460 [TCP segment of a reassembled PDU]"
"40","0.306845","52.3.144.142","192.168.1.31","TCP","1514","443  >  56483 [ACK] Seq=28673 Ack=104 Win=68 Len=1460 [TCP segment of a reassembled PDU]"
"41","0.306845","52.3.144.142","192.168.1.31","TLSv1.2","442","Application Data"
"42","0.306867","192.168.1.31","52.3.144.142","TCP","54","56483  >  443 [ACK] Seq=104 Ack=30521 Win=1026 Len=0"
"43","0.307496","52.3.144.142","192.168.1.31","TCP","1514","443  >  56483 [ACK] Seq=30521 Ack=104 Win=68 Len=1460 [TCP segment of a reassembled PDU]"
"44","0.307951","52.3.144.142","192.168.1.31","TCP","1514","443  >  56483 [ACK] Seq=31981 Ack=104 Win=68 Len=1460 [TCP segment of a reassembled PDU]"
"45","0.307951","52.3.144.142","192.168.1.31","TLSv1.2","122","Application Data"
"46","0.307951","52.3.144.142","192.168.1.31","TLSv1.2","459","Application Data"
"47","0.307971","192.168.1.31","52.3.144.142","TCP","54","56483  >  443 [ACK] Seq=104 Ack=33914 Win=1026 Len=0"
"48","0.308426","192.168.1.31","52.3.144.142","TLSv1.2","89","Application Data"
"49","0.310107","52.3.144.142","192.168.1.31","TCP","1514","443  >  56483 [ACK] Seq=33914 Ack=104 Win=68 Len=1460 [TCP segment of a reassembled PDU]"
"50","0.310127","192.168.1.31","52.3.144.142","TCP","54","56483  >  443 [ACK] Seq=139 Ack=35374 Win=1026 Len=0"
"51","0.310568","52.3.144.142","192.168.1.31","TCP","1514","443  >  56483 [ACK] Seq=35374 Ack=104 Win=68 Len=1460 [TCP segment of a reassembled PDU]"
"52","0.310576","192.168.1.31","52.3.144.142","TCP","54","56483  >  443 [ACK] Seq=139 Ack=36834 Win=1026 Len=0"
"53","0.310588","52.3.144.142","192.168.1.31","TCP","1514","443  >  56483 [PSH, ACK] Seq=36834 Ack=104 Win=68 Len=1460 [TCP segment of a reassembled PDU]"
"54","0.310591","192.168.1.31","52.3.144.142","TCP","54","56483  >  443 [ACK] Seq=139 Ack=38294 Win=1026 Len=0"
"55","0.310958","52.3.144.142","192.168.1.31","TLSv1.2","234","Application Data"
"56","0.310961","192.168.1.31","52.3.144.142","TCP","54","56483  >  443 [ACK] Seq=139 Ack=38474 Win=1025 Len=0"
"57","0.310982","52.3.144.142","192.168.1.31","TCP","1514","443  >  56483 [ACK] Seq=38474 Ack=104 Win=68 Len=1460 [TCP segment of a reassembled PDU]"
"58","0.310985","192.168.1.31","52.3.144.142","TCP","54","56483  >  443 [ACK] Seq=139 Ack=39934 Win=1026 Len=0"
"59","0.310995","52.3.144.142","192.168.1.31","TCP","1514","443  >  56483 [ACK] Seq=39934 Ack=104 Win=68 Len=1460 [TCP segment of a reassembled PDU]"
"60","0.310995","52.3.144.142","192.168.1.31","TLSv1.2","434","Application Data"
"61","0.311000","192.168.1.31","52.3.144.142","TCP","54","56483  >  443 [ACK] Seq=139 Ack=41774 Win=1026 Len=0"
"62","0.364615","52.3.144.142","192.168.1.31","TCP","60","443  >  56483 [ACK] Seq=41774 Ack=139 Win=68 Len=0"
"63","0.732060","192.168.1.31","52.3.144.142","TLSv1.2","601","Application Data"
"64","0.732086","192.168.1.31","52.3.144.142","TLSv1.2","1499","Application Data"
"65","0.747747","52.3.144.142","192.168.1.31","TCP","60","443  >  56483 [ACK] Seq=41774 Ack=686 Win=68 Len=0"
"66","0.753846","52.3.144.142","192.168.1.31","TCP","60","443  >  56483 [ACK] Seq=41774 Ack=2131 Win=68 Len=0"
"67","0.950213","192.168.1.31","52.3.144.142","TLSv1.2","354","Application Data"
"68","0.950240","192.168.1.31","52.3.144.142","TLSv1.2","273","Application Data"
"69","0.966048","52.3.144.142","192.168.1.31","TCP","60","443  >  56483 [ACK] Seq=41774 Ack=2431 Win=68 Len=0"
"70","0.966081","52.3.144.142","192.168.1.31","TCP","60","443  >  56483 [ACK] Seq=41774 Ack=2650 Win=68 Len=0"
"71","0.984440","192.168.1.31","52.3.144.142","TLSv1.2","147","Application Data"
"72","1.000155","52.3.144.142","192.168.1.31","TCP","60","443  >  56483 [ACK] Seq=41774 Ack=2743 Win=68 Len=0"
"73","1.000155","52.3.144.142","192.168.1.31","TLSv1.2","401","Application Data"
"74","1.017869","52.3.144.142","192.168.1.31","TLSv1.2","474","Application Data"
"75","1.017887","192.168.1.31","52.3.144.142","TCP","54","56483  >  443 [ACK] Seq=2743 Ack=42541 Win=1023 Len=0"
"76","1.271168","52.3.144.142","192.168.1.31","TLSv1.2","300","Application Data"
"77","1.271220","52.3.144.142","192.168.1.31","TCP","1514","443  >  56483 [ACK] Seq=42787 Ack=2743 Win=68 Len=1460 [TCP segment of a reassembled PDU]"
"78","1.271229","192.168.1.31","52.3.144.142","TCP","54","56483  >  443 [ACK] Seq=2743 Ack=44247 Win=1026 Len=0"
"79","1.271708","52.3.144.142","192.168.1.31","TCP","1514","443  >  56483 [ACK] Seq=44247 Ack=2743 Win=68 Len=1460 [TCP segment of a reassembled PDU]"
"80","1.271720","52.3.144.142","192.168.1.31","TCP","1514","443  >  56483 [ACK] Seq=45707 Ack=2743 Win=68 Len=1460 [TCP segment of a reassembled PDU]"
"81","1.271724","192.168.1.31","52.3.144.142","TCP","54","56483  >  443 [ACK] Seq=2743 Ack=47167 Win=1026 Len=0"
"82","1.271735","52.3.144.142","192.168.1.31","TCP","1514","443  >  56483 [ACK] Seq=47167 Ack=2743 Win=68 Len=1460 [TCP segment of a reassembled PDU]"
"83","1.271735","52.3.144.142","192.168.1.31","TLSv1.2","1009","Application Data"
"84","1.271741","192.168.1.31","52.3.144.142","TCP","54","56483  >  443 [ACK] Seq=2743 Ack=49582 Win=1026 Len=0"
"85","1.271763","52.3.144.142","192.168.1.31","TCP","1514","443  >  56483 [ACK] Seq=49582 Ack=2743 Win=68 Len=1460 [TCP segment of a reassembled PDU]"
"86","1.272089","52.3.144.142","192.168.1.31","TCP","1514","443  >  56483 [ACK] Seq=51042 Ack=2743 Win=68 Len=1460 [TCP segment of a reassembled PDU]"
"87","1.272089","52.3.144.142","192.168.1.31","TCP","1514","443  >  56483 [ACK] Seq=52502 Ack=2743 Win=68 Len=1460 [TCP segment of a reassembled PDU]"
"88","1.272100","192.168.1.31","52.3.144.142","TCP","54","56483  >  443 [ACK] Seq=2743 Ack=53962 Win=1026 Len=0"
"89","1.272114","52.3.144.142","192.168.1.31","TCP","1514","443  >  56483 [ACK] Seq=53962 Ack=2743 Win=68 Len=1460 [TCP segment of a reassembled PDU]"
"90","1.272114","52.3.144.142","192.168.1.31","TLSv1.2","60","Application Data"
"91","1.272118","192.168.1.31","52.3.144.142","TCP","54","56483  >  443 [ACK] Seq=2743 Ack=55427 Win=1026 Len=0"
"92","1.272750","52.3.144.142","192.168.1.31","TCP","1514","443  >  56483 [ACK] Seq=55427 Ack=2743 Win=68 Len=1460 [TCP segment of a reassembled PDU]"
"93","1.272754","192.168.1.31","52.3.144.142","TCP","54","56483  >  443 [ACK] Seq=2743 Ack=56887 Win=1026 Len=0"
"94","1.272779","52.3.144.142","192.168.1.31","TCP","1514","443  >  56483 [ACK] Seq=56887 Ack=2743 Win=68 Len=1460 [TCP segment of a reassembled PDU]"
"95","1.272779","52.3.144.142","192.168.1.31","TLSv1.2","462","Application Data"
"96","1.272785","192.168.1.31","52.3.144.142","TCP","54","56483  >  443 [ACK] Seq=2743 Ack=58755 Win=1026 Len=0"
"97","1.273193","52.3.144.142","192.168.1.31","TCP","1514","443  >  56483 [ACK] Seq=58755 Ack=2743 Win=68 Len=1460 [TCP segment of a reassembled PDU]"
"98","1.273663","52.3.144.142","192.168.1.31","TLSv1.2","1216","Application Data"
"99","1.273663","52.3.144.142","192.168.1.31","TLSv1.2","95","Application Data"
"100","1.273671","192.168.1.31","52.3.144.142","TCP","54","56483  >  443 [ACK] Seq=2743 Ack=61418 Win=1026 Len=0"
"101","1.275359","52.3.144.142","192.168.1.31","TCP","1514","443  >  56483 [ACK] Seq=61418 Ack=2743 Win=68 Len=1460 [TCP segment of a reassembled PDU]"
"102","1.275367","192.168.1.31","52.3.144.142","TCP","54","56483  >  443 [ACK] Seq=2743 Ack=62878 Win=1026 Len=0"
"103","1.275379","52.3.144.142","192.168.1.31","TCP","1514","443  >  56483 [ACK] Seq=62878 Ack=2743 Win=68 Len=1460 [TCP segment of a reassembled PDU]"
"104","1.275379","52.3.144.142","192.168.1.31","TLSv1.2","827","Application Data"
"105","1.275385","192.168.1.31","52.3.144.142","TCP","54","56483  >  443 [ACK] Seq=2743 Ack=65111 Win=1026 Len=0"
"106","1.276198","52.3.144.142","192.168.1.31","TCP","1514","443  >  56483 [ACK] Seq=65111 Ack=2743 Win=68 Len=1460 [TCP segment of a reassembled PDU]"
"107","1.276657","52.3.144.142","192.168.1.31","TCP","1514","443  >  56483 [ACK] Seq=66571 Ack=2743 Win=68 Len=1460 [TCP segment of a reassembled PDU]"
"108","1.276657","52.3.144.142","192.168.1.31","TLSv1.2","889","Application Data"
"109","1.276664","192.168.1.31","52.3.144.142","TCP","54","56483  >  443 [ACK] Seq=2743 Ack=68866 Win=1026 Len=0"
"110","1.276685","52.3.144.142","192.168.1.31","TCP","1514","443  >  56483 [ACK] Seq=68866 Ack=2743 Win=68 Len=1460 [TCP segment of a reassembled PDU]"
"111","1.276690","192.168.1.31","52.3.144.142","TCP","54","56483  >  443 [ACK] Seq=2743 Ack=70326 Win=1026 Len=0"
"112","1.276905","52.3.144.142","192.168.1.31","TLSv1.2","98","Application Data"
"113","1.321947","192.168.1.31","52.3.144.142","TCP","54","56483  >  443 [ACK] Seq=2743 Ack=70370 Win=1026 Len=0"
"114","2.865456","192.168.1.31","52.3.144.142","TLSv1.2","122","Application Data"
"115","2.894408","52.3.144.142","192.168.1.31","TLSv1.2","287","Application Data"
"116","2.895071","52.3.144.142","192.168.1.31","TCP","1514","443  >  56483 [ACK] Seq=70603 Ack=2811 Win=68 Len=1460 [TCP segment of a reassembled PDU]"
"117","2.895085","192.168.1.31","52.3.144.142","TCP","54","56483  >  443 [ACK] Seq=2811 Ack=72063 Win=1026 Len=0"
"118","2.895582","52.3.144.142","192.168.1.31","TCP","1514","443  >  56483 [ACK] Seq=72063 Ack=2811 Win=68 Len=1460 [TCP segment of a reassembled PDU]"
"119","2.895582","52.3.144.142","192.168.1.31","TLSv1.2","1514","Application Data"
"120","2.895582","52.3.144.142","192.168.1.31","TCP","1514","443  >  56483 [ACK] Seq=74983 Ack=2811 Win=68 Len=1460 [TCP segment of a reassembled PDU]"
"121","2.895582","52.3.144.142","192.168.1.31","TLSv1.2","783","Application Data"
"122","2.895595","192.168.1.31","52.3.144.142","TCP","54","56483  >  443 [ACK] Seq=2811 Ack=77172 Win=1026 Len=0"
"123","2.896881","52.3.144.142","192.168.1.31","TCP","1514","443  >  56483 [ACK] Seq=77172 Ack=2811 Win=68 Len=1460 [TCP segment of a reassembled PDU]"
"124","2.896881","52.3.144.142","192.168.1.31","TLSv1.2","178","Application Data"
"125","2.896891","192.168.1.31","52.3.144.142","TCP","54","56483  >  443 [ACK] Seq=2811 Ack=78756 Win=1026 Len=0"
"126","2.896990","52.3.144.142","192.168.1.31","TCP","1514","443  >  56483 [ACK] Seq=78756 Ack=2811 Win=68 Len=1460 [TCP segment of a reassembled PDU]"
"127","2.897434","52.3.144.142","192.168.1.31","TCP","1514","443  >  56483 [ACK] Seq=80216 Ack=2811 Win=68 Len=1460 [TCP segment of a reassembled PDU]"
"128","2.897434","52.3.144.142","192.168.1.31","TCP","1514","443  >  56483 [ACK] Seq=81676 Ack=2811 Win=68 Len=1460 [TCP segment of a reassembled PDU]"
"129","2.897434","52.3.144.142","192.168.1.31","TLSv1.2","819","Application Data"
"130","2.897434","52.3.144.142","192.168.1.31","TLSv1.2","170","Application Data"
"131","2.897447","192.168.1.31","52.3.144.142","TCP","54","56483  >  443 [ACK] Seq=2811 Ack=84017 Win=1026 Len=0"
"132","2.898816","52.3.144.142","192.168.1.31","TLSv1.2","292","Application Data"
"133","2.898824","192.168.1.31","52.3.144.142","TCP","54","56483  >  443 [ACK] Seq=2811 Ack=84255 Win=1025 Len=0"
"134","3.045474","192.168.1.31","52.3.144.142","TLSv1.2","374","Application Data"
"135","3.045496","192.168.1.31","52.3.144.142","TLSv1.2","742","Application Data"
"136","3.062113","52.3.144.142","192.168.1.31","TCP","60","443  >  56483 [ACK] Seq=84255 Ack=3819 Win=68 Len=0"
"137","3.062380","192.168.1.31","52.3.144.142","TLSv1.2","349","Application Data"
"138","3.062405","192.168.1.31","52.3.144.142","TLSv1.2","209","Application Data"
"139","3.078494","52.3.144.142","192.168.1.31","TCP","60","443  >  56483 [ACK] Seq=84255 Ack=4269 Win=68 Len=0"
"140","3.119309","52.3.144.142","192.168.1.31","TLSv1.2","311","Application Data"
"141","3.144188","192.168.1.31","52.3.144.142","TLSv1.2","350","Application Data"
"142","3.144215","192.168.1.31","52.3.144.142","TLSv1.2","1354","Application Data"
"143","3.163873","52.3.144.142","192.168.1.31","TLSv1.2","431","Application Data"
"144","3.204601","52.3.144.142","192.168.1.31","TCP","60","443  >  56483 [ACK] Seq=84889 Ack=5865 Win=68 Len=0"
"145","3.219153","192.168.1.31","52.3.144.142","TCP","54","56483  >  443 [ACK] Seq=5865 Ack=84889 Win=1023 Len=0"
"146","3.253597","192.168.1.31","52.3.144.142","TLSv1.2","350","Application Data"
"147","3.253616","192.168.1.31","52.3.144.142","TLSv1.2","1194","Application Data"
"148","3.274576","52.3.144.142","192.168.1.31","TCP","60","443  >  56483 [ACK] Seq=84889 Ack=6161 Win=68 Len=0"
"149","3.274576","52.3.144.142","192.168.1.31","TCP","60","443  >  56483 [ACK] Seq=84889 Ack=7301 Win=68 Len=0"
"150","3.324046","192.168.1.31","52.3.144.142","TLSv1.2","245","Application Data"
"151","3.324073","192.168.1.31","52.3.144.142","TLSv1.2","9757","Application Data"
"152","3.336542","52.3.144.142","192.168.1.31","TCP","60","443  >  56483 [ACK] Seq=84889 Ack=7492 Win=68 Len=0"
"153","3.342665","52.3.144.142","192.168.1.31","TCP","60","443  >  56483 [ACK] Seq=84889 Ack=8952 Win=68 Len=0"
"154","3.342665","52.3.144.142","192.168.1.31","TCP","60","443  >  56483 [ACK] Seq=84889 Ack=13332 Win=68 Len=0"
"155","3.342665","52.3.144.142","192.168.1.31","TCP","60","443  >  56483 [ACK] Seq=84889 Ack=17195 Win=103 Len=0"
"156","3.360224","52.3.144.142","192.168.1.31","TLSv1.2","1189","Application Data"
"157","3.364072","52.3.144.142","192.168.1.31","TCP","1514","443  >  56483 [ACK] Seq=86024 Ack=17195 Win=103 Len=1460 [TCP segment of a reassembled PDU]"
"158","3.364072","52.3.144.142","192.168.1.31","TCP","1514","443  >  56483 [ACK] Seq=87484 Ack=17195 Win=103 Len=1460 [TCP segment of a reassembled PDU]"
"159","3.364101","192.168.1.31","52.3.144.142","TCP","54","56483  >  443 [ACK] Seq=17195 Ack=88944 Win=1026 Len=0"
"160","3.365286","52.3.144.142","192.168.1.31","TLSv1.2","866","Application Data"
"161","3.365311","192.168.1.31","52.3.144.142","TCP","54","56483  >  443 [ACK] Seq=17195 Ack=89756 Win=1023 Len=0"
"162","4.164741","192.168.1.31","52.3.144.142","TLSv1.2","263","Application Data"
"163","4.164772","192.168.1.31","52.3.144.142","TLSv1.2","16460","Application Data"
"164","4.164791","192.168.1.31","52.3.144.142","TLSv1.2","8118","Application Data"
"165","4.180729","52.3.144.142","192.168.1.31","TCP","60","443  >  56483 [ACK] Seq=89756 Ack=18864 Win=144 Len=0"
"166","4.185656","52.3.144.142","192.168.1.31","TCP","60","443  >  56483 [ACK] Seq=89756 Ack=29084 Win=214 Len=0"
"167","4.185679","52.3.144.142","192.168.1.31","TCP","60","443  >  56483 [ACK] Seq=89756 Ack=33810 Win=249 Len=0"
"168","4.185679","52.3.144.142","192.168.1.31","TCP","60","443  >  56483 [ACK] Seq=89756 Ack=38190 Win=290 Len=0"
"169","4.186564","52.3.144.142","192.168.1.31","TCP","60","443  >  56483 [ACK] Seq=89756 Ack=41874 Win=325 Len=0"
"170","4.279167","52.3.144.142","192.168.1.31","TCP","1514","443  >  56483 [ACK] Seq=89756 Ack=41874 Win=325 Len=1460 [TCP segment of a reassembled PDU]"
"171","4.279199","52.3.144.142","192.168.1.31","TCP","1514","443  >  56483 [ACK] Seq=91216 Ack=41874 Win=325 Len=1460 [TCP segment of a reassembled PDU]"
"172","4.279209","192.168.1.31","52.3.144.142","TCP","54","56483  >  443 [ACK] Seq=41874 Ack=92676 Win=1026 Len=0"
"173","4.279640","52.3.144.142","192.168.1.31","TCP","1514","443  >  56483 [ACK] Seq=92676 Ack=41874 Win=325 Len=1460 [TCP segment of a reassembled PDU]"
"174","4.279671","52.3.144.142","192.168.1.31","TCP","1514","443  >  56483 [ACK] Seq=94136 Ack=41874 Win=325 Len=1460 [TCP segment of a reassembled PDU]"
"175","4.279671","52.3.144.142","192.168.1.31","TCP","1514","443  >  56483 [ACK] Seq=95596 Ack=41874 Win=325 Len=1460 [TCP segment of a reassembled PDU]"
"176","4.279671","52.3.144.142","192.168.1.31","TCP","1514","443  >  56483 [PSH, ACK] Seq=97056 Ack=41874 Win=325 Len=1460 [TCP segment of a reassembled PDU]"
"177","4.279682","192.168.1.31","52.3.144.142","TCP","54","56483  >  443 [ACK] Seq=41874 Ack=98516 Win=1026 Len=0"
"178","4.279695","52.3.144.142","192.168.1.31","TCP","1514","443  >  56483 [ACK] Seq=98516 Ack=41874 Win=325 Len=1460 [TCP segment of a reassembled PDU]"
"179","4.280333","52.3.144.142","192.168.1.31","TCP","1514","443  >  56483 [ACK] Seq=99976 Ack=41874 Win=325 Len=1460 [TCP segment of a reassembled PDU]"
"180","4.280333","52.3.144.142","192.168.1.31","TCP","1514","443  >  56483 [ACK] Seq=101436 Ack=41874 Win=325 Len=1460 [TCP segment of a reassembled PDU]"
"181","4.280333","52.3.144.142","192.168.1.31","TCP","1514","443  >  56483 [ACK] Seq=102896 Ack=41874 Win=325 Len=1460 [TCP segment of a reassembled PDU]"
"182","4.280333","52.3.144.142","192.168.1.31","TCP","1514","443  >  56483 [ACK] Seq=104356 Ack=41874 Win=325 Len=1460 [TCP segment of a reassembled PDU]"
"183","4.280333","52.3.144.142","192.168.1.31","TLSv1.2","1514","Application Data"
"184","4.280345","192.168.1.31","52.3.144.142","TCP","54","56483  >  443 [ACK] Seq=41874 Ack=107276 Win=1026 Len=0"
"185","4.280528","52.3.144.142","192.168.1.31","TCP","1514","443  >  56483 [ACK] Seq=107276 Ack=41874 Win=325 Len=1460 [TCP segment of a reassembled PDU]"
"186","4.280540","52.3.144.142","192.168.1.31","TCP","1514","443  >  56483 [ACK] Seq=108736 Ack=41874 Win=325 Len=1460 [TCP segment of a reassembled PDU]"
"187","4.280544","192.168.1.31","52.3.144.142","TCP","54","56483  >  443 [ACK] Seq=41874 Ack=110196 Win=1026 Len=0"
"188","4.281212","52.3.144.142","192.168.1.31","TCP","1514","443  >  56483 [ACK] Seq=110196 Ack=41874 Win=325 Len=1460 [TCP segment of a reassembled PDU]"
"189","4.281212","52.3.144.142","192.168.1.31","TCP","1514","443  >  56483 [ACK] Seq=111656 Ack=41874 Win=325 Len=1460 [TCP segment of a reassembled PDU]"
"190","4.281212","52.3.144.142","192.168.1.31","TCP","1514","443  >  56483 [ACK] Seq=113116 Ack=41874 Win=325 Len=1460 [TCP segment of a reassembled PDU]"
"191","4.281212","52.3.144.142","192.168.1.31","TCP","1514","443  >  56483 [PSH, ACK] Seq=114576 Ack=41874 Win=325 Len=1460 [TCP segment of a reassembled PDU]"
"192","4.281231","192.168.1.31","52.3.144.142","TCP","54","56483  >  443 [ACK] Seq=41874 Ack=116036 Win=1026 Len=0"
"193","4.281518","52.3.144.142","192.168.1.31","TCP","1514","443  >  56483 [ACK] Seq=116036 Ack=41874 Win=325 Len=1460 [TCP segment of a reassembled PDU]"
"194","4.281518","52.3.144.142","192.168.1.31","TCP","1514","443  >  56483 [ACK] Seq=117496 Ack=41874 Win=325 Len=1460 [TCP segment of a reassembled PDU]"
"195","4.281528","192.168.1.31","52.3.144.142","TCP","54","56483  >  443 [ACK] Seq=41874 Ack=118956 Win=1026 Len=0"
"196","4.282098","52.3.144.142","192.168.1.31","TCP","1514","443  >  56483 [ACK] Seq=118956 Ack=41874 Win=325 Len=1460 [TCP segment of a reassembled PDU]"
"197","4.282098","52.3.144.142","192.168.1.31","TCP","1514","443  >  56483 [ACK] Seq=120416 Ack=41874 Win=325 Len=1460 [TCP segment of a reassembled PDU]"
"198","4.282098","52.3.144.142","192.168.1.31","TLSv1.2","1514","Application Data"
"199","4.282098","52.3.144.142","192.168.1.31","TCP","1514","443  >  56483 [PSH, ACK] Seq=123336 Ack=41874 Win=325 Len=1460 [TCP segment of a reassembled PDU]"
"200","4.282113","192.168.1.31","52.3.144.142","TCP","54","56483  >  443 [ACK] Seq=41874 Ack=124796 Win=1026 Len=0"
"201","4.282431","52.3.144.142","192.168.1.31","TCP","1514","443  >  56483 [ACK] Seq=124796 Ack=41874 Win=325 Len=1460 [TCP segment of a reassembled PDU]"
"202","4.282868","52.3.144.142","192.168.1.31","TCP","1514","443  >  56483 [ACK] Seq=126256 Ack=41874 Win=325 Len=1460 [TCP segment of a reassembled PDU]"
"203","4.282879","192.168.1.31","52.3.144.142","TCP","54","56483  >  443 [ACK] Seq=41874 Ack=127716 Win=1026 Len=0"
"204","4.282905","52.3.144.142","192.168.1.31","TCP","1514","443  >  56483 [ACK] Seq=127716 Ack=41874 Win=325 Len=1460 [TCP segment of a reassembled PDU]"
"205","4.282905","52.3.144.142","192.168.1.31","TCP","1514","443  >  56483 [ACK] Seq=129176 Ack=41874 Win=325 Len=1460 [TCP segment of a reassembled PDU]"
"206","4.282905","52.3.144.142","192.168.1.31","TCP","1514","443  >  56483 [ACK] Seq=130636 Ack=41874 Win=325 Len=1460 [TCP segment of a reassembled PDU]"
"207","4.282913","192.168.1.31","52.3.144.142","TCP","54","56483  >  443 [ACK] Seq=41874 Ack=132096 Win=1026 Len=0"
"208","4.282927","52.3.144.142","192.168.1.31","TCP","1514","443  >  56483 [PSH, ACK] Seq=132096 Ack=41874 Win=325 Len=1460 [TCP segment of a reassembled PDU]"
"209","4.282932","192.168.1.31","52.3.144.142","TCP","54","56483  >  443 [ACK] Seq=41874 Ack=133556 Win=1026 Len=0"
"210","4.283263","52.3.144.142","192.168.1.31","TCP","1514","443  >  56483 [ACK] Seq=133556 Ack=41874 Win=325 Len=1460 [TCP segment of a reassembled PDU]"
"211","4.283275","52.3.144.142","192.168.1.31","TCP","1514","443  >  56483 [ACK] Seq=135016 Ack=41874 Win=325 Len=1460 [TCP segment of a reassembled PDU]"
"212","4.283280","192.168.1.31","52.3.144.142","TCP","54","56483  >  443 [ACK] Seq=41874 Ack=136476 Win=1026 Len=0"
"213","4.283294","52.3.144.142","192.168.1.31","TCP","1514","443  >  56483 [ACK] Seq=136476 Ack=41874 Win=325 Len=1460 [TCP segment of a reassembled PDU]"
"214","4.283294","52.3.144.142","192.168.1.31","TLSv1.2","252","Application Data"
"215","4.283301","192.168.1.31","52.3.144.142","TCP","54","56483  >  443 [ACK] Seq=41874 Ack=138134 Win=1026 Len=0"
"216","5.130825","52.3.144.142","192.168.1.31","TLSv1.2","236","Application Data"
"217","5.132024","52.3.144.142","192.168.1.31","TCP","1514","443  >  56483 [ACK] Seq=138316 Ack=41874 Win=325 Len=1460 [TCP segment of a reassembled PDU]"
"218","5.132024","52.3.144.142","192.168.1.31","TCP","1514","443  >  56483 [ACK] Seq=139776 Ack=41874 Win=325 Len=1460 [TCP segment of a reassembled PDU]"
"219","5.132061","192.168.1.31","52.3.144.142","TCP","54","56483  >  443 [ACK] Seq=41874 Ack=141236 Win=1026 Len=0"
"220","5.132410","52.3.144.142","192.168.1.31","TLSv1.2","1342","Application Data"
"221","5.132419","192.168.1.31","52.3.144.142","TCP","54","56483  >  443 [ACK] Seq=41874 Ack=142524 Win=1021 Len=0"
"222","5.132430","52.3.144.142","192.168.1.31","TCP","1514","443  >  56483 [ACK] Seq=142524 Ack=41874 Win=325 Len=1460 [TCP segment of a reassembled PDU]"
"223","5.132441","52.3.144.142","192.168.1.31","TCP","1514","443  >  56483 [ACK] Seq=143984 Ack=41874 Win=325 Len=1460 [TCP segment of a reassembled PDU]"
"224","5.132441","52.3.144.142","192.168.1.31","TLSv1.2","989","Application Data"
"225","5.132448","192.168.1.31","52.3.144.142","TCP","54","56483  >  443 [ACK] Seq=41874 Ack=146379 Win=1026 Len=0"
"226","5.133009","52.3.144.142","192.168.1.31","TCP","1514","443  >  56483 [ACK] Seq=146379 Ack=41874 Win=325 Len=1460 [TCP segment of a reassembled PDU]"
"227","5.133009","52.3.144.142","192.168.1.31","TCP","1514","443  >  56483 [ACK] Seq=147839 Ack=41874 Win=325 Len=1460 [TCP segment of a reassembled PDU]"
"228","5.133019","192.168.1.31","52.3.144.142","TCP","54","56483  >  443 [ACK] Seq=41874 Ack=149299 Win=1026 Len=0"
"229","5.133264","52.3.144.142","192.168.1.31","TLSv1.2","1128","Application Data"
"230","5.133271","192.168.1.31","52.3.144.142","TCP","54","56483  >  443 [ACK] Seq=41874 Ack=150373 Win=1022 Len=0"
"231","5.133310","52.3.144.142","192.168.1.31","TCP","1514","443  >  56483 [ACK] Seq=150373 Ack=41874 Win=325 Len=1460 [TCP segment of a reassembled PDU]"
"232","5.133746","52.3.144.142","192.168.1.31","TCP","1514","443  >  56483 [ACK] Seq=151833 Ack=41874 Win=325 Len=1460 [TCP segment of a reassembled PDU]"
"233","5.133746","52.3.144.142","192.168.1.31","TLSv1.2","328","Application Data"
"234","5.133746","52.3.144.142","192.168.1.31","TLSv1.2","101","Application Data"
"235","5.133752","192.168.1.31","52.3.144.142","TCP","54","56483  >  443 [ACK] Seq=41874 Ack=153614 Win=1026 Len=0"
"236","5.134593","52.3.144.142","192.168.1.31","TCP","1514","443  >  56483 [ACK] Seq=153614 Ack=41874 Win=325 Len=1460 [TCP segment of a reassembled PDU]"
"237","5.134601","52.3.144.142","192.168.1.31","TLSv1.2","1203","Application Data"
"238","5.134606","192.168.1.31","52.3.144.142","TCP","54","56483  >  443 [ACK] Seq=41874 Ack=156223 Win=1026 Len=0"
"239","5.135298","52.3.144.142","192.168.1.31","TCP","1514","443  >  56483 [ACK] Seq=156223 Ack=41874 Win=325 Len=1460 [TCP segment of a reassembled PDU]"
"240","5.135748","52.3.144.142","192.168.1.31","TLSv1.2","955","Application Data"
"241","5.135753","192.168.1.31","52.3.144.142","TCP","54","56483  >  443 [ACK] Seq=41874 Ack=158584 Win=1026 Len=0"
"242","5.135764","52.3.144.142","192.168.1.31","TCP","1514","443  >  56483 [ACK] Seq=158584 Ack=41874 Win=325 Len=1460 [TCP segment of a reassembled PDU]"
"243","5.135773","52.3.144.142","192.168.1.31","TLSv1.2","1156","Application Data"
"244","5.135777","192.168.1.31","52.3.144.142","TCP","54","56483  >  443 [ACK] Seq=41874 Ack=161146 Win=1026 Len=0"
"245","5.137330","52.3.144.142","192.168.1.31","TCP","1514","443  >  56483 [ACK] Seq=161146 Ack=41874 Win=325 Len=1460 [TCP segment of a reassembled PDU]"
"246","5.137346","52.3.144.142","192.168.1.31","TCP","1514","443  >  56483 [ACK] Seq=162606 Ack=41874 Win=325 Len=1460 [TCP segment of a reassembled PDU]"
"247","5.137346","52.3.144.142","192.168.1.31","TLSv1.2","63","Application Data"
"248","5.137351","192.168.1.31","52.3.144.142","TCP","54","56483  >  443 [ACK] Seq=41874 Ack=164075 Win=1026 Len=0"
"249","5.137624","52.3.144.142","192.168.1.31","TCP","1514","443  >  56483 [ACK] Seq=164075 Ack=41874 Win=325 Len=1460 [TCP segment of a reassembled PDU]"
"250","5.137628","192.168.1.31","52.3.144.142","TCP","54","56483  >  443 [ACK] Seq=41874 Ack=165535 Win=1026 Len=0"
"251","5.137637","52.3.144.142","192.168.1.31","TLSv1.2","1032","Application Data"
"252","5.137686","52.3.144.142","192.168.1.31","TLSv1.2","95","Application Data"
"253","5.137689","192.168.1.31","52.3.144.142","TCP","54","56483  >  443 [ACK] Seq=41874 Ack=166554 Win=1022 Len=0"
"254","5.139218","52.3.144.142","192.168.1.31","TCP","1514","443  >  56483 [ACK] Seq=166554 Ack=41874 Win=325 Len=1460 [TCP segment of a reassembled PDU]"
"255","5.139235","52.3.144.142","192.168.1.31","TLSv1.2","1496","Application Data"
"256","5.139243","192.168.1.31","52.3.144.142","TCP","54","56483  >  443 [ACK] Seq=41874 Ack=169456 Win=1026 Len=0"
"257","5.140103","52.3.144.142","192.168.1.31","TCP","1514","443  >  56483 [ACK] Seq=169456 Ack=41874 Win=325 Len=1460 [TCP segment of a reassembled PDU]"
"258","5.140139","52.3.144.142","192.168.1.31","TLSv1.2","1111","Application Data"
"259","5.140139","52.3.144.142","192.168.1.31","TCP","1514","443  >  56483 [ACK] Seq=171973 Ack=41874 Win=325 Len=1460 [TCP segment of a reassembled PDU]"
"260","5.140139","52.3.144.142","192.168.1.31","TCP","1514","443  >  56483 [ACK] Seq=173433 Ack=41874 Win=325 Len=1460 [TCP segment of a reassembled PDU]"
"261","5.140146","192.168.1.31","52.3.144.142","TCP","54","56483  >  443 [ACK] Seq=41874 Ack=174893 Win=1026 Len=0"
"262","5.140513","52.3.144.142","192.168.1.31","TLSv1.2","354","Application Data"
"263","5.142315","52.3.144.142","192.168.1.31","TCP","1514","443  >  56483 [ACK] Seq=175193 Ack=41874 Win=325 Len=1460 [TCP segment of a reassembled PDU]"
"264","5.142325","192.168.1.31","52.3.144.142","TCP","54","56483  >  443 [ACK] Seq=41874 Ack=176653 Win=1026 Len=0"
"265","5.142777","52.3.144.142","192.168.1.31","TLSv1.2","1192","Application Data"
"266","5.142791","52.3.144.142","192.168.1.31","TCP","1514","443  >  56483 [ACK] Seq=177791 Ack=41874 Win=325 Len=1460 [TCP segment of a reassembled PDU]"
"267","5.142794","192.168.1.31","52.3.144.142","TCP","54","56483  >  443 [ACK] Seq=41874 Ack=179251 Win=1026 Len=0"
"268","5.143193","52.3.144.142","192.168.1.31","TLSv1.2","1371","Application Data"
"269","5.143193","52.3.144.142","192.168.1.31","TLSv1.2","103","Application Data"
"270","5.143198","192.168.1.31","52.3.144.142","TCP","54","56483  >  443 [ACK] Seq=41874 Ack=180617 Win=1021 Len=0"
"271","5.143905","52.3.144.142","192.168.1.31","TCP","1514","443  >  56483 [ACK] Seq=180617 Ack=41874 Win=325 Len=1460 [TCP segment of a reassembled PDU]"
"272","5.143923","52.3.144.142","192.168.1.31","TCP","1514","443  >  56483 [ACK] Seq=182077 Ack=41874 Win=325 Len=1460 [TCP segment of a reassembled PDU]"
"273","5.143923","52.3.144.142","192.168.1.31","TLSv1.2","491","Application Data"
"274","5.143928","192.168.1.31","52.3.144.142","TCP","54","56483  >  443 [ACK] Seq=41874 Ack=183974 Win=1026 Len=0"
"275","5.144303","52.3.144.142","192.168.1.31","TCP","1514","443  >  56483 [ACK] Seq=183974 Ack=41874 Win=325 Len=1460 [TCP segment of a reassembled PDU]"
"276","5.144308","192.168.1.31","52.3.144.142","TCP","54","56483  >  443 [ACK] Seq=41874 Ack=185434 Win=1026 Len=0"
"277","5.144751","52.3.144.142","192.168.1.31","TLSv1.2","1267","Application Data"
"278","5.144764","52.3.144.142","192.168.1.31","TCP","1514","443  >  56483 [ACK] Seq=186647 Ack=41874 Win=325 Len=1460 [TCP segment of a reassembled PDU]"
"279","5.144766","192.168.1.31","52.3.144.142","TCP","54","56483  >  443 [ACK] Seq=41874 Ack=188107 Win=1026 Len=0"
"280","5.144776","52.3.144.142","192.168.1.31","TLSv1.2","1039","Application Data"
"281","5.145074","52.3.144.142","192.168.1.31","TCP","1514","443  >  56483 [ACK] Seq=189092 Ack=41874 Win=325 Len=1460 [TCP segment of a reassembled PDU]"
"282","5.145077","192.168.1.31","52.3.144.142","TCP","54","56483  >  443 [ACK] Seq=41874 Ack=190552 Win=1026 Len=0"
"283","5.145542","52.3.144.142","192.168.1.31","TLSv1.2","1235","Application Data"
"284","5.145567","52.3.144.142","192.168.1.31","TCP","1514","443  >  56483 [ACK] Seq=191733 Ack=41874 Win=325 Len=1460 [TCP segment of a reassembled PDU]"
"285","5.145571","192.168.1.31","52.3.144.142","TCP","54","56483  >  443 [ACK] Seq=41874 Ack=193193 Win=1026 Len=0"
"286","5.145811","52.3.144.142","192.168.1.31","TLSv1.2","1395","Application Data"
"287","5.145811","52.3.144.142","192.168.1.31","TLSv1.2","119","Application Data"
"288","5.145815","192.168.1.31","52.3.144.142","TCP","54","56483  >  443 [ACK] Seq=41874 Ack=194599 Win=1021 Len=0"
"289","5.147031","52.3.144.142","192.168.1.31","TCP","1514","443  >  56483 [ACK] Seq=194599 Ack=41874 Win=325 Len=1460 [TCP segment of a reassembled PDU]"
"290","5.147405","52.3.144.142","192.168.1.31","TLSv1.2","1432","Application Data"
"291","5.147412","192.168.1.31","52.3.144.142","TCP","54","56483  >  443 [ACK] Seq=41874 Ack=197437 Win=1026 Len=0"
"292","5.148030","52.3.144.142","192.168.1.31","TCP","1514","443  >  56483 [ACK] Seq=197437 Ack=41874 Win=325 Len=1460 [TCP segment of a reassembled PDU]"
"293","5.148044","52.3.144.142","192.168.1.31","TCP","1514","443  >  56483 [ACK] Seq=198897 Ack=41874 Win=325 Len=1460 [TCP segment of a reassembled PDU]"
"294","5.148047","192.168.1.31","52.3.144.142","TCP","54","56483  >  443 [ACK] Seq=41874 Ack=200357 Win=1026 Len=0"
"295","5.148057","52.3.144.142","192.168.1.31","TCP","1514","443  >  56483 [ACK] Seq=200357 Ack=41874 Win=325 Len=1460 [TCP segment of a reassembled PDU]"
"296","5.148057","52.3.144.142","192.168.1.31","TLSv1.2","72","Application Data"
"297","5.148063","192.168.1.31","52.3.144.142","TCP","54","56483  >  443 [ACK] Seq=41874 Ack=201835 Win=1026 Len=0"
"298","5.148417","52.3.144.142","192.168.1.31","TCP","1514","443  >  56483 [ACK] Seq=201835 Ack=41874 Win=325 Len=1460 [TCP segment of a reassembled PDU]"
"299","5.148879","52.3.144.142","192.168.1.31","TLSv1.2","1244","Application Data"
"300","5.148886","192.168.1.31","52.3.144.142","TCP","54","56483  >  443 [ACK] Seq=41874 Ack=204485 Win=1026 Len=0"
"301","5.150033","52.3.144.142","192.168.1.31","TCP","1514","443  >  56483 [ACK] Seq=204485 Ack=41874 Win=325 Len=1460 [TCP segment of a reassembled PDU]"
"302","5.150486","52.3.144.142","192.168.1.31","TLSv1.2","1350","Application Data"
"303","5.150491","192.168.1.31","52.3.144.142","TCP","54","56483  >  443 [ACK] Seq=41874 Ack=207241 Win=1026 Len=0"
"304","5.150501","52.3.144.142","192.168.1.31","TCP","1514","443  >  56483 [ACK] Seq=207241 Ack=41874 Win=325 Len=1460 [TCP segment of a reassembled PDU]"
"305","5.150512","52.3.144.142","192.168.1.31","TLSv1.2","1495","Application Data"
"306","5.150514","192.168.1.31","52.3.144.142","TCP","54","56483  >  443 [ACK] Seq=41874 Ack=210142 Win=1026 Len=0"
"307","5.150523","52.3.144.142","192.168.1.31","TLSv1.2","97","Application Data"
"308","5.152161","52.3.144.142","192.168.1.31","TCP","1514","443  >  56483 [ACK] Seq=210185 Ack=41874 Win=325 Len=1460 [TCP segment of a reassembled PDU]"
"309","5.152168","192.168.1.31","52.3.144.142","TCP","54","56483  >  443 [ACK] Seq=41874 Ack=211645 Win=1026 Len=0"
"310","5.152569","52.3.144.142","192.168.1.31","TLSv1.2","1346","Application Data"
"311","5.153938","52.3.144.142","192.168.1.31","TCP","1514","443  >  56483 [ACK] Seq=212937 Ack=41874 Win=325 Len=1460 [TCP segment of a reassembled PDU]"
"312","5.153948","192.168.1.31","52.3.144.142","TCP","54","56483  >  443 [ACK] Seq=41874 Ack=214397 Win=1026 Len=0"
"313","5.153961","52.3.144.142","192.168.1.31","TLSv1.2","1385","Application Data"
"314","5.154216","52.3.144.142","192.168.1.31","TCP","1514","443  >  56483 [ACK] Seq=215728 Ack=41874 Win=325 Len=1460 [TCP segment of a reassembled PDU]"
"315","5.154222","192.168.1.31","52.3.144.142","TCP","54","56483  >  443 [ACK] Seq=41874 Ack=217188 Win=1026 Len=0"
"316","5.154232","52.3.144.142","192.168.1.31","TLSv1.2","1236","Application Data"
"317","5.156073","52.3.144.142","192.168.1.31","TCP","1514","443  >  56483 [ACK] Seq=218370 Ack=41874 Win=325 Len=1460 [TCP segment of a reassembled PDU]"
"318","5.156077","192.168.1.31","52.3.144.142","TCP","54","56483  >  443 [ACK] Seq=41874 Ack=219830 Win=1026 Len=0"
"319","5.156087","52.3.144.142","192.168.1.31","TCP","1514","443  >  56483 [ACK] Seq=219830 Ack=41874 Win=325 Len=1460 [TCP segment of a reassembled PDU]"
"320","5.156087","52.3.144.142","192.168.1.31","TLSv1.2","309","Application Data"
"321","5.156091","192.168.1.31","52.3.144.142","TCP","54","56483  >  443 [ACK] Seq=41874 Ack=221545 Win=1026 Len=0"
"322","5.156689","52.3.144.142","192.168.1.31","TCP","1514","443  >  56483 [ACK] Seq=221545 Ack=41874 Win=325 Len=1460 [TCP segment of a reassembled PDU]"
"323","5.156705","52.3.144.142","192.168.1.31","TCP","1514","443  >  56483 [ACK] Seq=223005 Ack=41874 Win=325 Len=1460 [TCP segment of a reassembled PDU]"
"324","5.156705","52.3.144.142","192.168.1.31","TLSv1.2","219","Application Data"
"325","5.156705","52.3.144.142","192.168.1.31","TLSv1.2","94","Application Data"
"326","5.156710","192.168.1.31","52.3.144.142","TCP","54","56483  >  443 [ACK] Seq=41874 Ack=224670 Win=1026 Len=0"
"327","5.158538","52.3.144.142","192.168.1.31","TCP","1514","443  >  56483 [ACK] Seq=224670 Ack=41874 Win=325 Len=1460 [TCP segment of a reassembled PDU]"
"328","5.158591","52.3.144.142","192.168.1.31","TCP","1514","443  >  56483 [ACK] Seq=226130 Ack=41874 Win=325 Len=1460 [TCP segment of a reassembled PDU]"
"329","5.158591","52.3.144.142","192.168.1.31","TLSv1.2","60","Application Data"
"330","5.158596","192.168.1.31","52.3.144.142","TCP","54","56483  >  443 [ACK] Seq=41874 Ack=227592 Win=1026 Len=0"
"331","5.159143","52.3.144.142","192.168.1.31","TCP","1514","443  >  56483 [ACK] Seq=227592 Ack=41874 Win=325 Len=1460 [TCP segment of a reassembled PDU]"
"332","5.159143","52.3.144.142","192.168.1.31","TLSv1.2","1472","Application Data"
"333","5.159154","192.168.1.31","52.3.144.142","TCP","54","56483  >  443 [ACK] Seq=41874 Ack=230470 Win=1026 Len=0"
