"No.","Time","Source","Destination","Protocol","Length","Info"
"1","0.000000","100.86.87.79","34.120.52.64","TCP","66","59334  >  80 [SYN] Seq=0 Win=64240 Len=0 MSS=1460 WS=256 SACK_PERM"
"2","0.000437","100.86.87.79","34.120.52.64","TCP","66","59335  >  80 [SYN] Seq=0 Win=64240 Len=0 MSS=1460 WS=256 SACK_PERM"
"3","0.051617","34.120.52.64","100.86.87.79","TCP","66","80  >  59334 [SYN, ACK] Seq=0 Ack=1 Win=65535 Len=0 MSS=1412 SACK_PERM WS=256"
"4","0.051847","100.86.87.79","34.120.52.64","TCP","54","59334  >  80 [ACK] Seq=1 Ack=1 Win=66304 Len=0"
"5","0.051969","34.120.52.64","100.86.87.79","TCP","66","80  >  59335 [SYN, ACK] Seq=0 Ack=1 Win=65535 Len=0 MSS=1412 SACK_PERM WS=256"
"6","0.052383","100.86.87.79","34.120.52.64","TCP","54","59335  >  80 [ACK] Seq=1 Ack=1 Win=66304 Len=0"
"7","0.110610","100.86.87.79","34.120.52.64","TCP","66","59336  >  443 [SYN] Seq=0 Win=64240 Len=0 MSS=1460 WS=256 SACK_PERM"
"8","0.121499","34.120.52.64","100.86.87.79","TCP","66","443  >  59336 [SYN, ACK] Seq=0 Ack=1 Win=65535 Len=0 MSS=1412 SACK_PERM WS=256"
"9","0.121774","100.86.87.79","34.120.52.64","TCP","54","59336  >  443 [ACK] Seq=1 Ack=1 Win=66304 Len=0"
"10","0.122382","100.86.87.79","34.120.52.64","TLSv1.3","571","Client Hello (SNI=www.overleaf.com)"
"11","0.132674","34.120.52.64","100.86.87.79","TCP","56","443  >  59336 [ACK] Seq=1 Ack=518 Win=66816 Len=0"
"12","0.136199","34.120.52.64","100.86.87.79","TLSv1.3","1466","Server Hello, Change Cipher Spec"
"13","0.136199","34.120.52.64","100.86.87.79","TCP","690","443  >  59336 [PSH, ACK] Seq=1413 Ack=518 Win=66816 Len=636 [TCP segment of a reassembled PDU]"
"14","0.136199","34.120.52.64","100.86.87.79","TCP","1466","443  >  59336 [ACK] Seq=2049 Ack=518 Win=66816 Len=1412 [TCP segment of a reassembled PDU]"
"15","0.136199","34.120.52.64","100.86.87.79","TCP","690","443  >  59336 [PSH, ACK] Seq=3461 Ack=518 Win=66816 Len=636 [TCP segment of a reassembled PDU]"
"16","0.136199","34.120.52.64","100.86.87.79","TLSv1.3","970","Application Data"
"17","0.136656","100.86.87.79","34.120.52.64","TCP","54","59336  >  443 [ACK] Seq=518 Ack=5013 Win=66304 Len=0"
"18","0.140870","100.86.87.79","34.120.52.64","TLSv1.3","118","Change Cipher Spec, Application Data"
"19","0.141324","100.86.87.79","34.120.52.64","TLSv1.3","146","Application Data"
"20","0.141698","100.86.87.79","34.120.52.64","TLSv1.3","732","Application Data"
"21","0.151559","34.120.52.64","100.86.87.79","TLSv1.3","672","Application Data, Application Data"
"22","0.151559","34.120.52.64","100.86.87.79","TLSv1.3","85","Application Data"
"23","0.151790","100.86.87.79","34.120.52.64","TCP","54","59336  >  443 [ACK] Seq=1352 Ack=5662 Win=65536 Len=0"
"24","0.152084","100.86.87.79","34.120.52.64","TLSv1.3","85","Application Data"
"25","0.157335","34.120.52.64","100.86.87.79","TCP","56","443  >  59336 [ACK] Seq=5662 Ack=1352 Win=68096 Len=0"
"26","0.162084","34.120.52.64","100.86.87.79","TCP","56","443  >  59336 [ACK] Seq=5662 Ack=1383 Win=68096 Len=0"
"27","0.176614","34.120.52.64","100.86.87.79","TLSv1.3","1154","Application Data"
"28","0.177619","34.120.52.64","100.86.87.79","TLSv1.3","1466","Application Data"
"29","0.177756","100.86.87.79","34.120.52.64","TCP","54","59336  >  443 [ACK] Seq=1383 Ack=8174 Win=66304 Len=0"
"30","0.179211","34.120.52.64","100.86.87.79","TLSv1.3","2878","Application Data, Application Data"
"31","0.179211","34.120.52.64","100.86.87.79","TLSv1.3","86","Application Data"
"32","0.179211","34.120.52.64","100.86.87.79","TLSv1.3","1466","Application Data"
"33","0.179479","100.86.87.79","34.120.52.64","TCP","54","59336  >  443 [ACK] Seq=1383 Ack=12442 Win=66304 Len=0"
"34","0.179653","34.120.52.64","100.86.87.79","TLSv1.3","2878","Application Data, Application Data"
"35","0.179770","100.86.87.79","34.120.52.64","TCP","54","59336  >  443 [ACK] Seq=1383 Ack=15266 Win=66304 Len=0"
"36","0.181506","34.120.52.64","100.86.87.79","TLSv1.3","2878","Application Data, Application Data"
"37","0.181607","100.86.87.79","34.120.52.64","TCP","54","59336  >  443 [ACK] Seq=1383 Ack=18090 Win=66304 Len=0"
"38","0.183881","34.120.52.64","100.86.87.79","TLSv1.3","1466","Application Data"
"39","0.183881","34.120.52.64","100.86.87.79","TLSv1.3","591","Application Data, Application Data"
"40","0.184051","100.86.87.79","34.120.52.64","TCP","54","59336  >  443 [ACK] Seq=1383 Ack=20039 Win=66304 Len=0"
"41","0.184363","100.86.87.79","34.120.52.64","TLSv1.3","93","Application Data"
"42","0.238151","34.120.52.64","100.86.87.79","TCP","56","443  >  59336 [ACK] Seq=20039 Ack=1422 Win=68096 Len=0"
"43","3.199382","100.86.87.79","34.120.52.64","TCP","54","59334  >  80 [FIN, ACK] Seq=1 Ack=1 Win=66304 Len=0"
"44","3.199522","100.86.87.79","34.120.52.64","TCP","54","59335  >  80 [FIN, ACK] Seq=1 Ack=1 Win=66304 Len=0"
"45","3.200261","100.86.87.79","34.120.52.64","TCP","54","59336  >  443 [FIN, ACK] Seq=1422 Ack=20039 Win=66304 Len=0"
"46","3.213761","34.120.52.64","100.86.87.79","TCP","56","443  >  59336 [FIN, ACK] Seq=20039 Ack=1423 Win=68096 Len=0"
"47","3.213878","100.86.87.79","34.120.52.64","TCP","54","59336  >  443 [ACK] Seq=1423 Ack=20040 Win=66304 Len=0"
"48","3.459335","34.120.52.64","100.86.87.79","TCP","56","80  >  59334 [FIN, ACK] Seq=1 Ack=2 Win=65536 Len=0"
"49","3.459335","34.120.52.64","100.86.87.79","TCP","56","80  >  59335 [FIN, ACK] Seq=1 Ack=2 Win=65536 Len=0"
"50","3.459548","100.86.87.79","34.120.52.64","TCP","54","59334  >  80 [ACK] Seq=2 Ack=2 Win=66304 Len=0"
"51","3.459688","100.86.87.79","34.120.52.64","TCP","54","59335  >  80 [ACK] Seq=2 Ack=2 Win=66304 Len=0"
"52","6.626393","100.86.87.79","34.120.52.64","TCP","66","59344  >  443 [SYN] Seq=0 Win=64240 Len=0 MSS=1460 WS=256 SACK_PERM"
"53","6.640690","34.120.52.64","100.86.87.79","TCP","66","443  >  59344 [SYN, ACK] Seq=0 Ack=1 Win=65535 Len=0 MSS=1412 SACK_PERM WS=256"
"54","6.640955","100.86.87.79","34.120.52.64","TCP","54","59344  >  443 [ACK] Seq=1 Ack=1 Win=66304 Len=0"
"55","6.641629","100.86.87.79","34.120.52.64","TLSv1.3","882","Client Hello (SNI=www.overleaf.com)"
"56","6.655247","34.120.52.64","100.86.87.79","TCP","56","443  >  59344 [ACK] Seq=1 Ack=829 Win=67328 Len=0"
"57","6.655247","34.120.52.64","100.86.87.79","TLSv1.3","266","Server Hello, Change Cipher Spec, Application Data"
"58","6.657643","100.86.87.79","34.120.52.64","TLSv1.3","118","Change Cipher Spec, Application Data"
"59","6.669684","34.120.52.64","100.86.87.79","TLSv1.3","672","Application Data, Application Data"
"60","6.711195","100.86.87.79","34.120.52.64","TCP","54","59344  >  443 [ACK] Seq=893 Ack=831 Win=65280 Len=0"
"61","6.852540","100.86.87.79","34.120.52.64","TLSv1.3","146","Application Data"
"62","6.853061","100.86.87.79","34.120.52.64","TLSv1.3","85","Application Data"
"63","6.853460","100.86.87.79","34.120.52.64","TLSv1.3","669","Application Data"
"64","6.853641","100.86.87.79","34.120.52.64","TLSv1.3","144","Application Data"
"65","6.863923","34.120.52.64","100.86.87.79","TLSv1.3","85","Application Data"
"66","6.865391","34.120.52.64","100.86.87.79","TCP","56","443  >  59344 [ACK] Seq=862 Ack=1721 Win=68864 Len=0"
"67","6.875019","100.86.87.79","34.120.52.64","TLSv1.3","278","Application Data"
"68","6.888515","34.120.52.64","100.86.87.79","TLSv1.3","842","Application Data"
"69","6.888515","34.120.52.64","100.86.87.79","TLSv1.3","93","Application Data"
"70","6.888649","100.86.87.79","34.120.52.64","TCP","54","59344  >  443 [ACK] Seq=1945 Ack=1689 Win=66304 Len=0"
"71","6.888978","34.120.52.64","100.86.87.79","TLSv1.3","93","Application Data"
"72","6.890179","100.86.87.79","34.120.52.64","TLSv1.3","93","Application Data"
"73","6.905071","34.120.52.64","100.86.87.79","TCP","56","443  >  59344 [ACK] Seq=1728 Ack=1984 Win=70656 Len=0"
"74","7.077107","34.120.52.64","100.86.87.79","TLSv1.3","737","Application Data"
"75","7.077567","34.120.52.64","100.86.87.79","TLSv1.3","241","Application Data"
"76","7.077567","34.120.52.64","100.86.87.79","TLSv1.3","1466","Application Data"
"77","7.077687","100.86.87.79","34.120.52.64","TCP","54","59344  >  443 [ACK] Seq=1984 Ack=4010 Win=66304 Len=0"
"78","7.080403","34.120.52.64","100.86.87.79","TLSv1.3","5702","Application Data, Application Data, Application Data, Application Data"
"79","7.080525","100.86.87.79","34.120.52.64","TCP","54","59344  >  443 [ACK] Seq=1984 Ack=9658 Win=66304 Len=0"
"80","7.082090","34.120.52.64","100.86.87.79","TLSv1.3","1466","Application Data"
"81","7.082090","34.120.52.64","100.86.87.79","TLSv1.3","1466","Application Data"
"82","7.082090","34.120.52.64","100.86.87.79","TLSv1.3","2878","Application Data, Application Data"
"83","7.082236","100.86.87.79","34.120.52.64","TCP","54","59344  >  443 [ACK] Seq=1984 Ack=15306 Win=66304 Len=0"
"84","7.085265","34.120.52.64","100.86.87.79","TLSv1.3","1466","Application Data"
"85","7.085265","34.120.52.64","100.86.87.79","TLSv1.3","557","Application Data, Application Data, Application Data"
"86","7.085339","100.86.87.79","34.120.52.64","TCP","54","59344  >  443 [ACK] Seq=1984 Ack=17221 Win=66304 Len=0"
"87","7.085657","100.86.87.79","34.120.52.64","TLSv1.3","93","Application Data"
"88","7.096375","34.120.52.64","100.86.87.79","TCP","56","443  >  59344 [ACK] Seq=17221 Ack=2023 Win=70656 Len=0"
"89","41.026791","100.86.87.79","34.120.52.64","TLSv1.3","205","Application Data"
"90","41.026903","100.86.87.79","34.120.52.64","TLSv1.3","93","Application Data"
"91","41.037888","34.120.52.64","100.86.87.79","TCP","56","443  >  59344 [ACK] Seq=17221 Ack=2174 Win=72192 Len=0"
"92","41.037979","34.120.52.64","100.86.87.79","TCP","56","443  >  59344 [ACK] Seq=17221 Ack=2213 Win=72192 Len=0"
"93","41.038496","34.120.52.64","100.86.87.79","TLSv1.3","93","Application Data"
"94","41.091749","100.86.87.79","34.120.52.64","TCP","54","59344  >  443 [ACK] Seq=2213 Ack=17260 Win=66304 Len=0"
"95","41.348221","34.120.52.64","100.86.87.79","TLSv1.3","448","Application Data"
"96","41.348221","34.120.52.64","100.86.87.79","TLSv1.3","2878","Application Data, Application Data"
"97","41.348426","100.86.87.79","34.120.52.64","TCP","54","59344  >  443 [ACK] Seq=2213 Ack=20478 Win=66304 Len=0"
"98","41.349044","100.86.87.79","34.120.52.64","TLSv1.3","89","Application Data"
"99","41.350386","34.120.52.64","100.86.87.79","TLSv1.3","1466","Application Data"
"100","41.350386","34.120.52.64","100.86.87.79","TLSv1.3","112","Application Data"
"101","41.350386","34.120.52.64","100.86.87.79","TLSv1.3","14174","Application Data, Application Data, Application Data, Application Data, Application Data, Application Data, Application Data, Application Data, Application Data, Application Data"
"102","41.350594","100.86.87.79","34.120.52.64","TCP","54","59344  >  443 [ACK] Seq=2248 Ack=36068 Win=66304 Len=0"
"103","41.351359","34.120.52.64","100.86.87.79","TLSv1.3","1359","Application Data, Application Data, Application Data"
"104","41.351359","34.120.52.64","100.86.87.79","TCP","1359","[TCP Retransmission] 443  >  59344 [PSH, ACK] Seq=36068 Ack=2213 Win=72192 Len=1305"
"105","41.351475","100.86.87.79","34.120.52.64","TCP","66","59344  >  443 [ACK] Seq=2248 Ack=37373 Win=65024 Len=0 SLE=36068 SRE=37373"
"106","41.351694","100.86.87.79","34.120.52.64","TLSv1.3","93","Application Data"
"107","41.363207","34.120.52.64","100.86.87.79","TCP","56","443  >  59344 [ACK] Seq=37373 Ack=2287 Win=72192 Len=0"
"108","46.589762","100.86.87.79","34.120.52.64","TLSv1.3","231","Application Data"
"109","46.607136","34.120.52.64","100.86.87.79","TCP","56","443  >  59344 [ACK] Seq=37373 Ack=2464 Win=73984 Len=0"
"110","46.775474","34.120.52.64","100.86.87.79","TLSv1.3","447","Application Data"
"111","46.775474","34.120.52.64","100.86.87.79","TLSv1.3","2878","Application Data, Application Data"
"112","46.775727","100.86.87.79","34.120.52.64","TCP","54","59344  >  443 [ACK] Seq=2464 Ack=40590 Win=66304 Len=0"
"113","46.776467","100.86.87.79","34.120.52.64","TLSv1.3","89","Application Data"
"114","46.778842","34.120.52.64","100.86.87.79","TLSv1.3","14174","Application Data, Application Data, Application Data, Application Data, Application Data, Application Data, Application Data, Application Data, Application Data, Application Data, Application Data"
"115","46.778842","34.120.52.64","100.86.87.79","TLSv1.3","8526","[TCP Previous segment not captured] , Continuation Data"
"116","46.779004","100.86.87.79","34.120.52.64","TCP","66","59344  >  443 [ACK] Seq=2499 Ack=54710 Win=66304 Len=0 SLE=56122 SRE=64594"
"117","46.779448","34.120.52.64","100.86.87.79","TLSv1.3","557","Continuation Data"
"118","46.779520","100.86.87.79","34.120.52.64","TCP","66","[TCP Dup ACK 116#1] 59344  >  443 [ACK] Seq=2499 Ack=54710 Win=66304 Len=0 SLE=56122 SRE=65097"
"119","46.789371","34.120.52.64","100.86.87.79","TCP","56","443  >  59344 [ACK] Seq=65097 Ack=2499 Win=73984 Len=0"
"120","46.791774","34.120.52.64","100.86.87.79","TCP","1466","[TCP Out-Of-Order] 443  >  59344 [ACK] Seq=54710 Ack=2499 Win=73984 Len=1412"
"121","46.791866","100.86.87.79","34.120.52.64","TCP","54","59344  >  443 [ACK] Seq=2499 Ack=65097 Win=66304 Len=0"
"122","46.792869","100.86.87.79","34.120.52.64","TLSv1.3","93","Application Data"
"123","46.808923","34.120.52.64","100.86.87.79","TCP","56","443  >  59344 [ACK] Seq=65097 Ack=2538 Win=73984 Len=0"
"124","55.130357","100.86.87.79","34.120.52.64","TLSv1.3","208","Application Data"
"125","55.142973","34.120.52.64","100.86.87.79","TCP","56","443  >  59344 [ACK] Seq=65097 Ack=2692 Win=75520 Len=0"
"126","55.166593","34.120.52.64","100.86.87.79","TLSv1.3","447","Application Data"
"127","55.167232","34.120.52.64","100.86.87.79","TLSv1.3","1466","Application Data"
"128","55.167357","100.86.87.79","34.120.52.64","TCP","54","59344  >  443 [ACK] Seq=2692 Ack=66902 Win=66304 Len=0"
"129","55.167508","100.86.87.79","34.120.52.64","TLSv1.3","89","Application Data"
"130","55.167921","34.120.52.64","100.86.87.79","TLSv1.3","1466","Application Data"
"131","55.168037","100.86.87.79","34.120.52.64","TCP","54","59344  >  443 [ACK] Seq=2727 Ack=68314 Win=66304 Len=0"
"132","55.169478","34.120.52.64","100.86.87.79","TLSv1.3","1466","Application Data"
"133","55.169478","34.120.52.64","100.86.87.79","TLSv1.3","229","Application Data"
"134","55.169690","100.86.87.79","34.120.52.64","TCP","54","59344  >  443 [ACK] Seq=2727 Ack=69901 Win=66304 Len=0"
"135","55.170916","34.120.52.64","100.86.87.79","TLSv1.3","5702","Application Data, Application Data, Application Data, Application Data"
"136","55.171035","100.86.87.79","34.120.52.64","TCP","54","59344  >  443 [ACK] Seq=2727 Ack=75549 Win=66304 Len=0"
"137","55.173190","34.120.52.64","100.86.87.79","TLSv1.3","2878","Application Data, Application Data"
"138","55.173190","34.120.52.64","100.86.87.79","TLSv1.3","840","Application Data, Application Data, Application Data"
"139","55.173315","100.86.87.79","34.120.52.64","TCP","54","59344  >  443 [ACK] Seq=2727 Ack=79159 Win=66304 Len=0"
"140","55.173733","100.86.87.79","34.120.52.64","TLSv1.3","93","Application Data"
"141","55.183557","34.120.52.64","100.86.87.79","TCP","56","443  >  59344 [ACK] Seq=79159 Ack=2727 Win=75520 Len=0"
"142","55.185310","34.120.52.64","100.86.87.79","TCP","56","443  >  59344 [ACK] Seq=79159 Ack=2766 Win=75520 Len=0"
"143","65.870122","100.86.87.79","34.120.52.64","TLSv1.3","197","Application Data"
"144","65.870267","100.86.87.79","34.120.52.64","TLSv1.3","93","Application Data"
"145","65.886725","34.120.52.64","100.86.87.79","TLSv1.3","93","Application Data"
"146","65.913109","34.120.52.64","100.86.87.79","TLSv1.3","427","Application Data"
"147","65.913258","100.86.87.79","34.120.52.64","TCP","54","59344  >  443 [ACK] Seq=2948 Ack=79571 Win=65792 Len=0"
"148","65.916630","34.120.52.64","100.86.87.79","TLSv1.3","1466","Application Data"
"149","65.916630","34.120.52.64","100.86.87.79","TLSv1.3","1466","Application Data"
"150","65.916630","34.120.52.64","100.86.87.79","TLSv1.3","1466","Application Data"
"151","65.916630","34.120.52.64","100.86.87.79","TLSv1.3","1466","Application Data"
"152","65.916899","100.86.87.79","34.120.52.64","TCP","54","59344  >  443 [ACK] Seq=2948 Ack=85219 Win=66304 Len=0"
"153","65.917100","100.86.87.79","34.120.52.64","TLSv1.3","89","Application Data"
"154","65.921673","34.120.52.64","100.86.87.79","TLSv1.3","1466","Application Data"
"155","65.921673","34.120.52.64","100.86.87.79","TLSv1.3","1466","Application Data"
"156","65.921673","34.120.52.64","100.86.87.79","TLSv1.3","1466","Application Data"
"157","65.921673","34.120.52.64","100.86.87.79","TLSv1.3","1466","Application Data"
"158","65.921829","100.86.87.79","34.120.52.64","TCP","54","59344  >  443 [ACK] Seq=2983 Ack=90867 Win=66304 Len=0"
"159","65.923714","34.120.52.64","100.86.87.79","TLSv1.3","1466","Application Data"
"160","65.923714","34.120.52.64","100.86.87.79","TLSv1.3","518","Application Data, Application Data"
"161","65.923809","100.86.87.79","34.120.52.64","TCP","54","59344  >  443 [ACK] Seq=2983 Ack=92743 Win=66304 Len=0"
"162","65.923970","100.86.87.79","34.120.52.64","TLSv1.3","93","Application Data"
"163","65.948035","34.120.52.64","100.86.87.79","TCP","56","443  >  59344 [ACK] Seq=92743 Ack=2983 Win=77312 Len=0"
"164","65.948035","34.120.52.64","100.86.87.79","TCP","56","443  >  59344 [ACK] Seq=92743 Ack=3022 Win=77312 Len=0"
"165","68.718808","100.86.87.79","34.120.52.64","TLSv1.3","173","Application Data"
"166","68.718975","100.86.87.79","34.120.52.64","TLSv1.3","144","Application Data"
"167","68.731737","34.120.52.64","100.86.87.79","TCP","56","443  >  59344 [ACK] Seq=92743 Ack=3231 Win=77312 Len=0"
"168","68.733627","100.86.87.79","34.120.52.64","TLSv1.3","119","Application Data"
"169","68.777840","34.120.52.64","100.86.87.79","TCP","56","443  >  59344 [ACK] Seq=92743 Ack=3296 Win=77312 Len=0"
"170","68.777840","34.120.52.64","100.86.87.79","TLSv1.3","290","Application Data"
"171","68.777840","34.120.52.64","100.86.87.79","TLSv1.3","93","Application Data"
"172","68.777995","100.86.87.79","34.120.52.64","TCP","54","59344  >  443 [ACK] Seq=3296 Ack=93018 Win=66048 Len=0"
"173","68.779457","34.120.52.64","100.86.87.79","TLSv1.3","93","Application Data"
"174","68.779457","34.120.52.64","100.86.87.79","TLSv1.3","426","Application Data"
"175","68.779457","34.120.52.64","100.86.87.79","TLSv1.3","5702","Application Data, Application Data, Application Data, Application Data"
"176","68.779617","100.86.87.79","34.120.52.64","TCP","54","59344  >  443 [ACK] Seq=3296 Ack=99077 Win=66304 Len=0"
"177","68.779998","100.86.87.79","34.120.52.64","TLSv1.3","93","Application Data"
"178","68.780646","34.120.52.64","100.86.87.79","TLSv1.3","1191","Application Data"
"179","68.796111","34.120.52.64","100.86.87.79","TCP","56","443  >  59344 [ACK] Seq=100214 Ack=3335 Win=77312 Len=0"
"180","68.826840","100.86.87.79","34.120.52.64","TCP","54","59344  >  443 [ACK] Seq=3335 Ack=100214 Win=65024 Len=0"
"181","72.690061","100.86.87.79","34.120.52.64","TCP","54","59344  >  443 [FIN, ACK] Seq=3335 Ack=100214 Win=65024 Len=0"
"182","72.704499","34.120.52.64","100.86.87.79","TCP","56","443  >  59344 [FIN, ACK] Seq=100214 Ack=3336 Win=77312 Len=0"
"183","72.704592","100.86.87.79","34.120.52.64","TCP","54","59344  >  443 [ACK] Seq=3336 Ack=100215 Win=65024 Len=0"
"184","83.629861","100.86.87.79","34.120.52.64","TCP","66","59496  >  443 [SYN] Seq=0 Win=64240 Len=0 MSS=1460 WS=256 SACK_PERM"
"185","83.641916","34.120.52.64","100.86.87.79","TCP","66","443  >  59496 [SYN, ACK] Seq=0 Ack=1 Win=65535 Len=0 MSS=1412 SACK_PERM WS=256"
"186","83.642091","100.86.87.79","34.120.52.64","TCP","54","59496  >  443 [ACK] Seq=1 Ack=1 Win=131072 Len=0"
"187","83.642731","100.86.87.79","34.120.52.64","TLSv1.3","914","Client Hello (SNI=www.overleaf.com)"
"188","83.654697","34.120.52.64","100.86.87.79","TCP","56","443  >  59496 [ACK] Seq=1 Ack=861 Win=67328 Len=0"
"189","83.655966","34.120.52.64","100.86.87.79","TLSv1.3","266","Server Hello, Change Cipher Spec, Application Data"
"190","83.656668","100.86.87.79","34.120.52.64","TLSv1.3","118","Change Cipher Spec, Application Data"
"191","83.656927","100.86.87.79","34.120.52.64","TLSv1.3","146","Application Data"
"192","83.657247","100.86.87.79","34.120.52.64","TLSv1.3","705","Application Data"
"193","83.657309","100.86.87.79","34.120.52.64","TLSv1.3","114","Application Data"
"194","83.657409","100.86.87.79","34.120.52.64","TLSv1.3","163","Application Data"
"195","83.657506","100.86.87.79","34.120.52.64","TLSv1.3","175","Application Data"
"196","83.669517","34.120.52.64","100.86.87.79","TLSv1.3","672","Application Data, Application Data"
"197","83.669517","34.120.52.64","100.86.87.79","TLSv1.3","85","Application Data"
"198","83.669816","100.86.87.79","34.120.52.64","TCP","54","59496  >  443 [ACK] Seq=1958 Ack=862 Win=130304 Len=0"
"199","83.670428","100.86.87.79","34.120.52.64","TLSv1.3","85","Application Data"
"200","83.670444","34.120.52.64","100.86.87.79","TCP","56","443  >  59496 [ACK] Seq=862 Ack=1958 Win=69120 Len=0"
"201","83.688242","34.120.52.64","100.86.87.79","TCP","56","443  >  59496 [ACK] Seq=862 Ack=1989 Win=69120 Len=0"
"202","83.691126","34.120.52.64","100.86.87.79","TLSv1.3","843","Application Data"
"203","83.691126","34.120.52.64","100.86.87.79","TLSv1.3","90","Application Data"
"204","83.691126","34.120.52.64","100.86.87.79","TLSv1.3","93","Application Data"
"205","83.692051","34.120.52.64","100.86.87.79","TLSv1.3","361","Application Data"
"206","83.692051","34.120.52.64","100.86.87.79","TLSv1.3","93","Application Data"
"207","83.694668","100.86.87.79","34.120.52.64","TCP","54","59496  >  443 [ACK] Seq=1989 Ack=2072 Win=131072 Len=0"
"208","83.696022","100.86.87.79","34.120.52.64","TLSv1.3","93","Application Data"
"209","83.712582","34.120.52.64","100.86.87.79","TCP","56","443  >  59496 [ACK] Seq=2072 Ack=2028 Win=69120 Len=0"
"210","84.704091","100.86.87.79","34.120.52.64","TLSv1.3","125","Application Data"
"211","84.704192","100.86.87.79","34.120.52.64","TLSv1.3","2186","Application Data"
"212","84.724663","34.120.52.64","100.86.87.79","TCP","56","443  >  59496 [ACK] Seq=2072 Ack=4231 Win=74752 Len=0"
"213","85.060278","34.120.52.64","100.86.87.79","TLSv1.3","342","Application Data"
"214","85.060544","34.120.52.64","100.86.87.79","TLSv1.3","153","Application Data"
"215","85.060544","34.120.52.64","100.86.87.79","TLSv1.3","93","Application Data"
"216","85.060675","100.86.87.79","34.120.52.64","TCP","54","59496  >  443 [ACK] Seq=4231 Ack=2498 Win=130816 Len=0"
"217","85.061534","100.86.87.79","34.120.52.64","TLSv1.3","93","Application Data"
"218","85.094857","34.120.52.64","100.86.87.79","TCP","56","443  >  59496 [ACK] Seq=2498 Ack=4270 Win=74752 Len=0"
"219","87.656693","100.86.87.79","34.120.52.64","TLSv1.3","133","Application Data"
"220","87.656862","100.86.87.79","34.120.52.64","TLSv1.3","175","Application Data"
"221","87.657235","100.86.87.79","34.120.52.64","TLSv1.3","132","Application Data"
"222","87.657306","100.86.87.79","34.120.52.64","TLSv1.3","114","Application Data"
"223","87.673717","34.120.52.64","100.86.87.79","TCP","56","443  >  59496 [ACK] Seq=2498 Ack=4608 Win=77568 Len=0"
"224","87.690379","34.120.52.64","100.86.87.79","TLSv1.3","291","Application Data"
"225","87.693681","34.120.52.64","100.86.87.79","TLSv1.3","132","Application Data, Application Data"
"226","87.693781","100.86.87.79","34.120.52.64","TCP","54","59496  >  443 [ACK] Seq=4608 Ack=2813 Win=130560 Len=0"
"227","87.694679","100.86.87.79","34.120.52.64","TLSv1.3","93","Application Data"
"228","87.701192","34.120.52.64","100.86.87.79","TLSv1.3","309","Application Data"
"229","87.701192","34.120.52.64","100.86.87.79","TLSv1.3","90","Application Data"
"230","87.701363","100.86.87.79","34.120.52.64","TCP","54","59496  >  443 [ACK] Seq=4647 Ack=3104 Win=130048 Len=0"
"231","87.713650","34.120.52.64","100.86.87.79","TCP","56","443  >  59496 [ACK] Seq=3104 Ack=4647 Win=77568 Len=0"
"232","87.818042","100.86.87.79","34.120.52.64","TLSv1.3","125","Application Data"
"233","87.818241","100.86.87.79","34.120.52.64","TLSv1.3","2187","Application Data"
"234","87.828650","34.120.52.64","100.86.87.79","TCP","56","443  >  59496 [ACK] Seq=3104 Ack=4718 Win=77568 Len=0"
"235","87.829447","34.120.52.64","100.86.87.79","TCP","56","443  >  59496 [ACK] Seq=3104 Ack=6851 Win=83200 Len=0"
"236","88.269194","34.120.52.64","100.86.87.79","TLSv1.3","639","Application Data"
"237","88.270244","34.120.52.64","100.86.87.79","TLSv1.3","327","Application Data"
"238","88.270244","34.120.52.64","100.86.87.79","TLSv1.3","93","Application Data"
"239","88.270458","100.86.87.79","34.120.52.64","TCP","54","59496  >  443 [ACK] Seq=6851 Ack=4001 Win=131072 Len=0"
"240","88.270808","100.86.87.79","34.120.52.64","TLSv1.3","93","Application Data"
"241","88.279298","100.86.87.79","34.120.52.64","TLSv1.3","351","Application Data"
"242","88.284904","34.120.52.64","100.86.87.79","TCP","56","443  >  59496 [ACK] Seq=4001 Ack=6890 Win=83200 Len=0"
"243","88.293106","34.120.52.64","100.86.87.79","TCP","56","443  >  59496 [ACK] Seq=4001 Ack=7187 Win=86016 Len=0"
"244","88.856786","34.120.52.64","100.86.87.79","TLSv1.3","919","Application Data"
"245","88.856786","34.120.52.64","100.86.87.79","TLSv1.3","2878","Application Data, Application Data"
"246","88.857140","100.86.87.79","34.120.52.64","TCP","54","59496  >  443 [ACK] Seq=7187 Ack=7690 Win=131072 Len=0"
"247","88.858716","34.120.52.64","100.86.87.79","TLSv1.3","5702","Application Data, Application Data, Application Data, Application Data"
"248","88.858716","34.120.52.64","100.86.87.79","TLSv1.3","156","Application Data"
"249","88.858716","34.120.52.64","100.86.87.79","TLSv1.3","1466","Application Data"
"250","88.859078","100.86.87.79","34.120.52.64","TCP","54","59496  >  443 [ACK] Seq=7187 Ack=14852 Win=131072 Len=0"
"251","88.859709","100.86.87.79","34.120.52.64","TLSv1.3","89","Application Data"
"252","88.862375","34.120.52.64","100.86.87.79","TLSv1.3","897","Application Data, Application Data"
"253","88.862375","34.120.52.64","100.86.87.79","TCP","897","[TCP Retransmission] 443  >  59496 [PSH, ACK] Seq=14852 Ack=7187 Win=86016 Len=843"
"254","88.862571","100.86.87.79","34.120.52.64","TCP","66","59496  >  443 [ACK] Seq=7222 Ack=15695 Win=130304 Len=0 SLE=14852 SRE=15695"
"255","88.864542","100.86.87.79","34.120.52.64","TLSv1.3","93","Application Data"
"256","88.871042","34.120.52.64","100.86.87.79","TCP","56","443  >  59496 [ACK] Seq=15695 Ack=7222 Win=86016 Len=0"
"257","88.875744","34.120.52.64","100.86.87.79","TCP","56","443  >  59496 [ACK] Seq=15695 Ack=7261 Win=86016 Len=0"
"258","89.073782","100.86.87.79","34.120.52.64","TLSv1.3","222","Application Data"
"259","89.076442","100.86.87.79","34.120.52.64","TLSv1.3","148","Application Data"
"260","89.076531","100.86.87.79","34.120.52.64","TLSv1.3","210","Application Data"
"261","89.076875","100.86.87.79","34.120.52.64","TLSv1.3","133","Application Data"
"262","89.077010","100.86.87.79","34.120.52.64","TLSv1.3","151","Application Data"
"263","89.084974","34.120.52.64","100.86.87.79","TCP","56","443  >  59496 [ACK] Seq=15695 Ack=7429 Win=88832 Len=0"
"264","89.087288","34.120.52.64","100.86.87.79","TCP","56","443  >  59496 [ACK] Seq=15695 Ack=7679 Win=91648 Len=0"
"265","89.088228","34.120.52.64","100.86.87.79","TCP","56","443  >  59496 [ACK] Seq=15695 Ack=7758 Win=91648 Len=0"
"266","89.088654","34.120.52.64","100.86.87.79","TCP","56","443  >  59496 [ACK] Seq=15695 Ack=7855 Win=91648 Len=0"
"267","89.107576","34.120.52.64","100.86.87.79","TLSv1.3","342","Application Data"
"268","89.107949","34.120.52.64","100.86.87.79","TLSv1.3","87","Application Data"
"269","89.107949","34.120.52.64","100.86.87.79","TLSv1.3","93","Application Data"
"270","89.108056","100.86.87.79","34.120.52.64","TCP","54","59496  >  443 [ACK] Seq=7855 Ack=16055 Win=130048 Len=0"
"271","89.108696","100.86.87.79","34.120.52.64","TLSv1.3","93","Application Data"
"272","89.113816","34.120.52.64","100.86.87.79","TLSv1.3","294","Application Data"
"273","89.113935","100.86.87.79","34.120.52.64","TCP","54","59496  >  443 [ACK] Seq=7894 Ack=16295 Win=131072 Len=0"
"274","89.114118","34.120.52.64","100.86.87.79","TLSv1.3","93","Application Data"
"275","89.114181","100.86.87.79","34.120.52.64","TCP","54","59496  >  443 [ACK] Seq=7894 Ack=16334 Win=131072 Len=0"
"276","89.125721","34.120.52.64","100.86.87.79","TLSv1.3","294","Application Data"
"277","89.125721","34.120.52.64","100.86.87.79","TLSv1.3","132","Application Data, Application Data"
"278","89.125969","100.86.87.79","34.120.52.64","TCP","54","59496  >  443 [ACK] Seq=7894 Ack=16652 Win=130816 Len=0"
"279","89.127225","100.86.87.79","34.120.52.64","TLSv1.3","93","Application Data"
"280","89.143230","34.120.52.64","100.86.87.79","TCP","56","443  >  59496 [ACK] Seq=16652 Ack=7933 Win=91648 Len=0"
"281","97.476370","100.86.87.79","34.120.52.64","TLSv1.3","137","Application Data"
"282","97.488487","34.120.52.64","100.86.87.79","TCP","56","443  >  59496 [ACK] Seq=16652 Ack=8016 Win=91648 Len=0"
"283","97.548790","34.120.52.64","100.86.87.79","TLSv1.3","429","Application Data"
"284","97.548790","34.120.52.64","100.86.87.79","TLSv1.3","1466","Application Data"
"285","97.548790","34.120.52.64","100.86.87.79","TLSv1.3","1466","Application Data"
"286","97.548912","100.86.87.79","34.120.52.64","TCP","54","59496  >  443 [ACK] Seq=8016 Ack=19851 Win=131072 Len=0"
"287","97.549606","100.86.87.79","34.120.52.64","TLSv1.3","89","Application Data"
"288","97.552759","34.120.52.64","100.86.87.79","TLSv1.3","1466","Application Data"
"289","97.552759","34.120.52.64","100.86.87.79","TLSv1.3","1466","Application Data"
"290","97.552759","34.120.52.64","100.86.87.79","TLSv1.3","1466","Application Data"
"291","97.552759","34.120.52.64","100.86.87.79","TLSv1.3","1466","Application Data"
"292","97.552887","100.86.87.79","34.120.52.64","TCP","54","59496  >  443 [ACK] Seq=8051 Ack=25499 Win=131072 Len=0"
"293","97.554448","34.120.52.64","100.86.87.79","TLSv1.3","519","Application Data"
"294","97.554448","34.120.52.64","100.86.87.79","TLSv1.3","93","Application Data"
"295","97.554567","100.86.87.79","34.120.52.64","TCP","54","59496  >  443 [ACK] Seq=8051 Ack=26003 Win=130560 Len=0"
"296","97.554979","100.86.87.79","34.120.52.64","TLSv1.3","93","Application Data"
"297","97.565897","34.120.52.64","100.86.87.79","TCP","56","443  >  59496 [ACK] Seq=26003 Ack=8051 Win=91648 Len=0"
"298","97.566942","34.120.52.64","100.86.87.79","TCP","56","443  >  59496 [ACK] Seq=26003 Ack=8090 Win=91648 Len=0"
"299","97.572890","100.86.87.79","34.120.52.64","TLSv1.3","223","Application Data"
"300","97.586863","34.120.52.64","100.86.87.79","TCP","56","443  >  59496 [ACK] Seq=26003 Ack=8259 Win=94464 Len=0"
"301","97.610968","34.120.52.64","100.86.87.79","TLSv1.3","263","Application Data"
"302","97.610968","34.120.52.64","100.86.87.79","TLSv1.3","1159","Application Data"
"303","97.610968","34.120.52.64","100.86.87.79","TLSv1.3","2878","Application Data, Application Data"
"304","97.610968","34.120.52.64","100.86.87.79","TLSv1.3","1401","Application Data"
"305","97.611241","100.86.87.79","34.120.52.64","TCP","54","59496  >  443 [ACK] Seq=8259 Ack=31488 Win=131072 Len=0"
"306","97.617227","34.120.52.64","100.86.87.79","TLSv1.3","12762","Application Data, Application Data, Application Data, Application Data, Application Data, Application Data, Application Data, Application Data, Application Data"
"307","97.617454","100.86.87.79","34.120.52.64","TCP","54","59496  >  443 [ACK] Seq=8259 Ack=44196 Win=131072 Len=0"
"308","97.621981","34.120.52.64","100.86.87.79","TLSv1.3","4290","Application Data, Application Data, Application Data"
"309","97.622229","100.86.87.79","34.120.52.64","TCP","54","59496  >  443 [ACK] Seq=8259 Ack=48432 Win=131072 Len=0"
"310","97.627841","34.120.52.64","100.86.87.79","TLSv1.3","4290","Application Data, Application Data, Application Data"
"311","97.627841","34.120.52.64","100.86.87.79","TLSv1.3","18410","Application Data, Application Data, Application Data, Application Data, Application Data, Application Data, Application Data, Application Data, Application Data, Application Data, Application Data, Application Data, Application Data"
"312","97.627841","34.120.52.64","100.86.87.79","TLSv1.3","1003","Application Data, Application Data, Application Data"
"313","97.628118","100.86.87.79","34.120.52.64","TCP","54","59496  >  443 [ACK] Seq=8259 Ack=71973 Win=131072 Len=0"
"314","97.628616","100.86.87.79","34.120.52.64","TLSv1.3","93","Application Data"
"315","97.659237","34.120.52.64","100.86.87.79","TCP","56","443  >  59496 [ACK] Seq=71973 Ack=8298 Win=94464 Len=0"
"316","97.775821","100.86.87.79","34.120.52.64","TLSv1.3","177","Application Data"
"317","97.786624","34.120.52.64","100.86.87.79","TCP","56","443  >  59496 [ACK] Seq=71973 Ack=8421 Win=94464 Len=0"
"318","97.802669","34.120.52.64","100.86.87.79","TLSv1.3","122","Application Data"
"319","97.802669","34.120.52.64","100.86.87.79","TLSv1.3","168","Application Data"
"320","97.802669","34.120.52.64","100.86.87.79","TLSv1.3","93","Application Data"
"321","97.802824","100.86.87.79","34.120.52.64","TCP","54","59496  >  443 [ACK] Seq=8421 Ack=72194 Win=131072 Len=0"
"322","97.803158","100.86.87.79","34.120.52.64","TLSv1.3","93","Application Data"
"323","97.808766","100.86.87.79","34.120.52.64","TCP","66","59515  >  443 [SYN] Seq=0 Win=64240 Len=0 MSS=1460 WS=256 SACK_PERM"
"324","97.819774","34.120.52.64","100.86.87.79","TCP","56","443  >  59496 [ACK] Seq=72194 Ack=8460 Win=94464 Len=0"
"325","97.819774","34.120.52.64","100.86.87.79","TCP","66","443  >  59515 [SYN, ACK] Seq=0 Ack=1 Win=65535 Len=0 MSS=1412 SACK_PERM WS=256"
"326","97.820023","100.86.87.79","34.120.52.64","TCP","54","59515  >  443 [ACK] Seq=1 Ack=1 Win=131072 Len=0"
"327","97.820544","100.86.87.79","34.120.52.64","TLSv1.3","934","Client Hello (SNI=www.overleaf.com)"
"328","97.831062","34.120.52.64","100.86.87.79","TCP","56","443  >  59515 [ACK] Seq=1 Ack=881 Win=67328 Len=0"
"329","97.833219","34.120.52.64","100.86.87.79","TLSv1.3","272","Server Hello, Change Cipher Spec, Application Data"
"330","97.833710","100.86.87.79","34.120.52.64","TLSv1.3","118","Change Cipher Spec, Application Data"
"331","97.834103","100.86.87.79","34.120.52.64","TLSv1.3","922","Application Data"
"332","97.845904","34.120.52.64","100.86.87.79","TCP","56","443  >  59515 [ACK] Seq=219 Ack=1813 Win=69120 Len=0"
"333","97.859929","34.120.52.64","100.86.87.79","TLSv1.3","845","Application Data, Application Data"
"334","97.860320","34.120.52.64","100.86.87.79","TLSv1.3","81","Application Data"
"335","97.860399","100.86.87.79","34.120.52.64","TCP","54","59515  >  443 [ACK] Seq=1813 Ack=1037 Win=130048 Len=0"
"336","97.898249","34.120.52.64","100.86.87.79","TLSv1.3","1466","Application Data"
"337","97.898585","34.120.52.64","100.86.87.79","TLSv1.3","364","Application Data"
"338","97.898643","100.86.87.79","34.120.52.64","TCP","54","59515  >  443 [ACK] Seq=1813 Ack=2759 Win=131072 Len=0"
"339","97.906965","100.86.87.79","34.120.52.64","TLSv1.3","188","Application Data"
"340","97.907087","100.86.87.79","34.120.52.64","TLSv1.3","110","Application Data"
"341","97.907196","100.86.87.79","34.120.52.64","TLSv1.3","131","Application Data"
"342","97.917690","34.120.52.64","100.86.87.79","TCP","56","443  >  59496 [ACK] Seq=72194 Ack=8594 Win=97280 Len=0"
"343","97.918072","34.120.52.64","100.86.87.79","TCP","56","443  >  59496 [ACK] Seq=72194 Ack=8650 Win=97280 Len=0"
"344","97.922743","34.120.52.64","100.86.87.79","TCP","56","443  >  59515 [ACK] Seq=2759 Ack=1890 Win=69120 Len=0"
"345","97.937916","100.86.87.79","34.120.52.64","TLSv1.3","126","Application Data"
"346","97.949273","34.120.52.64","100.86.87.79","TCP","56","443  >  59496 [ACK] Seq=72194 Ack=8722 Win=97280 Len=0"
"347","97.955331","100.86.87.79","34.120.52.64","TLSv1.3","164","Application Data"
"348","97.962128","34.120.52.64","100.86.87.79","TLSv1.3","320","Application Data"
"349","97.962446","34.120.52.64","100.86.87.79","TLSv1.3","222","Application Data"
"350","97.962446","34.120.52.64","100.86.87.79","TLSv1.3","93","Application Data"
"351","97.962526","100.86.87.79","34.120.52.64","TCP","54","59496  >  443 [ACK] Seq=8722 Ack=72667 Win=130560 Len=0"
"352","97.963559","100.86.87.79","34.120.52.64","TLSv1.3","93","Application Data"
"353","97.966277","34.120.52.64","100.86.87.79","TCP","56","443  >  59515 [ACK] Seq=2759 Ack=2000 Win=69120 Len=0"
"354","97.969084","34.120.52.64","100.86.87.79","TLSv1.3","290","Application Data"
"355","97.970358","34.120.52.64","100.86.87.79","TLSv1.3","87","Application Data"
"356","97.970438","100.86.87.79","34.120.52.64","TCP","54","59496  >  443 [ACK] Seq=8761 Ack=72936 Win=130304 Len=0"
"357","97.982018","34.120.52.64","100.86.87.79","TCP","56","443  >  59496 [ACK] Seq=72936 Ack=8761 Win=97280 Len=0"
"358","98.078480","34.120.52.64","100.86.87.79","TLSv1.3","1466","Application Data"
"359","98.078480","34.120.52.64","100.86.87.79","TLSv1.3","1466","Application Data"
"360","98.078480","34.120.52.64","100.86.87.79","TLSv1.3","1466","Application Data"
"361","98.078480","34.120.52.64","100.86.87.79","TLSv1.3","1466","Application Data"
"362","98.078969","100.86.87.79","34.120.52.64","TCP","54","59515  >  443 [ACK] Seq=2000 Ack=8407 Win=131072 Len=0"
"363","98.085830","34.120.52.64","100.86.87.79","TLSv1.3","1466","Application Data"
"364","98.085830","34.120.52.64","100.86.87.79","TLSv1.3","1318","Application Data"
"365","98.085830","34.120.52.64","100.86.87.79","TLSv1.3","1347","Application Data"
"366","98.086374","100.86.87.79","34.120.52.64","TCP","54","59515  >  443 [ACK] Seq=2000 Ack=12376 Win=131072 Len=0"
"367","98.102476","34.120.52.64","100.86.87.79","TCP","1347","[TCP Spurious Retransmission] 443  >  59515 [PSH, ACK] Seq=11083 Ack=2000 Win=69120 Len=1293"
"368","98.102694","100.86.87.79","34.120.52.64","TCP","66","[TCP Dup ACK 366#1] 59515  >  443 [ACK] Seq=2000 Ack=12376 Win=131072 Len=0 SLE=11083 SRE=12376"
"369","98.108099","100.86.87.79","34.120.52.64","TLSv1.3","179","Application Data"
"370","98.108215","100.86.87.79","34.120.52.64","TLSv1.3","194","Application Data"
"371","98.112080","100.86.87.79","34.120.52.64","TLSv1.3","144","Application Data"
"372","98.138429","34.120.52.64","100.86.87.79","TCP","56","443  >  59496 [ACK] Seq=72936 Ack=9026 Win=100096 Len=0"
"373","98.151646","34.120.52.64","100.86.87.79","TCP","56","443  >  59496 [ACK] Seq=72936 Ack=9116 Win=100096 Len=0"
"374","98.181748","34.120.52.64","100.86.87.79","TLSv1.3","321","Application Data"
"375","98.184398","34.120.52.64","100.86.87.79","TLSv1.3","5702","Application Data, Application Data, Application Data, Application Data"
"376","98.184398","34.120.52.64","100.86.87.79","TLSv1.3","243","Application Data"
"377","98.184526","100.86.87.79","34.120.52.64","TCP","54","59496  >  443 [ACK] Seq=9116 Ack=79040 Win=131072 Len=0"
"378","98.184928","34.120.52.64","100.86.87.79","TLSv1.3","2878","Application Data, Application Data"
"379","98.185045","100.86.87.79","34.120.52.64","TCP","54","59496  >  443 [ACK] Seq=9116 Ack=81864 Win=131072 Len=0"
"380","98.187389","34.120.52.64","100.86.87.79","TLSv1.3","8526","Application Data, Application Data, Application Data, Application Data, Application Data, Application Data"
"381","98.187508","100.86.87.79","34.120.52.64","TCP","54","59496  >  443 [ACK] Seq=9116 Ack=90336 Win=131072 Len=0"
"382","98.189194","34.120.52.64","100.86.87.79","TLSv1.3","1131","Application Data, Application Data"
"383","98.189790","100.86.87.79","34.120.52.64","TLSv1.3","93","Application Data"
"384","98.200863","34.120.52.64","100.86.87.79","TCP","56","443  >  59496 [ACK] Seq=91413 Ack=9155 Win=100096 Len=0"
"385","98.349696","100.86.87.79","34.120.52.64","TLSv1.3","152","Application Data"
"386","98.349833","100.86.87.79","34.120.52.64","TLSv1.3","122","Application Data"
"387","98.363350","34.120.52.64","100.86.87.79","TCP","56","443  >  59496 [ACK] Seq=91413 Ack=9253 Win=100096 Len=0"
"388","98.363350","34.120.52.64","100.86.87.79","TCP","56","443  >  59496 [ACK] Seq=91413 Ack=9321 Win=100096 Len=0"
"389","98.391031","34.120.52.64","100.86.87.79","TLSv1.3","293","Application Data"
