No.,Time,Source,Destination,Protocol,Length,Info,label
1,0,100.86.87.79,192.0.77.40,TCP,66,61494  >  443 [SYN] Seq=0 Win=64240 Len=0 MSS=1460 WS=256 SACK_PERM,2
2,0.010312,192.0.77.40,100.86.87.79,TCP,66,"443  >  61494 [SYN, ACK] Seq=0 Ack=1 Win=42340 Len=0 MSS=1460 SACK_PERM WS=512",2
3,0.010636,100.86.87.79,192.0.77.40,TCP,54,61494  >  443 [ACK] Seq=1 Ack=1 Win=131328 Len=0,2
4,0.011585,100.86.87.79,192.0.77.40,TLSv1.3,1842,Client Hello (SNI=www.tumblr.com),2
5,0.024902,192.0.77.40,100.86.87.79,TCP,56,443  >  61494 [ACK] Seq=1 Ack=1461 Win=42496 Len=0,2
6,0.025695,192.0.77.40,100.86.87.79,TCP,56,443  >  61494 [ACK] Seq=1 Ack=1789 Win=42496 Len=0,2
7,0.025882,192.0.77.40,100.86.87.79,TLSv1.3,1514,"Server Hello, Change Cipher Spec, Application Data",2
8,0.026366,192.0.77.40,100.86.87.79,TCP,1514,443  >  61494 [ACK] Seq=1461 Ack=1789 Win=42496 Len=1460 [TCP segment of a reassembled PDU],2
9,0.026366,192.0.77.40,100.86.87.79,TLSv1.3,910,"Application Data, Application Data, Application Data",2
10,0.026557,100.86.87.79,192.0.77.40,TCP,54,61494  >  443 [ACK] Seq=1789 Ack=3777 Win=131328 Len=0,2
11,0.033806,100.86.87.79,192.0.77.40,TLSv1.3,118,"Change Cipher Spec, Application Data",2
12,0.04425,192.0.77.40,100.86.87.79,TLSv1.3,325,Application Data,2
13,0.044643,192.0.77.40,100.86.87.79,TLSv1.3,325,Application Data,2
14,0.044643,192.0.77.40,100.86.87.79,TLSv1.3,116,Application Data,2
15,0.044862,100.86.87.79,192.0.77.40,TCP,54,61494  >  443 [ACK] Seq=1853 Ack=4381 Win=130560 Len=0,2
16,0.123544,100.86.87.79,192.0.77.40,TLSv1.3,146,Application Data,2
17,0.125051,100.86.87.79,192.0.77.40,TLSv1.3,85,Application Data,2
18,0.125174,100.86.87.79,192.0.77.40,TLSv1.3,563,Application Data,2
19,0.133381,192.0.77.40,100.86.87.79,TLSv1.3,85,Application Data,2
20,0.140578,192.0.77.40,100.86.87.79,TCP,56,443  >  61494 [ACK] Seq=4412 Ack=2485 Win=42496 Len=0,2
21,0.141925,192.0.77.40,100.86.87.79,TLSv1.3,2836,"Application Data, Application Data",2
22,0.142055,100.86.87.79,192.0.77.40,TCP,54,61494  >  443 [ACK] Seq=2485 Ack=7194 Win=131328 Len=0,2
23,0.142733,192.0.77.40,100.86.87.79,TLSv1.3,1445,Application Data,2
24,0.142733,192.0.77.40,100.86.87.79,TLSv1.3,1445,Application Data,2
25,0.142733,192.0.77.40,100.86.87.79,TLSv1.3,1445,Application Data,2
26,0.142733,192.0.77.40,100.86.87.79,TLSv1.3,1445,Application Data,2
27,0.142733,192.0.77.40,100.86.87.79,TLSv1.3,1445,Application Data,2
28,0.142733,192.0.77.40,100.86.87.79,TLSv1.3,1445,Application Data,2
29,0.143139,100.86.87.79,192.0.77.40,TCP,54,61494  >  443 [ACK] Seq=2485 Ack=15540 Win=131328 Len=0,2
30,0.143602,192.0.77.40,100.86.87.79,TLSv1.3,1445,Application Data,2
31,0.143602,192.0.77.40,100.86.87.79,TLSv1.3,1421,Application Data,2
32,0.143694,100.86.87.79,192.0.77.40,TCP,54,61494  >  443 [ACK] Seq=2485 Ack=18298 Win=131328 Len=0,2
33,0.186567,100.86.87.79,192.0.77.40,TCP,66,61495  >  443 [SYN] Seq=0 Win=64240 Len=0 MSS=1460 WS=256 SACK_PERM,2
34,0.186832,100.86.87.79,192.0.77.40,TCP,66,61496  >  443 [SYN] Seq=0 Win=64240 Len=0 MSS=1460 WS=256 SACK_PERM,2
35,0.187534,100.86.87.79,192.0.77.40,TLSv1.3,195,Application Data,2
36,0.187639,100.86.87.79,192.0.77.40,TLSv1.3,143,Application Data,2
37,0.187676,100.86.87.79,192.0.77.40,TLSv1.3,126,Application Data,2
38,0.187709,100.86.87.79,192.0.77.40,TLSv1.3,136,Application Data,2
39,0.187742,100.86.87.79,192.0.77.40,TLSv1.3,123,Application Data,2
40,0.187784,100.86.87.79,192.0.77.40,TLSv1.3,123,Application Data,2
41,0.18782,100.86.87.79,192.0.77.40,TLSv1.3,123,Application Data,2
42,0.187858,100.86.87.79,192.0.77.40,TLSv1.3,122,Application Data,2
43,0.187895,100.86.87.79,192.0.77.40,TLSv1.3,123,Application Data,2
44,0.19731,192.0.77.40,100.86.87.79,TCP,66,"443  >  61495 [SYN, ACK] Seq=0 Ack=1 Win=42340 Len=0 MSS=1460 SACK_PERM WS=512",2
45,0.19731,192.0.77.40,100.86.87.79,TCP,66,"443  >  61496 [SYN, ACK] Seq=0 Ack=1 Win=42340 Len=0 MSS=1460 SACK_PERM WS=512",2
46,0.197548,100.86.87.79,192.0.77.40,TCP,54,61495  >  443 [ACK] Seq=1 Ack=1 Win=131328 Len=0,2
47,0.197591,100.86.87.79,192.0.77.40,TCP,54,61496  >  443 [ACK] Seq=1 Ack=1 Win=131328 Len=0,2
48,0.197673,192.0.77.40,100.86.87.79,TCP,56,443  >  61494 [ACK] Seq=18298 Ack=3076 Win=42496 Len=0,2
49,0.198249,100.86.87.79,192.0.77.40,TLSv1.3,1813,Client Hello (SNI=assets.tumblr.com),2
50,0.198592,192.0.77.40,100.86.87.79,TLSv1.3,4227,"Application Data, Application Data, Application Data",2
51,0.19871,100.86.87.79,192.0.77.40,TCP,54,61494  >  443 [ACK] Seq=3213 Ack=22471 Win=131328 Len=0,2
52,0.198763,100.86.87.79,192.0.77.40,TLSv1.3,1781,Client Hello (SNI=assets.tumblr.com),2
53,0.19932,192.0.77.40,100.86.87.79,TLSv1.3,1514,Application Data,2
54,0.19932,192.0.77.40,100.86.87.79,TLSv1.3,1376,Application Data,2
55,0.19932,192.0.77.40,100.86.87.79,TLSv1.3,1514,Application Data,2
56,0.19932,192.0.77.40,100.86.87.79,TLSv1.3,105,Application Data,2
57,0.19932,192.0.77.40,100.86.87.79,TLSv1.3,1514,Application Data,2
58,0.19932,192.0.77.40,100.86.87.79,TLSv1.3,1376,Application Data,2
59,0.19932,192.0.77.40,100.86.87.79,TLSv1.3,2974,"Application Data, Application Data",2
60,0.199534,100.86.87.79,192.0.77.40,TCP,54,61494  >  443 [ACK] Seq=3213 Ack=32466 Win=131328 Len=0,2
61,0.201203,192.0.77.40,100.86.87.79,TLSv1.3,1514,Application Data,2
62,0.201203,192.0.77.40,100.86.87.79,TLSv1.3,1514,Application Data,2
63,0.201203,192.0.77.40,100.86.87.79,TLSv1.3,1514,Application Data,2
64,0.201203,192.0.77.40,100.86.87.79,TLSv1.3,643,Application Data,2
65,0.201327,100.86.87.79,192.0.77.40,TCP,54,61494  >  443 [ACK] Seq=3213 Ack=37435 Win=131328 Len=0,2
66,0.202819,192.0.77.40,100.86.87.79,TLSv1.3,5894,"Application Data, Application Data, Application Data, Application Data",2
67,0.202907,100.86.87.79,192.0.77.40,TCP,54,61494  >  443 [ACK] Seq=3213 Ack=43275 Win=131328 Len=0,2
68,0.20299,192.0.77.40,100.86.87.79,TLSv1.3,2974,"Application Data, Application Data",2
69,0.203057,100.86.87.79,192.0.77.40,TCP,54,61494  >  443 [ACK] Seq=3213 Ack=46195 Win=131328 Len=0,2
70,0.203466,192.0.77.40,100.86.87.79,TLSv1.3,2974,"Application Data, Application Data",2
71,0.203542,100.86.87.79,192.0.77.40,TCP,54,61494  >  443 [ACK] Seq=3213 Ack=49115 Win=131328 Len=0,2
72,0.204097,192.0.77.40,100.86.87.79,TLSv1.3,1514,Application Data,2
73,0.204238,100.86.87.79,192.0.77.40,TCP,54,61494  >  443 [ACK] Seq=3213 Ack=50575 Win=131328 Len=0,2
74,0.208827,192.0.77.40,100.86.87.79,TCP,56,443  >  61495 [ACK] Seq=1 Ack=1760 Win=42496 Len=0,2
75,0.209303,192.0.77.40,100.86.87.79,TLSv1.3,2974,"Application Data, Application Data, Application Data",2
76,0.209409,100.86.87.79,192.0.77.40,TCP,54,61494  >  443 [ACK] Seq=3213 Ack=53495 Win=131328 Len=0,2
77,0.209586,192.0.77.40,100.86.87.79,TCP,56,443  >  61496 [ACK] Seq=1 Ack=1728 Win=42496 Len=0,2
78,0.212025,192.0.77.40,100.86.87.79,TLSv1.3,2974,"Server Hello, Change Cipher Spec, Application Data",2
79,0.212025,192.0.77.40,100.86.87.79,TLSv1.3,910,"Application Data, Application Data, Application Data",2
80,0.212025,192.0.77.40,100.86.87.79,TLSv1.3,4434,"Application Data, Application Data, Application Data",2
81,0.212323,100.86.87.79,192.0.77.40,TCP,54,61495  >  443 [ACK] Seq=1760 Ack=3777 Win=131328 Len=0,2
82,0.212424,100.86.87.79,192.0.77.40,TCP,54,61494  >  443 [ACK] Seq=3213 Ack=57875 Win=131328 Len=0,2
83,0.213054,192.0.77.40,100.86.87.79,TCP,1514,443  >  61494 [ACK] Seq=57875 Ack=3213 Win=42496 Len=1460 [TCP segment of a reassembled PDU],2
84,0.213054,192.0.77.40,100.86.87.79,TCP,1514,443  >  61494 [ACK] Seq=59335 Ack=3213 Win=42496 Len=1460 [TCP segment of a reassembled PDU],2
85,0.213054,192.0.77.40,100.86.87.79,TLSv1.3,1514,Application Data,2
86,0.213054,192.0.77.40,100.86.87.79,TCP,1514,443  >  61494 [ACK] Seq=62255 Ack=3213 Win=42496 Len=1460 [TCP segment of a reassembled PDU],2
87,0.213054,192.0.77.40,100.86.87.79,TCP,1514,443  >  61494 [ACK] Seq=63715 Ack=3213 Win=42496 Len=1460 [TCP segment of a reassembled PDU],2
88,0.213054,192.0.77.40,100.86.87.79,TLSv1.3,1514,"Server Hello, Change Cipher Spec, Application Data",2
89,0.213404,100.86.87.79,192.0.77.40,TCP,54,61494  >  443 [ACK] Seq=3213 Ack=65175 Win=131328 Len=0,2
90,0.216036,192.0.77.40,100.86.87.79,TCP,1514,443  >  61496 [ACK] Seq=1461 Ack=1728 Win=42496 Len=1460 [TCP segment of a reassembled PDU],2
91,0.216036,192.0.77.40,100.86.87.79,TLSv1.3,911,"Application Data, Application Data, Application Data",2
92,0.216036,192.0.77.40,100.86.87.79,TLSv1.3,5894,"Application Data, Application Data",2
93,0.216036,192.0.77.40,100.86.87.79,TLSv1.3,5894,Application Data,2
94,0.216156,100.86.87.79,192.0.77.40,TCP,54,61496  >  443 [ACK] Seq=1728 Ack=3778 Win=131328 Len=0,2
95,0.216193,100.86.87.79,192.0.77.40,TCP,54,61494  >  443 [ACK] Seq=3213 Ack=71015 Win=131328 Len=0,2
96,0.216242,100.86.87.79,192.0.77.40,TCP,54,61494  >  443 [ACK] Seq=3213 Ack=76855 Win=131328 Len=0,2
97,0.216315,192.0.77.40,100.86.87.79,TLSv1.3,1514,Application Data,2
98,0.216315,192.0.77.40,100.86.87.79,TCP,1514,443  >  61494 [ACK] Seq=78315 Ack=3213 Win=42496 Len=1460 [TCP segment of a reassembled PDU],2
99,0.216389,100.86.87.79,192.0.77.40,TCP,54,61494  >  443 [ACK] Seq=3213 Ack=79775 Win=131328 Len=0,2
100,0.216707,100.86.87.79,192.0.77.40,TLSv1.3,118,"Change Cipher Spec, Application Data",2
101,0.217386,100.86.87.79,192.0.77.40,TLSv1.3,118,"Change Cipher Spec, Application Data",2
102,0.21772,100.86.87.79,192.0.77.40,TCP,54,"61496  >  443 [FIN, ACK] Seq=1792 Ack=3778 Win=131328 Len=0",2
103,0.217895,100.86.87.79,192.0.77.40,TLSv1.3,146,Application Data,2
104,0.218557,100.86.87.79,192.0.77.40,TLSv1.3,488,Application Data,2
105,0.218646,100.86.87.79,192.0.77.40,TLSv1.3,147,Application Data,2
106,0.219675,192.0.77.40,100.86.87.79,TCP,1514,443  >  61494 [ACK] Seq=79775 Ack=3213 Win=42496 Len=1460 [TCP segment of a reassembled PDU],2
107,0.219675,192.0.77.40,100.86.87.79,TLSv1.3,1514,Application Data,2
108,0.219675,192.0.77.40,100.86.87.79,TLSv1.3,13194,"Application Data, Application Data, Application Data, Application Data",2
109,0.219675,192.0.77.40,100.86.87.79,TCP,1514,443  >  61494 [ACK] Seq=95835 Ack=3213 Win=42496 Len=1460 [TCP segment of a reassembled PDU],2
110,0.219864,100.86.87.79,192.0.77.40,TCP,54,61494  >  443 [ACK] Seq=3213 Ack=97295 Win=131328 Len=0,2
111,0.224282,192.0.77.40,100.86.87.79,TLSv1.3,1067,Application Data,2
112,0.228433,192.0.77.40,100.86.87.79,TLSv1.3,341,Application Data,2
113,0.228558,100.86.87.79,192.0.77.40,TCP,54,"61496  >  443 [RST, ACK] Seq=1793 Ack=4065 Win=0 Len=0",2
114,0.228698,192.0.77.40,100.86.87.79,TLSv1.3,341,Application Data,2
115,0.228966,192.0.77.40,100.86.87.79,TCP,56,"443  >  61496 [FIN, ACK] Seq=4352 Ack=1793 Win=42496 Len=0",2
116,0.228966,192.0.77.40,100.86.87.79,TLSv1.3,628,"Application Data, Application Data",2
117,0.229065,100.86.87.79,192.0.77.40,TCP,54,61495  >  443 [ACK] Seq=2443 Ack=4351 Win=130816 Len=0,2
118,0.229411,192.0.77.40,100.86.87.79,TLSv1.3,125,Application Data,2
119,0.229836,100.86.87.79,192.0.77.40,TLSv1.3,85,Application Data,2
120,0.230665,192.0.77.40,100.86.87.79,TLSv1.3,2836,"Application Data, Application Data",2
121,0.230665,192.0.77.40,100.86.87.79,TLSv1.3,1514,Application Data,2
122,0.230665,192.0.77.40,100.86.87.79,TLSv1.3,1376,Application Data,2
123,0.230665,192.0.77.40,100.86.87.79,TLSv1.3,2974,"Application Data, Application Data",2
124,0.230871,100.86.87.79,192.0.77.40,TCP,54,61495  >  443 [ACK] Seq=2474 Ack=12906 Win=131328 Len=0,2
125,0.231535,192.0.77.40,100.86.87.79,TLSv1.3,1514,Application Data,2
126,0.231535,192.0.77.40,100.86.87.79,TLSv1.3,1238,Application Data,2
127,0.231697,100.86.87.79,192.0.77.40,TCP,54,61495  >  443 [ACK] Seq=2474 Ack=15550 Win=131328 Len=0,2
128,0.232625,192.0.77.40,100.86.87.79,TLSv1.3,1514,Application Data,2
129,0.232625,192.0.77.40,100.86.87.79,TLSv1.3,1376,Application Data,2
130,0.232731,100.86.87.79,192.0.77.40,TCP,54,61495  >  443 [ACK] Seq=2474 Ack=18332 Win=131328 Len=0,2
131,0.235805,100.86.87.79,192.0.77.40,TLSv1.3,138,Application Data,2
132,0.235931,100.86.87.79,192.0.77.40,TLSv1.3,132,Application Data,2
133,0.235968,100.86.87.79,192.0.77.40,TLSv1.3,130,Application Data,2
134,0.23927,100.86.87.79,192.0.77.40,TLSv1.3,130,Application Data,2
135,0.239356,192.0.77.40,100.86.87.79,TLSv1.3,4434,"Application Data, Application Data, Application Data",2
136,0.239431,100.86.87.79,192.0.77.40,TLSv1.3,130,Application Data,2
137,0.239481,100.86.87.79,192.0.77.40,TLSv1.3,206,"Application Data, Application Data",2
138,0.239498,100.86.87.79,192.0.77.40,TLSv1.3,130,Application Data,2
139,0.239515,100.86.87.79,192.0.77.40,TLSv1.3,130,Application Data,2
140,0.239546,100.86.87.79,192.0.77.40,TLSv1.3,130,Application Data,2
141,0.239981,192.0.77.40,100.86.87.79,TLSv1.3,1514,Application Data,2
142,0.240528,100.86.87.79,192.0.77.40,TLSv1.3,130,Application Data,2
143,0.240587,100.86.87.79,192.0.77.40,TLSv1.3,129,Application Data,2
144,0.240633,100.86.87.79,192.0.77.40,TLSv1.3,130,Application Data,2
145,0.240666,100.86.87.79,192.0.77.40,TLSv1.3,130,Application Data,2
146,0.240696,100.86.87.79,192.0.77.40,TLSv1.3,130,Application Data,2
147,0.240726,100.86.87.79,192.0.77.40,TLSv1.3,130,Application Data,2
148,0.240759,100.86.87.79,192.0.77.40,TLSv1.3,130,Application Data,2
149,0.240791,100.86.87.79,192.0.77.40,TLSv1.3,130,Application Data,2
150,0.240822,100.86.87.79,192.0.77.40,TLSv1.3,129,Application Data,2
151,0.240853,100.86.87.79,192.0.77.40,TLSv1.3,130,Application Data,2
152,0.240897,100.86.87.79,192.0.77.40,TLSv1.3,130,Application Data,2
153,0.240931,100.86.87.79,192.0.77.40,TLSv1.3,130,Application Data,2
154,0.241146,100.86.87.79,192.0.77.40,TLSv1.3,143,Application Data,2
155,0.241207,100.86.87.79,192.0.77.40,TLSv1.3,130,Application Data,2
156,0.241237,100.86.87.79,192.0.77.40,TLSv1.3,130,Application Data,2
157,0.241298,100.86.87.79,192.0.77.40,TLSv1.3,129,Application Data,2
158,0.241363,100.86.87.79,192.0.77.40,TLSv1.3,130,Application Data,2
159,0.241397,100.86.87.79,192.0.77.40,TLSv1.3,130,Application Data,2
160,0.241428,100.86.87.79,192.0.77.40,TLSv1.3,130,Application Data,2
161,0.241429,192.0.77.40,100.86.87.79,TLSv1.3,2974,"Application Data, Application Data",2
162,0.241464,100.86.87.79,192.0.77.40,TLSv1.3,130,Application Data,2
163,0.241543,100.86.87.79,192.0.77.40,TLSv1.3,206,"Application Data, Application Data",2
164,0.241595,100.86.87.79,192.0.77.40,TLSv1.3,130,Application Data,2
165,0.241643,100.86.87.79,192.0.77.40,TLSv1.3,150,Application Data,2
166,0.242336,192.0.77.40,100.86.87.79,TCP,1514,[TCP Previous segment not captured] 443  >  61495 [ACK] Seq=28552 Ack=2474 Win=42496 Len=1460 [TCP segment of a reassembled PDU],2
167,0.242336,192.0.77.40,100.86.87.79,TLSv1.3,1514,Continuation Data,2
168,0.242336,192.0.77.40,100.86.87.79,TLSv1.3,2974,Continuation Data,2
169,0.242415,100.86.87.79,192.0.77.40,TCP,66,[TCP Dup ACK 163#1] 61495  >  443 [ACK] Seq=5098 Ack=27092 Win=131328 Len=0 SLE=28552 SRE=30012,2
170,0.242498,100.86.87.79,192.0.77.40,TCP,66,[TCP Dup ACK 163#2] 61495  >  443 [ACK] Seq=5098 Ack=27092 Win=131328 Len=0 SLE=28552 SRE=31472,2
171,0.24253,100.86.87.79,192.0.77.40,TCP,66,[TCP Dup ACK 163#3] 61495  >  443 [ACK] Seq=5098 Ack=27092 Win=131328 Len=0 SLE=28552 SRE=34392,2
172,0.24288,192.0.77.40,100.86.87.79,TLSv1.3,2974,Continuation Data,2
173,0.242929,100.86.87.79,192.0.77.40,TCP,66,[TCP Dup ACK 163#4] 61495  >  443 [ACK] Seq=5098 Ack=27092 Win=131328 Len=0 SLE=28552 SRE=37312,2
174,0.24324,192.0.77.40,100.86.87.79,TLSv1.3,1514,Continuation Data,2
175,0.243306,100.86.87.79,192.0.77.40,TCP,66,[TCP Dup ACK 163#5] 61495  >  443 [ACK] Seq=5098 Ack=27092 Win=131328 Len=0 SLE=28552 SRE=38772,2
176,0.243652,192.0.77.40,100.86.87.79,TLSv1.3,2974,Continuation Data,2
177,0.243707,100.86.87.79,192.0.77.40,TCP,66,[TCP Dup ACK 163#6] 61495  >  443 [ACK] Seq=5098 Ack=27092 Win=131328 Len=0 SLE=28552 SRE=41692,2
178,0.244078,192.0.77.40,100.86.87.79,TLSv1.3,1514,Continuation Data,2
179,0.244145,100.86.87.79,192.0.77.40,TCP,66,[TCP Dup ACK 163#7] 61495  >  443 [ACK] Seq=5098 Ack=27092 Win=131328 Len=0 SLE=28552 SRE=43152,2
180,0.246601,192.0.77.40,100.86.87.79,TLSv1.3,1514,Continuation Data,2
181,0.246741,100.86.87.79,192.0.77.40,TCP,66,[TCP Dup ACK 163#8] 61495  >  443 [ACK] Seq=5098 Ack=27092 Win=131328 Len=0 SLE=28552 SRE=44612,2
182,0.246997,192.0.77.40,100.86.87.79,TLSv1.3,2974,Continuation Data,2
183,0.247103,100.86.87.79,192.0.77.40,TCP,66,[TCP Dup ACK 163#9] 61495  >  443 [ACK] Seq=5098 Ack=27092 Win=131328 Len=0 SLE=28552 SRE=47532,2
184,0.248822,192.0.77.40,100.86.87.79,TLSv1.3,1514,Continuation Data,2
185,0.248822,192.0.77.40,100.86.87.79,TLSv1.3,1514,Continuation Data,2
186,0.248822,192.0.77.40,100.86.87.79,TLSv1.3,2974,Continuation Data,2
187,0.248933,100.86.87.79,192.0.77.40,TCP,66,[TCP Dup ACK 163#10] 61495  >  443 [ACK] Seq=5098 Ack=27092 Win=131328 Len=0 SLE=28552 SRE=48992,2
188,0.249014,100.86.87.79,192.0.77.40,TCP,66,[TCP Dup ACK 163#11] 61495  >  443 [ACK] Seq=5098 Ack=27092 Win=131328 Len=0 SLE=28552 SRE=50452,2
189,0.249075,100.86.87.79,192.0.77.40,TCP,66,[TCP Dup ACK 163#12] 61495  >  443 [ACK] Seq=5098 Ack=27092 Win=131328 Len=0 SLE=28552 SRE=53372,2
190,0.249266,192.0.77.40,100.86.87.79,TLSv1.3,2974,Continuation Data,2
191,0.249432,100.86.87.79,192.0.77.40,TCP,66,[TCP Dup ACK 163#13] 61495  >  443 [ACK] Seq=5098 Ack=27092 Win=131328 Len=0 SLE=28552 SRE=56292,2
192,0.25651,192.0.77.40,100.86.87.79,TLSv1.3,1514,Continuation Data,2
193,0.2566,100.86.87.79,192.0.77.40,TCP,66,[TCP Dup ACK 163#14] 61495  >  443 [ACK] Seq=5098 Ack=27092 Win=131328 Len=0 SLE=28552 SRE=57752,2
194,0.257722,192.0.77.40,100.86.87.79,TLSv1.3,1514,Continuation Data,2
195,0.257801,100.86.87.79,192.0.77.40,TCP,66,[TCP Dup ACK 163#15] 61495  >  443 [ACK] Seq=5098 Ack=27092 Win=131328 Len=0 SLE=28552 SRE=59212,2
196,0.258857,192.0.77.40,100.86.87.79,TLSv1.3,1514,Continuation Data,2
197,0.258857,192.0.77.40,100.86.87.79,TLSv1.3,1514,Continuation Data,2
198,0.258857,192.0.77.40,100.86.87.79,TLSv1.3,2974,Continuation Data,2
199,0.258921,100.86.87.79,192.0.77.40,TCP,66,[TCP Dup ACK 163#16] 61495  >  443 [ACK] Seq=5098 Ack=27092 Win=131328 Len=0 SLE=28552 SRE=60672,2
200,0.258953,100.86.87.79,192.0.77.40,TCP,66,[TCP Dup ACK 163#17] 61495  >  443 [ACK] Seq=5098 Ack=27092 Win=131328 Len=0 SLE=28552 SRE=62132,2
201,0.258973,100.86.87.79,192.0.77.40,TCP,66,[TCP Dup ACK 163#18] 61495  >  443 [ACK] Seq=5098 Ack=27092 Win=131328 Len=0 SLE=28552 SRE=65052,2
202,0.259563,192.0.77.40,100.86.87.79,TLSv1.3,2974,Continuation Data,2
203,0.259612,100.86.87.79,192.0.77.40,TCP,66,[TCP Dup ACK 163#19] 61495  >  443 [ACK] Seq=5098 Ack=27092 Win=131328 Len=0 SLE=28552 SRE=67972,2
204,0.261,192.0.77.40,100.86.87.79,TLSv1.3,2974,Continuation Data,2
205,0.261,192.0.77.40,100.86.87.79,TLSv1.3,1514,"[TCP Fast Retransmission] , Application Data",2
206,0.261,192.0.77.40,100.86.87.79,TLSv1.3,1514,Continuation Data,2
207,0.261082,100.86.87.79,192.0.77.40,TCP,66,[TCP Dup ACK 163#20] 61495  >  443 [ACK] Seq=5098 Ack=27092 Win=131328 Len=0 SLE=28552 SRE=70892,2
208,0.261159,100.86.87.79,192.0.77.40,TCP,54,61495  >  443 [ACK] Seq=5098 Ack=70892 Win=131328 Len=0,2
209,0.261192,100.86.87.79,192.0.77.40,TCP,54,61495  >  443 [ACK] Seq=5098 Ack=72352 Win=131328 Len=0,2
210,0.261853,192.0.77.40,100.86.87.79,TLSv1.3,7354,Continuation Data,2
211,0.261935,100.86.87.79,192.0.77.40,TCP,54,61495  >  443 [ACK] Seq=5098 Ack=79652 Win=131328 Len=0,2
212,0.265208,192.0.77.40,100.86.87.79,TLSv1.3,1514,Continuation Data,2
213,0.265208,192.0.77.40,100.86.87.79,TLSv1.3,1514,Continuation Data,2
214,0.265208,192.0.77.40,100.86.87.79,TLSv1.3,1514,Continuation Data,2
215,0.265536,100.86.87.79,192.0.77.40,TCP,54,61495  >  443 [ACK] Seq=5098 Ack=84032 Win=131328 Len=0,2
216,0.265863,192.0.77.40,100.86.87.79,TLSv1.3,2974,Continuation Data,2
217,0.265921,100.86.87.79,192.0.77.40,TCP,54,61495  >  443 [ACK] Seq=5098 Ack=86952 Win=131328 Len=0,2
218,0.267473,192.0.77.40,100.86.87.79,TLSv1.3,1514,Continuation Data,2
219,0.267473,192.0.77.40,100.86.87.79,TLSv1.3,1514,Continuation Data,2
220,0.267473,192.0.77.40,100.86.87.79,TLSv1.3,2974,Continuation Data,2
221,0.267554,100.86.87.79,192.0.77.40,TCP,54,61495  >  443 [ACK] Seq=5098 Ack=92792 Win=131328 Len=0,2
222,0.273367,100.86.87.79,192.0.77.40,TCP,54,61494  >  443 [ACK] Seq=3213 Ack=98308 Win=130304 Len=0,2
223,0.307974,192.0.77.40,100.86.87.79,TLSv1.3,1514,"[TCP Previous segment not captured] , Continuation Data",2
224,0.307974,192.0.77.40,100.86.87.79,TLSv1.3,1514,Continuation Data,2
225,0.307974,192.0.77.40,100.86.87.79,TLSv1.3,1514,Continuation Data,2
226,0.307974,192.0.77.40,100.86.87.79,TLSv1.3,1514,Continuation Data,2
227,0.307974,192.0.77.40,100.86.87.79,TLSv1.3,1514,Continuation Data,2
228,0.307974,192.0.77.40,100.86.87.79,TLSv1.3,1514,Continuation Data,2
229,0.307974,192.0.77.40,100.86.87.79,TCP,1514,443  >  61495 [ACK] Seq=107392 Ack=5098 Win=42496 Len=1460,2
230,0.307974,192.0.77.40,100.86.87.79,TLSv1.3,1514,Continuation Data,2
231,0.307974,192.0.77.40,100.86.87.79,TLSv1.3,1514,Continuation Data,2
232,0.307974,192.0.77.40,100.86.87.79,TLSv1.3,1514,Continuation Data,2
233,0.307974,192.0.77.40,100.86.87.79,TLSv1.3,1514,Continuation Data,2
234,0.307974,192.0.77.40,100.86.87.79,TLSv1.3,1514,Continuation Data,2
235,0.307974,192.0.77.40,100.86.87.79,TLSv1.3,1514,Continuation Data,2
236,0.307974,192.0.77.40,100.86.87.79,TLSv1.3,1514,Continuation Data,2
237,0.307974,192.0.77.40,100.86.87.79,TCP,1514,443  >  61495 [ACK] Seq=119072 Ack=5098 Win=42496 Len=1460,2
238,0.307974,192.0.77.40,100.86.87.79,TLSv1.3,1514,Continuation Data,2
239,0.307974,192.0.77.40,100.86.87.79,TLSv1.3,1514,Continuation Data,2
240,0.307974,192.0.77.40,100.86.87.79,TLSv1.3,1514,Continuation Data,2
241,0.307974,192.0.77.40,100.86.87.79,TLSv1.3,1514,Continuation Data,2
242,0.307974,192.0.77.40,100.86.87.79,TLSv1.3,1514,Continuation Data,2
243,0.307974,192.0.77.40,100.86.87.79,TLSv1.3,1514,Continuation Data,2
244,0.307974,192.0.77.40,100.86.87.79,TLSv1.3,1514,Continuation Data,2
245,0.307974,192.0.77.40,100.86.87.79,TLSv1.3,1514,Continuation Data,2
246,0.307974,192.0.77.40,100.86.87.79,TLSv1.3,1514,Continuation Data,2
247,0.307974,192.0.77.40,100.86.87.79,TLSv1.3,1514,Continuation Data,2
248,0.307974,192.0.77.40,100.86.87.79,TLSv1.3,1514,Continuation Data,2
249,0.308411,100.86.87.79,192.0.77.40,TCP,66,[TCP Dup ACK 221#1] 61495  >  443 [ACK] Seq=5098 Ack=92792 Win=131328 Len=0 SLE=98632 SRE=100092,2
250,0.308464,100.86.87.79,192.0.77.40,TCP,66,[TCP Dup ACK 221#2] 61495  >  443 [ACK] Seq=5098 Ack=92792 Win=131328 Len=0 SLE=98632 SRE=101552,2
251,0.308496,100.86.87.79,192.0.77.40,TCP,66,[TCP Dup ACK 221#3] 61495  >  443 [ACK] Seq=5098 Ack=92792 Win=131328 Len=0 SLE=98632 SRE=103012,2
252,0.308515,100.86.87.79,192.0.77.40,TCP,66,[TCP Dup ACK 221#4] 61495  >  443 [ACK] Seq=5098 Ack=92792 Win=131328 Len=0 SLE=98632 SRE=104472,2
253,0.308533,100.86.87.79,192.0.77.40,TCP,66,[TCP Dup ACK 221#5] 61495  >  443 [ACK] Seq=5098 Ack=92792 Win=131328 Len=0 SLE=98632 SRE=105932,2
254,0.30855,100.86.87.79,192.0.77.40,TCP,66,[TCP Dup ACK 221#6] 61495  >  443 [ACK] Seq=5098 Ack=92792 Win=131328 Len=0 SLE=98632 SRE=107392,2
255,0.30857,100.86.87.79,192.0.77.40,TCP,66,[TCP Dup ACK 221#7] 61495  >  443 [ACK] Seq=5098 Ack=92792 Win=131328 Len=0 SLE=98632 SRE=108852,2
256,0.308612,100.86.87.79,192.0.77.40,TCP,66,[TCP Dup ACK 221#8] 61495  >  443 [ACK] Seq=5098 Ack=92792 Win=131328 Len=0 SLE=98632 SRE=110312,2
257,0.308629,100.86.87.79,192.0.77.40,TCP,66,[TCP Dup ACK 221#9] 61495  >  443 [ACK] Seq=5098 Ack=92792 Win=131328 Len=0 SLE=98632 SRE=111772,2
258,0.308651,100.86.87.79,192.0.77.40,TCP,66,[TCP Dup ACK 221#10] 61495  >  443 [ACK] Seq=5098 Ack=92792 Win=131328 Len=0 SLE=98632 SRE=113232,2
259,0.30867,100.86.87.79,192.0.77.40,TCP,66,[TCP Dup ACK 221#11] 61495  >  443 [ACK] Seq=5098 Ack=92792 Win=131328 Len=0 SLE=98632 SRE=114692,2
260,0.308689,100.86.87.79,192.0.77.40,TCP,66,[TCP Dup ACK 221#12] 61495  >  443 [ACK] Seq=5098 Ack=92792 Win=131328 Len=0 SLE=98632 SRE=116152,2
261,0.308708,100.86.87.79,192.0.77.40,TCP,66,[TCP Dup ACK 221#13] 61495  >  443 [ACK] Seq=5098 Ack=92792 Win=131328 Len=0 SLE=98632 SRE=117612,2
262,0.308727,100.86.87.79,192.0.77.40,TCP,66,[TCP Dup ACK 221#14] 61495  >  443 [ACK] Seq=5098 Ack=92792 Win=131328 Len=0 SLE=98632 SRE=119072,2
263,0.308779,100.86.87.79,192.0.77.40,TCP,66,[TCP Dup ACK 221#15] 61495  >  443 [ACK] Seq=5098 Ack=92792 Win=131328 Len=0 SLE=98632 SRE=120532,2
264,0.308797,100.86.87.79,192.0.77.40,TCP,66,[TCP Dup ACK 221#16] 61495  >  443 [ACK] Seq=5098 Ack=92792 Win=131328 Len=0 SLE=98632 SRE=121992,2
265,0.308815,100.86.87.79,192.0.77.40,TCP,66,[TCP Dup ACK 221#17] 61495  >  443 [ACK] Seq=5098 Ack=92792 Win=131328 Len=0 SLE=98632 SRE=123452,2
266,0.308834,100.86.87.79,192.0.77.40,TCP,66,[TCP Dup ACK 221#18] 61495  >  443 [ACK] Seq=5098 Ack=92792 Win=131328 Len=0 SLE=98632 SRE=124912,2
267,0.308851,100.86.87.79,192.0.77.40,TCP,66,[TCP Dup ACK 221#19] 61495  >  443 [ACK] Seq=5098 Ack=92792 Win=131328 Len=0 SLE=98632 SRE=126372,2
268,0.308872,100.86.87.79,192.0.77.40,TCP,66,[TCP Dup ACK 221#20] 61495  >  443 [ACK] Seq=5098 Ack=92792 Win=131328 Len=0 SLE=98632 SRE=127832,2
269,0.308889,100.86.87.79,192.0.77.40,TCP,66,[TCP Dup ACK 221#21] 61495  >  443 [ACK] Seq=5098 Ack=92792 Win=131328 Len=0 SLE=98632 SRE=129292,2
270,0.308906,100.86.87.79,192.0.77.40,TCP,66,[TCP Dup ACK 221#22] 61495  >  443 [ACK] Seq=5098 Ack=92792 Win=131328 Len=0 SLE=98632 SRE=130752,2
271,0.308943,100.86.87.79,192.0.77.40,TCP,66,[TCP Dup ACK 221#23] 61495  >  443 [ACK] Seq=5098 Ack=92792 Win=131328 Len=0 SLE=98632 SRE=132212,2
272,0.30896,100.86.87.79,192.0.77.40,TCP,66,[TCP Dup ACK 221#24] 61495  >  443 [ACK] Seq=5098 Ack=92792 Win=131328 Len=0 SLE=98632 SRE=133672,2
273,0.308977,100.86.87.79,192.0.77.40,TCP,66,[TCP Dup ACK 221#25] 61495  >  443 [ACK] Seq=5098 Ack=92792 Win=131328 Len=0 SLE=98632 SRE=135132,2
274,0.308993,100.86.87.79,192.0.77.40,TCP,66,[TCP Dup ACK 221#26] 61495  >  443 [ACK] Seq=5098 Ack=92792 Win=131328 Len=0 SLE=98632 SRE=136592,2
275,0.311937,192.0.77.40,100.86.87.79,TLSv1.3,1514,Continuation Data,2
276,0.311937,192.0.77.40,100.86.87.79,TLSv1.3,1514,Continuation Data,2
277,0.311937,192.0.77.40,100.86.87.79,TLSv1.3,1514,Continuation Data,2
278,0.311937,192.0.77.40,100.86.87.79,TLSv1.3,1514,Continuation Data,2
279,0.311937,192.0.77.40,100.86.87.79,TLSv1.3,1514,Continuation Data,2
280,0.311937,192.0.77.40,100.86.87.79,TLSv1.3,1514,Continuation Data,2
281,0.311937,192.0.77.40,100.86.87.79,TLSv1.3,1514,Continuation Data,2
282,0.311937,192.0.77.40,100.86.87.79,TLSv1.3,1514,Continuation Data,2
283,0.312092,100.86.87.79,192.0.77.40,TCP,66,[TCP Dup ACK 221#27] 61495  >  443 [ACK] Seq=5098 Ack=92792 Win=131328 Len=0 SLE=98632 SRE=138052,2
284,0.312158,100.86.87.79,192.0.77.40,TCP,66,[TCP Dup ACK 221#28] 61495  >  443 [ACK] Seq=5098 Ack=92792 Win=131328 Len=0 SLE=98632 SRE=139512,2
285,0.312202,100.86.87.79,192.0.77.40,TCP,66,[TCP Dup ACK 221#29] 61495  >  443 [ACK] Seq=5098 Ack=92792 Win=131328 Len=0 SLE=98632 SRE=140972,2
286,0.312224,100.86.87.79,192.0.77.40,TCP,66,[TCP Dup ACK 221#30] 61495  >  443 [ACK] Seq=5098 Ack=92792 Win=131328 Len=0 SLE=98632 SRE=142432,2
287,0.312246,100.86.87.79,192.0.77.40,TCP,66,[TCP Dup ACK 221#31] 61495  >  443 [ACK] Seq=5098 Ack=92792 Win=131328 Len=0 SLE=98632 SRE=143892,2
288,0.312269,100.86.87.79,192.0.77.40,TCP,66,[TCP Dup ACK 221#32] 61495  >  443 [ACK] Seq=5098 Ack=92792 Win=131328 Len=0 SLE=98632 SRE=145352,2
289,0.312292,100.86.87.79,192.0.77.40,TCP,66,[TCP Dup ACK 221#33] 61495  >  443 [ACK] Seq=5098 Ack=92792 Win=131328 Len=0 SLE=98632 SRE=146812,2
290,0.312336,100.86.87.79,192.0.77.40,TCP,66,[TCP Dup ACK 221#34] 61495  >  443 [ACK] Seq=5098 Ack=92792 Win=131328 Len=0 SLE=98632 SRE=148272,2
291,0.312844,192.0.77.40,100.86.87.79,TLSv1.3,1514,Continuation Data,2
292,0.312844,192.0.77.40,100.86.87.79,TLSv1.3,1514,Continuation Data,2
293,0.312844,192.0.77.40,100.86.87.79,TLSv1.3,1514,Continuation Data,2
294,0.312844,192.0.77.40,100.86.87.79,TLSv1.3,1514,Continuation Data,2
295,0.312844,192.0.77.40,100.86.87.79,TLSv1.3,1514,Continuation Data,2
296,0.312844,192.0.77.40,100.86.87.79,TLSv1.3,1514,Continuation Data,2
297,0.312844,192.0.77.40,100.86.87.79,TLSv1.3,1514,Continuation Data,2
298,0.312844,192.0.77.40,100.86.87.79,TLSv1.3,1514,Continuation Data,2
299,0.312844,192.0.77.40,100.86.87.79,TLSv1.3,1514,Continuation Data,2
300,0.312844,192.0.77.40,100.86.87.79,TLSv1.3,1514,Continuation Data,2
301,0.312844,192.0.77.40,100.86.87.79,TLSv1.3,1514,Continuation Data,2
302,0.312844,192.0.77.40,100.86.87.79,TLSv1.3,1514,Continuation Data,2
303,0.313011,100.86.87.79,192.0.77.40,TCP,66,[TCP Dup ACK 221#35] 61495  >  443 [ACK] Seq=5098 Ack=92792 Win=131328 Len=0 SLE=98632 SRE=149732,2
304,0.313056,100.86.87.79,192.0.77.40,TCP,66,[TCP Dup ACK 221#36] 61495  >  443 [ACK] Seq=5098 Ack=92792 Win=131328 Len=0 SLE=98632 SRE=151192,2
305,0.313076,100.86.87.79,192.0.77.40,TCP,66,[TCP Dup ACK 221#37] 61495  >  443 [ACK] Seq=5098 Ack=92792 Win=131328 Len=0 SLE=98632 SRE=152652,2
306,0.313096,100.86.87.79,192.0.77.40,TCP,66,[TCP Dup ACK 221#38] 61495  >  443 [ACK] Seq=5098 Ack=92792 Win=131328 Len=0 SLE=98632 SRE=154112,2
307,0.31313,100.86.87.79,192.0.77.40,TCP,66,[TCP Dup ACK 221#39] 61495  >  443 [ACK] Seq=5098 Ack=92792 Win=131328 Len=0 SLE=98632 SRE=155572,2
308,0.313148,100.86.87.79,192.0.77.40,TCP,66,[TCP Dup ACK 221#40] 61495  >  443 [ACK] Seq=5098 Ack=92792 Win=131328 Len=0 SLE=98632 SRE=157032,2
309,0.313167,100.86.87.79,192.0.77.40,TCP,66,[TCP Dup ACK 221#41] 61495  >  443 [ACK] Seq=5098 Ack=92792 Win=131328 Len=0 SLE=98632 SRE=158492,2
310,0.313187,100.86.87.79,192.0.77.40,TCP,66,[TCP Dup ACK 221#42] 61495  >  443 [ACK] Seq=5098 Ack=92792 Win=131328 Len=0 SLE=98632 SRE=159952,2
311,0.313226,100.86.87.79,192.0.77.40,TCP,66,[TCP Dup ACK 221#43] 61495  >  443 [ACK] Seq=5098 Ack=92792 Win=131328 Len=0 SLE=98632 SRE=161412,2
312,0.313244,100.86.87.79,192.0.77.40,TCP,66,[TCP Dup ACK 221#44] 61495  >  443 [ACK] Seq=5098 Ack=92792 Win=131328 Len=0 SLE=98632 SRE=162872,2
313,0.313265,100.86.87.79,192.0.77.40,TCP,66,[TCP Dup ACK 221#45] 61495  >  443 [ACK] Seq=5098 Ack=92792 Win=131328 Len=0 SLE=98632 SRE=164332,2
314,0.313288,100.86.87.79,192.0.77.40,TCP,66,[TCP Dup ACK 221#46] 61495  >  443 [ACK] Seq=5098 Ack=92792 Win=131328 Len=0 SLE=98632 SRE=165792,2
315,0.322281,192.0.77.40,100.86.87.79,TLSv1.3,1514,"[TCP Fast Retransmission] , Continuation Data",2
316,0.322281,192.0.77.40,100.86.87.79,TCP,2974,[TCP Out-Of-Order] 443  >  61495 [ACK] Seq=94252 Ack=5098 Win=42496 Len=2920,2
317,0.32241,100.86.87.79,192.0.77.40,TCP,66,61495  >  443 [ACK] Seq=5098 Ack=94252 Win=131328 Len=0 SLE=98632 SRE=165792,2
318,0.322487,100.86.87.79,192.0.77.40,TCP,66,61495  >  443 [ACK] Seq=5098 Ack=97172 Win=131328 Len=0 SLE=98632 SRE=165792,2
319,0.3228,192.0.77.40,100.86.87.79,TCP,1514,[TCP Out-Of-Order] 443  >  61495 [ACK] Seq=97172 Ack=5098 Win=42496 Len=1460,2
320,0.3228,192.0.77.40,100.86.87.79,TLSv1.3,1514,Continuation Data,2
321,0.322924,100.86.87.79,192.0.77.40,TCP,54,61495  >  443 [ACK] Seq=5098 Ack=165792 Win=131328 Len=0,2
322,0.32303,100.86.87.79,192.0.77.40,TCP,54,61495  >  443 [ACK] Seq=5098 Ack=167252 Win=131328 Len=0,2
323,0.325229,192.0.77.40,100.86.87.79,TLSv1.3,14654,Continuation Data,2
324,0.325313,100.86.87.79,192.0.77.40,TCP,54,61495  >  443 [ACK] Seq=5098 Ack=181852 Win=131328 Len=0,2
325,0.325967,192.0.77.40,100.86.87.79,TLSv1.3,8814,Continuation Data,2
326,0.326033,100.86.87.79,192.0.77.40,TCP,54,61495  >  443 [ACK] Seq=5098 Ack=190612 Win=131328 Len=0,2
327,0.32961,192.0.77.40,100.86.87.79,TLSv1.3,5894,Continuation Data,2
328,0.329677,100.86.87.79,192.0.77.40,TCP,54,61495  >  443 [ACK] Seq=5098 Ack=196452 Win=131328 Len=0,2
329,0.332528,192.0.77.40,100.86.87.79,TLSv1.3,2974,Continuation Data,2
330,0.332605,100.86.87.79,192.0.77.40,TCP,54,61495  >  443 [ACK] Seq=5098 Ack=199372 Win=131328 Len=0,2
331,0.339266,192.0.77.40,100.86.87.79,TLSv1.3,1514,Continuation Data,2
332,0.339266,192.0.77.40,100.86.87.79,TLSv1.3,1514,Continuation Data,2
333,0.339266,192.0.77.40,100.86.87.79,TLSv1.3,1514,Continuation Data,2
334,0.339266,192.0.77.40,100.86.87.79,TLSv1.3,1514,Continuation Data,2
335,0.339266,192.0.77.40,100.86.87.79,TLSv1.3,1514,Continuation Data,2
336,0.339266,192.0.77.40,100.86.87.79,TLSv1.3,1514,Continuation Data,2
337,0.339266,192.0.77.40,100.86.87.79,TLSv1.3,1514,"[TCP Previous segment not captured] , Continuation Data",2
338,0.339266,192.0.77.40,100.86.87.79,TLSv1.3,1514,Continuation Data,2
339,0.339266,192.0.77.40,100.86.87.79,TLSv1.3,1514,Continuation Data,2
340,0.339266,192.0.77.40,100.86.87.79,TLSv1.3,1514,Continuation Data,2
341,0.339266,192.0.77.40,100.86.87.79,TLSv1.3,477,Continuation Data,2
342,0.339266,192.0.77.40,100.86.87.79,TCP,1514,443  >  61495 [ACK] Seq=215855 Ack=5098 Win=42496 Len=1460 [TCP segment of a reassembled PDU],2
343,0.339266,192.0.77.40,100.86.87.79,TCP,1514,443  >  61495 [ACK] Seq=217315 Ack=5098 Win=42496 Len=1460 [TCP segment of a reassembled PDU],2
344,0.339266,192.0.77.40,100.86.87.79,TLSv1.3,1385,Application Data,2
345,0.339266,192.0.77.40,100.86.87.79,TCP,2974,443  >  61495 [ACK] Seq=220106 Ack=5098 Win=42496 Len=2920 [TCP segment of a reassembled PDU],2
346,0.339526,100.86.87.79,192.0.77.40,TCP,66,61495  >  443 [ACK] Seq=5098 Ack=208132 Win=131328 Len=0 SLE=209592 SRE=211052,2
347,0.339582,100.86.87.79,192.0.77.40,TCP,66,[TCP Dup ACK 346#1] 61495  >  443 [ACK] Seq=5098 Ack=208132 Win=131328 Len=0 SLE=209592 SRE=212512,2
348,0.33961,100.86.87.79,192.0.77.40,TCP,66,[TCP Dup ACK 346#2] 61495  >  443 [ACK] Seq=5098 Ack=208132 Win=131328 Len=0 SLE=209592 SRE=213972,2
349,0.339638,100.86.87.79,192.0.77.40,TCP,66,[TCP Dup ACK 346#3] 61495  >  443 [ACK] Seq=5098 Ack=208132 Win=131328 Len=0 SLE=209592 SRE=215432,2
350,0.339659,100.86.87.79,192.0.77.40,TCP,66,[TCP Dup ACK 346#4] 61495  >  443 [ACK] Seq=5098 Ack=208132 Win=131328 Len=0 SLE=209592 SRE=215855,2
351,0.33968,100.86.87.79,192.0.77.40,TCP,66,[TCP Dup ACK 346#5] 61495  >  443 [ACK] Seq=5098 Ack=208132 Win=131328 Len=0 SLE=209592 SRE=217315,2
352,0.339701,100.86.87.79,192.0.77.40,TCP,66,[TCP Dup ACK 346#6] 61495  >  443 [ACK] Seq=5098 Ack=208132 Win=131328 Len=0 SLE=209592 SRE=218775,2
353,0.339721,100.86.87.79,192.0.77.40,TCP,66,[TCP Dup ACK 346#7] 61495  >  443 [ACK] Seq=5098 Ack=208132 Win=131328 Len=0 SLE=209592 SRE=220106,2
354,0.339743,100.86.87.79,192.0.77.40,TCP,66,[TCP Dup ACK 346#8] 61495  >  443 [ACK] Seq=5098 Ack=208132 Win=131328 Len=0 SLE=209592 SRE=223026,2
355,0.340186,192.0.77.40,100.86.87.79,TLSv1.3,23414,"Application Data, Application Data, Application Data",2
356,0.340303,100.86.87.79,192.0.77.40,TCP,66,[TCP Dup ACK 346#9] 61495  >  443 [ACK] Seq=5098 Ack=208132 Win=131328 Len=0 SLE=209592 SRE=246386,2
357,0.341952,192.0.77.40,100.86.87.79,TCP,8814,443  >  61495 [ACK] Seq=246386 Ack=5098 Win=42496 Len=8760 [TCP segment of a reassembled PDU],2
358,0.341991,100.86.87.79,192.0.77.40,TCP,66,[TCP Dup ACK 346#10] 61495  >  443 [ACK] Seq=5098 Ack=208132 Win=131328 Len=0 SLE=209592 SRE=255146,2
359,0.342994,192.0.77.40,100.86.87.79,TCP,1514,443  >  61495 [ACK] Seq=255146 Ack=5098 Win=42496 Len=1460 [TCP segment of a reassembled PDU],2
360,0.342994,192.0.77.40,100.86.87.79,TCP,1514,443  >  61495 [ACK] Seq=256606 Ack=5098 Win=42496 Len=1460 [TCP segment of a reassembled PDU],2
361,0.342994,192.0.77.40,100.86.87.79,TLSv1.3,11734,Application Data,2
362,0.343082,100.86.87.79,192.0.77.40,TCP,66,[TCP Dup ACK 346#11] 61495  >  443 [ACK] Seq=5098 Ack=208132 Win=131328 Len=0 SLE=209592 SRE=256606,2
363,0.343127,100.86.87.79,192.0.77.40,TCP,66,[TCP Dup ACK 346#12] 61495  >  443 [ACK] Seq=5098 Ack=208132 Win=131328 Len=0 SLE=209592 SRE=258066,2
364,0.343156,100.86.87.79,192.0.77.40,TCP,66,[TCP Dup ACK 346#13] 61495  >  443 [ACK] Seq=5098 Ack=208132 Win=131328 Len=0 SLE=209592 SRE=269746,2
365,0.344466,192.0.77.40,100.86.87.79,TLSv1.3,11734,Application Data,2
366,0.344536,100.86.87.79,192.0.77.40,TCP,66,[TCP Dup ACK 346#14] 61495  >  443 [ACK] Seq=5098 Ack=208132 Win=131328 Len=0 SLE=209592 SRE=281426,2
367,0.345779,192.0.77.40,100.86.87.79,TCP,5894,443  >  61495 [ACK] Seq=281426 Ack=5098 Win=42496 Len=5840 [TCP segment of a reassembled PDU],2
368,0.345828,100.86.87.79,192.0.77.40,TCP,66,[TCP Dup ACK 346#15] 61495  >  443 [ACK] Seq=5098 Ack=208132 Win=131328 Len=0 SLE=209592 SRE=287266,2
369,0.346084,192.0.77.40,100.86.87.79,TCP,1514,443  >  61495 [ACK] Seq=287266 Ack=5098 Win=42496 Len=1460 [TCP segment of a reassembled PDU],2
370,0.346134,100.86.87.79,192.0.77.40,TCP,66,[TCP Dup ACK 346#16] 61495  >  443 [ACK] Seq=5098 Ack=208132 Win=131328 Len=0 SLE=209592 SRE=288726,2
371,0.35422,192.0.77.40,100.86.87.79,TCP,1514,443  >  61495 [ACK] Seq=288726 Ack=5098 Win=42496 Len=1460 [TCP segment of a reassembled PDU],2
372,0.354271,100.86.87.79,192.0.77.40,TCP,66,[TCP Dup ACK 346#17] 61495  >  443 [ACK] Seq=5098 Ack=208132 Win=131328 Len=0 SLE=209592 SRE=290186,2
373,0.356547,192.0.77.40,100.86.87.79,TCP,2974,443  >  61495 [ACK] Seq=290186 Ack=5098 Win=42496 Len=2920 [TCP segment of a reassembled PDU],2
374,0.3566,100.86.87.79,192.0.77.40,TCP,66,[TCP Dup ACK 346#18] 61495  >  443 [ACK] Seq=5098 Ack=208132 Win=131328 Len=0 SLE=209592 SRE=293106,2
375,0.358932,192.0.77.40,100.86.87.79,TLSv1.3,1514,Application Data,2
376,0.358932,192.0.77.40,100.86.87.79,TCP,1514,443  >  61495 [ACK] Seq=294566 Ack=5098 Win=42496 Len=1460 [TCP segment of a reassembled PDU],2
377,0.358932,192.0.77.40,100.86.87.79,TCP,1514,443  >  61495 [ACK] Seq=296026 Ack=5098 Win=42496 Len=1460 [TCP segment of a reassembled PDU],2
378,0.358932,192.0.77.40,100.86.87.79,TCP,1514,443  >  61495 [ACK] Seq=297486 Ack=5098 Win=42496 Len=1460 [TCP segment of a reassembled PDU],2
379,0.359054,100.86.87.79,192.0.77.40,TCP,66,[TCP Dup ACK 346#19] 61495  >  443 [ACK] Seq=5098 Ack=208132 Win=131328 Len=0 SLE=209592 SRE=294566,2
380,0.3591,100.86.87.79,192.0.77.40,TCP,66,[TCP Dup ACK 346#20] 61495  >  443 [ACK] Seq=5098 Ack=208132 Win=131328 Len=0 SLE=209592 SRE=296026,2
381,0.359128,100.86.87.79,192.0.77.40,TCP,66,[TCP Dup ACK 346#21] 61495  >  443 [ACK] Seq=5098 Ack=208132 Win=131328 Len=0 SLE=209592 SRE=297486,2
382,0.359154,100.86.87.79,192.0.77.40,TCP,66,[TCP Dup ACK 346#22] 61495  >  443 [ACK] Seq=5098 Ack=208132 Win=131328 Len=0 SLE=209592 SRE=298946,2
383,0.371084,192.0.77.40,100.86.87.79,TCP,1514,443  >  61495 [ACK] Seq=298946 Ack=5098 Win=42496 Len=1460 [TCP segment of a reassembled PDU],2
384,0.371084,192.0.77.40,100.86.87.79,TLSv1.3,1514,"[TCP Fast Retransmission] , Continuation Data",2
385,0.371084,192.0.77.40,100.86.87.79,TLSv1.3,38014,"Application Data, Application Data",2
386,0.371195,100.86.87.79,192.0.77.40,TCP,66,[TCP Dup ACK 346#23] 61495  >  443 [ACK] Seq=5098 Ack=208132 Win=131328 Len=0 SLE=209592 SRE=300406,2
387,0.371282,100.86.87.79,192.0.77.40,TCP,54,61495  >  443 [ACK] Seq=5098 Ack=300406 Win=131328 Len=0,2
388,0.371343,100.86.87.79,192.0.77.40,TCP,54,61495  >  443 [ACK] Seq=5098 Ack=338366 Win=93440 Len=0,2
389,0.371428,100.86.87.79,192.0.77.40,TCP,54,[TCP Window Update] 61495  >  443 [ACK] Seq=5098 Ack=338366 Win=131328 Len=0,2
390,0.375517,192.0.77.40,100.86.87.79,TCP,1148,443  >  61495 [ACK] Seq=338366 Ack=5098 Win=42496 Len=1094 [TCP segment of a reassembled PDU],2
391,0.384283,192.0.77.40,100.86.87.79,TCP,1514,443  >  61495 [ACK] Seq=339460 Ack=5098 Win=42496 Len=1460 [TCP segment of a reassembled PDU],2
392,0.384387,100.86.87.79,192.0.77.40,TCP,54,61495  >  443 [ACK] Seq=5098 Ack=340920 Win=131328 Len=0,2
393,0.384666,192.0.77.40,100.86.87.79,TLSv1.3,2974,Application Data,2
394,0.384749,100.86.87.79,192.0.77.40,TCP,54,61495  >  443 [ACK] Seq=5098 Ack=343840 Win=131328 Len=0,2
395,0.385838,192.0.77.40,100.86.87.79,TCP,8814,443  >  61495 [ACK] Seq=343840 Ack=5098 Win=42496 Len=8760 [TCP segment of a reassembled PDU],2
396,0.385904,100.86.87.79,192.0.77.40,TCP,54,61495  >  443 [ACK] Seq=5098 Ack=352600 Win=131328 Len=0,2
