"No.","Time","Source","Destination","Protocol","Length","Info"
"1","0.000000","100.86.111.80","23.61.11.185","TCP","66","51454  >  443 [SYN] Seq=0 Win=64240 Len=0 MSS=1460 WS=256 SACK_PERM"
"2","0.011853","23.61.11.185","100.86.111.80","TCP","66","443  >  51454 [SYN, ACK] Seq=0 Ack=1 Win=64240 Len=0 MSS=1460 SACK_PERM WS=128"
"3","0.012135","100.86.111.80","23.61.11.185","TCP","54","51454  >  443 [ACK] Seq=1 Ack=1 Win=65536 Len=0"
"4","0.014228","100.86.111.80","23.61.11.185","TCP","1514","51454  >  443 [ACK] Seq=1 Ack=1 Win=65536 Len=1460 [TCP segment of a reassembled PDU]"
"5","0.014228","100.86.111.80","23.61.11.185","TLSv1.3","358","Client Hello (SNI=rubicon.wellsfargo.com)"
"6","0.024797","23.61.11.185","100.86.111.80","TCP","56","443  >  51454 [ACK] Seq=1 Ack=1765 Win=63360 Len=0"
"7","0.029132","23.61.11.185","100.86.111.80","TLSv1.3","1514","Server Hello, Change Cipher Spec, Application Data"
"8","0.029132","23.61.11.185","100.86.111.80","TCP","1514","443  >  51454 [PSH, ACK] Seq=1461 Ack=1765 Win=64128 Len=1460 [TCP segment of a reassembled PDU]"
"9","0.029416","100.86.111.80","23.61.11.185","TCP","54","51454  >  443 [ACK] Seq=1765 Ack=2921 Win=65536 Len=0"
"10","0.029526","23.61.11.185","100.86.111.80","TLSv1.3","1230","Application Data, Application Data"
"11","0.029526","23.61.11.185","100.86.111.80","TLSv1.3","92","Application Data"
"12","0.029727","100.86.111.80","23.61.11.185","TCP","54","51454  >  443 [ACK] Seq=1765 Ack=4135 Win=64256 Len=0"
"13","0.037240","100.86.111.80","23.61.11.185","TLSv1.3","134","Change Cipher Spec, Application Data"
"14","0.039279","100.86.111.80","23.61.11.185","TCP","1514","51454  >  443 [ACK] Seq=1845 Ack=4135 Win=64256 Len=1460 [TCP segment of a reassembled PDU]"
"15","0.039279","100.86.111.80","23.61.11.185","TLSv1.3","1221","Application Data"
"16","0.051150","23.61.11.185","100.86.111.80","TLSv1.3","357","Application Data"
"17","0.051150","23.61.11.185","100.86.111.80","TLSv1.3","357","Application Data"
"18","0.051414","100.86.111.80","23.61.11.185","TCP","54","51454  >  443 [ACK] Seq=4472 Ack=4741 Win=65536 Len=0"
"19","0.051533","23.61.11.185","100.86.111.80","TCP","56","443  >  51454 [ACK] Seq=4741 Ack=4472 Win=63360 Len=0"
"20","0.122297","23.61.11.185","100.86.111.80","TCP","1514","443  >  51454 [ACK] Seq=4741 Ack=4472 Win=64128 Len=1460 [TCP segment of a reassembled PDU]"
"21","0.122297","23.61.11.185","100.86.111.80","TLSv1.3","816","Application Data"
"22","0.122587","100.86.111.80","23.61.11.185","TCP","54","51454  >  443 [ACK] Seq=4472 Ack=6963 Win=65536 Len=0"
"23","0.832392","100.86.111.80","23.61.11.185","TCP","1514","51454  >  443 [ACK] Seq=4472 Ack=6963 Win=65536 Len=1460 [TCP segment of a reassembled PDU]"
"24","0.832392","100.86.111.80","23.61.11.185","TCP","1514","51454  >  443 [ACK] Seq=5932 Ack=6963 Win=65536 Len=1460 [TCP segment of a reassembled PDU]"
"25","0.832392","100.86.111.80","23.61.11.185","TLSv1.3","1514","Application Data"
"26","0.832392","100.86.111.80","23.61.11.185","TCP","1514","51454  >  443 [ACK] Seq=8852 Ack=6963 Win=65536 Len=1460 [TCP segment of a reassembled PDU]"
"27","0.832392","100.86.111.80","23.61.11.185","TCP","1514","51454  >  443 [ACK] Seq=10312 Ack=6963 Win=65536 Len=1460 [TCP segment of a reassembled PDU]"
"28","0.832392","100.86.111.80","23.61.11.185","TCP","1514","51454  >  443 [ACK] Seq=11772 Ack=6963 Win=65536 Len=1460 [TCP segment of a reassembled PDU]"
"29","0.832392","100.86.111.80","23.61.11.185","TCP","1514","51454  >  443 [ACK] Seq=13232 Ack=6963 Win=65536 Len=1460 [TCP segment of a reassembled PDU]"
"30","0.832392","100.86.111.80","23.61.11.185","TCP","1514","51454  >  443 [ACK] Seq=14692 Ack=6963 Win=65536 Len=1460 [TCP segment of a reassembled PDU]"
"31","0.832392","100.86.111.80","23.61.11.185","TCP","1514","51454  >  443 [ACK] Seq=16152 Ack=6963 Win=65536 Len=1460 [TCP segment of a reassembled PDU]"
"32","0.832392","100.86.111.80","23.61.11.185","TLSv1.3","163","Application Data"
"33","0.845367","23.61.11.185","100.86.111.80","TCP","56","443  >  51454 [ACK] Seq=6963 Ack=7392 Win=64128 Len=0"
"34","0.873833","100.86.111.80","23.61.11.185","TCP","1514","[TCP Retransmission] 51454  >  443 [PSH, ACK] Seq=16261 Ack=6963 Win=65536 Len=1460 [TCP segment of a reassembled PDU]"
"35","0.883879","23.61.11.185","100.86.111.80","TCP","56","443  >  51454 [ACK] Seq=6963 Ack=17721 Win=57216 Len=0"
"36","0.903750","23.61.11.185","100.86.111.80","TCP","66","[TCP Window Update] 443  >  51454 [ACK] Seq=6963 Ack=17721 Win=64128 Len=0 SLE=16261 SRE=17721"
"37","0.950345","23.61.11.185","100.86.111.80","TCP","1514","443  >  51454 [ACK] Seq=6963 Ack=17721 Win=64128 Len=1460 [TCP segment of a reassembled PDU]"
"38","0.951889","23.61.11.185","100.86.111.80","TLSv1.3","487","Application Data"
"39","0.952127","100.86.111.80","23.61.11.185","TCP","54","51454  >  443 [ACK] Seq=17721 Ack=8856 Win=65536 Len=0"
"40","10.459852","100.86.111.80","23.61.11.185","TCP","1514","51454  >  443 [ACK] Seq=17721 Ack=8856 Win=65536 Len=1460 [TCP segment of a reassembled PDU]"
"41","10.459852","100.86.111.80","23.61.11.185","TCP","1514","51454  >  443 [ACK] Seq=19181 Ack=8856 Win=65536 Len=1460 [TCP segment of a reassembled PDU]"
"42","10.459852","100.86.111.80","23.61.11.185","TLSv1.3","1096","Application Data"
"43","10.460010","100.86.111.80","23.61.11.185","TCP","1514","51454  >  443 [ACK] Seq=21683 Ack=8856 Win=65536 Len=1460 [TCP segment of a reassembled PDU]"
"44","10.460010","100.86.111.80","23.61.11.185","TCP","1514","51454  >  443 [ACK] Seq=23143 Ack=8856 Win=65536 Len=1460 [TCP segment of a reassembled PDU]"
"45","10.460010","100.86.111.80","23.61.11.185","TCP","1514","51454  >  443 [ACK] Seq=24603 Ack=8856 Win=65536 Len=1460 [TCP segment of a reassembled PDU]"
"46","10.460010","100.86.111.80","23.61.11.185","TCP","1514","51454  >  443 [ACK] Seq=26063 Ack=8856 Win=65536 Len=1460 [TCP segment of a reassembled PDU]"
"47","10.460010","100.86.111.80","23.61.11.185","TCP","1514","51454  >  443 [ACK] Seq=27523 Ack=8856 Win=65536 Len=1460 [TCP segment of a reassembled PDU]"
"48","10.460010","100.86.111.80","23.61.11.185","TCP","1514","51454  >  443 [ACK] Seq=28983 Ack=8856 Win=65536 Len=1460 [TCP segment of a reassembled PDU]"
"49","10.460010","100.86.111.80","23.61.11.185","TCP","1514","51454  >  443 [ACK] Seq=30443 Ack=8856 Win=65536 Len=1460 [TCP segment of a reassembled PDU]"
"50","10.460010","100.86.111.80","23.61.11.185","TCP","1514","51454  >  443 [ACK] Seq=31903 Ack=8856 Win=65536 Len=1460 [TCP segment of a reassembled PDU]"
"51","10.460010","100.86.111.80","23.61.11.185","TCP","1514","51454  >  443 [ACK] Seq=33363 Ack=8856 Win=65536 Len=1460 [TCP segment of a reassembled PDU]"
"52","10.460010","100.86.111.80","23.61.11.185","TCP","1514","51454  >  443 [ACK] Seq=34823 Ack=8856 Win=65536 Len=1460 [TCP segment of a reassembled PDU]"
"53","10.460010","100.86.111.80","23.61.11.185","TCP","1514","51454  >  443 [ACK] Seq=36283 Ack=8856 Win=65536 Len=1460 [TCP segment of a reassembled PDU]"
"54","10.460010","100.86.111.80","23.61.11.185","TLSv1.3","1514","Application Data"
"55","10.460010","100.86.111.80","23.61.11.185","TCP","1514","51454  >  443 [ACK] Seq=39203 Ack=8856 Win=65536 Len=1460 [TCP segment of a reassembled PDU]"
"56","10.460010","100.86.111.80","23.61.11.185","TCP","1514","51454  >  443 [ACK] Seq=40663 Ack=8856 Win=65536 Len=1460 [TCP segment of a reassembled PDU]"
"57","10.460010","100.86.111.80","23.61.11.185","TCP","1514","51454  >  443 [ACK] Seq=42123 Ack=8856 Win=65536 Len=1460 [TCP segment of a reassembled PDU]"
"58","10.460010","100.86.111.80","23.61.11.185","TCP","1514","51454  >  443 [ACK] Seq=43583 Ack=8856 Win=65536 Len=1460 [TCP segment of a reassembled PDU]"
"59","10.460010","100.86.111.80","23.61.11.185","TCP","1514","51454  >  443 [ACK] Seq=45043 Ack=8856 Win=65536 Len=1460 [TCP segment of a reassembled PDU]"
"60","10.460010","100.86.111.80","23.61.11.185","TCP","1514","51454  >  443 [ACK] Seq=46503 Ack=8856 Win=65536 Len=1460 [TCP segment of a reassembled PDU]"
"61","10.460010","100.86.111.80","23.61.11.185","TCP","1514","51454  >  443 [ACK] Seq=47963 Ack=8856 Win=65536 Len=1460 [TCP segment of a reassembled PDU]"
"62","10.485770","100.86.111.80","23.61.11.185","TCP","1514","51454  >  443 [ACK] Seq=49423 Ack=8856 Win=65536 Len=1460 [TCP segment of a reassembled PDU]"
"63","10.524337","23.61.11.185","100.86.111.80","TCP","56","443  >  51454 [ACK] Seq=8856 Ack=19181 Win=64128 Len=0"
"64","10.524437","100.86.111.80","23.61.11.185","TCP","1514","51454  >  443 [ACK] Seq=50883 Ack=8856 Win=65536 Len=1460 [TCP segment of a reassembled PDU]"
"65","10.529099","23.61.11.185","100.86.111.80","TCP","56","443  >  51454 [ACK] Seq=8856 Ack=23143 Win=64128 Len=0"
"66","10.529099","23.61.11.185","100.86.111.80","TCP","56","443  >  51454 [ACK] Seq=8856 Ack=27523 Win=61312 Len=0"
"67","10.529346","100.86.111.80","23.61.11.185","TCP","1514","51454  >  443 [ACK] Seq=52343 Ack=8856 Win=65536 Len=1460 [TCP segment of a reassembled PDU]"
"68","10.529346","100.86.111.80","23.61.11.185","TLSv1.3","1514","Application Data"
"69","10.529346","100.86.111.80","23.61.11.185","TCP","1514","51454  >  443 [ACK] Seq=55263 Ack=8856 Win=65536 Len=1460 [TCP segment of a reassembled PDU]"
"70","10.529346","100.86.111.80","23.61.11.185","TLSv1.3","871","Application Data"
"71","10.529592","23.61.11.185","100.86.111.80","TCP","56","443  >  51454 [ACK] Seq=8856 Ack=36283 Win=55168 Len=0"
"72","10.529592","23.61.11.185","100.86.111.80","TCP","56","443  >  51454 [ACK] Seq=8856 Ack=40663 Win=52096 Len=0"
"73","10.529592","23.61.11.185","100.86.111.80","TCP","56","443  >  51454 [ACK] Seq=8856 Ack=43583 Win=50048 Len=0"
"74","10.529592","23.61.11.185","100.86.111.80","TCP","56","443  >  51454 [ACK] Seq=8856 Ack=50883 Win=44800 Len=0"
"75","10.541597","23.61.11.185","100.86.111.80","TCP","56","443  >  51454 [ACK] Seq=8856 Ack=53803 Win=63360 Len=0"
"76","10.542311","23.61.11.185","100.86.111.80","TCP","56","443  >  51454 [ACK] Seq=8856 Ack=57540 Win=60288 Len=0"
"77","10.651629","100.86.111.80","23.61.11.185","TCP","66","51475  >  443 [SYN] Seq=0 Win=64240 Len=0 MSS=1460 WS=256 SACK_PERM"
"78","10.730734","23.61.11.185","100.86.111.80","TCP","66","443  >  51475 [SYN, ACK] Seq=0 Ack=1 Win=64240 Len=0 MSS=1460 SACK_PERM WS=128"
"79","10.731687","100.86.111.80","23.61.11.185","TCP","54","51475  >  443 [ACK] Seq=1 Ack=1 Win=65536 Len=0"
"80","10.734286","100.86.111.80","23.61.11.185","TCP","1514","51475  >  443 [ACK] Seq=1 Ack=1 Win=65536 Len=1460 [TCP segment of a reassembled PDU]"
"81","10.734286","100.86.111.80","23.61.11.185","TLSv1.3","645","Client Hello (SNI=rubicon.wellsfargo.com)"
"82","10.794873","23.61.11.185","100.86.111.80","TCP","56","443  >  51475 [ACK] Seq=1 Ack=2052 Win=63616 Len=0"
"83","10.794873","23.61.11.185","100.86.111.80","TLSv1.3","324","Server Hello, Change Cipher Spec, Application Data, Application Data"
"84","10.798660","100.86.111.80","23.61.11.185","TLSv1.3","134","Change Cipher Spec, Application Data"
"85","10.802566","100.86.111.80","23.61.11.185","TCP","1514","51475  >  443 [ACK] Seq=2132 Ack=271 Win=65280 Len=1460 [TCP segment of a reassembled PDU]"
"86","10.802566","100.86.111.80","23.61.11.185","TCP","1514","51475  >  443 [ACK] Seq=3592 Ack=271 Win=65280 Len=1460 [TCP segment of a reassembled PDU]"
"87","10.802566","100.86.111.80","23.61.11.185","TLSv1.3","1183","Application Data"
"88","10.803156","100.86.111.80","23.61.11.185","TCP","1514","51475  >  443 [ACK] Seq=6181 Ack=271 Win=65280 Len=1460 [TCP segment of a reassembled PDU]"
"89","10.803156","100.86.111.80","23.61.11.185","TCP","1514","51475  >  443 [ACK] Seq=7641 Ack=271 Win=65280 Len=1460 [TCP segment of a reassembled PDU]"
"90","10.803156","100.86.111.80","23.61.11.185","TCP","1514","51475  >  443 [ACK] Seq=9101 Ack=271 Win=65280 Len=1460 [TCP segment of a reassembled PDU]"
"91","10.803156","100.86.111.80","23.61.11.185","TCP","1514","51475  >  443 [ACK] Seq=10561 Ack=271 Win=65280 Len=1460 [TCP segment of a reassembled PDU]"
"92","10.803156","100.86.111.80","23.61.11.185","TCP","1514","51475  >  443 [ACK] Seq=12021 Ack=271 Win=65280 Len=1460 [TCP segment of a reassembled PDU]"
"93","10.803156","100.86.111.80","23.61.11.185","TCP","1514","51475  >  443 [ACK] Seq=13481 Ack=271 Win=65280 Len=1460 [TCP segment of a reassembled PDU]"
"94","10.803156","100.86.111.80","23.61.11.185","TCP","1514","51475  >  443 [ACK] Seq=14941 Ack=271 Win=65280 Len=1460 [TCP segment of a reassembled PDU]"
"95","10.803156","100.86.111.80","23.61.11.185","TCP","1514","51475  >  443 [ACK] Seq=16401 Ack=271 Win=65280 Len=1460 [TCP segment of a reassembled PDU]"
"96","10.852394","23.61.11.185","100.86.111.80","TCP","56","443  >  51475 [ACK] Seq=271 Ack=9101 Win=59264 Len=0"
"97","10.852394","23.61.11.185","100.86.111.80","TLSv1.3","357","Application Data"
"98","10.852719","100.86.111.80","23.61.11.185","TCP","1514","51475  >  443 [ACK] Seq=17861 Ack=574 Win=65024 Len=1460 [TCP segment of a reassembled PDU]"
"99","10.852719","100.86.111.80","23.61.11.185","TCP","1514","51475  >  443 [ACK] Seq=19321 Ack=574 Win=65024 Len=1460 [TCP segment of a reassembled PDU]"
"100","10.852719","100.86.111.80","23.61.11.185","TCP","1514","51475  >  443 [ACK] Seq=20781 Ack=574 Win=65024 Len=1460 [TCP segment of a reassembled PDU]"
"101","10.852719","100.86.111.80","23.61.11.185","TLSv1.3","1514","Application Data"
"102","10.852719","100.86.111.80","23.61.11.185","TCP","1514","51475  >  443 [ACK] Seq=23701 Ack=574 Win=65024 Len=1460 [TCP segment of a reassembled PDU]"
"103","10.852719","100.86.111.80","23.61.11.185","TCP","1514","51475  >  443 [ACK] Seq=25161 Ack=574 Win=65024 Len=1460 [TCP segment of a reassembled PDU]"
"104","10.852719","100.86.111.80","23.61.11.185","TCP","1514","51475  >  443 [ACK] Seq=26621 Ack=574 Win=65024 Len=1460 [TCP segment of a reassembled PDU]"
"105","10.852719","100.86.111.80","23.61.11.185","TCP","1514","51475  >  443 [ACK] Seq=28081 Ack=574 Win=65024 Len=1460 [TCP segment of a reassembled PDU]"
"106","10.852719","100.86.111.80","23.61.11.185","TCP","1514","51475  >  443 [ACK] Seq=29541 Ack=574 Win=65024 Len=1460 [TCP segment of a reassembled PDU]"
"107","10.852719","100.86.111.80","23.61.11.185","TCP","1514","51475  >  443 [ACK] Seq=31001 Ack=574 Win=65024 Len=1460 [TCP segment of a reassembled PDU]"
"108","10.852719","100.86.111.80","23.61.11.185","TCP","1514","51475  >  443 [ACK] Seq=32461 Ack=574 Win=65024 Len=1460 [TCP segment of a reassembled PDU]"
"109","10.852719","100.86.111.80","23.61.11.185","TCP","1514","51475  >  443 [ACK] Seq=33921 Ack=574 Win=65024 Len=1460 [TCP segment of a reassembled PDU]"
"110","10.873286","23.61.11.185","100.86.111.80","TCP","56","443  >  51475 [ACK] Seq=574 Ack=13481 Win=56192 Len=0"
"111","10.873507","100.86.111.80","23.61.11.185","TCP","1514","51475  >  443 [ACK] Seq=35381 Ack=574 Win=65024 Len=1460 [TCP segment of a reassembled PDU]"
"112","10.873507","100.86.111.80","23.61.11.185","TCP","1514","51475  >  443 [ACK] Seq=36841 Ack=574 Win=65024 Len=1460 [TCP segment of a reassembled PDU]"
"113","10.873507","100.86.111.80","23.61.11.185","TLSv1.3","1514","Application Data"
"114","10.873507","100.86.111.80","23.61.11.185","TCP","1514","51475  >  443 [ACK] Seq=39761 Ack=574 Win=65024 Len=1460 [TCP segment of a reassembled PDU]"
"115","10.873774","23.61.11.185","100.86.111.80","TCP","56","443  >  51475 [ACK] Seq=574 Ack=17861 Win=53120 Len=0"
"116","10.873774","23.61.11.185","100.86.111.80","TLSv1.3","938","Application Data"
"117","10.874081","100.86.111.80","23.61.11.185","TCP","1514","51475  >  443 [ACK] Seq=41221 Ack=574 Win=65024 Len=1460 [TCP segment of a reassembled PDU]"
"118","10.874081","100.86.111.80","23.61.11.185","TCP","1514","51475  >  443 [ACK] Seq=42681 Ack=574 Win=65024 Len=1460 [TCP segment of a reassembled PDU]"
"119","10.874081","100.86.111.80","23.61.11.185","TCP","1514","51475  >  443 [ACK] Seq=44141 Ack=574 Win=65024 Len=1460 [TCP segment of a reassembled PDU]"
"120","10.874081","100.86.111.80","23.61.11.185","TCP","1514","51475  >  443 [ACK] Seq=45601 Ack=574 Win=65024 Len=1460 [TCP segment of a reassembled PDU]"
"121","10.874081","100.86.111.80","23.61.11.185","TCP","1514","51475  >  443 [ACK] Seq=47061 Ack=574 Win=65024 Len=1460 [TCP segment of a reassembled PDU]"
"122","10.874081","100.86.111.80","23.61.11.185","TCP","1514","51475  >  443 [ACK] Seq=48521 Ack=574 Win=65024 Len=1460 [TCP segment of a reassembled PDU]"
"123","10.884127","23.61.11.185","100.86.111.80","TCP","56","443  >  51475 [ACK] Seq=574 Ack=20781 Win=63360 Len=0"
"124","10.884296","100.86.111.80","23.61.11.185","TCP","1514","51475  >  443 [ACK] Seq=49981 Ack=574 Win=65024 Len=1460 [TCP segment of a reassembled PDU]"
"125","10.884296","100.86.111.80","23.61.11.185","TCP","1514","51475  >  443 [ACK] Seq=51441 Ack=574 Win=65024 Len=1460 [TCP segment of a reassembled PDU]"
"126","10.884296","100.86.111.80","23.61.11.185","TCP","1514","51475  >  443 [ACK] Seq=52901 Ack=574 Win=65024 Len=1460 [TCP segment of a reassembled PDU]"
"127","10.884296","100.86.111.80","23.61.11.185","TLSv1.3","1514","Application Data"
"128","10.928646","100.86.111.80","23.61.11.185","TCP","54","51454  >  443 [ACK] Seq=57540 Ack=9740 Win=64768 Len=0"
"129","10.935491","23.61.11.185","100.86.111.80","TCP","56","443  >  51475 [ACK] Seq=574 Ack=26621 Win=59264 Len=0"
"130","10.935491","23.61.11.185","100.86.111.80","TCP","56","443  >  51475 [ACK] Seq=574 Ack=49981 Win=42752 Len=0"
"131","10.935659","100.86.111.80","23.61.11.185","TCP","1514","51475  >  443 [ACK] Seq=55821 Ack=574 Win=65024 Len=1460 [TCP segment of a reassembled PDU]"
"132","10.935659","100.86.111.80","23.61.11.185","TCP","1514","51475  >  443 [ACK] Seq=57281 Ack=574 Win=65024 Len=1460 [TCP segment of a reassembled PDU]"
"133","10.935659","100.86.111.80","23.61.11.185","TCP","1514","51475  >  443 [ACK] Seq=58741 Ack=574 Win=65024 Len=1460 [TCP segment of a reassembled PDU]"
"134","10.935659","100.86.111.80","23.61.11.185","TCP","1514","51475  >  443 [ACK] Seq=60201 Ack=574 Win=65024 Len=1460 [TCP segment of a reassembled PDU]"
"135","10.935659","100.86.111.80","23.61.11.185","TCP","1514","51475  >  443 [ACK] Seq=61661 Ack=574 Win=65024 Len=1460 [TCP segment of a reassembled PDU]"
"136","10.935659","100.86.111.80","23.61.11.185","TCP","1514","51475  >  443 [ACK] Seq=63121 Ack=574 Win=65024 Len=1460 [TCP segment of a reassembled PDU]"
"137","10.935659","100.86.111.80","23.61.11.185","TLSv1.3","95","Application Data"
"138","10.942233","23.61.11.185","100.86.111.80","TCP","56","443  >  51475 [ACK] Seq=574 Ack=55821 Win=61312 Len=0"
"139","10.954101","23.61.11.185","100.86.111.80","TCP","56","443  >  51475 [ACK] Seq=574 Ack=58741 Win=63360 Len=0"
"140","10.959189","23.61.11.185","100.86.111.80","TCP","56","443  >  51475 [ACK] Seq=574 Ack=64622 Win=64128 Len=0"
"141","11.018714","23.61.11.185","100.86.111.80","TCP","1514","443  >  51475 [ACK] Seq=574 Ack=64622 Win=64128 Len=1460 [TCP segment of a reassembled PDU]"
"142","11.018714","23.61.11.185","100.86.111.80","TLSv1.3","489","Application Data"
"143","11.019023","100.86.111.80","23.61.11.185","TCP","54","51475  >  443 [ACK] Seq=64622 Ack=2469 Win=65536 Len=0"
"144","12.552244","100.86.111.80","23.61.11.185","TCP","1514","51475  >  443 [ACK] Seq=64622 Ack=2469 Win=65536 Len=1460 [TCP segment of a reassembled PDU]"
"145","12.552244","100.86.111.80","23.61.11.185","TCP","1514","51475  >  443 [ACK] Seq=66082 Ack=2469 Win=65536 Len=1460 [TCP segment of a reassembled PDU]"
"146","12.552244","100.86.111.80","23.61.11.185","TLSv1.3","1077","Application Data"
"147","12.593114","23.61.11.185","100.86.111.80","TCP","56","443  >  51475 [ACK] Seq=2469 Ack=68565 Win=64128 Len=0"
"148","12.650484","100.86.111.80","23.61.11.185","TCP","1514","51454  >  443 [ACK] Seq=57540 Ack=9740 Win=64768 Len=1460 [TCP segment of a reassembled PDU]"
"149","12.650484","100.86.111.80","23.61.11.185","TCP","1514","51454  >  443 [ACK] Seq=59000 Ack=9740 Win=64768 Len=1460 [TCP segment of a reassembled PDU]"
"150","12.650484","100.86.111.80","23.61.11.185","TLSv1.3","1231","Application Data"
"151","12.650682","100.86.111.80","23.61.11.185","TCP","1514","51454  >  443 [ACK] Seq=61637 Ack=9740 Win=64768 Len=1460 [TCP segment of a reassembled PDU]"
"152","12.650682","100.86.111.80","23.61.11.185","TCP","1514","51454  >  443 [ACK] Seq=63097 Ack=9740 Win=64768 Len=1460 [TCP segment of a reassembled PDU]"
"153","12.650682","100.86.111.80","23.61.11.185","TCP","1514","51454  >  443 [ACK] Seq=64557 Ack=9740 Win=64768 Len=1460 [TCP segment of a reassembled PDU]"
"154","12.650682","100.86.111.80","23.61.11.185","TCP","1514","51454  >  443 [ACK] Seq=66017 Ack=9740 Win=64768 Len=1460 [TCP segment of a reassembled PDU]"
"155","12.650682","100.86.111.80","23.61.11.185","TCP","1514","51454  >  443 [ACK] Seq=67477 Ack=9740 Win=64768 Len=1460 [TCP segment of a reassembled PDU]"
"156","12.650682","100.86.111.80","23.61.11.185","TCP","1514","51454  >  443 [ACK] Seq=68937 Ack=9740 Win=64768 Len=1460 [TCP segment of a reassembled PDU]"
"157","12.650682","100.86.111.80","23.61.11.185","TCP","1514","51454  >  443 [ACK] Seq=70397 Ack=9740 Win=64768 Len=1460 [TCP segment of a reassembled PDU]"
"158","12.650682","100.86.111.80","23.61.11.185","TCP","1514","51454  >  443 [ACK] Seq=71857 Ack=9740 Win=64768 Len=1460 [TCP segment of a reassembled PDU]"
"159","12.650682","100.86.111.80","23.61.11.185","TCP","1514","51454  >  443 [ACK] Seq=73317 Ack=9740 Win=64768 Len=1460 [TCP segment of a reassembled PDU]"
"160","12.650682","100.86.111.80","23.61.11.185","TCP","1514","51454  >  443 [ACK] Seq=74777 Ack=9740 Win=64768 Len=1460 [TCP segment of a reassembled PDU]"
"161","12.650682","100.86.111.80","23.61.11.185","TCP","1514","51454  >  443 [ACK] Seq=76237 Ack=9740 Win=64768 Len=1460 [TCP segment of a reassembled PDU]"
"162","12.650682","100.86.111.80","23.61.11.185","TLSv1.3","1514","Application Data"
"163","12.650682","100.86.111.80","23.61.11.185","TCP","1514","51454  >  443 [ACK] Seq=79157 Ack=9740 Win=64768 Len=1460 [TCP segment of a reassembled PDU]"
"164","12.650682","100.86.111.80","23.61.11.185","TCP","1514","51454  >  443 [ACK] Seq=80617 Ack=9740 Win=64768 Len=1460 [TCP segment of a reassembled PDU]"
"165","12.650682","100.86.111.80","23.61.11.185","TCP","1514","51454  >  443 [ACK] Seq=82077 Ack=9740 Win=64768 Len=1460 [TCP segment of a reassembled PDU]"
"166","12.650682","100.86.111.80","23.61.11.185","TCP","1514","51454  >  443 [ACK] Seq=83537 Ack=9740 Win=64768 Len=1460 [TCP segment of a reassembled PDU]"
"167","12.650682","100.86.111.80","23.61.11.185","TCP","1514","51454  >  443 [ACK] Seq=84997 Ack=9740 Win=64768 Len=1460 [TCP segment of a reassembled PDU]"
"168","12.650682","100.86.111.80","23.61.11.185","TCP","1514","51454  >  443 [ACK] Seq=86457 Ack=9740 Win=64768 Len=1460 [TCP segment of a reassembled PDU]"
"169","12.650682","100.86.111.80","23.61.11.185","TCP","1514","51454  >  443 [ACK] Seq=87917 Ack=9740 Win=64768 Len=1460 [TCP segment of a reassembled PDU]"
"170","12.650682","100.86.111.80","23.61.11.185","TCP","1514","51454  >  443 [ACK] Seq=89377 Ack=9740 Win=64768 Len=1460 [TCP segment of a reassembled PDU]"
"171","12.650682","100.86.111.80","23.61.11.185","TCP","1514","51454  >  443 [ACK] Seq=90837 Ack=9740 Win=64768 Len=1460 [TCP segment of a reassembled PDU]"
"172","12.650682","100.86.111.80","23.61.11.185","TCP","1514","51454  >  443 [ACK] Seq=92297 Ack=9740 Win=64768 Len=1460 [TCP segment of a reassembled PDU]"
"173","12.650682","100.86.111.80","23.61.11.185","TLSv1.3","1514","Application Data"
"174","12.650682","100.86.111.80","23.61.11.185","TCP","1514","51454  >  443 [ACK] Seq=95217 Ack=9740 Win=64768 Len=1460 [TCP segment of a reassembled PDU]"
"175","12.650682","100.86.111.80","23.61.11.185","TLSv1.3","871","Application Data"
"176","12.671530","23.61.11.185","100.86.111.80","TCP","56","443  >  51454 [ACK] Seq=9740 Ack=61637 Win=64128 Len=0"
"177","12.671530","23.61.11.185","100.86.111.80","TCP","56","443  >  51454 [ACK] Seq=9740 Ack=66017 Win=62336 Len=0"
"178","12.671530","23.61.11.185","100.86.111.80","TCP","56","443  >  51454 [ACK] Seq=9740 Ack=70397 Win=59264 Len=0"
"179","12.671530","23.61.11.185","100.86.111.80","TCP","56","443  >  51454 [ACK] Seq=9740 Ack=76237 Win=55168 Len=0"
"180","12.671530","23.61.11.185","100.86.111.80","TCP","56","443  >  51454 [ACK] Seq=9740 Ack=82077 Win=51072 Len=0"
"181","12.673324","23.61.11.185","100.86.111.80","TCP","56","443  >  51454 [ACK] Seq=9740 Ack=97494 Win=64128 Len=0"
"182","12.715024","100.86.111.80","23.61.11.185","TCP","66","51493  >  443 [SYN] Seq=0 Win=64240 Len=0 MSS=1460 WS=256 SACK_PERM"
"183","12.741782","23.61.11.185","100.86.111.80","TCP","1514","443  >  51475 [ACK] Seq=2469 Ack=68565 Win=64128 Len=1460 [TCP segment of a reassembled PDU]"
"184","12.741967","23.61.11.185","100.86.111.80","TLSv1.3","681","Application Data"
"185","12.741967","23.61.11.185","100.86.111.80","TCP","66","443  >  51493 [SYN, ACK] Seq=0 Ack=1 Win=64240 Len=0 MSS=1460 SACK_PERM WS=128"
"186","12.742316","100.86.111.80","23.61.11.185","TCP","54","51475  >  443 [ACK] Seq=68565 Ack=4556 Win=65536 Len=0"
"187","12.742403","100.86.111.80","23.61.11.185","TCP","54","51493  >  443 [ACK] Seq=1 Ack=1 Win=65536 Len=0"
"188","12.743911","100.86.111.80","23.61.11.185","TCP","1514","51493  >  443 [ACK] Seq=1 Ack=1 Win=65536 Len=1460 [TCP segment of a reassembled PDU]"
"189","12.743911","100.86.111.80","23.61.11.185","TLSv1.3","677","Client Hello (SNI=rubicon.wellsfargo.com)"
"190","12.750468","100.86.111.80","23.61.11.185","TCP","1514","51475  >  443 [ACK] Seq=68565 Ack=4556 Win=65536 Len=1460 [TCP segment of a reassembled PDU]"
"191","12.750468","100.86.111.80","23.61.11.185","TCP","1514","51475  >  443 [ACK] Seq=70025 Ack=4556 Win=65536 Len=1460 [TCP segment of a reassembled PDU]"
"192","12.750468","100.86.111.80","23.61.11.185","TLSv1.3","1514","Application Data"
"193","12.750468","100.86.111.80","23.61.11.185","TCP","1514","51475  >  443 [ACK] Seq=72945 Ack=4556 Win=65536 Len=1460 [TCP segment of a reassembled PDU]"
"194","12.750468","100.86.111.80","23.61.11.185","TCP","1514","51475  >  443 [ACK] Seq=74405 Ack=4556 Win=65536 Len=1460 [TCP segment of a reassembled PDU]"
"195","12.750468","100.86.111.80","23.61.11.185","TCP","1514","51475  >  443 [ACK] Seq=75865 Ack=4556 Win=65536 Len=1460 [TCP segment of a reassembled PDU]"
"196","12.750468","100.86.111.80","23.61.11.185","TCP","1514","51475  >  443 [ACK] Seq=77325 Ack=4556 Win=65536 Len=1460 [TCP segment of a reassembled PDU]"
"197","12.750468","100.86.111.80","23.61.11.185","TCP","1514","51475  >  443 [ACK] Seq=78785 Ack=4556 Win=65536 Len=1460 [TCP segment of a reassembled PDU]"
"198","12.750468","100.86.111.80","23.61.11.185","TCP","1514","51475  >  443 [ACK] Seq=80245 Ack=4556 Win=65536 Len=1460 [TCP segment of a reassembled PDU]"
"199","12.750468","100.86.111.80","23.61.11.185","TCP","1514","51475  >  443 [ACK] Seq=81705 Ack=4556 Win=65536 Len=1460 [TCP segment of a reassembled PDU]"
"200","12.750468","100.86.111.80","23.61.11.185","TCP","1514","51475  >  443 [ACK] Seq=83165 Ack=4556 Win=65536 Len=1460 [TCP segment of a reassembled PDU]"
"201","12.750468","100.86.111.80","23.61.11.185","TCP","1514","51475  >  443 [ACK] Seq=84625 Ack=4556 Win=65536 Len=1460 [TCP segment of a reassembled PDU]"
"202","12.750468","100.86.111.80","23.61.11.185","TCP","1514","51475  >  443 [ACK] Seq=86085 Ack=4556 Win=65536 Len=1460 [TCP segment of a reassembled PDU]"
"203","12.750468","100.86.111.80","23.61.11.185","TCP","1514","51475  >  443 [ACK] Seq=87545 Ack=4556 Win=65536 Len=1460 [TCP segment of a reassembled PDU]"
"204","12.750468","100.86.111.80","23.61.11.185","TLSv1.3","1514","Application Data"
"205","12.750468","100.86.111.80","23.61.11.185","TCP","1514","51475  >  443 [ACK] Seq=90465 Ack=4556 Win=65536 Len=1460 [TCP segment of a reassembled PDU]"
"206","12.750468","100.86.111.80","23.61.11.185","TCP","1514","51475  >  443 [ACK] Seq=91925 Ack=4556 Win=65536 Len=1460 [TCP segment of a reassembled PDU]"
"207","12.750468","100.86.111.80","23.61.11.185","TCP","1514","51475  >  443 [ACK] Seq=93385 Ack=4556 Win=65536 Len=1460 [TCP segment of a reassembled PDU]"
"208","12.750468","100.86.111.80","23.61.11.185","TCP","1514","51475  >  443 [ACK] Seq=94845 Ack=4556 Win=65536 Len=1460 [TCP segment of a reassembled PDU]"
"209","12.750468","100.86.111.80","23.61.11.185","TCP","1514","51475  >  443 [ACK] Seq=96305 Ack=4556 Win=65536 Len=1460 [TCP segment of a reassembled PDU]"
"210","12.750468","100.86.111.80","23.61.11.185","TCP","1514","51475  >  443 [ACK] Seq=97765 Ack=4556 Win=65536 Len=1460 [TCP segment of a reassembled PDU]"
"211","12.750468","100.86.111.80","23.61.11.185","TCP","1514","51475  >  443 [ACK] Seq=99225 Ack=4556 Win=65536 Len=1460 [TCP segment of a reassembled PDU]"
"212","12.750468","100.86.111.80","23.61.11.185","TCP","1514","51475  >  443 [ACK] Seq=100685 Ack=4556 Win=65536 Len=1460 [TCP segment of a reassembled PDU]"
"213","12.750468","100.86.111.80","23.61.11.185","TCP","1514","51475  >  443 [ACK] Seq=102145 Ack=4556 Win=65536 Len=1460 [TCP segment of a reassembled PDU]"
"214","12.750468","100.86.111.80","23.61.11.185","TCP","1514","51475  >  443 [ACK] Seq=103605 Ack=4556 Win=65536 Len=1460 [TCP segment of a reassembled PDU]"
"215","12.750468","100.86.111.80","23.61.11.185","TLSv1.3","1514","Application Data"
"216","12.750468","100.86.111.80","23.61.11.185","TCP","1514","51475  >  443 [ACK] Seq=106525 Ack=4556 Win=65536 Len=1460 [TCP segment of a reassembled PDU]"
"217","12.750468","100.86.111.80","23.61.11.185","TCP","1514","51475  >  443 [ACK] Seq=107985 Ack=4556 Win=65536 Len=1460 [TCP segment of a reassembled PDU]"
"218","12.750468","100.86.111.80","23.61.11.185","TCP","1514","51475  >  443 [ACK] Seq=109445 Ack=4556 Win=65536 Len=1460 [TCP segment of a reassembled PDU]"
"219","12.750468","100.86.111.80","23.61.11.185","TCP","1514","51475  >  443 [ACK] Seq=110905 Ack=4556 Win=65536 Len=1460 [TCP segment of a reassembled PDU]"
"220","12.750468","100.86.111.80","23.61.11.185","TCP","1514","51475  >  443 [ACK] Seq=112365 Ack=4556 Win=65536 Len=1460 [TCP segment of a reassembled PDU]"
"221","12.750468","100.86.111.80","23.61.11.185","TCP","1514","51475  >  443 [ACK] Seq=113825 Ack=4556 Win=65536 Len=1460 [TCP segment of a reassembled PDU]"
"222","12.750468","100.86.111.80","23.61.11.185","TCP","1514","51475  >  443 [ACK] Seq=115285 Ack=4556 Win=65536 Len=1460 [TCP segment of a reassembled PDU]"
"223","12.750468","100.86.111.80","23.61.11.185","TCP","1514","51475  >  443 [ACK] Seq=116745 Ack=4556 Win=65536 Len=1460 [TCP segment of a reassembled PDU]"
"224","12.750468","100.86.111.80","23.61.11.185","TCP","1514","51475  >  443 [ACK] Seq=118205 Ack=4556 Win=65536 Len=1460 [TCP segment of a reassembled PDU]"
"225","12.750468","100.86.111.80","23.61.11.185","TCP","1514","51475  >  443 [ACK] Seq=119665 Ack=4556 Win=65536 Len=1460 [TCP segment of a reassembled PDU]"
"226","12.750468","100.86.111.80","23.61.11.185","TLSv1.3","1514","Application Data"
"227","12.750468","100.86.111.80","23.61.11.185","TCP","1514","51475  >  443 [ACK] Seq=122585 Ack=4556 Win=65536 Len=1460 [TCP segment of a reassembled PDU]"
"228","12.750468","100.86.111.80","23.61.11.185","TCP","1514","51475  >  443 [ACK] Seq=124045 Ack=4556 Win=65536 Len=1460 [TCP segment of a reassembled PDU]"
"229","12.750468","100.86.111.80","23.61.11.185","TCP","1514","51475  >  443 [ACK] Seq=125505 Ack=4556 Win=65536 Len=1460 [TCP segment of a reassembled PDU]"
"230","12.750468","100.86.111.80","23.61.11.185","TCP","1514","51475  >  443 [ACK] Seq=126965 Ack=4556 Win=65536 Len=1460 [TCP segment of a reassembled PDU]"
"231","12.750468","100.86.111.80","23.61.11.185","TCP","1514","51475  >  443 [ACK] Seq=128425 Ack=4556 Win=65536 Len=1460 [TCP segment of a reassembled PDU]"
"232","12.750468","100.86.111.80","23.61.11.185","TCP","1514","51475  >  443 [ACK] Seq=129885 Ack=4556 Win=65536 Len=1460 [TCP segment of a reassembled PDU]"
"233","12.765666","23.61.11.185","100.86.111.80","TCP","56","443  >  51493 [ACK] Seq=1 Ack=1461 Win=64128 Len=0"
"234","12.765666","23.61.11.185","100.86.111.80","TCP","56","443  >  51493 [ACK] Seq=1 Ack=2084 Win=64128 Len=0"
"235","12.766552","23.61.11.185","100.86.111.80","TLSv1.3","324","Server Hello, Change Cipher Spec, Application Data, Application Data"
"236","12.766552","23.61.11.185","100.86.111.80","TCP","56","443  >  51475 [ACK] Seq=4556 Ack=78785 Win=84608 Len=0"
"237","12.766552","23.61.11.185","100.86.111.80","TCP","56","443  >  51475 [ACK] Seq=4556 Ack=84625 Win=96256 Len=0"
"238","12.766734","100.86.111.80","23.61.11.185","TCP","1514","51475  >  443 [ACK] Seq=131345 Ack=4556 Win=65536 Len=1460 [TCP segment of a reassembled PDU]"
"239","12.766734","100.86.111.80","23.61.11.185","TLSv1.3","299","Application Data"
"240","12.768021","100.86.111.80","23.61.11.185","TLSv1.3","134","Change Cipher Spec, Application Data"
"241","12.768731","23.61.11.185","100.86.111.80","TCP","56","443  >  51475 [ACK] Seq=4556 Ack=87545 Win=102144 Len=0"
"242","12.768731","23.61.11.185","100.86.111.80","TCP","56","443  >  51475 [ACK] Seq=4556 Ack=90465 Win=107904 Len=0"
"243","12.770867","23.61.11.185","100.86.111.80","TCP","56","443  >  51475 [ACK] Seq=4556 Ack=99225 Win=125440 Len=0"
"244","12.770867","23.61.11.185","100.86.111.80","TCP","56","443  >  51475 [ACK] Seq=4556 Ack=105065 Win=137088 Len=0"
"245","12.770970","23.61.11.185","100.86.111.80","TCP","56","443  >  51475 [ACK] Seq=4556 Ack=113825 Win=154624 Len=0"
"246","12.770970","23.61.11.185","100.86.111.80","TCP","56","443  >  51475 [ACK] Seq=4556 Ack=116745 Win=160512 Len=0"
"247","12.770970","23.61.11.185","100.86.111.80","TCP","56","443  >  51475 [ACK] Seq=4556 Ack=122585 Win=172160 Len=0"
"248","12.770970","23.61.11.185","100.86.111.80","TCP","56","443  >  51475 [ACK] Seq=4556 Ack=125505 Win=178048 Len=0"
"249","12.771981","23.61.11.185","100.86.111.80","TCP","56","443  >  51475 [ACK] Seq=4556 Ack=128425 Win=183808 Len=0"
"250","12.772054","23.61.11.185","100.86.111.80","TCP","56","443  >  51475 [ACK] Seq=4556 Ack=131345 Win=189696 Len=0"
"251","12.779283","23.61.11.185","100.86.111.80","TCP","56","443  >  51475 [ACK] Seq=4556 Ack=133050 Win=193152 Len=0"
"252","12.795685","23.61.11.185","100.86.111.80","TLSv1.3","940","Application Data"
"253","12.816839","23.61.11.185","100.86.111.80","TLSv1.3","357","Application Data"
"254","12.846000","100.86.111.80","23.61.11.185","TCP","54","51454  >  443 [ACK] Seq=97494 Ack=10626 Win=65536 Len=0"
"255","12.860996","100.86.111.80","23.61.11.185","TCP","54","51493  >  443 [ACK] Seq=2164 Ack=574 Win=65024 Len=0"
"256","12.888342","23.61.11.185","100.86.111.80","TLSv1.3","938","Application Data"
"257","12.938494","100.86.111.80","23.61.11.185","TCP","54","51475  >  443 [ACK] Seq=133050 Ack=5440 Win=64768 Len=0"
"258","20.009170","100.86.111.80","23.61.11.185","TCP","1514","51475  >  443 [ACK] Seq=133050 Ack=5440 Win=64768 Len=1460 [TCP segment of a reassembled PDU]"
"259","20.009170","100.86.111.80","23.61.11.185","TCP","1514","51475  >  443 [ACK] Seq=134510 Ack=5440 Win=64768 Len=1460 [TCP segment of a reassembled PDU]"
"260","20.009170","100.86.111.80","23.61.11.185","TLSv1.3","1189","Application Data"
"261","20.020449","23.61.11.185","100.86.111.80","TCP","56","443  >  51475 [ACK] Seq=5440 Ack=137105 Win=201216 Len=0"
"262","20.099065","23.61.11.185","100.86.111.80","TCP","1514","443  >  51475 [ACK] Seq=5440 Ack=137105 Win=201216 Len=1460 [TCP segment of a reassembled PDU]"
"263","20.099065","23.61.11.185","100.86.111.80","TLSv1.3","683","Application Data"
"264","20.099278","100.86.111.80","23.61.11.185","TCP","54","51475  >  443 [ACK] Seq=137105 Ack=7529 Win=65536 Len=0"
"265","20.215519","100.86.111.80","23.61.11.185","TCP","1514","51475  >  443 [ACK] Seq=137105 Ack=7529 Win=65536 Len=1460 [TCP segment of a reassembled PDU]"
"266","20.215519","100.86.111.80","23.61.11.185","TCP","1514","51475  >  443 [ACK] Seq=138565 Ack=7529 Win=65536 Len=1460 [TCP segment of a reassembled PDU]"
"267","20.215519","100.86.111.80","23.61.11.185","TLSv1.3","1514","Application Data"
"268","20.215519","100.86.111.80","23.61.11.185","TCP","1514","51475  >  443 [ACK] Seq=141485 Ack=7529 Win=65536 Len=1460 [TCP segment of a reassembled PDU]"
"269","20.215519","100.86.111.80","23.61.11.185","TCP","1514","51475  >  443 [ACK] Seq=142945 Ack=7529 Win=65536 Len=1460 [TCP segment of a reassembled PDU]"
"270","20.215519","100.86.111.80","23.61.11.185","TLSv1.3","303","Application Data[Illegal Segments]"
"271","20.223273","100.86.111.80","23.61.11.185","TCP","1514","51454  >  443 [ACK] Seq=97494 Ack=10626 Win=65536 Len=1460 [TCP segment of a reassembled PDU]"
"272","20.223273","100.86.111.80","23.61.11.185","TCP","1514","51454  >  443 [ACK] Seq=98954 Ack=10626 Win=65536 Len=1460 [TCP segment of a reassembled PDU]"
"273","20.223273","100.86.111.80","23.61.11.185","TLSv1.3","1347","Application Data"
"274","20.223670","100.86.111.80","23.61.11.185","TCP","1514","51454  >  443 [ACK] Seq=101707 Ack=10626 Win=65536 Len=1460 [TCP segment of a reassembled PDU]"
"275","20.223670","100.86.111.80","23.61.11.185","TCP","1514","51454  >  443 [ACK] Seq=103167 Ack=10626 Win=65536 Len=1460 [TCP segment of a reassembled PDU]"
"276","20.223670","100.86.111.80","23.61.11.185","TCP","1514","51454  >  443 [ACK] Seq=104627 Ack=10626 Win=65536 Len=1460 [TCP segment of a reassembled PDU]"
"277","20.223670","100.86.111.80","23.61.11.185","TCP","1514","51454  >  443 [ACK] Seq=106087 Ack=10626 Win=65536 Len=1460 [TCP segment of a reassembled PDU]"
"278","20.223670","100.86.111.80","23.61.11.185","TCP","1514","51454  >  443 [ACK] Seq=107547 Ack=10626 Win=65536 Len=1460 [TCP segment of a reassembled PDU]"
"279","20.223670","100.86.111.80","23.61.11.185","TCP","1514","51454  >  443 [ACK] Seq=109007 Ack=10626 Win=65536 Len=1460 [TCP segment of a reassembled PDU]"
"280","20.223670","100.86.111.80","23.61.11.185","TCP","1514","51454  >  443 [ACK] Seq=110467 Ack=10626 Win=65536 Len=1460 [TCP segment of a reassembled PDU]"
"281","20.223670","100.86.111.80","23.61.11.185","TCP","1514","51454  >  443 [ACK] Seq=111927 Ack=10626 Win=65536 Len=1460 [TCP segment of a reassembled PDU]"
"282","20.223670","100.86.111.80","23.61.11.185","TCP","1514","51454  >  443 [ACK] Seq=113387 Ack=10626 Win=65536 Len=1460 [TCP segment of a reassembled PDU]"
"283","20.223670","100.86.111.80","23.61.11.185","TCP","1514","51454  >  443 [ACK] Seq=114847 Ack=10626 Win=65536 Len=1460 [TCP segment of a reassembled PDU]"
"284","20.223670","100.86.111.80","23.61.11.185","TCP","1514","51454  >  443 [ACK] Seq=116307 Ack=10626 Win=65536 Len=1460 [TCP segment of a reassembled PDU]"
"285","20.223670","100.86.111.80","23.61.11.185","TLSv1.3","923","Application Data, Application Data"
"286","20.227360","23.61.11.185","100.86.111.80","TCP","56","443  >  51475 [ACK] Seq=7529 Ack=140025 Win=207104 Len=0"
"287","20.227360","23.61.11.185","100.86.111.80","TCP","56","443  >  51475 [ACK] Seq=7529 Ack=144654 Win=216320 Len=0"
"288","20.234501","23.61.11.185","100.86.111.80","TCP","56","443  >  51454 [ACK] Seq=10626 Ack=98954 Win=67072 Len=0"
"289","20.237247","23.61.11.185","100.86.111.80","TCP","56","443  >  51454 [ACK] Seq=10626 Ack=101707 Win=72960 Len=0"
"290","20.237247","23.61.11.185","100.86.111.80","TCP","56","443  >  51454 [ACK] Seq=10626 Ack=103167 Win=75776 Len=0"
"291","20.237387","23.61.11.185","100.86.111.80","TCP","56","443  >  51454 [ACK] Seq=10626 Ack=109007 Win=87552 Len=0"
"292","20.237387","23.61.11.185","100.86.111.80","TCP","56","443  >  51454 [ACK] Seq=10626 Ack=113387 Win=96256 Len=0"
