No.,Time,Source,Destination,Protocol,Length,Info,label
1,0.0,192.168.1.31,52.3.144.142,TLSv1.2,118,Application Data,0
2,2.8e-05,192.168.1.31,52.3.144.142,TLSv1.2,93,Application Data,0
3,0.016127,52.3.144.142,192.168.1.31,TCP,60,443  >  56483 [ACK] Seq=1 Ack=104 Win=68 Len=0,0
4,0.016873,52.3.144.142,192.168.1.31,TLSv1.2,93,Application Data,0
5,0.059521,192.168.1.31,52.3.144.142,TCP,54,56483  >  443 [ACK] Seq=104 Ack=40 Win=1025 Len=0,0
6,0.299244,52.3.144.142,192.168.1.31,TLSv1.2,301,Application Data,0
7,0.299791,52.3.144.142,192.168.1.31,TCP,1514,443  >  56483 [ACK] Seq=287 Ack=104 Win=68 Len=1460 [TCP segment of a reassembled PDU],0
8,0.299791,52.3.144.142,192.168.1.31,TCP,1514,443  >  56483 [ACK] Seq=1747 Ack=104 Win=68 Len=1460 [TCP segment of a reassembled PDU],0
9,0.299791,52.3.144.142,192.168.1.31,TCP,1514,"443  >  56483 [PSH, ACK] Seq=3207 Ack=104 Win=68 Len=1460 [TCP segment of a reassembled PDU]",0
10,0.299805,192.168.1.31,52.3.144.142,TCP,54,56483  >  443 [ACK] Seq=104 Ack=4667 Win=1026 Len=0,0
11,0.300269,52.3.144.142,192.168.1.31,TLSv1.2,896,Application Data,0
12,0.300397,52.3.144.142,192.168.1.31,TCP,1514,443  >  56483 [ACK] Seq=5509 Ack=104 Win=68 Len=1460 [TCP segment of a reassembled PDU],0
13,0.300397,52.3.144.142,192.168.1.31,TLSv1.2,1055,Application Data,0
14,0.300409,192.168.1.31,52.3.144.142,TCP,54,56483  >  443 [ACK] Seq=104 Ack=7970 Win=1026 Len=0,0
15,0.300897,52.3.144.142,192.168.1.31,TCP,1514,443  >  56483 [ACK] Seq=7970 Ack=104 Win=68 Len=1460 [TCP segment of a reassembled PDU],0
16,0.300897,52.3.144.142,192.168.1.31,TCP,1514,443  >  56483 [ACK] Seq=9430 Ack=104 Win=68 Len=1460 [TCP segment of a reassembled PDU],0
17,0.300911,192.168.1.31,52.3.144.142,TCP,54,56483  >  443 [ACK] Seq=104 Ack=10890 Win=1026 Len=0,0
18,0.301356,52.3.144.142,192.168.1.31,TLSv1.2,1198,Application Data,0
19,0.301367,192.168.1.31,52.3.144.142,TCP,54,56483  >  443 [ACK] Seq=104 Ack=12034 Win=1022 Len=0,0
20,0.30194,52.3.144.142,192.168.1.31,TCP,1514,443  >  56483 [ACK] Seq=12034 Ack=104 Win=68 Len=1460 [TCP segment of a reassembled PDU],0
21,0.301958,52.3.144.142,192.168.1.31,TCP,1514,443  >  56483 [ACK] Seq=13494 Ack=104 Win=68 Len=1460 [TCP segment of a reassembled PDU],0
22,0.301964,192.168.1.31,52.3.144.142,TCP,54,56483  >  443 [ACK] Seq=104 Ack=14954 Win=1026 Len=0,0
23,0.302424,52.3.144.142,192.168.1.31,TLSv1.2,1254,Application Data,0
24,0.302424,52.3.144.142,192.168.1.31,TLSv1.2,253,Application Data,0
25,0.302433,192.168.1.31,52.3.144.142,TCP,54,56483  >  443 [ACK] Seq=104 Ack=16353 Win=1021 Len=0,0
26,0.30338,52.3.144.142,192.168.1.31,TCP,1514,443  >  56483 [ACK] Seq=16353 Ack=104 Win=68 Len=1460 [TCP segment of a reassembled PDU],0
27,0.303861,52.3.144.142,192.168.1.31,TCP,1514,443  >  56483 [ACK] Seq=17813 Ack=104 Win=68 Len=1460 [TCP segment of a reassembled PDU],0
28,0.303861,52.3.144.142,192.168.1.31,TLSv1.2,249,Application Data,0
29,0.303873,192.168.1.31,52.3.144.142,TCP,54,56483  >  443 [ACK] Seq=104 Ack=19468 Win=1026 Len=0,0
30,0.304603,52.3.144.142,192.168.1.31,TCP,1514,443  >  56483 [ACK] Seq=19468 Ack=104 Win=68 Len=1460 [TCP segment of a reassembled PDU],0
31,0.304627,192.168.1.31,52.3.144.142,TCP,54,56483  >  443 [ACK] Seq=104 Ack=20928 Win=1026 Len=0,0
32,0.305075,52.3.144.142,192.168.1.31,TCP,1514,443  >  56483 [ACK] Seq=20928 Ack=104 Win=68 Len=1460 [TCP segment of a reassembled PDU],0
33,0.305075,52.3.144.142,192.168.1.31,TLSv1.2,913,Application Data,0
34,0.305102,192.168.1.31,52.3.144.142,TCP,54,56483  >  443 [ACK] Seq=104 Ack=23247 Win=1026 Len=0,0
35,0.305282,52.3.144.142,192.168.1.31,TCP,1514,443  >  56483 [ACK] Seq=23247 Ack=104 Win=68 Len=1460 [TCP segment of a reassembled PDU],0
36,0.305282,52.3.144.142,192.168.1.31,TCP,1514,443  >  56483 [ACK] Seq=24707 Ack=104 Win=68 Len=1460 [TCP segment of a reassembled PDU],0
37,0.305282,52.3.144.142,192.168.1.31,TLSv1.2,1100,Application Data,0
38,0.305296,192.168.1.31,52.3.144.142,TCP,54,56483  >  443 [ACK] Seq=104 Ack=27213 Win=1026 Len=0,0
39,0.306845,52.3.144.142,192.168.1.31,TCP,1514,443  >  56483 [ACK] Seq=27213 Ack=104 Win=68 Len=1460 [TCP segment of a reassembled PDU],0
40,0.306845,52.3.144.142,192.168.1.31,TCP,1514,443  >  56483 [ACK] Seq=28673 Ack=104 Win=68 Len=1460 [TCP segment of a reassembled PDU],0
41,0.306845,52.3.144.142,192.168.1.31,TLSv1.2,442,Application Data,0
42,0.306867,192.168.1.31,52.3.144.142,TCP,54,56483  >  443 [ACK] Seq=104 Ack=30521 Win=1026 Len=0,0
43,0.307496,52.3.144.142,192.168.1.31,TCP,1514,443  >  56483 [ACK] Seq=30521 Ack=104 Win=68 Len=1460 [TCP segment of a reassembled PDU],0
44,0.307951,52.3.144.142,192.168.1.31,TCP,1514,443  >  56483 [ACK] Seq=31981 Ack=104 Win=68 Len=1460 [TCP segment of a reassembled PDU],0
45,0.307951,52.3.144.142,192.168.1.31,TLSv1.2,122,Application Data,0
46,0.307951,52.3.144.142,192.168.1.31,TLSv1.2,459,Application Data,0
47,0.307971,192.168.1.31,52.3.144.142,TCP,54,56483  >  443 [ACK] Seq=104 Ack=33914 Win=1026 Len=0,0
48,0.308426,192.168.1.31,52.3.144.142,TLSv1.2,89,Application Data,0
49,0.310107,52.3.144.142,192.168.1.31,TCP,1514,443  >  56483 [ACK] Seq=33914 Ack=104 Win=68 Len=1460 [TCP segment of a reassembled PDU],0
50,0.310127,192.168.1.31,52.3.144.142,TCP,54,56483  >  443 [ACK] Seq=139 Ack=35374 Win=1026 Len=0,0
51,0.310568,52.3.144.142,192.168.1.31,TCP,1514,443  >  56483 [ACK] Seq=35374 Ack=104 Win=68 Len=1460 [TCP segment of a reassembled PDU],0
52,0.310576,192.168.1.31,52.3.144.142,TCP,54,56483  >  443 [ACK] Seq=139 Ack=36834 Win=1026 Len=0,0
53,0.310588,52.3.144.142,192.168.1.31,TCP,1514,"443  >  56483 [PSH, ACK] Seq=36834 Ack=104 Win=68 Len=1460 [TCP segment of a reassembled PDU]",0
54,0.310591,192.168.1.31,52.3.144.142,TCP,54,56483  >  443 [ACK] Seq=139 Ack=38294 Win=1026 Len=0,0
55,0.310958,52.3.144.142,192.168.1.31,TLSv1.2,234,Application Data,0
56,0.310961,192.168.1.31,52.3.144.142,TCP,54,56483  >  443 [ACK] Seq=139 Ack=38474 Win=1025 Len=0,0
57,0.310982,52.3.144.142,192.168.1.31,TCP,1514,443  >  56483 [ACK] Seq=38474 Ack=104 Win=68 Len=1460 [TCP segment of a reassembled PDU],0
58,0.310985,192.168.1.31,52.3.144.142,TCP,54,56483  >  443 [ACK] Seq=139 Ack=39934 Win=1026 Len=0,0
59,0.310995,52.3.144.142,192.168.1.31,TCP,1514,443  >  56483 [ACK] Seq=39934 Ack=104 Win=68 Len=1460 [TCP segment of a reassembled PDU],0
60,0.310995,52.3.144.142,192.168.1.31,TLSv1.2,434,Application Data,0
61,0.311,192.168.1.31,52.3.144.142,TCP,54,56483  >  443 [ACK] Seq=139 Ack=41774 Win=1026 Len=0,0
62,0.364615,52.3.144.142,192.168.1.31,TCP,60,443  >  56483 [ACK] Seq=41774 Ack=139 Win=68 Len=0,0
63,0.73206,192.168.1.31,52.3.144.142,TLSv1.2,601,Application Data,0
64,0.732086,192.168.1.31,52.3.144.142,TLSv1.2,1499,Application Data,0
65,0.747747,52.3.144.142,192.168.1.31,TCP,60,443  >  56483 [ACK] Seq=41774 Ack=686 Win=68 Len=0,0
66,0.753846,52.3.144.142,192.168.1.31,TCP,60,443  >  56483 [ACK] Seq=41774 Ack=2131 Win=68 Len=0,0
67,0.950213,192.168.1.31,52.3.144.142,TLSv1.2,354,Application Data,0
68,0.95024,192.168.1.31,52.3.144.142,TLSv1.2,273,Application Data,0
69,0.966048,52.3.144.142,192.168.1.31,TCP,60,443  >  56483 [ACK] Seq=41774 Ack=2431 Win=68 Len=0,0
70,0.966081,52.3.144.142,192.168.1.31,TCP,60,443  >  56483 [ACK] Seq=41774 Ack=2650 Win=68 Len=0,0
71,0.98444,192.168.1.31,52.3.144.142,TLSv1.2,147,Application Data,0
72,1.000155,52.3.144.142,192.168.1.31,TCP,60,443  >  56483 [ACK] Seq=41774 Ack=2743 Win=68 Len=0,0
73,1.000155,52.3.144.142,192.168.1.31,TLSv1.2,401,Application Data,0
74,1.017869,52.3.144.142,192.168.1.31,TLSv1.2,474,Application Data,0
75,1.017887,192.168.1.31,52.3.144.142,TCP,54,56483  >  443 [ACK] Seq=2743 Ack=42541 Win=1023 Len=0,0
76,1.271168,52.3.144.142,192.168.1.31,TLSv1.2,300,Application Data,0
77,1.27122,52.3.144.142,192.168.1.31,TCP,1514,443  >  56483 [ACK] Seq=42787 Ack=2743 Win=68 Len=1460 [TCP segment of a reassembled PDU],0
78,1.271229,192.168.1.31,52.3.144.142,TCP,54,56483  >  443 [ACK] Seq=2743 Ack=44247 Win=1026 Len=0,0
79,1.271708,52.3.144.142,192.168.1.31,TCP,1514,443  >  56483 [ACK] Seq=44247 Ack=2743 Win=68 Len=1460 [TCP segment of a reassembled PDU],0
80,1.27172,52.3.144.142,192.168.1.31,TCP,1514,443  >  56483 [ACK] Seq=45707 Ack=2743 Win=68 Len=1460 [TCP segment of a reassembled PDU],0
81,1.271724,192.168.1.31,52.3.144.142,TCP,54,56483  >  443 [ACK] Seq=2743 Ack=47167 Win=1026 Len=0,0
82,1.271735,52.3.144.142,192.168.1.31,TCP,1514,443  >  56483 [ACK] Seq=47167 Ack=2743 Win=68 Len=1460 [TCP segment of a reassembled PDU],0
83,1.271735,52.3.144.142,192.168.1.31,TLSv1.2,1009,Application Data,0
84,1.271741,192.168.1.31,52.3.144.142,TCP,54,56483  >  443 [ACK] Seq=2743 Ack=49582 Win=1026 Len=0,0
85,1.271763,52.3.144.142,192.168.1.31,TCP,1514,443  >  56483 [ACK] Seq=49582 Ack=2743 Win=68 Len=1460 [TCP segment of a reassembled PDU],0
86,1.272089,52.3.144.142,192.168.1.31,TCP,1514,443  >  56483 [ACK] Seq=51042 Ack=2743 Win=68 Len=1460 [TCP segment of a reassembled PDU],0
87,1.272089,52.3.144.142,192.168.1.31,TCP,1514,443  >  56483 [ACK] Seq=52502 Ack=2743 Win=68 Len=1460 [TCP segment of a reassembled PDU],0
88,1.2721,192.168.1.31,52.3.144.142,TCP,54,56483  >  443 [ACK] Seq=2743 Ack=53962 Win=1026 Len=0,0
89,1.272114,52.3.144.142,192.168.1.31,TCP,1514,443  >  56483 [ACK] Seq=53962 Ack=2743 Win=68 Len=1460 [TCP segment of a reassembled PDU],0
90,1.272114,52.3.144.142,192.168.1.31,TLSv1.2,60,Application Data,0
91,1.272118,192.168.1.31,52.3.144.142,TCP,54,56483  >  443 [ACK] Seq=2743 Ack=55427 Win=1026 Len=0,0
92,1.27275,52.3.144.142,192.168.1.31,TCP,1514,443  >  56483 [ACK] Seq=55427 Ack=2743 Win=68 Len=1460 [TCP segment of a reassembled PDU],0
93,1.272754,192.168.1.31,52.3.144.142,TCP,54,56483  >  443 [ACK] Seq=2743 Ack=56887 Win=1026 Len=0,0
94,1.272779,52.3.144.142,192.168.1.31,TCP,1514,443  >  56483 [ACK] Seq=56887 Ack=2743 Win=68 Len=1460 [TCP segment of a reassembled PDU],0
95,1.272779,52.3.144.142,192.168.1.31,TLSv1.2,462,Application Data,0
96,1.272785,192.168.1.31,52.3.144.142,TCP,54,56483  >  443 [ACK] Seq=2743 Ack=58755 Win=1026 Len=0,0
97,1.273193,52.3.144.142,192.168.1.31,TCP,1514,443  >  56483 [ACK] Seq=58755 Ack=2743 Win=68 Len=1460 [TCP segment of a reassembled PDU],0
98,1.273663,52.3.144.142,192.168.1.31,TLSv1.2,1216,Application Data,0
99,1.273663,52.3.144.142,192.168.1.31,TLSv1.2,95,Application Data,0
100,1.273671,192.168.1.31,52.3.144.142,TCP,54,56483  >  443 [ACK] Seq=2743 Ack=61418 Win=1026 Len=0,0
101,1.275359,52.3.144.142,192.168.1.31,TCP,1514,443  >  56483 [ACK] Seq=61418 Ack=2743 Win=68 Len=1460 [TCP segment of a reassembled PDU],0
102,1.275367,192.168.1.31,52.3.144.142,TCP,54,56483  >  443 [ACK] Seq=2743 Ack=62878 Win=1026 Len=0,0
103,1.275379,52.3.144.142,192.168.1.31,TCP,1514,443  >  56483 [ACK] Seq=62878 Ack=2743 Win=68 Len=1460 [TCP segment of a reassembled PDU],0
104,1.275379,52.3.144.142,192.168.1.31,TLSv1.2,827,Application Data,0
105,1.275385,192.168.1.31,52.3.144.142,TCP,54,56483  >  443 [ACK] Seq=2743 Ack=65111 Win=1026 Len=0,0
106,1.276198,52.3.144.142,192.168.1.31,TCP,1514,443  >  56483 [ACK] Seq=65111 Ack=2743 Win=68 Len=1460 [TCP segment of a reassembled PDU],0
107,1.276657,52.3.144.142,192.168.1.31,TCP,1514,443  >  56483 [ACK] Seq=66571 Ack=2743 Win=68 Len=1460 [TCP segment of a reassembled PDU],0
108,1.276657,52.3.144.142,192.168.1.31,TLSv1.2,889,Application Data,0
109,1.276664,192.168.1.31,52.3.144.142,TCP,54,56483  >  443 [ACK] Seq=2743 Ack=68866 Win=1026 Len=0,0
110,1.276685,52.3.144.142,192.168.1.31,TCP,1514,443  >  56483 [ACK] Seq=68866 Ack=2743 Win=68 Len=1460 [TCP segment of a reassembled PDU],0
111,1.27669,192.168.1.31,52.3.144.142,TCP,54,56483  >  443 [ACK] Seq=2743 Ack=70326 Win=1026 Len=0,0
112,1.276905,52.3.144.142,192.168.1.31,TLSv1.2,98,Application Data,0
113,1.321947,192.168.1.31,52.3.144.142,TCP,54,56483  >  443 [ACK] Seq=2743 Ack=70370 Win=1026 Len=0,0
114,2.865456,192.168.1.31,52.3.144.142,TLSv1.2,122,Application Data,0
115,2.894408,52.3.144.142,192.168.1.31,TLSv1.2,287,Application Data,0
116,2.895071,52.3.144.142,192.168.1.31,TCP,1514,443  >  56483 [ACK] Seq=70603 Ack=2811 Win=68 Len=1460 [TCP segment of a reassembled PDU],0
117,2.895085,192.168.1.31,52.3.144.142,TCP,54,56483  >  443 [ACK] Seq=2811 Ack=72063 Win=1026 Len=0,0
118,2.895582,52.3.144.142,192.168.1.31,TCP,1514,443  >  56483 [ACK] Seq=72063 Ack=2811 Win=68 Len=1460 [TCP segment of a reassembled PDU],0
119,2.895582,52.3.144.142,192.168.1.31,TLSv1.2,1514,Application Data,0
120,2.895582,52.3.144.142,192.168.1.31,TCP,1514,443  >  56483 [ACK] Seq=74983 Ack=2811 Win=68 Len=1460 [TCP segment of a reassembled PDU],0
121,2.895582,52.3.144.142,192.168.1.31,TLSv1.2,783,Application Data,0
122,2.895595,192.168.1.31,52.3.144.142,TCP,54,56483  >  443 [ACK] Seq=2811 Ack=77172 Win=1026 Len=0,0
123,2.896881,52.3.144.142,192.168.1.31,TCP,1514,443  >  56483 [ACK] Seq=77172 Ack=2811 Win=68 Len=1460 [TCP segment of a reassembled PDU],0
124,2.896881,52.3.144.142,192.168.1.31,TLSv1.2,178,Application Data,0
125,2.896891,192.168.1.31,52.3.144.142,TCP,54,56483  >  443 [ACK] Seq=2811 Ack=78756 Win=1026 Len=0,0
126,2.89699,52.3.144.142,192.168.1.31,TCP,1514,443  >  56483 [ACK] Seq=78756 Ack=2811 Win=68 Len=1460 [TCP segment of a reassembled PDU],0
127,2.897434,52.3.144.142,192.168.1.31,TCP,1514,443  >  56483 [ACK] Seq=80216 Ack=2811 Win=68 Len=1460 [TCP segment of a reassembled PDU],0
128,2.897434,52.3.144.142,192.168.1.31,TCP,1514,443  >  56483 [ACK] Seq=81676 Ack=2811 Win=68 Len=1460 [TCP segment of a reassembled PDU],0
129,2.897434,52.3.144.142,192.168.1.31,TLSv1.2,819,Application Data,0
130,2.897434,52.3.144.142,192.168.1.31,TLSv1.2,170,Application Data,0
131,2.897447,192.168.1.31,52.3.144.142,TCP,54,56483  >  443 [ACK] Seq=2811 Ack=84017 Win=1026 Len=0,0
132,2.898816,52.3.144.142,192.168.1.31,TLSv1.2,292,Application Data,0
133,2.898824,192.168.1.31,52.3.144.142,TCP,54,56483  >  443 [ACK] Seq=2811 Ack=84255 Win=1025 Len=0,0
134,3.045474,192.168.1.31,52.3.144.142,TLSv1.2,374,Application Data,0
135,3.045496,192.168.1.31,52.3.144.142,TLSv1.2,742,Application Data,0
136,3.062113,52.3.144.142,192.168.1.31,TCP,60,443  >  56483 [ACK] Seq=84255 Ack=3819 Win=68 Len=0,0
137,3.06238,192.168.1.31,52.3.144.142,TLSv1.2,349,Application Data,0
138,3.062405,192.168.1.31,52.3.144.142,TLSv1.2,209,Application Data,0
139,3.078494,52.3.144.142,192.168.1.31,TCP,60,443  >  56483 [ACK] Seq=84255 Ack=4269 Win=68 Len=0,0
140,3.119309,52.3.144.142,192.168.1.31,TLSv1.2,311,Application Data,0
141,3.144188,192.168.1.31,52.3.144.142,TLSv1.2,350,Application Data,0
142,3.144215,192.168.1.31,52.3.144.142,TLSv1.2,1354,Application Data,0
143,3.163873,52.3.144.142,192.168.1.31,TLSv1.2,431,Application Data,0
144,3.204601,52.3.144.142,192.168.1.31,TCP,60,443  >  56483 [ACK] Seq=84889 Ack=5865 Win=68 Len=0,0
145,3.219153,192.168.1.31,52.3.144.142,TCP,54,56483  >  443 [ACK] Seq=5865 Ack=84889 Win=1023 Len=0,0
146,3.253597,192.168.1.31,52.3.144.142,TLSv1.2,350,Application Data,0
147,3.253616,192.168.1.31,52.3.144.142,TLSv1.2,1194,Application Data,0
148,3.274576,52.3.144.142,192.168.1.31,TCP,60,443  >  56483 [ACK] Seq=84889 Ack=6161 Win=68 Len=0,0
149,3.274576,52.3.144.142,192.168.1.31,TCP,60,443  >  56483 [ACK] Seq=84889 Ack=7301 Win=68 Len=0,0
150,3.324046,192.168.1.31,52.3.144.142,TLSv1.2,245,Application Data,0
151,3.324073,192.168.1.31,52.3.144.142,TLSv1.2,9757,Application Data,0
152,3.336542,52.3.144.142,192.168.1.31,TCP,60,443  >  56483 [ACK] Seq=84889 Ack=7492 Win=68 Len=0,0
153,3.342665,52.3.144.142,192.168.1.31,TCP,60,443  >  56483 [ACK] Seq=84889 Ack=8952 Win=68 Len=0,0
154,3.342665,52.3.144.142,192.168.1.31,TCP,60,443  >  56483 [ACK] Seq=84889 Ack=13332 Win=68 Len=0,0
155,3.342665,52.3.144.142,192.168.1.31,TCP,60,443  >  56483 [ACK] Seq=84889 Ack=17195 Win=103 Len=0,0
156,3.360224,52.3.144.142,192.168.1.31,TLSv1.2,1189,Application Data,0
157,3.364072,52.3.144.142,192.168.1.31,TCP,1514,443  >  56483 [ACK] Seq=86024 Ack=17195 Win=103 Len=1460 [TCP segment of a reassembled PDU],0
158,3.364072,52.3.144.142,192.168.1.31,TCP,1514,443  >  56483 [ACK] Seq=87484 Ack=17195 Win=103 Len=1460 [TCP segment of a reassembled PDU],0
159,3.364101,192.168.1.31,52.3.144.142,TCP,54,56483  >  443 [ACK] Seq=17195 Ack=88944 Win=1026 Len=0,0
160,3.365286,52.3.144.142,192.168.1.31,TLSv1.2,866,Application Data,0
161,3.365311,192.168.1.31,52.3.144.142,TCP,54,56483  >  443 [ACK] Seq=17195 Ack=89756 Win=1023 Len=0,0
162,4.164741,192.168.1.31,52.3.144.142,TLSv1.2,263,Application Data,0
163,4.164772,192.168.1.31,52.3.144.142,TLSv1.2,16460,Application Data,0
164,4.164791,192.168.1.31,52.3.144.142,TLSv1.2,8118,Application Data,0
165,4.180729,52.3.144.142,192.168.1.31,TCP,60,443  >  56483 [ACK] Seq=89756 Ack=18864 Win=144 Len=0,0
166,4.185656,52.3.144.142,192.168.1.31,TCP,60,443  >  56483 [ACK] Seq=89756 Ack=29084 Win=214 Len=0,0
167,4.185679,52.3.144.142,192.168.1.31,TCP,60,443  >  56483 [ACK] Seq=89756 Ack=33810 Win=249 Len=0,0
168,4.185679,52.3.144.142,192.168.1.31,TCP,60,443  >  56483 [ACK] Seq=89756 Ack=38190 Win=290 Len=0,0
169,4.186564,52.3.144.142,192.168.1.31,TCP,60,443  >  56483 [ACK] Seq=89756 Ack=41874 Win=325 Len=0,0
170,4.279167,52.3.144.142,192.168.1.31,TCP,1514,443  >  56483 [ACK] Seq=89756 Ack=41874 Win=325 Len=1460 [TCP segment of a reassembled PDU],0
171,4.279199,52.3.144.142,192.168.1.31,TCP,1514,443  >  56483 [ACK] Seq=91216 Ack=41874 Win=325 Len=1460 [TCP segment of a reassembled PDU],0
172,4.279209,192.168.1.31,52.3.144.142,TCP,54,56483  >  443 [ACK] Seq=41874 Ack=92676 Win=1026 Len=0,0
173,4.27964,52.3.144.142,192.168.1.31,TCP,1514,443  >  56483 [ACK] Seq=92676 Ack=41874 Win=325 Len=1460 [TCP segment of a reassembled PDU],0
174,4.279671,52.3.144.142,192.168.1.31,TCP,1514,443  >  56483 [ACK] Seq=94136 Ack=41874 Win=325 Len=1460 [TCP segment of a reassembled PDU],0
175,4.279671,52.3.144.142,192.168.1.31,TCP,1514,443  >  56483 [ACK] Seq=95596 Ack=41874 Win=325 Len=1460 [TCP segment of a reassembled PDU],0
176,4.279671,52.3.144.142,192.168.1.31,TCP,1514,"443  >  56483 [PSH, ACK] Seq=97056 Ack=41874 Win=325 Len=1460 [TCP segment of a reassembled PDU]",0
177,4.279682,192.168.1.31,52.3.144.142,TCP,54,56483  >  443 [ACK] Seq=41874 Ack=98516 Win=1026 Len=0,0
178,4.279695,52.3.144.142,192.168.1.31,TCP,1514,443  >  56483 [ACK] Seq=98516 Ack=41874 Win=325 Len=1460 [TCP segment of a reassembled PDU],0
179,4.280333,52.3.144.142,192.168.1.31,TCP,1514,443  >  56483 [ACK] Seq=99976 Ack=41874 Win=325 Len=1460 [TCP segment of a reassembled PDU],0
180,4.280333,52.3.144.142,192.168.1.31,TCP,1514,443  >  56483 [ACK] Seq=101436 Ack=41874 Win=325 Len=1460 [TCP segment of a reassembled PDU],0
181,4.280333,52.3.144.142,192.168.1.31,TCP,1514,443  >  56483 [ACK] Seq=102896 Ack=41874 Win=325 Len=1460 [TCP segment of a reassembled PDU],0
182,4.280333,52.3.144.142,192.168.1.31,TCP,1514,443  >  56483 [ACK] Seq=104356 Ack=41874 Win=325 Len=1460 [TCP segment of a reassembled PDU],0
183,4.280333,52.3.144.142,192.168.1.31,TLSv1.2,1514,Application Data,0
184,4.280345,192.168.1.31,52.3.144.142,TCP,54,56483  >  443 [ACK] Seq=41874 Ack=107276 Win=1026 Len=0,0
185,4.280528,52.3.144.142,192.168.1.31,TCP,1514,443  >  56483 [ACK] Seq=107276 Ack=41874 Win=325 Len=1460 [TCP segment of a reassembled PDU],0
186,4.28054,52.3.144.142,192.168.1.31,TCP,1514,443  >  56483 [ACK] Seq=108736 Ack=41874 Win=325 Len=1460 [TCP segment of a reassembled PDU],0
187,4.280544,192.168.1.31,52.3.144.142,TCP,54,56483  >  443 [ACK] Seq=41874 Ack=110196 Win=1026 Len=0,0
188,4.281212,52.3.144.142,192.168.1.31,TCP,1514,443  >  56483 [ACK] Seq=110196 Ack=41874 Win=325 Len=1460 [TCP segment of a reassembled PDU],0
189,4.281212,52.3.144.142,192.168.1.31,TCP,1514,443  >  56483 [ACK] Seq=111656 Ack=41874 Win=325 Len=1460 [TCP segment of a reassembled PDU],0
190,4.281212,52.3.144.142,192.168.1.31,TCP,1514,443  >  56483 [ACK] Seq=113116 Ack=41874 Win=325 Len=1460 [TCP segment of a reassembled PDU],0
191,4.281212,52.3.144.142,192.168.1.31,TCP,1514,"443  >  56483 [PSH, ACK] Seq=114576 Ack=41874 Win=325 Len=1460 [TCP segment of a reassembled PDU]",0
192,4.281231,192.168.1.31,52.3.144.142,TCP,54,56483  >  443 [ACK] Seq=41874 Ack=116036 Win=1026 Len=0,0
193,4.281518,52.3.144.142,192.168.1.31,TCP,1514,443  >  56483 [ACK] Seq=116036 Ack=41874 Win=325 Len=1460 [TCP segment of a reassembled PDU],0
194,4.281518,52.3.144.142,192.168.1.31,TCP,1514,443  >  56483 [ACK] Seq=117496 Ack=41874 Win=325 Len=1460 [TCP segment of a reassembled PDU],0
195,4.281528,192.168.1.31,52.3.144.142,TCP,54,56483  >  443 [ACK] Seq=41874 Ack=118956 Win=1026 Len=0,0
196,4.282098,52.3.144.142,192.168.1.31,TCP,1514,443  >  56483 [ACK] Seq=118956 Ack=41874 Win=325 Len=1460 [TCP segment of a reassembled PDU],0
197,4.282098,52.3.144.142,192.168.1.31,TCP,1514,443  >  56483 [ACK] Seq=120416 Ack=41874 Win=325 Len=1460 [TCP segment of a reassembled PDU],0
198,4.282098,52.3.144.142,192.168.1.31,TLSv1.2,1514,Application Data,0
199,4.282098,52.3.144.142,192.168.1.31,TCP,1514,"443  >  56483 [PSH, ACK] Seq=123336 Ack=41874 Win=325 Len=1460 [TCP segment of a reassembled PDU]",0
200,4.282113,192.168.1.31,52.3.144.142,TCP,54,56483  >  443 [ACK] Seq=41874 Ack=124796 Win=1026 Len=0,0
201,4.282431,52.3.144.142,192.168.1.31,TCP,1514,443  >  56483 [ACK] Seq=124796 Ack=41874 Win=325 Len=1460 [TCP segment of a reassembled PDU],0
202,4.282868,52.3.144.142,192.168.1.31,TCP,1514,443  >  56483 [ACK] Seq=126256 Ack=41874 Win=325 Len=1460 [TCP segment of a reassembled PDU],0
203,4.282879,192.168.1.31,52.3.144.142,TCP,54,56483  >  443 [ACK] Seq=41874 Ack=127716 Win=1026 Len=0,0
204,4.282905,52.3.144.142,192.168.1.31,TCP,1514,443  >  56483 [ACK] Seq=127716 Ack=41874 Win=325 Len=1460 [TCP segment of a reassembled PDU],0
205,4.282905,52.3.144.142,192.168.1.31,TCP,1514,443  >  56483 [ACK] Seq=129176 Ack=41874 Win=325 Len=1460 [TCP segment of a reassembled PDU],0
206,4.282905,52.3.144.142,192.168.1.31,TCP,1514,443  >  56483 [ACK] Seq=130636 Ack=41874 Win=325 Len=1460 [TCP segment of a reassembled PDU],0
207,4.282913,192.168.1.31,52.3.144.142,TCP,54,56483  >  443 [ACK] Seq=41874 Ack=132096 Win=1026 Len=0,0
208,4.282927,52.3.144.142,192.168.1.31,TCP,1514,"443  >  56483 [PSH, ACK] Seq=132096 Ack=41874 Win=325 Len=1460 [TCP segment of a reassembled PDU]",0
209,4.282932,192.168.1.31,52.3.144.142,TCP,54,56483  >  443 [ACK] Seq=41874 Ack=133556 Win=1026 Len=0,0
210,4.283263,52.3.144.142,192.168.1.31,TCP,1514,443  >  56483 [ACK] Seq=133556 Ack=41874 Win=325 Len=1460 [TCP segment of a reassembled PDU],0
211,4.283275,52.3.144.142,192.168.1.31,TCP,1514,443  >  56483 [ACK] Seq=135016 Ack=41874 Win=325 Len=1460 [TCP segment of a reassembled PDU],0
212,4.28328,192.168.1.31,52.3.144.142,TCP,54,56483  >  443 [ACK] Seq=41874 Ack=136476 Win=1026 Len=0,0
213,4.283294,52.3.144.142,192.168.1.31,TCP,1514,443  >  56483 [ACK] Seq=136476 Ack=41874 Win=325 Len=1460 [TCP segment of a reassembled PDU],0
214,4.283294,52.3.144.142,192.168.1.31,TLSv1.2,252,Application Data,0
215,4.283301,192.168.1.31,52.3.144.142,TCP,54,56483  >  443 [ACK] Seq=41874 Ack=138134 Win=1026 Len=0,0
216,5.130825,52.3.144.142,192.168.1.31,TLSv1.2,236,Application Data,0
217,5.132024,52.3.144.142,192.168.1.31,TCP,1514,443  >  56483 [ACK] Seq=138316 Ack=41874 Win=325 Len=1460 [TCP segment of a reassembled PDU],0
218,5.132024,52.3.144.142,192.168.1.31,TCP,1514,443  >  56483 [ACK] Seq=139776 Ack=41874 Win=325 Len=1460 [TCP segment of a reassembled PDU],0
219,5.132061,192.168.1.31,52.3.144.142,TCP,54,56483  >  443 [ACK] Seq=41874 Ack=141236 Win=1026 Len=0,0
220,5.13241,52.3.144.142,192.168.1.31,TLSv1.2,1342,Application Data,0
221,5.132419,192.168.1.31,52.3.144.142,TCP,54,56483  >  443 [ACK] Seq=41874 Ack=142524 Win=1021 Len=0,0
222,5.13243,52.3.144.142,192.168.1.31,TCP,1514,443  >  56483 [ACK] Seq=142524 Ack=41874 Win=325 Len=1460 [TCP segment of a reassembled PDU],0
223,5.132441,52.3.144.142,192.168.1.31,TCP,1514,443  >  56483 [ACK] Seq=143984 Ack=41874 Win=325 Len=1460 [TCP segment of a reassembled PDU],0
224,5.132441,52.3.144.142,192.168.1.31,TLSv1.2,989,Application Data,0
225,5.132448,192.168.1.31,52.3.144.142,TCP,54,56483  >  443 [ACK] Seq=41874 Ack=146379 Win=1026 Len=0,0
226,5.133009,52.3.144.142,192.168.1.31,TCP,1514,443  >  56483 [ACK] Seq=146379 Ack=41874 Win=325 Len=1460 [TCP segment of a reassembled PDU],0
227,5.133009,52.3.144.142,192.168.1.31,TCP,1514,443  >  56483 [ACK] Seq=147839 Ack=41874 Win=325 Len=1460 [TCP segment of a reassembled PDU],0
228,5.133019,192.168.1.31,52.3.144.142,TCP,54,56483  >  443 [ACK] Seq=41874 Ack=149299 Win=1026 Len=0,0
229,5.133264,52.3.144.142,192.168.1.31,TLSv1.2,1128,Application Data,0
230,5.133271,192.168.1.31,52.3.144.142,TCP,54,56483  >  443 [ACK] Seq=41874 Ack=150373 Win=1022 Len=0,0
231,5.13331,52.3.144.142,192.168.1.31,TCP,1514,443  >  56483 [ACK] Seq=150373 Ack=41874 Win=325 Len=1460 [TCP segment of a reassembled PDU],0
232,5.133746,52.3.144.142,192.168.1.31,TCP,1514,443  >  56483 [ACK] Seq=151833 Ack=41874 Win=325 Len=1460 [TCP segment of a reassembled PDU],0
233,5.133746,52.3.144.142,192.168.1.31,TLSv1.2,328,Application Data,0
234,5.133746,52.3.144.142,192.168.1.31,TLSv1.2,101,Application Data,0
235,5.133752,192.168.1.31,52.3.144.142,TCP,54,56483  >  443 [ACK] Seq=41874 Ack=153614 Win=1026 Len=0,0
236,5.134593,52.3.144.142,192.168.1.31,TCP,1514,443  >  56483 [ACK] Seq=153614 Ack=41874 Win=325 Len=1460 [TCP segment of a reassembled PDU],0
237,5.134601,52.3.144.142,192.168.1.31,TLSv1.2,1203,Application Data,0
238,5.134606,192.168.1.31,52.3.144.142,TCP,54,56483  >  443 [ACK] Seq=41874 Ack=156223 Win=1026 Len=0,0
239,5.135298,52.3.144.142,192.168.1.31,TCP,1514,443  >  56483 [ACK] Seq=156223 Ack=41874 Win=325 Len=1460 [TCP segment of a reassembled PDU],0
240,5.135748,52.3.144.142,192.168.1.31,TLSv1.2,955,Application Data,0
241,5.135753,192.168.1.31,52.3.144.142,TCP,54,56483  >  443 [ACK] Seq=41874 Ack=158584 Win=1026 Len=0,0
242,5.135764,52.3.144.142,192.168.1.31,TCP,1514,443  >  56483 [ACK] Seq=158584 Ack=41874 Win=325 Len=1460 [TCP segment of a reassembled PDU],0
243,5.135773,52.3.144.142,192.168.1.31,TLSv1.2,1156,Application Data,0
244,5.135777,192.168.1.31,52.3.144.142,TCP,54,56483  >  443 [ACK] Seq=41874 Ack=161146 Win=1026 Len=0,0
245,5.13733,52.3.144.142,192.168.1.31,TCP,1514,443  >  56483 [ACK] Seq=161146 Ack=41874 Win=325 Len=1460 [TCP segment of a reassembled PDU],0
246,5.137346,52.3.144.142,192.168.1.31,TCP,1514,443  >  56483 [ACK] Seq=162606 Ack=41874 Win=325 Len=1460 [TCP segment of a reassembled PDU],0
247,5.137346,52.3.144.142,192.168.1.31,TLSv1.2,63,Application Data,0
248,5.137351,192.168.1.31,52.3.144.142,TCP,54,56483  >  443 [ACK] Seq=41874 Ack=164075 Win=1026 Len=0,0
249,5.137624,52.3.144.142,192.168.1.31,TCP,1514,443  >  56483 [ACK] Seq=164075 Ack=41874 Win=325 Len=1460 [TCP segment of a reassembled PDU],0
250,5.137628,192.168.1.31,52.3.144.142,TCP,54,56483  >  443 [ACK] Seq=41874 Ack=165535 Win=1026 Len=0,0
251,5.137637,52.3.144.142,192.168.1.31,TLSv1.2,1032,Application Data,0
252,5.137686,52.3.144.142,192.168.1.31,TLSv1.2,95,Application Data,0
253,5.137689,192.168.1.31,52.3.144.142,TCP,54,56483  >  443 [ACK] Seq=41874 Ack=166554 Win=1022 Len=0,0
254,5.139218,52.3.144.142,192.168.1.31,TCP,1514,443  >  56483 [ACK] Seq=166554 Ack=41874 Win=325 Len=1460 [TCP segment of a reassembled PDU],0
255,5.139235,52.3.144.142,192.168.1.31,TLSv1.2,1496,Application Data,0
256,5.139243,192.168.1.31,52.3.144.142,TCP,54,56483  >  443 [ACK] Seq=41874 Ack=169456 Win=1026 Len=0,0
257,5.140103,52.3.144.142,192.168.1.31,TCP,1514,443  >  56483 [ACK] Seq=169456 Ack=41874 Win=325 Len=1460 [TCP segment of a reassembled PDU],0
258,5.140139,52.3.144.142,192.168.1.31,TLSv1.2,1111,Application Data,0
259,5.140139,52.3.144.142,192.168.1.31,TCP,1514,443  >  56483 [ACK] Seq=171973 Ack=41874 Win=325 Len=1460 [TCP segment of a reassembled PDU],0
260,5.140139,52.3.144.142,192.168.1.31,TCP,1514,443  >  56483 [ACK] Seq=173433 Ack=41874 Win=325 Len=1460 [TCP segment of a reassembled PDU],0
261,5.140146,192.168.1.31,52.3.144.142,TCP,54,56483  >  443 [ACK] Seq=41874 Ack=174893 Win=1026 Len=0,0
262,5.140513,52.3.144.142,192.168.1.31,TLSv1.2,354,Application Data,0
263,5.142315,52.3.144.142,192.168.1.31,TCP,1514,443  >  56483 [ACK] Seq=175193 Ack=41874 Win=325 Len=1460 [TCP segment of a reassembled PDU],0
264,5.142325,192.168.1.31,52.3.144.142,TCP,54,56483  >  443 [ACK] Seq=41874 Ack=176653 Win=1026 Len=0,0
265,5.142777,52.3.144.142,192.168.1.31,TLSv1.2,1192,Application Data,0
266,5.142791,52.3.144.142,192.168.1.31,TCP,1514,443  >  56483 [ACK] Seq=177791 Ack=41874 Win=325 Len=1460 [TCP segment of a reassembled PDU],0
267,5.142794,192.168.1.31,52.3.144.142,TCP,54,56483  >  443 [ACK] Seq=41874 Ack=179251 Win=1026 Len=0,0
268,5.143193,52.3.144.142,192.168.1.31,TLSv1.2,1371,Application Data,0
269,5.143193,52.3.144.142,192.168.1.31,TLSv1.2,103,Application Data,0
270,5.143198,192.168.1.31,52.3.144.142,TCP,54,56483  >  443 [ACK] Seq=41874 Ack=180617 Win=1021 Len=0,0
271,5.143905,52.3.144.142,192.168.1.31,TCP,1514,443  >  56483 [ACK] Seq=180617 Ack=41874 Win=325 Len=1460 [TCP segment of a reassembled PDU],0
272,5.143923,52.3.144.142,192.168.1.31,TCP,1514,443  >  56483 [ACK] Seq=182077 Ack=41874 Win=325 Len=1460 [TCP segment of a reassembled PDU],0
273,5.143923,52.3.144.142,192.168.1.31,TLSv1.2,491,Application Data,0
274,5.143928,192.168.1.31,52.3.144.142,TCP,54,56483  >  443 [ACK] Seq=41874 Ack=183974 Win=1026 Len=0,0
275,5.144303,52.3.144.142,192.168.1.31,TCP,1514,443  >  56483 [ACK] Seq=183974 Ack=41874 Win=325 Len=1460 [TCP segment of a reassembled PDU],0
276,5.144308,192.168.1.31,52.3.144.142,TCP,54,56483  >  443 [ACK] Seq=41874 Ack=185434 Win=1026 Len=0,0
277,5.144751,52.3.144.142,192.168.1.31,TLSv1.2,1267,Application Data,0
278,5.144764,52.3.144.142,192.168.1.31,TCP,1514,443  >  56483 [ACK] Seq=186647 Ack=41874 Win=325 Len=1460 [TCP segment of a reassembled PDU],0
279,5.144766,192.168.1.31,52.3.144.142,TCP,54,56483  >  443 [ACK] Seq=41874 Ack=188107 Win=1026 Len=0,0
280,5.144776,52.3.144.142,192.168.1.31,TLSv1.2,1039,Application Data,0
281,5.145074,52.3.144.142,192.168.1.31,TCP,1514,443  >  56483 [ACK] Seq=189092 Ack=41874 Win=325 Len=1460 [TCP segment of a reassembled PDU],0
282,5.145077,192.168.1.31,52.3.144.142,TCP,54,56483  >  443 [ACK] Seq=41874 Ack=190552 Win=1026 Len=0,0
283,5.145542,52.3.144.142,192.168.1.31,TLSv1.2,1235,Application Data,0
284,5.145567,52.3.144.142,192.168.1.31,TCP,1514,443  >  56483 [ACK] Seq=191733 Ack=41874 Win=325 Len=1460 [TCP segment of a reassembled PDU],0
285,5.145571,192.168.1.31,52.3.144.142,TCP,54,56483  >  443 [ACK] Seq=41874 Ack=193193 Win=1026 Len=0,0
286,5.145811,52.3.144.142,192.168.1.31,TLSv1.2,1395,Application Data,0
287,5.145811,52.3.144.142,192.168.1.31,TLSv1.2,119,Application Data,0
288,5.145815,192.168.1.31,52.3.144.142,TCP,54,56483  >  443 [ACK] Seq=41874 Ack=194599 Win=1021 Len=0,0
289,5.147031,52.3.144.142,192.168.1.31,TCP,1514,443  >  56483 [ACK] Seq=194599 Ack=41874 Win=325 Len=1460 [TCP segment of a reassembled PDU],0
290,5.147405,52.3.144.142,192.168.1.31,TLSv1.2,1432,Application Data,0
291,5.147412,192.168.1.31,52.3.144.142,TCP,54,56483  >  443 [ACK] Seq=41874 Ack=197437 Win=1026 Len=0,0
292,5.14803,52.3.144.142,192.168.1.31,TCP,1514,443  >  56483 [ACK] Seq=197437 Ack=41874 Win=325 Len=1460 [TCP segment of a reassembled PDU],0
293,5.148044,52.3.144.142,192.168.1.31,TCP,1514,443  >  56483 [ACK] Seq=198897 Ack=41874 Win=325 Len=1460 [TCP segment of a reassembled PDU],0
294,5.148047,192.168.1.31,52.3.144.142,TCP,54,56483  >  443 [ACK] Seq=41874 Ack=200357 Win=1026 Len=0,0
295,5.148057,52.3.144.142,192.168.1.31,TCP,1514,443  >  56483 [ACK] Seq=200357 Ack=41874 Win=325 Len=1460 [TCP segment of a reassembled PDU],0
296,5.148057,52.3.144.142,192.168.1.31,TLSv1.2,72,Application Data,0
297,5.148063,192.168.1.31,52.3.144.142,TCP,54,56483  >  443 [ACK] Seq=41874 Ack=201835 Win=1026 Len=0,0
298,5.148417,52.3.144.142,192.168.1.31,TCP,1514,443  >  56483 [ACK] Seq=201835 Ack=41874 Win=325 Len=1460 [TCP segment of a reassembled PDU],0
299,5.148879,52.3.144.142,192.168.1.31,TLSv1.2,1244,Application Data,0
300,5.148886,192.168.1.31,52.3.144.142,TCP,54,56483  >  443 [ACK] Seq=41874 Ack=204485 Win=1026 Len=0,0
301,5.150033,52.3.144.142,192.168.1.31,TCP,1514,443  >  56483 [ACK] Seq=204485 Ack=41874 Win=325 Len=1460 [TCP segment of a reassembled PDU],0
302,5.150486,52.3.144.142,192.168.1.31,TLSv1.2,1350,Application Data,0
303,5.150491,192.168.1.31,52.3.144.142,TCP,54,56483  >  443 [ACK] Seq=41874 Ack=207241 Win=1026 Len=0,0
304,5.150501,52.3.144.142,192.168.1.31,TCP,1514,443  >  56483 [ACK] Seq=207241 Ack=41874 Win=325 Len=1460 [TCP segment of a reassembled PDU],0
305,5.150512,52.3.144.142,192.168.1.31,TLSv1.2,1495,Application Data,0
306,5.150514,192.168.1.31,52.3.144.142,TCP,54,56483  >  443 [ACK] Seq=41874 Ack=210142 Win=1026 Len=0,0
307,5.150523,52.3.144.142,192.168.1.31,TLSv1.2,97,Application Data,0
308,5.152161,52.3.144.142,192.168.1.31,TCP,1514,443  >  56483 [ACK] Seq=210185 Ack=41874 Win=325 Len=1460 [TCP segment of a reassembled PDU],0
309,5.152168,192.168.1.31,52.3.144.142,TCP,54,56483  >  443 [ACK] Seq=41874 Ack=211645 Win=1026 Len=0,0
310,5.152569,52.3.144.142,192.168.1.31,TLSv1.2,1346,Application Data,0
311,5.153938,52.3.144.142,192.168.1.31,TCP,1514,443  >  56483 [ACK] Seq=212937 Ack=41874 Win=325 Len=1460 [TCP segment of a reassembled PDU],0
312,5.153948,192.168.1.31,52.3.144.142,TCP,54,56483  >  443 [ACK] Seq=41874 Ack=214397 Win=1026 Len=0,0
313,5.153961,52.3.144.142,192.168.1.31,TLSv1.2,1385,Application Data,0
314,5.154216,52.3.144.142,192.168.1.31,TCP,1514,443  >  56483 [ACK] Seq=215728 Ack=41874 Win=325 Len=1460 [TCP segment of a reassembled PDU],0
315,5.154222,192.168.1.31,52.3.144.142,TCP,54,56483  >  443 [ACK] Seq=41874 Ack=217188 Win=1026 Len=0,0
316,5.154232,52.3.144.142,192.168.1.31,TLSv1.2,1236,Application Data,0
317,5.156073,52.3.144.142,192.168.1.31,TCP,1514,443  >  56483 [ACK] Seq=218370 Ack=41874 Win=325 Len=1460 [TCP segment of a reassembled PDU],0
318,5.156077,192.168.1.31,52.3.144.142,TCP,54,56483  >  443 [ACK] Seq=41874 Ack=219830 Win=1026 Len=0,0
319,5.156087,52.3.144.142,192.168.1.31,TCP,1514,443  >  56483 [ACK] Seq=219830 Ack=41874 Win=325 Len=1460 [TCP segment of a reassembled PDU],0
320,5.156087,52.3.144.142,192.168.1.31,TLSv1.2,309,Application Data,0
321,5.156091,192.168.1.31,52.3.144.142,TCP,54,56483  >  443 [ACK] Seq=41874 Ack=221545 Win=1026 Len=0,0
322,5.156689,52.3.144.142,192.168.1.31,TCP,1514,443  >  56483 [ACK] Seq=221545 Ack=41874 Win=325 Len=1460 [TCP segment of a reassembled PDU],0
323,5.156705,52.3.144.142,192.168.1.31,TCP,1514,443  >  56483 [ACK] Seq=223005 Ack=41874 Win=325 Len=1460 [TCP segment of a reassembled PDU],0
324,5.156705,52.3.144.142,192.168.1.31,TLSv1.2,219,Application Data,0
325,5.156705,52.3.144.142,192.168.1.31,TLSv1.2,94,Application Data,0
326,5.15671,192.168.1.31,52.3.144.142,TCP,54,56483  >  443 [ACK] Seq=41874 Ack=224670 Win=1026 Len=0,0
327,5.158538,52.3.144.142,192.168.1.31,TCP,1514,443  >  56483 [ACK] Seq=224670 Ack=41874 Win=325 Len=1460 [TCP segment of a reassembled PDU],0
328,5.158591,52.3.144.142,192.168.1.31,TCP,1514,443  >  56483 [ACK] Seq=226130 Ack=41874 Win=325 Len=1460 [TCP segment of a reassembled PDU],0
329,5.158591,52.3.144.142,192.168.1.31,TLSv1.2,60,Application Data,0
330,5.158596,192.168.1.31,52.3.144.142,TCP,54,56483  >  443 [ACK] Seq=41874 Ack=227592 Win=1026 Len=0,0
331,5.159143,52.3.144.142,192.168.1.31,TCP,1514,443  >  56483 [ACK] Seq=227592 Ack=41874 Win=325 Len=1460 [TCP segment of a reassembled PDU],0
332,5.159143,52.3.144.142,192.168.1.31,TLSv1.2,1472,Application Data,0
333,5.159154,192.168.1.31,52.3.144.142,TCP,54,56483  >  443 [ACK] Seq=41874 Ack=230470 Win=1026 Len=0,0
334,5.159852,52.3.144.142,192.168.1.31,TCP,1514,443  >  56483 [ACK] Seq=230470 Ack=41874 Win=325 Len=1460 [TCP segment of a reassembled PDU],0
335,5.15986,192.168.1.31,52.3.144.142,TCP,54,56483  >  443 [ACK] Seq=41874 Ack=231930 Win=1026 Len=0,0
336,5.159872,52.3.144.142,192.168.1.31,TLSv1.2,1357,Application Data,0
337,5.162102,52.3.144.142,192.168.1.31,TCP,1514,443  >  56483 [ACK] Seq=233233 Ack=41874 Win=325 Len=1460 [TCP segment of a reassembled PDU],0
338,5.162102,52.3.144.142,192.168.1.31,TLSv1.2,1195,Application Data,0
339,5.162111,192.168.1.31,52.3.144.142,TCP,54,56483  >  443 [ACK] Seq=41874 Ack=235834 Win=1026 Len=0,0
340,5.16216,52.3.144.142,192.168.1.31,TCP,1514,443  >  56483 [ACK] Seq=235834 Ack=41874 Win=325 Len=1460 [TCP segment of a reassembled PDU],0
341,5.162163,192.168.1.31,52.3.144.142,TCP,54,56483  >  443 [ACK] Seq=41874 Ack=237294 Win=1026 Len=0,0
342,5.162173,52.3.144.142,192.168.1.31,TCP,1514,443  >  56483 [ACK] Seq=237294 Ack=41874 Win=325 Len=1460 [TCP segment of a reassembled PDU],0
343,5.162173,52.3.144.142,192.168.1.31,TLSv1.2,497,Application Data,0
344,5.162173,52.3.144.142,192.168.1.31,TLSv1.2,121,Application Data,0
345,5.162179,192.168.1.31,52.3.144.142,TCP,54,56483  >  443 [ACK] Seq=41874 Ack=239264 Win=1026 Len=0,0
346,5.163716,52.3.144.142,192.168.1.31,TCP,1514,443  >  56483 [ACK] Seq=239264 Ack=41874 Win=325 Len=1460 [TCP segment of a reassembled PDU],0
347,5.163719,192.168.1.31,52.3.144.142,TCP,54,56483  >  443 [ACK] Seq=41874 Ack=240724 Win=1026 Len=0,0
348,5.164187,52.3.144.142,192.168.1.31,TLSv1.2,1286,Application Data,0
349,5.165416,52.3.144.142,192.168.1.31,TCP,1514,443  >  56483 [ACK] Seq=241956 Ack=41874 Win=325 Len=1460 [TCP segment of a reassembled PDU],0
350,5.165423,192.168.1.31,52.3.144.142,TCP,54,56483  >  443 [ACK] Seq=41874 Ack=243416 Win=1026 Len=0,0
351,5.165444,52.3.144.142,192.168.1.31,TCP,1514,443  >  56483 [ACK] Seq=243416 Ack=41874 Win=325 Len=1460 [TCP segment of a reassembled PDU],0
352,5.165444,52.3.144.142,192.168.1.31,TLSv1.2,84,Application Data,0
353,5.165463,192.168.1.31,52.3.144.142,TCP,54,56483  >  443 [ACK] Seq=41874 Ack=244906 Win=1026 Len=0,0
354,5.165473,52.3.144.142,192.168.1.31,TCP,1514,443  >  56483 [ACK] Seq=244906 Ack=41874 Win=325 Len=1460 [TCP segment of a reassembled PDU],0
355,5.165628,52.3.144.142,192.168.1.31,TLSv1.2,1252,Application Data,0
356,5.165632,192.168.1.31,52.3.144.142,TCP,54,56483  >  443 [ACK] Seq=41874 Ack=247564 Win=1026 Len=0,0
357,5.166876,52.3.144.142,192.168.1.31,TCP,1514,443  >  56483 [ACK] Seq=247564 Ack=41874 Win=325 Len=1460 [TCP segment of a reassembled PDU],0
358,5.167358,52.3.144.142,192.168.1.31,TLSv1.2,1357,Application Data,0
359,5.167365,192.168.1.31,52.3.144.142,TCP,54,56483  >  443 [ACK] Seq=41874 Ack=250327 Win=1026 Len=0,0
360,5.167376,52.3.144.142,192.168.1.31,TCP,1514,443  >  56483 [ACK] Seq=250327 Ack=41874 Win=325 Len=1460 [TCP segment of a reassembled PDU],0
361,5.167627,52.3.144.142,192.168.1.31,TLSv1.2,1478,Application Data,0
362,5.167627,52.3.144.142,192.168.1.31,TLSv1.2,98,Application Data,0
363,5.167631,192.168.1.31,52.3.144.142,TCP,54,56483  >  443 [ACK] Seq=41874 Ack=253255 Win=1026 Len=0,0
364,5.169164,52.3.144.142,192.168.1.31,TCP,1514,443  >  56483 [ACK] Seq=253255 Ack=41874 Win=325 Len=1460 [TCP segment of a reassembled PDU],0
365,5.169175,192.168.1.31,52.3.144.142,TCP,54,56483  >  443 [ACK] Seq=41874 Ack=254715 Win=1026 Len=0,0
366,5.169478,52.3.144.142,192.168.1.31,TLSv1.2,1222,Application Data,0
367,5.169931,52.3.144.142,192.168.1.31,TCP,1514,443  >  56483 [ACK] Seq=255883 Ack=41874 Win=325 Len=1460 [TCP segment of a reassembled PDU],0
368,5.169934,192.168.1.31,52.3.144.142,TCP,54,56483  >  443 [ACK] Seq=41874 Ack=257343 Win=1026 Len=0,0
369,5.170382,52.3.144.142,192.168.1.31,TLSv1.2,1252,Application Data,0
370,5.170798,52.3.144.142,192.168.1.31,TCP,1514,443  >  56483 [ACK] Seq=258541 Ack=41874 Win=325 Len=1460 [TCP segment of a reassembled PDU],0
