No.,Time,Source,Destination,Protocol,Length,Info,label
1,0,100.86.111.80,23.12.147.175,TCP,66,64109  >  443 [SYN] Seq=0 Win=64240 Len=0 MSS=1460 WS=256 SACK_PERM,1
2,0.019513,23.12.147.175,100.86.111.80,TCP,66,"443  >  64109 [SYN, ACK] Seq=0 Ack=1 Win=64240 Len=0 MSS=1460 SACK_PERM WS=128",1
3,0.01973,100.86.111.80,23.12.147.175,TCP,54,64109  >  443 [ACK] Seq=1 Ack=1 Win=65536 Len=0,1
4,0.020695,100.86.111.80,23.12.147.175,TCP,1514,64109  >  443 [ACK] Seq=1 Ack=1 Win=65536 Len=1460 [TCP segment of a reassembled PDU],1
5,0.020695,100.86.111.80,23.12.147.175,TLSv1.3,356,Client Hello (SNI=dias.bank.truist.com),1
6,0.061353,100.86.111.80,23.12.147.175,TCP,1514,"[TCP Retransmission] 64109  >  443 [PSH, ACK] Seq=303 Ack=1 Win=65536 Len=1460 [TCP segment of a reassembled PDU]",1
7,0.069801,23.12.147.175,100.86.111.80,TCP,56,443  >  64109 [ACK] Seq=1 Ack=1763 Win=64128 Len=0,1
8,0.070162,23.12.147.175,100.86.111.80,TLSv1.3,1514,"Server Hello, Change Cipher Spec, Application Data",1
9,0.070162,23.12.147.175,100.86.111.80,TCP,1514,"443  >  64109 [PSH, ACK] Seq=1461 Ack=1763 Win=64128 Len=1460 [TCP segment of a reassembled PDU]",1
10,0.070299,100.86.111.80,23.12.147.175,TCP,54,64109  >  443 [ACK] Seq=1763 Ack=2921 Win=65536 Len=0,1
11,0.070445,23.12.147.175,100.86.111.80,TLSv1.3,1230,Application Data,1
12,0.070445,23.12.147.175,100.86.111.80,TLSv1.3,202,"Application Data, Application Data",1
13,0.070549,100.86.111.80,23.12.147.175,TCP,54,64109  >  443 [ACK] Seq=1763 Ack=4245 Win=64256 Len=0,1
14,0.078278,23.12.147.175,100.86.111.80,TCP,202,"[TCP Spurious Retransmission] 443  >  64109 [PSH, ACK] Seq=4097 Ack=1763 Win=64128 Len=148",1
15,0.078419,100.86.111.80,23.12.147.175,TCP,66,[TCP Dup ACK 13#1] 64109  >  443 [ACK] Seq=1763 Ack=4245 Win=64256 Len=0 SLE=4097 SRE=4245,1
16,0.079213,100.86.111.80,23.12.147.175,TLSv1.3,134,"Change Cipher Spec, Application Data",1
17,0.080003,100.86.111.80,23.12.147.175,TLSv1.3,146,Application Data,1
18,0.080089,100.86.111.80,23.12.147.175,TLSv1.3,446,Application Data,1
19,0.082524,23.12.147.175,100.86.111.80,TCP,66,[TCP Dup ACK 7#1] 443  >  64109 [ACK] Seq=4245 Ack=1763 Win=64128 Len=0 SLE=303 SRE=1763,1
20,0.097593,23.12.147.175,100.86.111.80,TCP,56,443  >  64109 [ACK] Seq=4245 Ack=1843 Win=64128 Len=0,1
21,0.097841,23.12.147.175,100.86.111.80,TCP,56,443  >  64109 [ACK] Seq=4245 Ack=2327 Win=64128 Len=0,1
22,0.097841,23.12.147.175,100.86.111.80,TLSv1.3,341,Application Data,1
23,0.097841,23.12.147.175,100.86.111.80,TLSv1.3,341,Application Data,1
24,0.09821,100.86.111.80,23.12.147.175,TCP,54,64109  >  443 [ACK] Seq=2327 Ack=4819 Win=65536 Len=0,1
25,0.108406,23.12.147.175,100.86.111.80,TLSv1.3,115,Application Data,1
26,0.108406,23.12.147.175,100.86.111.80,TLSv1.3,85,Application Data,1
27,0.108623,100.86.111.80,23.12.147.175,TCP,54,64109  >  443 [ACK] Seq=2327 Ack=4911 Win=65536 Len=0,1
28,0.109746,100.86.111.80,23.12.147.175,TLSv1.3,85,Application Data,1
29,0.1685,23.12.147.175,100.86.111.80,TCP,56,443  >  64109 [ACK] Seq=4911 Ack=2358 Win=64128 Len=0,1
30,0.254309,23.12.147.175,100.86.111.80,TLSv1.3,573,Application Data,1
31,0.254668,23.12.147.175,100.86.111.80,TCP,1514,443  >  64109 [ACK] Seq=5430 Ack=2358 Win=64128 Len=1460 [TCP segment of a reassembled PDU],1
32,0.254668,23.12.147.175,100.86.111.80,TCP,1514,"443  >  64109 [PSH, ACK] Seq=6890 Ack=2358 Win=64128 Len=1460 [TCP segment of a reassembled PDU]",1
33,0.254758,100.86.111.80,23.12.147.175,TCP,54,64109  >  443 [ACK] Seq=2358 Ack=8350 Win=65536 Len=0,1
34,0.25506,23.12.147.175,100.86.111.80,TCP,1514,443  >  64109 [ACK] Seq=8350 Ack=2358 Win=64128 Len=1460 [TCP segment of a reassembled PDU],1
35,0.25506,23.12.147.175,100.86.111.80,TCP,1514,"443  >  64109 [PSH, ACK] Seq=9810 Ack=2358 Win=64128 Len=1460 [TCP segment of a reassembled PDU]",1
36,0.255141,100.86.111.80,23.12.147.175,TCP,54,64109  >  443 [ACK] Seq=2358 Ack=11270 Win=65536 Len=0,1
37,0.255355,23.12.147.175,100.86.111.80,TCP,1514,443  >  64109 [ACK] Seq=11270 Ack=2358 Win=64128 Len=1460 [TCP segment of a reassembled PDU],1
38,0.255355,23.12.147.175,100.86.111.80,TCP,1514,"443  >  64109 [PSH, ACK] Seq=12730 Ack=2358 Win=64128 Len=1460 [TCP segment of a reassembled PDU]",1
39,0.255457,100.86.111.80,23.12.147.175,TCP,54,64109  >  443 [ACK] Seq=2358 Ack=14190 Win=65536 Len=0,1
40,0.263756,23.12.147.175,100.86.111.80,TCP,1514,443  >  64109 [ACK] Seq=14190 Ack=2358 Win=64128 Len=1460 [TCP segment of a reassembled PDU],1
41,0.263895,100.86.111.80,23.12.147.175,TCP,54,64109  >  443 [ACK] Seq=2358 Ack=15650 Win=65536 Len=0,1
42,0.264098,23.12.147.175,100.86.111.80,TCP,1514,"443  >  64109 [PSH, ACK] Seq=15650 Ack=2358 Win=64128 Len=1460 [TCP segment of a reassembled PDU]",1
43,0.264098,23.12.147.175,100.86.111.80,TCP,1514,443  >  64109 [ACK] Seq=17110 Ack=2358 Win=64128 Len=1460 [TCP segment of a reassembled PDU],1
44,0.264207,100.86.111.80,23.12.147.175,TCP,54,64109  >  443 [ACK] Seq=2358 Ack=18570 Win=65536 Len=0,1
45,0.264433,23.12.147.175,100.86.111.80,TCP,1514,"443  >  64109 [PSH, ACK] Seq=18570 Ack=2358 Win=64128 Len=1460 [TCP segment of a reassembled PDU]",1
46,0.264433,23.12.147.175,100.86.111.80,TCP,1514,443  >  64109 [ACK] Seq=20030 Ack=2358 Win=64128 Len=1460 [TCP segment of a reassembled PDU],1
47,0.26452,100.86.111.80,23.12.147.175,TCP,54,64109  >  443 [ACK] Seq=2358 Ack=21490 Win=65536 Len=0,1
48,0.264767,23.12.147.175,100.86.111.80,TLSv1.3,1514,"Application Data, Application Data",1
49,0.268025,23.12.147.175,100.86.111.80,TCP,1514,443  >  64109 [ACK] Seq=22950 Ack=2358 Win=64128 Len=1460 [TCP segment of a reassembled PDU],1
50,0.268179,100.86.111.80,23.12.147.175,TCP,54,64109  >  443 [ACK] Seq=2358 Ack=24410 Win=65536 Len=0,1
51,0.268333,23.12.147.175,100.86.111.80,TCP,1514,"443  >  64109 [PSH, ACK] Seq=24410 Ack=2358 Win=64128 Len=1460 [TCP segment of a reassembled PDU]",1
52,0.272366,23.12.147.175,100.86.111.80,TCP,1514,443  >  64109 [ACK] Seq=25870 Ack=2358 Win=64128 Len=1460 [TCP segment of a reassembled PDU],1
53,0.272508,100.86.111.80,23.12.147.175,TCP,54,64109  >  443 [ACK] Seq=2358 Ack=27330 Win=65536 Len=0,1
54,0.272878,23.12.147.175,100.86.111.80,TCP,1514,"443  >  64109 [PSH, ACK] Seq=27330 Ack=2358 Win=64128 Len=1460 [TCP segment of a reassembled PDU]",1
55,0.272878,23.12.147.175,100.86.111.80,TCP,1514,443  >  64109 [ACK] Seq=28790 Ack=2358 Win=64128 Len=1460 [TCP segment of a reassembled PDU],1
56,0.273032,100.86.111.80,23.12.147.175,TCP,54,64109  >  443 [ACK] Seq=2358 Ack=30250 Win=65536 Len=0,1
57,0.273163,23.12.147.175,100.86.111.80,TCP,1514,"443  >  64109 [PSH, ACK] Seq=30250 Ack=2358 Win=64128 Len=1460 [TCP segment of a reassembled PDU]",1
58,0.27512,23.12.147.175,100.86.111.80,TCP,1514,443  >  64109 [ACK] Seq=31710 Ack=2358 Win=64128 Len=1460 [TCP segment of a reassembled PDU],1
59,0.275235,100.86.111.80,23.12.147.175,TCP,54,64109  >  443 [ACK] Seq=2358 Ack=33170 Win=65536 Len=0,1
60,0.285964,23.12.147.175,100.86.111.80,TCP,1514,443  >  64109 [ACK] Seq=33170 Ack=2358 Win=64128 Len=1460 [TCP segment of a reassembled PDU],1
61,0.285964,23.12.147.175,100.86.111.80,TCP,1514,"443  >  64109 [PSH, ACK] Seq=34630 Ack=2358 Win=64128 Len=1460 [TCP segment of a reassembled PDU]",1
62,0.285964,23.12.147.175,100.86.111.80,TCP,1514,443  >  64109 [ACK] Seq=36090 Ack=2358 Win=64128 Len=1460 [TCP segment of a reassembled PDU],1
63,0.285964,23.12.147.175,100.86.111.80,TLSv1.3,1514,"Application Data, Application Data",1
64,0.286225,100.86.111.80,23.12.147.175,TCP,54,64109  >  443 [ACK] Seq=2358 Ack=39010 Win=65536 Len=0,1
65,0.295141,23.12.147.175,100.86.111.80,TCP,1514,443  >  64109 [ACK] Seq=39010 Ack=2358 Win=64128 Len=1460 [TCP segment of a reassembled PDU],1
66,0.295141,23.12.147.175,100.86.111.80,TCP,1514,"443  >  64109 [PSH, ACK] Seq=40470 Ack=2358 Win=64128 Len=1460 [TCP segment of a reassembled PDU]",1
67,0.295141,23.12.147.175,100.86.111.80,TCP,1514,443  >  64109 [ACK] Seq=41930 Ack=2358 Win=64128 Len=1460 [TCP segment of a reassembled PDU],1
68,0.295141,23.12.147.175,100.86.111.80,TCP,1514,"443  >  64109 [PSH, ACK] Seq=43390 Ack=2358 Win=64128 Len=1460 [TCP segment of a reassembled PDU]",1
69,0.295473,100.86.111.80,23.12.147.175,TCP,54,64109  >  443 [ACK] Seq=2358 Ack=44850 Win=65536 Len=0,1
70,0.298185,23.12.147.175,100.86.111.80,TCP,1514,443  >  64109 [ACK] Seq=44850 Ack=2358 Win=64128 Len=1460 [TCP segment of a reassembled PDU],1
71,0.299019,23.12.147.175,100.86.111.80,TLSv1.3,1514,Application Data,1
72,0.299019,23.12.147.175,100.86.111.80,TCP,1514,"443  >  64109 [PSH, ACK] Seq=47770 Ack=2358 Win=64128 Len=1460 [TCP segment of a reassembled PDU]",1
73,0.299237,100.86.111.80,23.12.147.175,TCP,54,64109  >  443 [ACK] Seq=2358 Ack=49230 Win=65536 Len=0,1
74,0.309678,23.12.147.175,100.86.111.80,TCP,1514,443  >  64109 [ACK] Seq=49230 Ack=2358 Win=64128 Len=1460 [TCP segment of a reassembled PDU],1
75,0.309678,23.12.147.175,100.86.111.80,TCP,1514,"443  >  64109 [PSH, ACK] Seq=50690 Ack=2358 Win=64128 Len=1460 [TCP segment of a reassembled PDU]",1
76,0.309678,23.12.147.175,100.86.111.80,TCP,1514,443  >  64109 [ACK] Seq=52150 Ack=2358 Win=64128 Len=1460 [TCP segment of a reassembled PDU],1
77,0.309678,23.12.147.175,100.86.111.80,TCP,1514,"443  >  64109 [PSH, ACK] Seq=53610 Ack=2358 Win=64128 Len=1460 [TCP segment of a reassembled PDU]",1
78,0.310019,100.86.111.80,23.12.147.175,TCP,54,64109  >  443 [ACK] Seq=2358 Ack=55070 Win=65536 Len=0,1
79,0.31277,23.12.147.175,100.86.111.80,TCP,1514,443  >  64109 [ACK] Seq=55070 Ack=2358 Win=64128 Len=1460 [TCP segment of a reassembled PDU],1
80,0.31277,23.12.147.175,100.86.111.80,TCP,1514,"443  >  64109 [PSH, ACK] Seq=56530 Ack=2358 Win=64128 Len=1460 [TCP segment of a reassembled PDU]",1
81,0.312876,100.86.111.80,23.12.147.175,TCP,54,64109  >  443 [ACK] Seq=2358 Ack=57990 Win=65536 Len=0,1
82,0.31311,23.12.147.175,100.86.111.80,TCP,1514,443  >  64109 [ACK] Seq=57990 Ack=2358 Win=64128 Len=1460 [TCP segment of a reassembled PDU],1
83,0.31311,23.12.147.175,100.86.111.80,TCP,1514,"443  >  64109 [PSH, ACK] Seq=59450 Ack=2358 Win=64128 Len=1460 [TCP segment of a reassembled PDU]",1
84,0.313187,100.86.111.80,23.12.147.175,TCP,54,64109  >  443 [ACK] Seq=2358 Ack=60910 Win=65536 Len=0,1
85,0.32002,23.12.147.175,100.86.111.80,TCP,1514,443  >  64109 [ACK] Seq=60910 Ack=2358 Win=64128 Len=1460 [TCP segment of a reassembled PDU],1
86,0.32002,23.12.147.175,100.86.111.80,TLSv1.3,1514,"Application Data, Application Data",1
87,0.320142,100.86.111.80,23.12.147.175,TCP,54,64109  >  443 [ACK] Seq=2358 Ack=63830 Win=65536 Len=0,1
88,0.320548,23.12.147.175,100.86.111.80,TCP,1514,443  >  64109 [ACK] Seq=63830 Ack=2358 Win=64128 Len=1460 [TCP segment of a reassembled PDU],1
89,0.320548,23.12.147.175,100.86.111.80,TCP,1514,"443  >  64109 [PSH, ACK] Seq=65290 Ack=2358 Win=64128 Len=1460 [TCP segment of a reassembled PDU]",1
90,0.320672,100.86.111.80,23.12.147.175,TCP,54,64109  >  443 [ACK] Seq=2358 Ack=66750 Win=65536 Len=0,1
91,0.320734,23.12.147.175,100.86.111.80,TCP,1514,443  >  64109 [ACK] Seq=66750 Ack=2358 Win=64128 Len=1460 [TCP segment of a reassembled PDU],1
92,0.320734,23.12.147.175,100.86.111.80,TCP,1514,"443  >  64109 [PSH, ACK] Seq=68210 Ack=2358 Win=64128 Len=1460 [TCP segment of a reassembled PDU]",1
93,0.320853,100.86.111.80,23.12.147.175,TCP,54,64109  >  443 [ACK] Seq=2358 Ack=69670 Win=65536 Len=0,1
94,0.321103,23.12.147.175,100.86.111.80,TCP,1514,443  >  64109 [ACK] Seq=69670 Ack=2358 Win=64128 Len=1460 [TCP segment of a reassembled PDU],1
95,0.321168,100.86.111.80,23.12.147.175,TCP,54,64109  >  443 [ACK] Seq=2358 Ack=71130 Win=65536 Len=0,1
96,0.32332,23.12.147.175,100.86.111.80,TCP,1514,"443  >  64109 [PSH, ACK] Seq=71130 Ack=2358 Win=64128 Len=1460 [TCP segment of a reassembled PDU]",1
97,0.32332,23.12.147.175,100.86.111.80,TCP,1514,443  >  64109 [ACK] Seq=72590 Ack=2358 Win=64128 Len=1460 [TCP segment of a reassembled PDU],1
98,0.323532,100.86.111.80,23.12.147.175,TCP,54,64109  >  443 [ACK] Seq=2358 Ack=74050 Win=65536 Len=0,1
99,0.323637,23.12.147.175,100.86.111.80,TCP,1514,"443  >  64109 [PSH, ACK] Seq=74050 Ack=2358 Win=64128 Len=1460 [TCP segment of a reassembled PDU]",1
100,0.323637,23.12.147.175,100.86.111.80,TCP,1514,443  >  64109 [ACK] Seq=75510 Ack=2358 Win=64128 Len=1460 [TCP segment of a reassembled PDU],1
101,0.323748,100.86.111.80,23.12.147.175,TCP,54,64109  >  443 [ACK] Seq=2358 Ack=76970 Win=65536 Len=0,1
102,0.325415,23.12.147.175,100.86.111.80,TCP,1514,"443  >  64109 [PSH, ACK] Seq=76970 Ack=2358 Win=64128 Len=1460 [TCP segment of a reassembled PDU]",1
103,0.325415,23.12.147.175,100.86.111.80,TLSv1.3,1514,"Application Data, Application Data",1
104,0.325415,23.12.147.175,100.86.111.80,TCP,1514,"443  >  64109 [PSH, ACK] Seq=79890 Ack=2358 Win=64128 Len=1460 [TCP segment of a reassembled PDU]",1
105,0.325415,23.12.147.175,100.86.111.80,TCP,1514,443  >  64109 [ACK] Seq=81350 Ack=2358 Win=64128 Len=1460 [TCP segment of a reassembled PDU],1
106,0.325415,23.12.147.175,100.86.111.80,TCP,1514,"443  >  64109 [PSH, ACK] Seq=82810 Ack=2358 Win=64128 Len=1460 [TCP segment of a reassembled PDU]",1
107,0.325415,23.12.147.175,100.86.111.80,TCP,1514,443  >  64109 [ACK] Seq=84270 Ack=2358 Win=64128 Len=1460 [TCP segment of a reassembled PDU],1
108,0.325415,23.12.147.175,100.86.111.80,TCP,1514,"443  >  64109 [PSH, ACK] Seq=85730 Ack=2358 Win=64128 Len=1460 [TCP segment of a reassembled PDU]",1
109,0.325415,23.12.147.175,100.86.111.80,TCP,1514,443  >  64109 [ACK] Seq=87190 Ack=2358 Win=64128 Len=1460 [TCP segment of a reassembled PDU],1
110,0.325415,23.12.147.175,100.86.111.80,TCP,1514,"443  >  64109 [PSH, ACK] Seq=88650 Ack=2358 Win=64128 Len=1460 [TCP segment of a reassembled PDU]",1
111,0.325415,23.12.147.175,100.86.111.80,TCP,1514,443  >  64109 [ACK] Seq=90110 Ack=2358 Win=64128 Len=1460 [TCP segment of a reassembled PDU],1
112,0.325415,23.12.147.175,100.86.111.80,TCP,1514,"443  >  64109 [PSH, ACK] Seq=91570 Ack=2358 Win=64128 Len=1460 [TCP segment of a reassembled PDU]",1
113,0.325722,100.86.111.80,23.12.147.175,TCP,54,64109  >  443 [ACK] Seq=2358 Ack=93030 Win=65536 Len=0,1
114,0.330013,23.12.147.175,100.86.111.80,TCP,1514,443  >  64109 [ACK] Seq=93030 Ack=2358 Win=64128 Len=1460 [TCP segment of a reassembled PDU],1
115,0.330013,23.12.147.175,100.86.111.80,TLSv1.3,1514,"Application Data, Application Data",1
116,0.330208,100.86.111.80,23.12.147.175,TCP,54,64109  >  443 [ACK] Seq=2358 Ack=95950 Win=65536 Len=0,1
117,0.338632,23.12.147.175,100.86.111.80,TCP,1514,443  >  64109 [ACK] Seq=95950 Ack=2358 Win=64128 Len=1460 [TCP segment of a reassembled PDU],1
118,0.338743,100.86.111.80,23.12.147.175,TCP,54,64109  >  443 [ACK] Seq=2358 Ack=97410 Win=65536 Len=0,1
119,0.338986,23.12.147.175,100.86.111.80,TCP,1514,"443  >  64109 [PSH, ACK] Seq=97410 Ack=2358 Win=64128 Len=1460 [TCP segment of a reassembled PDU]",1
120,0.339357,23.12.147.175,100.86.111.80,TCP,1514,443  >  64109 [ACK] Seq=98870 Ack=2358 Win=64128 Len=1460 [TCP segment of a reassembled PDU],1
121,0.339357,23.12.147.175,100.86.111.80,TCP,1514,"443  >  64109 [PSH, ACK] Seq=100330 Ack=2358 Win=64128 Len=1460 [TCP segment of a reassembled PDU]",1
122,0.33947,100.86.111.80,23.12.147.175,TCP,54,64109  >  443 [ACK] Seq=2358 Ack=101790 Win=65536 Len=0,1
123,0.339717,23.12.147.175,100.86.111.80,TCP,1514,443  >  64109 [ACK] Seq=101790 Ack=2358 Win=64128 Len=1460 [TCP segment of a reassembled PDU],1
124,0.339717,23.12.147.175,100.86.111.80,TCP,1514,"443  >  64109 [PSH, ACK] Seq=103250 Ack=2358 Win=64128 Len=1460 [TCP segment of a reassembled PDU]",1
125,0.33984,100.86.111.80,23.12.147.175,TCP,54,64109  >  443 [ACK] Seq=2358 Ack=104710 Win=65536 Len=0,1
126,0.343531,23.12.147.175,100.86.111.80,TCP,1514,443  >  64109 [ACK] Seq=104710 Ack=2358 Win=64128 Len=1460 [TCP segment of a reassembled PDU],1
127,0.343531,23.12.147.175,100.86.111.80,TCP,1514,"443  >  64109 [PSH, ACK] Seq=106170 Ack=2358 Win=64128 Len=1460 [TCP segment of a reassembled PDU]",1
128,0.343675,100.86.111.80,23.12.147.175,TCP,54,64109  >  443 [ACK] Seq=2358 Ack=107630 Win=65536 Len=0,1
129,0.343849,23.12.147.175,100.86.111.80,TCP,1514,443  >  64109 [ACK] Seq=107630 Ack=2358 Win=64128 Len=1460 [TCP segment of a reassembled PDU],1
130,0.343849,23.12.147.175,100.86.111.80,TCP,1514,"443  >  64109 [PSH, ACK] Seq=109090 Ack=2358 Win=64128 Len=1460 [TCP segment of a reassembled PDU]",1
131,0.343919,100.86.111.80,23.12.147.175,TCP,54,64109  >  443 [ACK] Seq=2358 Ack=110550 Win=65536 Len=0,1
132,0.344217,23.12.147.175,100.86.111.80,TCP,1514,443  >  64109 [ACK] Seq=110550 Ack=2358 Win=64128 Len=1460 [TCP segment of a reassembled PDU],1
133,0.344217,23.12.147.175,100.86.111.80,TLSv1.3,1514,"Application Data, Application Data",1
134,0.344287,100.86.111.80,23.12.147.175,TCP,54,64109  >  443 [ACK] Seq=2358 Ack=113470 Win=65536 Len=0,1
135,0.344552,23.12.147.175,100.86.111.80,TCP,1514,443  >  64109 [ACK] Seq=113470 Ack=2358 Win=64128 Len=1460 [TCP segment of a reassembled PDU],1
136,0.344552,23.12.147.175,100.86.111.80,TCP,1514,"443  >  64109 [PSH, ACK] Seq=114930 Ack=2358 Win=64128 Len=1460 [TCP segment of a reassembled PDU]",1
137,0.344639,100.86.111.80,23.12.147.175,TCP,54,64109  >  443 [ACK] Seq=2358 Ack=116390 Win=65536 Len=0,1
138,0.346091,23.12.147.175,100.86.111.80,TCP,1514,443  >  64109 [ACK] Seq=116390 Ack=2358 Win=64128 Len=1460 [TCP segment of a reassembled PDU],1
139,0.346091,23.12.147.175,100.86.111.80,TCP,1514,"443  >  64109 [PSH, ACK] Seq=117850 Ack=2358 Win=64128 Len=1460 [TCP segment of a reassembled PDU]",1
140,0.346213,100.86.111.80,23.12.147.175,TCP,54,64109  >  443 [ACK] Seq=2358 Ack=119310 Win=65536 Len=0,1
141,0.346289,23.12.147.175,100.86.111.80,TLSv1.3,1514,Application Data,1
142,0.346289,23.12.147.175,100.86.111.80,TCP,1514,"443  >  64109 [PSH, ACK] Seq=120770 Ack=2358 Win=64128 Len=1460 [TCP segment of a reassembled PDU]",1
143,0.346289,23.12.147.175,100.86.111.80,TCP,1514,443  >  64109 [ACK] Seq=122230 Ack=2358 Win=64128 Len=1460 [TCP segment of a reassembled PDU],1
144,0.346289,23.12.147.175,100.86.111.80,TCP,1514,"443  >  64109 [PSH, ACK] Seq=123690 Ack=2358 Win=64128 Len=1460 [TCP segment of a reassembled PDU]",1
145,0.346392,100.86.111.80,23.12.147.175,TCP,54,64109  >  443 [ACK] Seq=2358 Ack=125150 Win=65536 Len=0,1
146,0.346468,23.12.147.175,100.86.111.80,TCP,1514,443  >  64109 [ACK] Seq=125150 Ack=2358 Win=64128 Len=1460 [TCP segment of a reassembled PDU],1
147,0.346468,23.12.147.175,100.86.111.80,TCP,1514,"443  >  64109 [PSH, ACK] Seq=126610 Ack=2358 Win=64128 Len=1460 [TCP segment of a reassembled PDU]",1
148,0.346567,100.86.111.80,23.12.147.175,TCP,54,64109  >  443 [ACK] Seq=2358 Ack=128070 Win=65536 Len=0,1
149,0.351088,23.12.147.175,100.86.111.80,TCP,1514,443  >  64109 [ACK] Seq=128070 Ack=2358 Win=64128 Len=1460 [TCP segment of a reassembled PDU],1
150,0.351088,23.12.147.175,100.86.111.80,TCP,1514,"443  >  64109 [PSH, ACK] Seq=129530 Ack=2358 Win=64128 Len=1460 [TCP segment of a reassembled PDU]",1
151,0.351222,100.86.111.80,23.12.147.175,TCP,54,64109  >  443 [ACK] Seq=2358 Ack=130990 Win=65536 Len=0,1
152,0.351409,23.12.147.175,100.86.111.80,TCP,1514,443  >  64109 [ACK] Seq=130990 Ack=2358 Win=64128 Len=1460 [TCP segment of a reassembled PDU],1
153,0.351409,23.12.147.175,100.86.111.80,TCP,1514,"443  >  64109 [PSH, ACK] Seq=132450 Ack=2358 Win=64128 Len=1460 [TCP segment of a reassembled PDU]",1
154,0.351476,100.86.111.80,23.12.147.175,TCP,54,64109  >  443 [ACK] Seq=2358 Ack=133910 Win=65536 Len=0,1
155,0.351754,23.12.147.175,100.86.111.80,TCP,1514,443  >  64109 [ACK] Seq=133910 Ack=2358 Win=64128 Len=1460 [TCP segment of a reassembled PDU],1
156,0.351754,23.12.147.175,100.86.111.80,TCP,1514,"443  >  64109 [PSH, ACK] Seq=135370 Ack=2358 Win=64128 Len=1460 [TCP segment of a reassembled PDU]",1
157,0.351818,100.86.111.80,23.12.147.175,TCP,54,64109  >  443 [ACK] Seq=2358 Ack=136830 Win=65536 Len=0,1
158,0.352105,23.12.147.175,100.86.111.80,TLSv1.3,1514,"Application Data, Application Data",1
159,0.352105,23.12.147.175,100.86.111.80,TCP,1514,"443  >  64109 [PSH, ACK] Seq=138290 Ack=2358 Win=64128 Len=1460 [TCP segment of a reassembled PDU]",1
160,0.352163,100.86.111.80,23.12.147.175,TCP,54,64109  >  443 [ACK] Seq=2358 Ack=139750 Win=65536 Len=0,1
161,0.352535,23.12.147.175,100.86.111.80,TCP,1514,443  >  64109 [ACK] Seq=139750 Ack=2358 Win=64128 Len=1460 [TCP segment of a reassembled PDU],1
162,0.352535,23.12.147.175,100.86.111.80,TCP,1514,"443  >  64109 [PSH, ACK] Seq=141210 Ack=2358 Win=64128 Len=1460 [TCP segment of a reassembled PDU]",1
163,0.352683,100.86.111.80,23.12.147.175,TCP,54,64109  >  443 [ACK] Seq=2358 Ack=142670 Win=65536 Len=0,1
164,0.352783,23.12.147.175,100.86.111.80,TCP,1514,443  >  64109 [ACK] Seq=142670 Ack=2358 Win=64128 Len=1460 [TCP segment of a reassembled PDU],1
165,0.352783,23.12.147.175,100.86.111.80,TCP,1514,"443  >  64109 [PSH, ACK] Seq=144130 Ack=2358 Win=64128 Len=1460 [TCP segment of a reassembled PDU]",1
166,0.352848,100.86.111.80,23.12.147.175,TCP,54,64109  >  443 [ACK] Seq=2358 Ack=145590 Win=65536 Len=0,1
167,0.35319,23.12.147.175,100.86.111.80,TCP,1514,443  >  64109 [ACK] Seq=145590 Ack=2358 Win=64128 Len=1460 [TCP segment of a reassembled PDU],1
168,0.35319,23.12.147.175,100.86.111.80,TCP,1514,"443  >  64109 [PSH, ACK] Seq=147050 Ack=2358 Win=64128 Len=1460 [TCP segment of a reassembled PDU]",1
169,0.353295,100.86.111.80,23.12.147.175,TCP,54,64109  >  443 [ACK] Seq=2358 Ack=148510 Win=65536 Len=0,1
170,0.355224,23.12.147.175,100.86.111.80,TCP,1514,443  >  64109 [ACK] Seq=148510 Ack=2358 Win=64128 Len=1460 [TCP segment of a reassembled PDU],1
171,0.355371,100.86.111.80,23.12.147.175,TCP,54,64109  >  443 [ACK] Seq=2358 Ack=149970 Win=65536 Len=0,1
172,0.355569,23.12.147.175,100.86.111.80,TCP,1514,"443  >  64109 [PSH, ACK] Seq=149970 Ack=2358 Win=64128 Len=1460 [TCP segment of a reassembled PDU]",1
173,0.355569,23.12.147.175,100.86.111.80,TCP,1514,443  >  64109 [ACK] Seq=151430 Ack=2358 Win=64128 Len=1460 [TCP segment of a reassembled PDU],1
174,0.355662,100.86.111.80,23.12.147.175,TCP,54,64109  >  443 [ACK] Seq=2358 Ack=152890 Win=65536 Len=0,1
175,0.355853,23.12.147.175,100.86.111.80,TLSv1.3,1514,"Application Data, Application Data",1
176,0.355853,23.12.147.175,100.86.111.80,TCP,1514,443  >  64109 [ACK] Seq=154350 Ack=2358 Win=64128 Len=1460 [TCP segment of a reassembled PDU],1
177,0.355913,100.86.111.80,23.12.147.175,TCP,54,64109  >  443 [ACK] Seq=2358 Ack=155810 Win=65536 Len=0,1
178,0.356195,23.12.147.175,100.86.111.80,TCP,1514,"443  >  64109 [PSH, ACK] Seq=155810 Ack=2358 Win=64128 Len=1460 [TCP segment of a reassembled PDU]",1
179,0.356195,23.12.147.175,100.86.111.80,TCP,1514,443  >  64109 [ACK] Seq=157270 Ack=2358 Win=64128 Len=1460 [TCP segment of a reassembled PDU],1
180,0.356289,100.86.111.80,23.12.147.175,TCP,54,64109  >  443 [ACK] Seq=2358 Ack=158730 Win=65536 Len=0,1
181,0.356534,23.12.147.175,100.86.111.80,TCP,1514,"443  >  64109 [PSH, ACK] Seq=158730 Ack=2358 Win=64128 Len=1460 [TCP segment of a reassembled PDU]",1
182,0.356534,23.12.147.175,100.86.111.80,TCP,1514,443  >  64109 [ACK] Seq=160190 Ack=2358 Win=64128 Len=1460 [TCP segment of a reassembled PDU],1
183,0.356616,100.86.111.80,23.12.147.175,TCP,54,64109  >  443 [ACK] Seq=2358 Ack=161650 Win=65536 Len=0,1
184,0.356892,23.12.147.175,100.86.111.80,TCP,1514,"443  >  64109 [PSH, ACK] Seq=161650 Ack=2358 Win=64128 Len=1460 [TCP segment of a reassembled PDU]",1
185,0.356892,23.12.147.175,100.86.111.80,TCP,1514,443  >  64109 [ACK] Seq=163110 Ack=2358 Win=64128 Len=1460 [TCP segment of a reassembled PDU],1
186,0.356964,100.86.111.80,23.12.147.175,TCP,54,64109  >  443 [ACK] Seq=2358 Ack=164570 Win=65536 Len=0,1
187,0.358767,23.12.147.175,100.86.111.80,TCP,1514,"443  >  64109 [PSH, ACK] Seq=164570 Ack=2358 Win=64128 Len=1460 [TCP segment of a reassembled PDU]",1
188,0.358767,23.12.147.175,100.86.111.80,TCP,1514,443  >  64109 [ACK] Seq=166030 Ack=2358 Win=64128 Len=1460 [TCP segment of a reassembled PDU],1
189,0.358916,100.86.111.80,23.12.147.175,TCP,54,64109  >  443 [ACK] Seq=2358 Ack=167490 Win=131328 Len=0,1
190,0.358976,23.12.147.175,100.86.111.80,TCP,1514,"443  >  64109 [PSH, ACK] Seq=167490 Ack=2358 Win=64128 Len=1460 [TCP segment of a reassembled PDU]",1
191,0.358976,23.12.147.175,100.86.111.80,TLSv1.3,1514,"Application Data, Application Data",1
192,0.358976,23.12.147.175,100.86.111.80,TCP,1514,"443  >  64109 [PSH, ACK] Seq=170410 Ack=2358 Win=64128 Len=1460 [TCP segment of a reassembled PDU]",1
193,0.359052,100.86.111.80,23.12.147.175,TCP,54,64109  >  443 [ACK] Seq=2358 Ack=171870 Win=131328 Len=0,1
194,0.359319,23.12.147.175,100.86.111.80,TCP,1514,443  >  64109 [ACK] Seq=171870 Ack=2358 Win=64128 Len=1460 [TCP segment of a reassembled PDU],1
195,0.359319,23.12.147.175,100.86.111.80,TCP,1514,"443  >  64109 [PSH, ACK] Seq=173330 Ack=2358 Win=64128 Len=1460 [TCP segment of a reassembled PDU]",1
196,0.359438,100.86.111.80,23.12.147.175,TCP,54,64109  >  443 [ACK] Seq=2358 Ack=174790 Win=131328 Len=0,1
197,0.359639,23.12.147.175,100.86.111.80,TCP,1514,443  >  64109 [ACK] Seq=174790 Ack=2358 Win=64128 Len=1460 [TCP segment of a reassembled PDU],1
198,0.359639,23.12.147.175,100.86.111.80,TCP,1514,"443  >  64109 [PSH, ACK] Seq=176250 Ack=2358 Win=64128 Len=1460 [TCP segment of a reassembled PDU]",1
199,0.359722,100.86.111.80,23.12.147.175,TCP,54,64109  >  443 [ACK] Seq=2358 Ack=177710 Win=131328 Len=0,1
200,0.361243,23.12.147.175,100.86.111.80,TCP,1514,443  >  64109 [ACK] Seq=177710 Ack=2358 Win=64128 Len=1460 [TCP segment of a reassembled PDU],1
201,0.361356,100.86.111.80,23.12.147.175,TCP,54,64109  >  443 [ACK] Seq=2358 Ack=179170 Win=131328 Len=0,1
202,0.361582,23.12.147.175,100.86.111.80,TCP,1514,"443  >  64109 [PSH, ACK] Seq=179170 Ack=2358 Win=64128 Len=1460 [TCP segment of a reassembled PDU]",1
203,0.361582,23.12.147.175,100.86.111.80,TCP,1514,443  >  64109 [ACK] Seq=180630 Ack=2358 Win=64128 Len=1460 [TCP segment of a reassembled PDU],1
204,0.361659,100.86.111.80,23.12.147.175,TCP,54,64109  >  443 [ACK] Seq=2358 Ack=182090 Win=131328 Len=0,1
205,0.361926,23.12.147.175,100.86.111.80,TCP,1514,"443  >  64109 [PSH, ACK] Seq=182090 Ack=2358 Win=64128 Len=1460 [TCP segment of a reassembled PDU]",1
206,0.361926,23.12.147.175,100.86.111.80,TCP,1514,443  >  64109 [ACK] Seq=183550 Ack=2358 Win=64128 Len=1460 [TCP segment of a reassembled PDU],1
207,0.361999,100.86.111.80,23.12.147.175,TCP,54,64109  >  443 [ACK] Seq=2358 Ack=185010 Win=131328 Len=0,1
208,0.362396,23.12.147.175,100.86.111.80,TLSv1.3,1514,"Application Data, Application Data",1
209,0.363224,23.12.147.175,100.86.111.80,TCP,1514,443  >  64109 [ACK] Seq=186470 Ack=2358 Win=64128 Len=1460 [TCP segment of a reassembled PDU],1
210,0.363224,23.12.147.175,100.86.111.80,TCP,1514,"443  >  64109 [PSH, ACK] Seq=187930 Ack=2358 Win=64128 Len=1460 [TCP segment of a reassembled PDU]",1
211,0.363425,100.86.111.80,23.12.147.175,TCP,54,64109  >  443 [ACK] Seq=2358 Ack=189390 Win=131328 Len=0,1
212,0.363967,23.12.147.175,100.86.111.80,TCP,1514,443  >  64109 [ACK] Seq=189390 Ack=2358 Win=64128 Len=1460 [TCP segment of a reassembled PDU],1
213,0.363967,23.12.147.175,100.86.111.80,TCP,1514,"443  >  64109 [PSH, ACK] Seq=190850 Ack=2358 Win=64128 Len=1460 [TCP segment of a reassembled PDU]",1
214,0.364125,100.86.111.80,23.12.147.175,TCP,54,64109  >  443 [ACK] Seq=2358 Ack=192310 Win=131328 Len=0,1
215,0.368391,23.12.147.175,100.86.111.80,TCP,1514,443  >  64109 [ACK] Seq=192310 Ack=2358 Win=64128 Len=1460 [TCP segment of a reassembled PDU],1
216,0.368538,100.86.111.80,23.12.147.175,TCP,54,64109  >  443 [ACK] Seq=2358 Ack=193770 Win=131328 Len=0,1
217,0.368864,23.12.147.175,100.86.111.80,TCP,1514,"443  >  64109 [PSH, ACK] Seq=193770 Ack=2358 Win=64128 Len=1460 [TCP segment of a reassembled PDU]",1
218,0.368864,23.12.147.175,100.86.111.80,TCP,1514,443  >  64109 [ACK] Seq=195230 Ack=2358 Win=64128 Len=1460 [TCP segment of a reassembled PDU],1
219,0.369015,100.86.111.80,23.12.147.175,TCP,54,64109  >  443 [ACK] Seq=2358 Ack=196690 Win=131328 Len=0,1
220,0.369306,23.12.147.175,100.86.111.80,TCP,1514,"443  >  64109 [PSH, ACK] Seq=196690 Ack=2358 Win=64128 Len=1460 [TCP segment of a reassembled PDU]",1
221,0.369306,23.12.147.175,100.86.111.80,TCP,1514,443  >  64109 [ACK] Seq=198150 Ack=2358 Win=64128 Len=1460 [TCP segment of a reassembled PDU],1
222,0.369413,100.86.111.80,23.12.147.175,TCP,54,64109  >  443 [ACK] Seq=2358 Ack=199610 Win=131328 Len=0,1
223,0.369472,23.12.147.175,100.86.111.80,TCP,1514,443  >  64109 [ACK] Seq=199610 Ack=2358 Win=64128 Len=1460 [TCP segment of a reassembled PDU],1
224,0.369472,23.12.147.175,100.86.111.80,TCP,1514,443  >  64109 [ACK] Seq=201070 Ack=2358 Win=64128 Len=1460 [TCP segment of a reassembled PDU],1
225,0.369562,100.86.111.80,23.12.147.175,TCP,54,64109  >  443 [ACK] Seq=2358 Ack=202530 Win=131328 Len=0,1
226,0.369808,23.12.147.175,100.86.111.80,TLSv1.3,1514,"Application Data, Application Data",1
227,0.369808,23.12.147.175,100.86.111.80,TCP,1514,443  >  64109 [ACK] Seq=203990 Ack=2358 Win=64128 Len=1460 [TCP segment of a reassembled PDU],1
228,0.369925,100.86.111.80,23.12.147.175,TCP,54,64109  >  443 [ACK] Seq=2358 Ack=205450 Win=131328 Len=0,1
229,0.370212,23.12.147.175,100.86.111.80,TCP,1514,"443  >  64109 [PSH, ACK] Seq=205450 Ack=2358 Win=64128 Len=1460 [TCP segment of a reassembled PDU]",1
230,0.370212,23.12.147.175,100.86.111.80,TCP,1514,443  >  64109 [ACK] Seq=206910 Ack=2358 Win=64128 Len=1460 [TCP segment of a reassembled PDU],1
231,0.370324,100.86.111.80,23.12.147.175,TCP,54,64109  >  443 [ACK] Seq=2358 Ack=208370 Win=131328 Len=0,1
232,0.370491,23.12.147.175,100.86.111.80,TCP,1514,443  >  64109 [ACK] Seq=208370 Ack=2358 Win=64128 Len=1460 [TCP segment of a reassembled PDU],1
233,0.370491,23.12.147.175,100.86.111.80,TCP,1514,443  >  64109 [ACK] Seq=209830 Ack=2358 Win=64128 Len=1460 [TCP segment of a reassembled PDU],1
234,0.370583,100.86.111.80,23.12.147.175,TCP,54,64109  >  443 [ACK] Seq=2358 Ack=211290 Win=131328 Len=0,1
235,0.373285,23.12.147.175,100.86.111.80,TCP,1514,"443  >  64109 [PSH, ACK] Seq=211290 Ack=2358 Win=64128 Len=1460 [TCP segment of a reassembled PDU]",1
236,0.373285,23.12.147.175,100.86.111.80,TCP,1514,443  >  64109 [ACK] Seq=212750 Ack=2358 Win=64128 Len=1460 [TCP segment of a reassembled PDU],1
237,0.373434,100.86.111.80,23.12.147.175,TCP,54,64109  >  443 [ACK] Seq=2358 Ack=214210 Win=131328 Len=0,1
238,0.373507,23.12.147.175,100.86.111.80,TCP,1514,443  >  64109 [ACK] Seq=214210 Ack=2358 Win=64128 Len=1460 [TCP segment of a reassembled PDU],1
239,0.373507,23.12.147.175,100.86.111.80,TCP,1514,443  >  64109 [ACK] Seq=215670 Ack=2358 Win=64128 Len=1460 [TCP segment of a reassembled PDU],1
240,0.373507,23.12.147.175,100.86.111.80,TCP,1514,443  >  64109 [ACK] Seq=217130 Ack=2358 Win=64128 Len=1460 [TCP segment of a reassembled PDU],1
241,0.373595,100.86.111.80,23.12.147.175,TCP,54,64109  >  443 [ACK] Seq=2358 Ack=218590 Win=131328 Len=0,1
242,0.376311,23.12.147.175,100.86.111.80,TLSv1.3,1514,"Application Data, Application Data",1
243,0.376311,23.12.147.175,100.86.111.80,TCP,1514,443  >  64109 [ACK] Seq=220050 Ack=2358 Win=64128 Len=1460 [TCP segment of a reassembled PDU],1
244,0.376436,100.86.111.80,23.12.147.175,TCP,54,64109  >  443 [ACK] Seq=2358 Ack=221510 Win=131328 Len=0,1
245,0.37662,23.12.147.175,100.86.111.80,TCP,1514,443  >  64109 [ACK] Seq=221510 Ack=2358 Win=64128 Len=1460 [TCP segment of a reassembled PDU],1
246,0.37662,23.12.147.175,100.86.111.80,TCP,1514,443  >  64109 [ACK] Seq=222970 Ack=2358 Win=64128 Len=1460 [TCP segment of a reassembled PDU],1
247,0.376726,100.86.111.80,23.12.147.175,TCP,54,64109  >  443 [ACK] Seq=2358 Ack=224430 Win=131328 Len=0,1
248,0.377005,23.12.147.175,100.86.111.80,TCP,1514,443  >  64109 [ACK] Seq=224430 Ack=2358 Win=64128 Len=1460 [TCP segment of a reassembled PDU],1
249,0.377005,23.12.147.175,100.86.111.80,TCP,1514,"443  >  64109 [PSH, ACK] Seq=225890 Ack=2358 Win=64128 Len=1460 [TCP segment of a reassembled PDU]",1
250,0.377163,100.86.111.80,23.12.147.175,TCP,54,64109  >  443 [ACK] Seq=2358 Ack=227350 Win=131328 Len=0,1
251,0.378187,23.12.147.175,100.86.111.80,TCP,1514,443  >  64109 [ACK] Seq=227350 Ack=2358 Win=64128 Len=1460 [TCP segment of a reassembled PDU],1
252,0.378187,23.12.147.175,100.86.111.80,TCP,1514,443  >  64109 [ACK] Seq=228810 Ack=2358 Win=64128 Len=1460 [TCP segment of a reassembled PDU],1
253,0.378336,100.86.111.80,23.12.147.175,TCP,54,64109  >  443 [ACK] Seq=2358 Ack=230270 Win=131328 Len=0,1
254,0.378421,23.12.147.175,100.86.111.80,TCP,1514,443  >  64109 [ACK] Seq=230270 Ack=2358 Win=64128 Len=1460 [TCP segment of a reassembled PDU],1
255,0.378421,23.12.147.175,100.86.111.80,TCP,1514,443  >  64109 [ACK] Seq=231730 Ack=2358 Win=64128 Len=1460 [TCP segment of a reassembled PDU],1
256,0.378421,23.12.147.175,100.86.111.80,TCP,1514,"443  >  64109 [PSH, ACK] Seq=233190 Ack=2358 Win=64128 Len=1460 [TCP segment of a reassembled PDU]",1
257,0.378421,23.12.147.175,100.86.111.80,TLSv1.3,1514,"Application Data, Application Data",1
258,0.378421,23.12.147.175,100.86.111.80,TCP,1514,443  >  64109 [ACK] Seq=236110 Ack=2358 Win=64128 Len=1460 [TCP segment of a reassembled PDU],1
259,0.378421,23.12.147.175,100.86.111.80,TCP,1514,"443  >  64109 [PSH, ACK] Seq=237570 Ack=2358 Win=64128 Len=1460 [TCP segment of a reassembled PDU]",1
260,0.378571,100.86.111.80,23.12.147.175,TCP,54,64109  >  443 [ACK] Seq=2358 Ack=239030 Win=131328 Len=0,1
261,0.378876,23.12.147.175,100.86.111.80,TCP,1514,443  >  64109 [ACK] Seq=239030 Ack=2358 Win=64128 Len=1460 [TCP segment of a reassembled PDU],1
262,0.378876,23.12.147.175,100.86.111.80,TCP,1514,443  >  64109 [ACK] Seq=240490 Ack=2358 Win=64128 Len=1460 [TCP segment of a reassembled PDU],1
263,0.379003,100.86.111.80,23.12.147.175,TCP,54,64109  >  443 [ACK] Seq=2358 Ack=241950 Win=131328 Len=0,1
264,0.382098,23.12.147.175,100.86.111.80,TCP,1514,443  >  64109 [ACK] Seq=241950 Ack=2358 Win=64128 Len=1460 [TCP segment of a reassembled PDU],1
265,0.382098,23.12.147.175,100.86.111.80,TCP,1514,443  >  64109 [ACK] Seq=243410 Ack=2358 Win=64128 Len=1460 [TCP segment of a reassembled PDU],1
266,0.382098,23.12.147.175,100.86.111.80,TCP,1514,"443  >  64109 [PSH, ACK] Seq=244870 Ack=2358 Win=64128 Len=1460 [TCP segment of a reassembled PDU]",1
267,0.382098,23.12.147.175,100.86.111.80,TCP,1514,443  >  64109 [ACK] Seq=246330 Ack=2358 Win=64128 Len=1460 [TCP segment of a reassembled PDU],1
268,0.382098,23.12.147.175,100.86.111.80,TCP,1514,443  >  64109 [ACK] Seq=247790 Ack=2358 Win=64128 Len=1460 [TCP segment of a reassembled PDU],1
269,0.382098,23.12.147.175,100.86.111.80,TCP,1514,443  >  64109 [ACK] Seq=249250 Ack=2358 Win=64128 Len=1460 [TCP segment of a reassembled PDU],1
270,0.382098,23.12.147.175,100.86.111.80,TLSv1.3,1514,"Application Data, Application Data",1
271,0.382098,23.12.147.175,100.86.111.80,TCP,1514,"443  >  64109 [PSH, ACK] Seq=252170 Ack=2358 Win=64128 Len=1460 [TCP segment of a reassembled PDU]",1
272,0.382098,23.12.147.175,100.86.111.80,TCP,1514,443  >  64109 [ACK] Seq=253630 Ack=2358 Win=64128 Len=1460 [TCP segment of a reassembled PDU],1
273,0.382098,23.12.147.175,100.86.111.80,TCP,1514,443  >  64109 [ACK] Seq=255090 Ack=2358 Win=64128 Len=1460 [TCP segment of a reassembled PDU],1
274,0.382098,23.12.147.175,100.86.111.80,TCP,1514,443  >  64109 [ACK] Seq=256550 Ack=2358 Win=64128 Len=1460 [TCP segment of a reassembled PDU],1
275,0.382098,23.12.147.175,100.86.111.80,TCP,1514,443  >  64109 [ACK] Seq=258010 Ack=2358 Win=64128 Len=1460 [TCP segment of a reassembled PDU],1
276,0.382098,23.12.147.175,100.86.111.80,TCP,1514,"443  >  64109 [PSH, ACK] Seq=259470 Ack=2358 Win=64128 Len=1460 [TCP segment of a reassembled PDU]",1
277,0.382098,23.12.147.175,100.86.111.80,TCP,1514,443  >  64109 [ACK] Seq=260930 Ack=2358 Win=64128 Len=1460 [TCP segment of a reassembled PDU],1
278,0.382098,23.12.147.175,100.86.111.80,TCP,1514,443  >  64109 [ACK] Seq=262390 Ack=2358 Win=64128 Len=1460 [TCP segment of a reassembled PDU],1
279,0.382098,23.12.147.175,100.86.111.80,TCP,1514,443  >  64109 [ACK] Seq=263850 Ack=2358 Win=64128 Len=1460 [TCP segment of a reassembled PDU],1
280,0.382453,100.86.111.80,23.12.147.175,TCP,54,64109  >  443 [ACK] Seq=2358 Ack=265310 Win=131328 Len=0,1
281,0.383525,23.12.147.175,100.86.111.80,TCP,1514,443  >  64109 [ACK] Seq=265310 Ack=2358 Win=64128 Len=1460 [TCP segment of a reassembled PDU],1
282,0.383525,23.12.147.175,100.86.111.80,TCP,1514,"443  >  64109 [PSH, ACK] Seq=266770 Ack=2358 Win=64128 Len=1460 [TCP segment of a reassembled PDU]",1
283,0.383704,100.86.111.80,23.12.147.175,TCP,54,64109  >  443 [ACK] Seq=2358 Ack=268230 Win=131328 Len=0,1
284,0.384,23.12.147.175,100.86.111.80,TLSv1.3,1514,"Application Data, Application Data",1
285,0.384,23.12.147.175,100.86.111.80,TCP,1514,"443  >  64109 [PSH, ACK] Seq=269690 Ack=2358 Win=64128 Len=1460 [TCP segment of a reassembled PDU]",1
286,0.38415,100.86.111.80,23.12.147.175,TCP,54,64109  >  443 [ACK] Seq=2358 Ack=271150 Win=131328 Len=0,1
287,0.384242,23.12.147.175,100.86.111.80,TCP,1514,443  >  64109 [ACK] Seq=271150 Ack=2358 Win=64128 Len=1460 [TCP segment of a reassembled PDU],1
288,0.384242,23.12.147.175,100.86.111.80,TCP,1514,443  >  64109 [ACK] Seq=272610 Ack=2358 Win=64128 Len=1460 [TCP segment of a reassembled PDU],1
289,0.384344,100.86.111.80,23.12.147.175,TCP,54,64109  >  443 [ACK] Seq=2358 Ack=274070 Win=131328 Len=0,1
290,0.38441,23.12.147.175,100.86.111.80,TCP,1514,443  >  64109 [ACK] Seq=274070 Ack=2358 Win=64128 Len=1460 [TCP segment of a reassembled PDU],1
291,0.38441,23.12.147.175,100.86.111.80,TCP,1514,443  >  64109 [ACK] Seq=275530 Ack=2358 Win=64128 Len=1460 [TCP segment of a reassembled PDU],1
292,0.384482,100.86.111.80,23.12.147.175,TCP,54,64109  >  443 [ACK] Seq=2358 Ack=276990 Win=131328 Len=0,1
293,0.384726,23.12.147.175,100.86.111.80,TCP,1514,"443  >  64109 [PSH, ACK] Seq=276990 Ack=2358 Win=64128 Len=1460 [TCP segment of a reassembled PDU]",1
294,0.384726,23.12.147.175,100.86.111.80,TCP,1514,443  >  64109 [ACK] Seq=278450 Ack=2358 Win=64128 Len=1460 [TCP segment of a reassembled PDU],1
295,0.38484,100.86.111.80,23.12.147.175,TCP,54,64109  >  443 [ACK] Seq=2358 Ack=279910 Win=131328 Len=0,1
296,0.385061,23.12.147.175,100.86.111.80,TCP,1514,443  >  64109 [ACK] Seq=279910 Ack=2358 Win=64128 Len=1460 [TCP segment of a reassembled PDU],1
297,0.385061,23.12.147.175,100.86.111.80,TCP,1514,443  >  64109 [ACK] Seq=281370 Ack=2358 Win=64128 Len=1460 [TCP segment of a reassembled PDU],1
298,0.385194,100.86.111.80,23.12.147.175,TCP,54,64109  >  443 [ACK] Seq=2358 Ack=282830 Win=131328 Len=0,1
299,0.385399,23.12.147.175,100.86.111.80,TCP,1514,443  >  64109 [ACK] Seq=282830 Ack=2358 Win=64128 Len=1460 [TCP segment of a reassembled PDU],1
300,0.385399,23.12.147.175,100.86.111.80,TLSv1.3,1514,"Application Data, Application Data",1
301,0.385531,100.86.111.80,23.12.147.175,TCP,54,64109  >  443 [ACK] Seq=2358 Ack=285750 Win=131328 Len=0,1
302,0.385679,23.12.147.175,100.86.111.80,TCP,1514,443  >  64109 [ACK] Seq=285750 Ack=2358 Win=64128 Len=1460 [TCP segment of a reassembled PDU],1
303,0.385769,100.86.111.80,23.12.147.175,TCP,54,64109  >  443 [ACK] Seq=2358 Ack=287210 Win=131328 Len=0,1
304,0.386338,23.12.147.175,100.86.111.80,TCP,1514,443  >  64109 [ACK] Seq=287210 Ack=2358 Win=64128 Len=1460 [TCP segment of a reassembled PDU],1
305,0.386338,23.12.147.175,100.86.111.80,TCP,1514,443  >  64109 [ACK] Seq=288670 Ack=2358 Win=64128 Len=1460 [TCP segment of a reassembled PDU],1
306,0.386505,100.86.111.80,23.12.147.175,TCP,54,64109  >  443 [ACK] Seq=2358 Ack=290130 Win=131328 Len=0,1
307,0.386574,23.12.147.175,100.86.111.80,TCP,1514,443  >  64109 [ACK] Seq=290130 Ack=2358 Win=64128 Len=1460 [TCP segment of a reassembled PDU],1
