No.,Time,Source,Destination,Protocol,Length,Info,label
1,0,100.86.100.45,104.244.42.65,TCP,78,61715  >  443 [SYN] Seq=0 Win=65535 Len=0 MSS=1460 WS=64 TSval=1029916710 TSecr=0 SACK_PERM,2
2,0.092999,104.244.42.65,100.86.100.45,TCP,74,"443  >  61715 [SYN, ACK] Seq=0 Ack=1 Win=65535 Len=0 MSS=1360 SACK_PERM TSval=3617604828 TSecr=1029916710 WS=256",2
3,0.0931,100.86.100.45,104.244.42.65,TCP,66,61715  >  443 [ACK] Seq=1 Ack=1 Win=132096 Len=0 TSval=1029916803 TSecr=3617604828,2
4,0.093207,100.86.100.45,104.244.42.65,TLSv1.3,629,Client Hello (SNI=twitter.com),2
5,0.186263,104.244.42.65,100.86.100.45,TCP,66,443  >  61715 [ACK] Seq=1 Ack=564 Win=66816 Len=0 TSval=3617604921 TSecr=1029916803,2
6,0.187767,104.244.42.65,100.86.100.45,TLSv1.3,1414,"Server Hello, Change Cipher Spec",2
7,0.18783,100.86.100.45,104.244.42.65,TCP,66,61715  >  443 [ACK] Seq=564 Ack=1349 Win=130752 Len=0 TSval=1029916898 TSecr=3617604922,2
8,0.18841,104.244.42.65,100.86.100.45,TCP,1414,"443  >  61715 [PSH, ACK] Seq=1349 Ack=564 Win=66816 Len=1348 TSval=3617604922 TSecr=1029916803 [TCP segment of a reassembled PDU]",2
9,0.18841,104.244.42.65,100.86.100.45,TLSv1.3,872,Application Data,2
10,0.188446,100.86.100.45,104.244.42.65,TCP,66,61715  >  443 [ACK] Seq=564 Ack=3503 Win=128896 Len=0 TSval=1029916898 TSecr=3617604922,2
11,0.189471,100.86.100.45,104.244.42.65,TLSv1.3,130,"Change Cipher Spec, Application Data",2
12,0.18956,100.86.100.45,104.244.42.65,TLSv1.3,158,Application Data,2
13,0.189676,100.86.100.45,104.244.42.65,TLSv1.3,931,Application Data,2
14,0.283045,104.244.42.65,100.86.100.45,TCP,66,443  >  61715 [ACK] Seq=3503 Ack=1585 Win=69376 Len=0 TSval=3617605018 TSecr=1029916899,2
15,0.283503,104.244.42.65,100.86.100.45,TLSv1.3,593,"Application Data, Application Data",2
16,0.283553,100.86.100.45,104.244.42.65,TCP,66,61715  >  443 [ACK] Seq=1585 Ack=4030 Win=130496 Len=0 TSval=1029916992 TSecr=3617605018,2
17,0.283691,100.86.100.45,104.244.42.65,TLSv1.3,97,Application Data,2
18,0.349516,104.244.42.65,100.86.100.45,TCP,1414,443  >  61715 [ACK] Seq=4030 Ack=1585 Win=69376 Len=1348 TSval=3617605083 TSecr=1029916899 [TCP segment of a reassembled PDU],2
19,0.349517,104.244.42.65,100.86.100.45,TCP,1414,"443  >  61715 [PSH, ACK] Seq=5378 Ack=1585 Win=69376 Len=1348 TSval=3617605083 TSecr=1029916899 [TCP segment of a reassembled PDU]",2
20,0.349517,104.244.42.65,100.86.100.45,TLSv1.3,1356,Application Data,2
21,0.349617,100.86.100.45,104.244.42.65,TCP,66,61715  >  443 [ACK] Seq=1616 Ack=8016 Win=127040 Len=0 TSval=1029917059 TSecr=3617605083,2
22,0.349706,100.86.100.45,104.244.42.65,TCP,66,[TCP Window Update] 61715  >  443 [ACK] Seq=1616 Ack=8016 Win=131072 Len=0 TSval=1029917059 TSecr=3617605083,2
23,0.351197,104.244.42.65,100.86.100.45,TLSv1.3,127,Application Data,2
24,0.351198,104.244.42.65,100.86.100.45,TLSv1.3,190,Application Data,2
25,0.351198,104.244.42.65,100.86.100.45,TLSv1.3,161,Application Data,2
26,0.351199,104.244.42.65,100.86.100.45,TLSv1.3,118,Application Data,2
27,0.351199,104.244.42.65,100.86.100.45,TLSv1.3,156,"Application Data, Application Data",2
28,0.351199,104.244.42.65,100.86.100.45,TLSv1.3,113,Application Data,2
29,0.35129,100.86.100.45,104.244.42.65,TCP,66,61715  >  443 [ACK] Seq=1616 Ack=8485 Win=130560 Len=0 TSval=1029917061 TSecr=3617605084,2
30,0.376537,104.244.42.65,100.86.100.45,TLSv1.3,1414,"Application Data, Application Data, Application Data, Application Data, Application Data, Application Data, Application Data, Application Data, Application Data, Application Data, Application Data, Application Data",2
31,0.376636,100.86.100.45,104.244.42.65,TCP,66,61715  >  443 [ACK] Seq=1616 Ack=9833 Win=129664 Len=0 TSval=1029917086 TSecr=3617605111,2
32,0.376887,104.244.42.65,100.86.100.45,TLSv1.3,590,"Application Data, Application Data",2
33,0.376908,100.86.100.45,104.244.42.65,TCP,66,61715  >  443 [ACK] Seq=1616 Ack=10357 Win=130496 Len=0 TSval=1029917086 TSecr=3617605111,2
34,0.44416,104.244.42.65,100.86.100.45,TLSv1.3,1414,"Application Data, Application Data",2
35,0.444161,104.244.42.65,100.86.100.45,TCP,1414,"443  >  61715 [PSH, ACK] Seq=11705 Ack=1616 Win=69376 Len=1348 TSval=3617605179 TSecr=1029917059 [TCP segment of a reassembled PDU]",2
36,0.444241,100.86.100.45,104.244.42.65,TCP,66,61715  >  443 [ACK] Seq=1616 Ack=13053 Win=128320 Len=0 TSval=1029917153 TSecr=3617605179,2
37,0.444279,100.86.100.45,104.244.42.65,TCP,66,[TCP Window Update] 61715  >  443 [ACK] Seq=1616 Ack=13053 Win=131072 Len=0 TSval=1029917153 TSecr=3617605179,2
38,0.444542,104.244.42.65,100.86.100.45,TLSv1.3,1414,"Application Data, Application Data, Application Data, Application Data",2
39,0.444543,104.244.42.65,100.86.100.45,TLSv1.3,1414,"Application Data, Application Data, Application Data, Application Data",2
40,0.444544,104.244.42.65,100.86.100.45,TLSv1.3,1414,"Application Data, Application Data",2
41,0.444544,104.244.42.65,100.86.100.45,TLSv1.3,1414,"Application Data, Application Data",2
42,0.444578,100.86.100.45,104.244.42.65,TCP,66,61715  >  443 [ACK] Seq=1616 Ack=18445 Win=125632 Len=0 TSval=1029917153 TSecr=3617605179,2
43,0.444595,100.86.100.45,104.244.42.65,TCP,66,[TCP Window Update] 61715  >  443 [ACK] Seq=1616 Ack=18445 Win=131072 Len=0 TSval=1029917154 TSecr=3617605179,2
44,0.444924,104.244.42.65,100.86.100.45,TCP,1414,443  >  61715 [ACK] Seq=18445 Ack=1616 Win=69376 Len=1348 TSval=3617605179 TSecr=1029917061 [TCP segment of a reassembled PDU],2
45,0.444925,104.244.42.65,100.86.100.45,TCP,1414,"443  >  61715 [PSH, ACK] Seq=19793 Ack=1616 Win=69376 Len=1348 TSval=3617605179 TSecr=1029917061 [TCP segment of a reassembled PDU]",2
46,0.444948,100.86.100.45,104.244.42.65,TCP,66,61715  >  443 [ACK] Seq=1616 Ack=21141 Win=128320 Len=0 TSval=1029917154 TSecr=3617605179,2
47,0.44499,100.86.100.45,104.244.42.65,TCP,66,[TCP Window Update] 61715  >  443 [ACK] Seq=1616 Ack=21141 Win=131072 Len=0 TSval=1029917154 TSecr=3617605179,2
48,0.446576,104.244.42.65,100.86.100.45,TLSv1.3,1414,Application Data,2
49,0.446577,104.244.42.65,100.86.100.45,TCP,1414,"443  >  61715 [PSH, ACK] Seq=22489 Ack=1616 Win=69376 Len=1348 TSval=3617605179 TSecr=1029917061 [TCP segment of a reassembled PDU]",2
50,0.446578,104.244.42.65,100.86.100.45,TLSv1.3,1414,Application Data,2
51,0.446578,104.244.42.65,100.86.100.45,TCP,1414,"443  >  61715 [PSH, ACK] Seq=25185 Ack=1616 Win=69376 Len=1348 TSval=3617605179 TSecr=1029917061 [TCP segment of a reassembled PDU]",2
52,0.446579,104.244.42.65,100.86.100.45,TLSv1.3,1414,Application Data,2
53,0.446579,104.244.42.65,100.86.100.45,TCP,1414,"443  >  61715 [PSH, ACK] Seq=27881 Ack=1616 Win=69376 Len=1348 TSval=3617605179 TSecr=1029917061 [TCP segment of a reassembled PDU]",2
54,0.44658,104.244.42.65,100.86.100.45,TCP,1414,443  >  61715 [ACK] Seq=29229 Ack=1616 Win=69376 Len=1348 TSval=3617605179 TSecr=1029917061 [TCP segment of a reassembled PDU],2
55,0.44658,104.244.42.65,100.86.100.45,TLSv1.3,1414,Application Data,2
56,0.446581,104.244.42.65,100.86.100.45,TCP,1414,443  >  61715 [ACK] Seq=31925 Ack=1616 Win=69376 Len=1348 TSval=3617605179 TSecr=1029917061 [TCP segment of a reassembled PDU],2
57,0.446582,104.244.42.65,100.86.100.45,TLSv1.3,1414,Application Data,2
58,0.446666,100.86.100.45,104.244.42.65,TCP,66,61715  >  443 [ACK] Seq=1616 Ack=34621 Win=117568 Len=0 TSval=1029917156 TSecr=3617605179,2
59,0.44673,100.86.100.45,104.244.42.65,TCP,66,[TCP Window Update] 61715  >  443 [ACK] Seq=1616 Ack=34621 Win=131072 Len=0 TSval=1029917156 TSecr=3617605179,2
60,0.470985,104.244.42.65,100.86.100.45,TCP,1414,443  >  61715 [ACK] Seq=34621 Ack=1616 Win=69376 Len=1348 TSval=3617605204 TSecr=1029917086 [TCP segment of a reassembled PDU],2
61,0.470986,104.244.42.65,100.86.100.45,TLSv1.3,1414,Application Data,2
62,0.471116,100.86.100.45,104.244.42.65,TCP,66,61715  >  443 [ACK] Seq=1616 Ack=37317 Win=128320 Len=0 TSval=1029917181 TSecr=3617605204,2
63,0.471171,100.86.100.45,104.244.42.65,TCP,66,[TCP Window Update] 61715  >  443 [ACK] Seq=1616 Ack=37317 Win=131072 Len=0 TSval=1029917181 TSecr=3617605204,2
64,0.472618,104.244.42.65,100.86.100.45,TCP,1414,443  >  61715 [ACK] Seq=37317 Ack=1616 Win=69376 Len=1348 TSval=3617605206 TSecr=1029917086 [TCP segment of a reassembled PDU],2
65,0.472723,100.86.100.45,104.244.42.65,TCP,66,61715  >  443 [ACK] Seq=1616 Ack=38665 Win=129664 Len=0 TSval=1029917182 TSecr=3617605206,2
66,0.473371,104.244.42.65,100.86.100.45,TLSv1.3,1414,"Application Data, Application Data, Application Data, Application Data",2
67,0.473423,100.86.100.45,104.244.42.65,TCP,66,61715  >  443 [ACK] Seq=1616 Ack=40013 Win=129664 Len=0 TSval=1029917182 TSecr=3617605206,2
68,0.538027,104.244.42.65,100.86.100.45,TLSv1.3,1414,Application Data,2
69,0.538028,104.244.42.65,100.86.100.45,TLSv1.3,1414,"[TCP Previous segment not captured] , Continuation Data",2
70,0.538128,100.86.100.45,104.244.42.65,TCP,66,61715  >  443 [ACK] Seq=1616 Ack=41361 Win=129664 Len=0 TSval=1029917248 TSecr=3617605273,2
71,0.538171,100.86.100.45,104.244.42.65,TCP,78,[TCP Dup ACK 70#1] 61715  >  443 [ACK] Seq=1616 Ack=41361 Win=129664 Len=0 TSval=1029917248 TSecr=3617605273 SLE=42709 SRE=44057,2
72,0.538427,104.244.42.65,100.86.100.45,TLSv1.3,1414,Continuation Data,2
73,0.538428,104.244.42.65,100.86.100.45,TCP,1414,443  >  61715 [ACK] Seq=45405 Ack=1616 Win=69376 Len=1348 TSval=3617605273 TSecr=1029917154,2
74,0.538452,100.86.100.45,104.244.42.65,TCP,78,[TCP Window Update] 61715  >  443 [ACK] Seq=1616 Ack=41361 Win=131072 Len=0 TSval=1029917248 TSecr=3617605273 SLE=42709 SRE=46753,2
75,0.538873,104.244.42.65,100.86.100.45,TLSv1.3,1414,Continuation Data,2
76,0.538874,104.244.42.65,100.86.100.45,TLSv1.3,1414,Continuation Data,2
77,0.538899,100.86.100.45,104.244.42.65,TCP,78,[TCP Dup ACK 70#2] 61715  >  443 [ACK] Seq=1616 Ack=41361 Win=131072 Len=0 TSval=1029917248 TSecr=3617605273 SLE=42709 SRE=49449,2
78,0.540138,104.244.42.65,100.86.100.45,TLSv1.3,1414,Continuation Data,2
79,0.540139,104.244.42.65,100.86.100.45,TLSv1.3,1414,Continuation Data,2
80,0.540139,104.244.42.65,100.86.100.45,TLSv1.3,1414,Continuation Data,2
81,0.54014,104.244.42.65,100.86.100.45,TLSv1.3,1414,Continuation Data,2
82,0.54014,104.244.42.65,100.86.100.45,TLSv1.3,1414,Continuation Data,2
83,0.540141,104.244.42.65,100.86.100.45,TLSv1.3,1013,Continuation Data,2
84,0.540228,100.86.100.45,104.244.42.65,TCP,78,[TCP Dup ACK 70#3] 61715  >  443 [ACK] Seq=1616 Ack=41361 Win=131072 Len=0 TSval=1029917250 TSecr=3617605273 SLE=42709 SRE=57136,2
85,0.632755,104.244.42.65,100.86.100.45,TCP,1414,[TCP Out-Of-Order] 443  >  61715 [ACK] Seq=41361 Ack=1616 Win=69376 Len=1348 TSval=3617605367 TSecr=1029917248,2
86,0.632872,100.86.100.45,104.244.42.65,TCP,66,61715  >  443 [ACK] Seq=1616 Ack=57136 Win=115264 Len=0 TSval=1029917343 TSecr=3617605367,2
87,0.633015,100.86.100.45,104.244.42.65,TCP,66,[TCP Window Update] 61715  >  443 [ACK] Seq=1616 Ack=57136 Win=131072 Len=0 TSval=1029917343 TSecr=3617605367,2
88,0.777976,100.86.100.45,104.244.42.65,TLSv1.3,686,Application Data,2
89,0.871267,104.244.42.65,100.86.100.45,TCP,66,443  >  61715 [ACK] Seq=57136 Ack=2236 Win=71168 Len=0 TSval=3617605606 TSecr=1029917488,2
90,0.877858,100.86.100.45,104.244.42.65,TLSv1.3,138,Application Data,2
91,0.889981,100.86.100.45,104.244.42.65,TLSv1.3,278,Application Data,2
92,0.890019,100.86.100.45,104.244.42.65,TCP,1414,61715  >  443 [ACK] Seq=2520 Ack=57136 Win=131072 Len=1348 TSval=1029917600 TSecr=3617605606 [TCP segment of a reassembled PDU],2
93,0.890025,100.86.100.45,104.244.42.65,TLSv1.3,369,Application Data,2
94,0.892253,104.244.42.65,100.86.100.45,TLSv1.3,418,Application Data,2
95,0.892333,100.86.100.45,104.244.42.65,TCP,66,61715  >  443 [ACK] Seq=4171 Ack=57488 Win=130688 Len=0 TSval=1029917602 TSecr=3617605627,2
96,0.922496,100.86.100.45,104.244.42.65,TLSv1.3,253,Application Data,2
97,0.987501,104.244.42.65,100.86.100.45,TCP,1414,443  >  61715 [ACK] Seq=57488 Ack=2308 Win=71168 Len=1348 TSval=3617605717 TSecr=1029917587 [TCP segment of a reassembled PDU],2
98,0.987502,104.244.42.65,100.86.100.45,TCP,1414,"443  >  61715 [PSH, ACK] Seq=58836 Ack=2308 Win=71168 Len=1348 TSval=3617605717 TSecr=1029917587 [TCP segment of a reassembled PDU]",2
99,0.987502,104.244.42.65,100.86.100.45,TCP,1414,443  >  61715 [ACK] Seq=60184 Ack=2308 Win=71168 Len=1348 TSval=3617605717 TSecr=1029917587 [TCP segment of a reassembled PDU],2
100,0.987503,104.244.42.65,100.86.100.45,TCP,1414,"443  >  61715 [PSH, ACK] Seq=61532 Ack=2308 Win=71168 Len=1348 TSval=3617605717 TSecr=1029917587 [TCP segment of a reassembled PDU]",2
101,0.987503,104.244.42.65,100.86.100.45,TLSv1.3,821,Application Data,2
102,0.987504,104.244.42.65,100.86.100.45,TCP,66,443  >  61715 [ACK] Seq=63635 Ack=4171 Win=76288 Len=0 TSval=3617605718 TSecr=1029917600,2
103,0.987614,100.86.100.45,104.244.42.65,TCP,66,61715  >  443 [ACK] Seq=4358 Ack=63635 Win=124864 Len=0 TSval=1029917697 TSecr=3617605717,2
104,0.987715,100.86.100.45,104.244.42.65,TCP,66,[TCP Window Update] 61715  >  443 [ACK] Seq=4358 Ack=63635 Win=131072 Len=0 TSval=1029917697 TSecr=3617605718,2
105,1.027995,104.244.42.65,100.86.100.45,TCP,1414,443  >  61715 [ACK] Seq=63635 Ack=4358 Win=78848 Len=1348 TSval=3617605763 TSecr=1029917632 [TCP segment of a reassembled PDU],2
106,1.027996,104.244.42.65,100.86.100.45,TCP,1414,"443  >  61715 [PSH, ACK] Seq=64983 Ack=4358 Win=78848 Len=1348 TSval=3617605763 TSecr=1029917632 [TCP segment of a reassembled PDU]",2
107,1.027997,104.244.42.65,100.86.100.45,TCP,1414,443  >  61715 [ACK] Seq=66331 Ack=4358 Win=78848 Len=1348 TSval=3617605763 TSecr=1029917632 [TCP segment of a reassembled PDU],2
108,1.028063,100.86.100.45,104.244.42.65,TCP,66,61715  >  443 [ACK] Seq=4358 Ack=67679 Win=126976 Len=0 TSval=1029917738 TSecr=3617605763,2
109,1.028149,100.86.100.45,104.244.42.65,TCP,66,[TCP Window Update] 61715  >  443 [ACK] Seq=4358 Ack=67679 Win=131072 Len=0 TSval=1029917738 TSecr=3617605763,2
110,1.028378,104.244.42.65,100.86.100.45,TCP,1414,"443  >  61715 [PSH, ACK] Seq=67679 Ack=4358 Win=78848 Len=1348 TSval=3617605763 TSecr=1029917632 [TCP segment of a reassembled PDU]",2
111,1.028379,104.244.42.65,100.86.100.45,TCP,1414,443  >  61715 [ACK] Seq=69027 Ack=4358 Win=78848 Len=1348 TSval=3617605763 TSecr=1029917632 [TCP segment of a reassembled PDU],2
112,1.028404,100.86.100.45,104.244.42.65,TCP,66,61715  >  443 [ACK] Seq=4358 Ack=70375 Win=128320 Len=0 TSval=1029917738 TSecr=3617605763,2
113,1.028448,100.86.100.45,104.244.42.65,TCP,66,[TCP Window Update] 61715  >  443 [ACK] Seq=4358 Ack=70375 Win=131072 Len=0 TSval=1029917738 TSecr=3617605763,2
114,1.029802,104.244.42.65,100.86.100.45,TCP,1414,"443  >  61715 [PSH, ACK] Seq=70375 Ack=4358 Win=78848 Len=1348 TSval=3617605763 TSecr=1029917632 [TCP segment of a reassembled PDU]",2
115,1.029803,104.244.42.65,100.86.100.45,TCP,1414,443  >  61715 [ACK] Seq=71723 Ack=4358 Win=78848 Len=1348 TSval=3617605763 TSecr=1029917632 [TCP segment of a reassembled PDU],2
116,1.029804,104.244.42.65,100.86.100.45,TCP,1414,"443  >  61715 [PSH, ACK] Seq=73071 Ack=4358 Win=78848 Len=1348 TSval=3617605763 TSecr=1029917632 [TCP segment of a reassembled PDU]",2
117,1.029805,104.244.42.65,100.86.100.45,TCP,1414,443  >  61715 [ACK] Seq=74419 Ack=4358 Win=78848 Len=1348 TSval=3617605763 TSecr=1029917632 [TCP segment of a reassembled PDU],2
118,1.029806,104.244.42.65,100.86.100.45,TCP,1414,"443  >  61715 [PSH, ACK] Seq=75767 Ack=4358 Win=78848 Len=1348 TSval=3617605763 TSecr=1029917632 [TCP segment of a reassembled PDU]",2
119,1.029806,104.244.42.65,100.86.100.45,TCP,1414,443  >  61715 [ACK] Seq=77115 Ack=4358 Win=78848 Len=1348 TSval=3617605763 TSecr=1029917632 [TCP segment of a reassembled PDU],2
120,1.029807,104.244.42.65,100.86.100.45,TCP,1414,"443  >  61715 [PSH, ACK] Seq=78463 Ack=4358 Win=78848 Len=1348 TSval=3617605763 TSecr=1029917632 [TCP segment of a reassembled PDU]",2
121,1.029808,104.244.42.65,100.86.100.45,TLSv1.3,1260,"Application Data, Application Data",2
122,1.029942,100.86.100.45,104.244.42.65,TCP,66,61715  >  443 [ACK] Seq=4358 Ack=81005 Win=120384 Len=0 TSval=1029917740 TSecr=3617605763,2
123,1.032208,100.86.100.45,104.244.42.65,TCP,66,[TCP Window Update] 61715  >  443 [ACK] Seq=4358 Ack=81005 Win=131072 Len=0 TSval=1029917742 TSecr=3617605763,2
124,1.546185,100.86.100.45,104.244.42.65,TLSv1.3,532,Application Data,2
125,1.546608,100.86.100.45,104.244.42.65,TLSv1.3,898,Application Data,2
126,1.639477,104.244.42.65,100.86.100.45,TCP,66,443  >  61715 [ACK] Seq=81005 Ack=5656 Win=84224 Len=0 TSval=3617606374 TSecr=1029918255,2
127,1.6626,104.244.42.65,100.86.100.45,TLSv1.3,244,Application Data,2
128,1.662644,100.86.100.45,104.244.42.65,TCP,66,61715  >  443 [ACK] Seq=5656 Ack=81183 Win=130880 Len=0 TSval=1029918372 TSecr=3617606397,2
129,1.754662,100.86.100.45,104.244.42.65,TLSv1.3,599,Application Data,2
130,1.756943,100.86.100.45,104.244.42.65,TLSv1.3,882,Application Data,2
131,1.756996,100.86.100.45,104.244.42.65,TLSv1.3,456,Application Data,2
132,1.823601,100.86.100.45,104.244.42.65,TLSv1.3,277,Application Data,2
133,1.840416,100.86.100.45,104.244.42.65,TLSv1.3,591,Application Data,2
134,1.840493,100.86.100.45,104.244.42.65,TLSv1.3,1319,Application Data,2
135,1.84224,100.86.100.45,104.244.42.65,TLSv1.3,656,Application Data,2
136,1.850072,104.244.42.65,100.86.100.45,TCP,66,443  >  61715 [ACK] Seq=81183 Ack=7005 Win=89600 Len=0 TSval=3617606584 TSecr=1029918464,2
137,1.876903,104.244.42.65,100.86.100.45,TLSv1.3,239,Application Data,2
138,1.876959,100.86.100.45,104.244.42.65,TCP,66,61715  >  443 [ACK] Seq=9974 Ack=81356 Win=130880 Len=0 TSval=1029918586 TSecr=3617606611,2
139,1.928662,104.244.42.65,100.86.100.45,TCP,1414,443  >  61715 [ACK] Seq=81356 Ack=7606 Win=95232 Len=1348 TSval=3617606663 TSecr=1029918533 [TCP segment of a reassembled PDU],2
140,1.928748,100.86.100.45,104.244.42.65,TCP,66,61715  >  443 [ACK] Seq=9974 Ack=82704 Win=129664 Len=0 TSval=1029918639 TSecr=3617606663,2
141,1.929252,104.244.42.65,100.86.100.45,TLSv1.3,963,Application Data,2
142,1.929282,100.86.100.45,104.244.42.65,TCP,66,61715  >  443 [ACK] Seq=9974 Ack=83601 Win=130112 Len=0 TSval=1029918639 TSecr=3617606663,2
143,1.934466,104.244.42.65,100.86.100.45,TCP,66,443  >  61715 [ACK] Seq=83601 Ack=9384 Win=100608 Len=0 TSval=3617606669 TSecr=1029918550,2
144,1.935803,104.244.42.65,100.86.100.45,TLSv1.3,190,Application Data,2
145,1.935878,100.86.100.45,104.244.42.65,TCP,66,61715  >  443 [ACK] Seq=9974 Ack=83725 Win=130944 Len=0 TSval=1029918646 TSecr=3617606670,2
146,1.970792,104.244.42.65,100.86.100.45,TCP,1414,443  >  61715 [ACK] Seq=83725 Ack=9974 Win=103168 Len=1348 TSval=3617606705 TSecr=1029918586 [TCP segment of a reassembled PDU],2
147,1.970792,104.244.42.65,100.86.100.45,TCP,1414,"443  >  61715 [PSH, ACK] Seq=85073 Ack=9974 Win=103168 Len=1348 TSval=3617606705 TSecr=1029918586 [TCP segment of a reassembled PDU]",2
148,1.970793,104.244.42.65,100.86.100.45,TCP,1414,443  >  61715 [ACK] Seq=86421 Ack=9974 Win=103168 Len=1348 TSval=3617606705 TSecr=1029918586 [TCP segment of a reassembled PDU],2
149,1.970887,100.86.100.45,104.244.42.65,TCP,66,61715  >  443 [ACK] Seq=9974 Ack=87769 Win=126976 Len=0 TSval=1029918681 TSecr=3617606705,2
150,1.971036,100.86.100.45,104.244.42.65,TCP,66,[TCP Window Update] 61715  >  443 [ACK] Seq=9974 Ack=87769 Win=131072 Len=0 TSval=1029918681 TSecr=3617606705,2
151,1.971107,104.244.42.65,100.86.100.45,TCP,1414,"443  >  61715 [PSH, ACK] Seq=87769 Ack=9974 Win=103168 Len=1348 TSval=3617606705 TSecr=1029918586 [TCP segment of a reassembled PDU]",2
152,1.971108,104.244.42.65,100.86.100.45,TCP,1414,443  >  61715 [ACK] Seq=89117 Ack=9974 Win=103168 Len=1348 TSval=3617606705 TSecr=1029918586 [TCP segment of a reassembled PDU],2
153,1.971137,100.86.100.45,104.244.42.65,TCP,66,61715  >  443 [ACK] Seq=9974 Ack=90465 Win=128320 Len=0 TSval=1029918681 TSecr=3617606705,2
154,1.971177,100.86.100.45,104.244.42.65,TCP,66,[TCP Window Update] 61715  >  443 [ACK] Seq=9974 Ack=90465 Win=131072 Len=0 TSval=1029918681 TSecr=3617606705,2
155,1.972688,104.244.42.65,100.86.100.45,TCP,1414,"443  >  61715 [PSH, ACK] Seq=90465 Ack=9974 Win=103168 Len=1348 TSval=3617606705 TSecr=1029918586 [TCP segment of a reassembled PDU]",2
156,1.972689,104.244.42.65,100.86.100.45,TCP,1414,443  >  61715 [ACK] Seq=91813 Ack=9974 Win=103168 Len=1348 TSval=3617606705 TSecr=1029918586 [TCP segment of a reassembled PDU],2
157,1.972689,104.244.42.65,100.86.100.45,TCP,1414,"443  >  61715 [PSH, ACK] Seq=93161 Ack=9974 Win=103168 Len=1348 TSval=3617606705 TSecr=1029918586 [TCP segment of a reassembled PDU]",2
158,1.97269,104.244.42.65,100.86.100.45,TCP,1414,443  >  61715 [ACK] Seq=94509 Ack=9974 Win=103168 Len=1348 TSval=3617606705 TSecr=1029918586 [TCP segment of a reassembled PDU],2
159,1.972691,104.244.42.65,100.86.100.45,TCP,1414,"443  >  61715 [PSH, ACK] Seq=95857 Ack=9974 Win=103168 Len=1348 TSval=3617606705 TSecr=1029918586 [TCP segment of a reassembled PDU]",2
160,1.972691,104.244.42.65,100.86.100.45,TCP,1414,443  >  61715 [ACK] Seq=97205 Ack=9974 Win=103168 Len=1348 TSval=3617606705 TSecr=1029918586 [TCP segment of a reassembled PDU],2
161,1.972692,104.244.42.65,100.86.100.45,TCP,1414,"443  >  61715 [PSH, ACK] Seq=98553 Ack=9974 Win=103168 Len=1348 TSval=3617606705 TSecr=1029918586 [TCP segment of a reassembled PDU]",2
162,1.972692,104.244.42.65,100.86.100.45,TLSv1.3,1414,Application Data,2
163,1.972693,104.244.42.65,100.86.100.45,TCP,1414,"443  >  61715 [PSH, ACK] Seq=101249 Ack=9974 Win=103168 Len=1348 TSval=3617606705 TSecr=1029918586 [TCP segment of a reassembled PDU]",2
164,1.972693,104.244.42.65,100.86.100.45,TCP,1414,443  >  61715 [ACK] Seq=102597 Ack=9974 Win=103168 Len=1348 TSval=3617606705 TSecr=1029918586 [TCP segment of a reassembled PDU],2
165,1.972694,104.244.42.65,100.86.100.45,TCP,1414,"443  >  61715 [PSH, ACK] Seq=103945 Ack=9974 Win=103168 Len=1348 TSval=3617606705 TSecr=1029918586 [TCP segment of a reassembled PDU]",2
166,1.972694,104.244.42.65,100.86.100.45,TCP,1414,443  >  61715 [ACK] Seq=105293 Ack=9974 Win=103168 Len=1348 TSval=3617606705 TSecr=1029918586 [TCP segment of a reassembled PDU],2
167,1.972695,104.244.42.65,100.86.100.45,TCP,1414,"443  >  61715 [PSH, ACK] Seq=106641 Ack=9974 Win=103168 Len=1348 TSval=3617606705 TSecr=1029918586 [TCP segment of a reassembled PDU]",2
168,1.972695,104.244.42.65,100.86.100.45,TCP,1414,443  >  61715 [ACK] Seq=107989 Ack=9974 Win=103168 Len=1348 TSval=3617606705 TSecr=1029918586 [TCP segment of a reassembled PDU],2
169,1.972696,104.244.42.65,100.86.100.45,TCP,1414,"443  >  61715 [PSH, ACK] Seq=109337 Ack=9974 Win=103168 Len=1348 TSval=3617606705 TSecr=1029918586 [TCP segment of a reassembled PDU]",2
170,1.972697,104.244.42.65,100.86.100.45,TLSv1.3,197,Application Data,2
171,1.972729,104.244.42.65,100.86.100.45,TCP,1414,443  >  61715 [ACK] Seq=110816 Ack=9974 Win=103168 Len=1348 TSval=3617606707 TSecr=1029918586 [TCP segment of a reassembled PDU],2
172,1.972729,104.244.42.65,100.86.100.45,TLSv1.3,205,Application Data,2
173,1.972776,100.86.100.45,104.244.42.65,TCP,66,61715  >  443 [ACK] Seq=9974 Ack=106641 Win=114880 Len=0 TSval=1029918683 TSecr=3617606705,2
174,1.972812,100.86.100.45,104.244.42.65,TCP,66,61715  >  443 [ACK] Seq=9974 Ack=110816 Win=110720 Len=0 TSval=1029918683 TSecr=3617606705,2
175,1.972834,100.86.100.45,104.244.42.65,TCP,66,61715  >  443 [ACK] Seq=9974 Ack=112303 Win=126592 Len=0 TSval=1029918683 TSecr=3617606707,2
176,1.97306,100.86.100.45,104.244.42.65,TCP,66,[TCP Window Update] 61715  >  443 [ACK] Seq=9974 Ack=112303 Win=131072 Len=0 TSval=1029918683 TSecr=3617606707,2
177,2.011175,104.244.42.65,100.86.100.45,TCP,1414,443  >  61715 [ACK] Seq=112303 Ack=9974 Win=103168 Len=1348 TSval=3617606742 TSecr=1029918586 [TCP segment of a reassembled PDU],2
178,2.011176,104.244.42.65,100.86.100.45,TLSv1.3,576,Application Data,2
179,2.011269,100.86.100.45,104.244.42.65,TCP,66,61715  >  443 [ACK] Seq=9974 Ack=114161 Win=129152 Len=0 TSval=1029918721 TSecr=3617606742,2
180,2.151593,104.244.42.65,100.86.100.45,TCP,1414,443  >  61715 [ACK] Seq=114161 Ack=9974 Win=103168 Len=1348 TSval=3617606886 TSecr=1029918721 [TCP segment of a reassembled PDU],2
181,2.151679,100.86.100.45,104.244.42.65,TCP,66,61715  >  443 [ACK] Seq=9974 Ack=115509 Win=129664 Len=0 TSval=1029918861 TSecr=3617606886,2
182,2.152093,104.244.42.65,100.86.100.45,TCP,1414,"443  >  61715 [PSH, ACK] Seq=115509 Ack=9974 Win=103168 Len=1348 TSval=3617606886 TSecr=1029918721 [TCP segment of a reassembled PDU]",2
183,2.152094,104.244.42.65,100.86.100.45,TLSv1.3,1153,Application Data,2
184,2.152126,100.86.100.45,104.244.42.65,TCP,66,61715  >  443 [ACK] Seq=9974 Ack=117944 Win=128576 Len=0 TSval=1029918861 TSecr=3617606886,2
185,2.158223,104.244.42.65,100.86.100.45,TLSv1.3,349,Application Data,2
186,2.158287,100.86.100.45,104.244.42.65,TCP,66,61715  >  443 [ACK] Seq=9974 Ack=118227 Win=130752 Len=0 TSval=1029918868 TSecr=3617606893,2
187,3.187271,104.244.42.65,100.86.100.45,TCP,1414,443  >  61715 [ACK] Seq=118227 Ack=9974 Win=103168 Len=1348 TSval=3617607922 TSecr=1029918868 [TCP segment of a reassembled PDU],2
188,3.187273,104.244.42.65,100.86.100.45,TCP,1414,"443  >  61715 [PSH, ACK] Seq=119575 Ack=9974 Win=103168 Len=1348 TSval=3617607922 TSecr=1029918868 [TCP segment of a reassembled PDU]",2
189,3.187274,104.244.42.65,100.86.100.45,TCP,1414,443  >  61715 [ACK] Seq=120923 Ack=9974 Win=103168 Len=1348 TSval=3617607922 TSecr=1029918868 [TCP segment of a reassembled PDU],2
190,3.187486,100.86.100.45,104.244.42.65,TCP,66,61715  >  443 [ACK] Seq=9974 Ack=122271 Win=126976 Len=0 TSval=1029919897 TSecr=3617607922,2
191,3.18761,104.244.42.65,100.86.100.45,TCP,1414,"443  >  61715 [PSH, ACK] Seq=122271 Ack=9974 Win=103168 Len=1348 TSval=3617607922 TSecr=1029918868 [TCP segment of a reassembled PDU]",2
192,3.187621,104.244.42.65,100.86.100.45,TCP,1414,443  >  61715 [ACK] Seq=123619 Ack=9974 Win=103168 Len=1348 TSval=3617607922 TSecr=1029918868 [TCP segment of a reassembled PDU],2
193,3.187675,100.86.100.45,104.244.42.65,TCP,66,61715  >  443 [ACK] Seq=9974 Ack=124967 Win=124288 Len=0 TSval=1029919897 TSecr=3617607922,2
194,3.187787,100.86.100.45,104.244.42.65,TCP,66,[TCP Window Update] 61715  >  443 [ACK] Seq=9974 Ack=124967 Win=131072 Len=0 TSval=1029919897 TSecr=3617607922,2
195,3.189155,104.244.42.65,100.86.100.45,TCP,1414,"443  >  61715 [PSH, ACK] Seq=124967 Ack=9974 Win=103168 Len=1348 TSval=3617607922 TSecr=1029918868 [TCP segment of a reassembled PDU]",2
196,3.189157,104.244.42.65,100.86.100.45,TCP,1414,443  >  61715 [ACK] Seq=126315 Ack=9974 Win=103168 Len=1348 TSval=3617607922 TSecr=1029918868 [TCP segment of a reassembled PDU],2
197,3.189158,104.244.42.65,100.86.100.45,TCP,1414,"443  >  61715 [PSH, ACK] Seq=127663 Ack=9974 Win=103168 Len=1348 TSval=3617607922 TSecr=1029918868 [TCP segment of a reassembled PDU]",2
198,3.18916,104.244.42.65,100.86.100.45,TCP,1414,443  >  61715 [ACK] Seq=129011 Ack=9974 Win=103168 Len=1348 TSval=3617607922 TSecr=1029918868 [TCP segment of a reassembled PDU],2
199,3.189161,104.244.42.65,100.86.100.45,TCP,1414,"443  >  61715 [PSH, ACK] Seq=130359 Ack=9974 Win=103168 Len=1348 TSval=3617607922 TSecr=1029918868 [TCP segment of a reassembled PDU]",2
200,3.189163,104.244.42.65,100.86.100.45,TCP,1414,443  >  61715 [ACK] Seq=131707 Ack=9974 Win=103168 Len=1348 TSval=3617607922 TSecr=1029918868 [TCP segment of a reassembled PDU],2
201,3.189165,104.244.42.65,100.86.100.45,TCP,1414,"443  >  61715 [PSH, ACK] Seq=133055 Ack=9974 Win=103168 Len=1348 TSval=3617607922 TSecr=1029918868 [TCP segment of a reassembled PDU]",2
202,3.189167,104.244.42.65,100.86.100.45,TLSv1.3,1414,Application Data,2
203,3.189168,104.244.42.65,100.86.100.45,TCP,1414,"443  >  61715 [PSH, ACK] Seq=135751 Ack=9974 Win=103168 Len=1348 TSval=3617607922 TSecr=1029918868 [TCP segment of a reassembled PDU]",2
204,3.189169,104.244.42.65,100.86.100.45,TCP,1414,443  >  61715 [ACK] Seq=137099 Ack=9974 Win=103168 Len=1348 TSval=3617607922 TSecr=1029918868 [TCP segment of a reassembled PDU],2
205,3.189171,104.244.42.65,100.86.100.45,TCP,1414,"443  >  61715 [PSH, ACK] Seq=138447 Ack=9974 Win=103168 Len=1348 TSval=3617607922 TSecr=1029918868 [TCP segment of a reassembled PDU]",2
206,3.189172,104.244.42.65,100.86.100.45,TCP,1414,443  >  61715 [ACK] Seq=139795 Ack=9974 Win=103168 Len=1348 TSval=3617607922 TSecr=1029918868 [TCP segment of a reassembled PDU],2
207,3.189174,104.244.42.65,100.86.100.45,TCP,1414,"443  >  61715 [PSH, ACK] Seq=141143 Ack=9974 Win=103168 Len=1348 TSval=3617607922 TSecr=1029918868 [TCP segment of a reassembled PDU]",2
208,3.189175,104.244.42.65,100.86.100.45,TCP,1414,443  >  61715 [ACK] Seq=142491 Ack=9974 Win=103168 Len=1348 TSval=3617607922 TSecr=1029918868 [TCP segment of a reassembled PDU],2
209,3.189176,104.244.42.65,100.86.100.45,TCP,1414,"443  >  61715 [PSH, ACK] Seq=143839 Ack=9974 Win=103168 Len=1348 TSval=3617607922 TSecr=1029918868 [TCP segment of a reassembled PDU]",2
210,3.189177,104.244.42.65,100.86.100.45,TCP,1414,443  >  61715 [ACK] Seq=145187 Ack=9974 Win=103168 Len=1348 TSval=3617607922 TSecr=1029918868 [TCP segment of a reassembled PDU],2
211,3.189178,104.244.42.65,100.86.100.45,TCP,1414,"443  >  61715 [PSH, ACK] Seq=146535 Ack=9974 Win=103168 Len=1348 TSval=3617607922 TSecr=1029918868 [TCP segment of a reassembled PDU]",2
212,3.18918,104.244.42.65,100.86.100.45,TCP,1414,443  >  61715 [ACK] Seq=147883 Ack=9974 Win=103168 Len=1348 TSval=3617607922 TSecr=1029918868 [TCP segment of a reassembled PDU],2
213,3.189182,104.244.42.65,100.86.100.45,TCP,1414,"443  >  61715 [PSH, ACK] Seq=149231 Ack=9974 Win=103168 Len=1348 TSval=3617607922 TSecr=1029918868 [TCP segment of a reassembled PDU]",2
214,3.189183,104.244.42.65,100.86.100.45,TLSv1.3,1414,Application Data,2
215,3.189185,104.244.42.65,100.86.100.45,TCP,1414,"443  >  61715 [PSH, ACK] Seq=151927 Ack=9974 Win=103168 Len=1348 TSval=3617607922 TSecr=1029918868 [TCP segment of a reassembled PDU]",2
216,3.189187,104.244.42.65,100.86.100.45,TCP,1414,443  >  61715 [ACK] Seq=153275 Ack=9974 Win=103168 Len=1348 TSval=3617607922 TSecr=1029918868 [TCP segment of a reassembled PDU],2
217,3.189189,104.244.42.65,100.86.100.45,TLSv1.3,436,Application Data,2
218,3.189299,100.86.100.45,104.244.42.65,TCP,66,61715  >  443 [ACK] Seq=9974 Ack=141143 Win=114880 Len=0 TSval=1029919899 TSecr=3617607922,2
219,3.189341,100.86.100.45,104.244.42.65,TCP,66,61715  >  443 [ACK] Seq=9974 Ack=154623 Win=101376 Len=0 TSval=1029919899 TSecr=3617607922,2
220,3.18941,100.86.100.45,104.244.42.65,TCP,66,61715  >  443 [ACK] Seq=9974 Ack=154993 Win=118400 Len=0 TSval=1029919899 TSecr=3617607922,2
221,3.189888,100.86.100.45,104.244.42.65,TCP,66,[TCP Window Update] 61715  >  443 [ACK] Seq=9974 Ack=154993 Win=131072 Len=0 TSval=1029919899 TSecr=3617607922,2
222,3.745323,100.86.100.45,104.244.42.65,TLSv1.3,197,Application Data,2
223,3.863593,104.244.42.65,100.86.100.45,TCP,1414,443  >  61715 [ACK] Seq=154993 Ack=10105 Win=105984 Len=1348 TSval=3617608598 TSecr=1029920454 [TCP segment of a reassembled PDU],2
224,3.863594,104.244.42.65,100.86.100.45,TCP,1414,"443  >  61715 [PSH, ACK] Seq=156341 Ack=10105 Win=105984 Len=1348 TSval=3617608598 TSecr=1029920454 [TCP segment of a reassembled PDU]",2
225,3.863595,104.244.42.65,100.86.100.45,TCP,1414,443  >  61715 [ACK] Seq=157689 Ack=10105 Win=105984 Len=1348 TSval=3617608598 TSecr=1029920454 [TCP segment of a reassembled PDU],2
226,3.863709,100.86.100.45,104.244.42.65,TCP,66,61715  >  443 [ACK] Seq=10105 Ack=159037 Win=126976 Len=0 TSval=1029920573 TSecr=3617608598,2
227,3.86379,104.244.42.65,100.86.100.45,TCP,1414,"443  >  61715 [PSH, ACK] Seq=159037 Ack=10105 Win=105984 Len=1348 TSval=3617608598 TSecr=1029920454 [TCP segment of a reassembled PDU]",2
228,3.863791,104.244.42.65,100.86.100.45,TCP,1414,443  >  61715 [ACK] Seq=160385 Ack=10105 Win=105984 Len=1348 TSval=3617608598 TSecr=1029920454 [TCP segment of a reassembled PDU],2
229,3.863799,100.86.100.45,104.244.42.65,TCP,66,[TCP Window Update] 61715  >  443 [ACK] Seq=10105 Ack=159037 Win=131072 Len=0 TSval=1029920573 TSecr=3617608598,2
230,3.863826,100.86.100.45,104.244.42.65,TCP,66,61715  >  443 [ACK] Seq=10105 Ack=161733 Win=128320 Len=0 TSval=1029920573 TSecr=3617608598,2
231,3.863839,100.86.100.45,104.244.42.65,TCP,66,[TCP Window Update] 61715  >  443 [ACK] Seq=10105 Ack=161733 Win=131072 Len=0 TSval=1029920573 TSecr=3617608598,2
232,3.864344,104.244.42.65,100.86.100.45,TLSv1.3,1018,Application Data,2
233,3.864368,100.86.100.45,104.244.42.65,TCP,66,61715  >  443 [ACK] Seq=10105 Ack=162685 Win=130112 Len=0 TSval=1029920573 TSecr=3617608598,2
234,4.14453,100.86.100.45,104.244.42.65,TLSv1.3,159,Application Data,2
235,4.278027,104.244.42.65,100.86.100.45,TCP,66,443  >  61715 [ACK] Seq=162685 Ack=10198 Win=105984 Len=0 TSval=3617609013 TSecr=1029920853,2
236,4.408872,104.244.42.65,100.86.100.45,TCP,1414,443  >  61715 [ACK] Seq=162685 Ack=10198 Win=105984 Len=1348 TSval=3617609142 TSecr=1029920853 [TCP segment of a reassembled PDU],2
237,4.408873,104.244.42.65,100.86.100.45,TCP,1414,"443  >  61715 [PSH, ACK] Seq=164033 Ack=10198 Win=105984 Len=1348 TSval=3617609142 TSecr=1029920853 [TCP segment of a reassembled PDU]",2
238,4.408874,104.244.42.65,100.86.100.45,TLSv1.3,1104,Application Data,2
239,4.408874,104.244.42.65,100.86.100.45,TLSv1.3,237,Application Data,2
240,4.408875,104.244.42.65,100.86.100.45,TLSv1.3,140,Application Data,2
241,4.408875,104.244.42.65,100.86.100.45,TLSv1.3,254,Application Data,2
242,4.408875,104.244.42.65,100.86.100.45,TLSv1.3,155,Application Data,2
243,4.408876,104.244.42.65,100.86.100.45,TLSv1.3,445,Application Data,2
244,4.408876,104.244.42.65,100.86.100.45,TLSv1.3,154,Application Data,2
245,4.408876,104.244.42.65,100.86.100.45,TLSv1.3,232,Application Data,2
246,4.408877,104.244.42.65,100.86.100.45,TLSv1.3,106,Application Data,2
247,4.408877,104.244.42.65,100.86.100.45,TLSv1.3,194,Application Data,2
248,4.408877,104.244.42.65,100.86.100.45,TLSv1.3,164,Application Data,2
249,4.408878,104.244.42.65,100.86.100.45,TLSv1.3,322,Application Data,2
250,4.408878,104.244.42.65,100.86.100.45,TLSv1.3,391,Application Data,2
251,4.408878,104.244.42.65,100.86.100.45,TLSv1.3,355,Application Data,2
252,4.408879,104.244.42.65,100.86.100.45,TCP,1414,443  >  61715 [ACK] Seq=168710 Ack=10198 Win=105984 Len=1348 TSval=3617609143 TSecr=1029920853 [TCP segment of a reassembled PDU],2
253,4.408879,104.244.42.65,100.86.100.45,TLSv1.3,1083,Application Data,2
254,4.40888,104.244.42.65,100.86.100.45,TLSv1.3,1330,Application Data,2
255,4.40888,104.244.42.65,100.86.100.45,TLSv1.3,142,Application Data,2
256,4.408881,104.244.42.65,100.86.100.45,TLSv1.3,394,Application Data,2
257,4.408881,104.244.42.65,100.86.100.45,TLSv1.3,433,Application Data,2
258,4.409019,100.86.100.45,104.244.42.65,TCP,66,61715  >  443 [ACK] Seq=10198 Ack=173110 Win=120640 Len=0 TSval=1029921119 TSecr=3617609143,2
259,4.409082,100.86.100.45,104.244.42.65,TCP,66,[TCP Window Update] 61715  >  443 [ACK] Seq=10198 Ack=173110 Win=131072 Len=0 TSval=1029921119 TSecr=3617609143,2
260,4.410908,104.244.42.65,100.86.100.45,TLSv1.3,376,Application Data,2
261,4.410909,104.244.42.65,100.86.100.45,TLSv1.3,777,Application Data,2
262,4.41091,104.244.42.65,100.86.100.45,TCP,1414,443  >  61715 [ACK] Seq=174131 Ack=10198 Win=105984 Len=1348 TSval=3617609143 TSecr=1029920853 [TCP segment of a reassembled PDU],2
263,4.410911,104.244.42.65,100.86.100.45,TLSv1.3,301,Application Data,2
264,4.410911,104.244.42.65,100.86.100.45,TLSv1.3,1261,Application Data,2
265,4.410912,104.244.42.65,100.86.100.45,TCP,1414,443  >  61715 [ACK] Seq=176909 Ack=10198 Win=105984 Len=1348 TSval=3617609144 TSecr=1029920853 [TCP segment of a reassembled PDU],2
266,4.410914,104.244.42.65,100.86.100.45,TCP,1414,"443  >  61715 [PSH, ACK] Seq=178257 Ack=10198 Win=105984 Len=1348 TSval=3617609144 TSecr=1029920853 [TCP segment of a reassembled PDU]",2
267,4.410914,104.244.42.65,100.86.100.45,TLSv1.3,1169,Application Data,2
268,4.410915,104.244.42.65,100.86.100.45,TCP,1414,443  >  61715 [ACK] Seq=180708 Ack=10198 Win=105984 Len=1348 TSval=3617609144 TSecr=1029920853 [TCP segment of a reassembled PDU],2
269,4.411059,100.86.100.45,104.244.42.65,TCP,66,61715  >  443 [ACK] Seq=10198 Ack=182056 Win=122112 Len=0 TSval=1029921121 TSecr=3617609144,2
270,4.411097,100.86.100.45,104.244.42.65,TCP,66,[TCP Window Update] 61715  >  443 [ACK] Seq=10198 Ack=182056 Win=131072 Len=0 TSval=1029921121 TSecr=3617609144,2
271,4.503134,104.244.42.65,100.86.100.45,TCP,1414,443  >  61715 [ACK] Seq=182056 Ack=10198 Win=105984 Len=1348 TSval=3617609238 TSecr=1029921119 [TCP segment of a reassembled PDU],2
272,4.503135,104.244.42.65,100.86.100.45,TLSv1.3,1414,Application Data,2
273,4.503136,104.244.42.65,100.86.100.45,TCP,1414,443  >  61715 [ACK] Seq=184752 Ack=10198 Win=105984 Len=1348 TSval=3617609238 TSecr=1029921119 [TCP segment of a reassembled PDU],2
274,4.503229,100.86.100.45,104.244.42.65,TCP,66,61715  >  443 [ACK] Seq=10198 Ack=186100 Win=126976 Len=0 TSval=1029921213 TSecr=3617609238,2
275,4.503341,100.86.100.45,104.244.42.65,TCP,66,[TCP Window Update] 61715  >  443 [ACK] Seq=10198 Ack=186100 Win=131072 Len=0 TSval=1029921213 TSecr=3617609238,2
276,4.503451,104.244.42.65,100.86.100.45,TLSv1.3,1414,"[TCP Previous segment not captured] , Continuation Data",2
277,4.503451,104.244.42.65,100.86.100.45,TLSv1.3,1414,Continuation Data,2
278,4.503479,100.86.100.45,104.244.42.65,TCP,78,[TCP Dup ACK 274#1] 61715  >  443 [ACK] Seq=10198 Ack=186100 Win=131072 Len=0 TSval=1029921213 TSecr=3617609238 SLE=187448 SRE=190144,2
279,4.504767,104.244.42.65,100.86.100.45,TLSv1.3,1414,Continuation Data,2
280,4.504768,104.244.42.65,100.86.100.45,TLSv1.3,1414,Continuation Data,2
281,4.504769,104.244.42.65,100.86.100.45,TLSv1.3,1414,Continuation Data,2
282,4.504769,104.244.42.65,100.86.100.45,TLSv1.3,1414,Continuation Data,2
283,4.50477,104.244.42.65,100.86.100.45,TLSv1.3,1414,Continuation Data,2
284,4.50477,104.244.42.65,100.86.100.45,TLSv1.3,1414,Continuation Data,2
285,4.504771,104.244.42.65,100.86.100.45,TLSv1.3,1414,Continuation Data,2
286,4.504772,104.244.42.65,100.86.100.45,TLSv1.3,1414,Continuation Data,2
287,4.504772,104.244.42.65,100.86.100.45,TLSv1.3,1414,Continuation Data,2
288,4.504773,104.244.42.65,100.86.100.45,TLSv1.3,1414,Continuation Data,2
289,4.504774,104.244.42.65,100.86.100.45,TLSv1.3,1414,Continuation Data,2
290,4.504775,104.244.42.65,100.86.100.45,TLSv1.3,1414,Continuation Data,2
291,4.504775,104.244.42.65,100.86.100.45,TLSv1.3,1414,Continuation Data,2
292,4.504776,104.244.42.65,100.86.100.45,TCP,1414,"443  >  61715 [PSH, ACK] Seq=207668 Ack=10198 Win=105984 Len=1348 TSval=3617609238 TSecr=1029921119",2
293,4.504777,104.244.42.65,100.86.100.45,TLSv1.3,1414,Continuation Data,2
294,4.504777,104.244.42.65,100.86.100.45,TLSv1.3,1414,Continuation Data,2
295,4.504778,104.244.42.65,100.86.100.45,TLSv1.3,1414,Continuation Data,2
296,4.504778,104.244.42.65,100.86.100.45,TLSv1.3,1414,Continuation Data,2
297,4.50486,100.86.100.45,104.244.42.65,TCP,78,[TCP Dup ACK 274#2] 61715  >  443 [ACK] Seq=10198 Ack=186100 Win=131072 Len=0 TSval=1029921215 TSecr=3617609238 SLE=187448 SRE=206320,2
298,4.504913,100.86.100.45,104.244.42.65,TCP,78,[TCP Dup ACK 274#3] 61715  >  443 [ACK] Seq=10198 Ack=186100 Win=131072 Len=0 TSval=1029921215 TSecr=3617609238 SLE=187448 SRE=214408,2
299,4.504929,104.244.42.65,100.86.100.45,TLSv1.3,649,Continuation Data,2
300,4.504952,100.86.100.45,104.244.42.65,TCP,78,[TCP Dup ACK 274#4] 61715  >  443 [ACK] Seq=10198 Ack=186100 Win=131072 Len=0 TSval=1029921215 TSecr=3617609238 SLE=187448 SRE=214991,2
301,4.598923,104.244.42.65,100.86.100.45,TCP,1414,[TCP Retransmission] 443  >  61715 [ACK] Seq=186100 Ack=10198 Win=105984 Len=1348 TSval=3617609333 TSecr=1029921215,2
