No.,Time,Source,Destination,Protocol,Length,Info,label
1,0.0,100.86.111.80,23.61.11.185,TCP,66,51454  >  443 [SYN] Seq=0 Win=64240 Len=0 MSS=1460 WS=256 SACK_PERM,1
2,0.011853,23.61.11.185,100.86.111.80,TCP,66,"443  >  51454 [SYN, ACK] Seq=0 Ack=1 Win=64240 Len=0 MSS=1460 SACK_PERM WS=128",1
3,0.012135,100.86.111.80,23.61.11.185,TCP,54,51454  >  443 [ACK] Seq=1 Ack=1 Win=65536 Len=0,1
4,0.014228,100.86.111.80,23.61.11.185,TCP,1514,51454  >  443 [ACK] Seq=1 Ack=1 Win=65536 Len=1460 [TCP segment of a reassembled PDU],1
5,0.014228,100.86.111.80,23.61.11.185,TLSv1.3,358,Client Hello (SNI=rubicon.wellsfargo.com),1
6,0.024797,23.61.11.185,100.86.111.80,TCP,56,443  >  51454 [ACK] Seq=1 Ack=1765 Win=63360 Len=0,1
7,0.029132,23.61.11.185,100.86.111.80,TLSv1.3,1514,"Server Hello, Change Cipher Spec, Application Data",1
8,0.029132,23.61.11.185,100.86.111.80,TCP,1514,"443  >  51454 [PSH, ACK] Seq=1461 Ack=1765 Win=64128 Len=1460 [TCP segment of a reassembled PDU]",1
9,0.029416,100.86.111.80,23.61.11.185,TCP,54,51454  >  443 [ACK] Seq=1765 Ack=2921 Win=65536 Len=0,1
10,0.029526,23.61.11.185,100.86.111.80,TLSv1.3,1230,"Application Data, Application Data",1
11,0.029526,23.61.11.185,100.86.111.80,TLSv1.3,92,Application Data,1
12,0.029727,100.86.111.80,23.61.11.185,TCP,54,51454  >  443 [ACK] Seq=1765 Ack=4135 Win=64256 Len=0,1
13,0.03724,100.86.111.80,23.61.11.185,TLSv1.3,134,"Change Cipher Spec, Application Data",1
14,0.039279,100.86.111.80,23.61.11.185,TCP,1514,51454  >  443 [ACK] Seq=1845 Ack=4135 Win=64256 Len=1460 [TCP segment of a reassembled PDU],1
15,0.039279,100.86.111.80,23.61.11.185,TLSv1.3,1221,Application Data,1
16,0.05115,23.61.11.185,100.86.111.80,TLSv1.3,357,Application Data,1
17,0.05115,23.61.11.185,100.86.111.80,TLSv1.3,357,Application Data,1
18,0.051414,100.86.111.80,23.61.11.185,TCP,54,51454  >  443 [ACK] Seq=4472 Ack=4741 Win=65536 Len=0,1
19,0.051533,23.61.11.185,100.86.111.80,TCP,56,443  >  51454 [ACK] Seq=4741 Ack=4472 Win=63360 Len=0,1
20,0.122297,23.61.11.185,100.86.111.80,TCP,1514,443  >  51454 [ACK] Seq=4741 Ack=4472 Win=64128 Len=1460 [TCP segment of a reassembled PDU],1
21,0.122297,23.61.11.185,100.86.111.80,TLSv1.3,816,Application Data,1
22,0.122587,100.86.111.80,23.61.11.185,TCP,54,51454  >  443 [ACK] Seq=4472 Ack=6963 Win=65536 Len=0,1
23,0.832392,100.86.111.80,23.61.11.185,TCP,1514,51454  >  443 [ACK] Seq=4472 Ack=6963 Win=65536 Len=1460 [TCP segment of a reassembled PDU],1
24,0.832392,100.86.111.80,23.61.11.185,TCP,1514,51454  >  443 [ACK] Seq=5932 Ack=6963 Win=65536 Len=1460 [TCP segment of a reassembled PDU],1
25,0.832392,100.86.111.80,23.61.11.185,TLSv1.3,1514,Application Data,1
26,0.832392,100.86.111.80,23.61.11.185,TCP,1514,51454  >  443 [ACK] Seq=8852 Ack=6963 Win=65536 Len=1460 [TCP segment of a reassembled PDU],1
27,0.832392,100.86.111.80,23.61.11.185,TCP,1514,51454  >  443 [ACK] Seq=10312 Ack=6963 Win=65536 Len=1460 [TCP segment of a reassembled PDU],1
28,0.832392,100.86.111.80,23.61.11.185,TCP,1514,51454  >  443 [ACK] Seq=11772 Ack=6963 Win=65536 Len=1460 [TCP segment of a reassembled PDU],1
29,0.832392,100.86.111.80,23.61.11.185,TCP,1514,51454  >  443 [ACK] Seq=13232 Ack=6963 Win=65536 Len=1460 [TCP segment of a reassembled PDU],1
30,0.832392,100.86.111.80,23.61.11.185,TCP,1514,51454  >  443 [ACK] Seq=14692 Ack=6963 Win=65536 Len=1460 [TCP segment of a reassembled PDU],1
31,0.832392,100.86.111.80,23.61.11.185,TCP,1514,51454  >  443 [ACK] Seq=16152 Ack=6963 Win=65536 Len=1460 [TCP segment of a reassembled PDU],1
32,0.832392,100.86.111.80,23.61.11.185,TLSv1.3,163,Application Data,1
33,0.845367,23.61.11.185,100.86.111.80,TCP,56,443  >  51454 [ACK] Seq=6963 Ack=7392 Win=64128 Len=0,1
34,0.873833,100.86.111.80,23.61.11.185,TCP,1514,"[TCP Retransmission] 51454  >  443 [PSH, ACK] Seq=16261 Ack=6963 Win=65536 Len=1460 [TCP segment of a reassembled PDU]",1
35,0.883879,23.61.11.185,100.86.111.80,TCP,56,443  >  51454 [ACK] Seq=6963 Ack=17721 Win=57216 Len=0,1
36,0.90375,23.61.11.185,100.86.111.80,TCP,66,[TCP Window Update] 443  >  51454 [ACK] Seq=6963 Ack=17721 Win=64128 Len=0 SLE=16261 SRE=17721,1
37,0.950345,23.61.11.185,100.86.111.80,TCP,1514,443  >  51454 [ACK] Seq=6963 Ack=17721 Win=64128 Len=1460 [TCP segment of a reassembled PDU],1
38,0.951889,23.61.11.185,100.86.111.80,TLSv1.3,487,Application Data,1
39,0.952127,100.86.111.80,23.61.11.185,TCP,54,51454  >  443 [ACK] Seq=17721 Ack=8856 Win=65536 Len=0,1
40,10.459852,100.86.111.80,23.61.11.185,TCP,1514,51454  >  443 [ACK] Seq=17721 Ack=8856 Win=65536 Len=1460 [TCP segment of a reassembled PDU],1
41,10.459852,100.86.111.80,23.61.11.185,TCP,1514,51454  >  443 [ACK] Seq=19181 Ack=8856 Win=65536 Len=1460 [TCP segment of a reassembled PDU],1
42,10.459852,100.86.111.80,23.61.11.185,TLSv1.3,1096,Application Data,1
43,10.46001,100.86.111.80,23.61.11.185,TCP,1514,51454  >  443 [ACK] Seq=21683 Ack=8856 Win=65536 Len=1460 [TCP segment of a reassembled PDU],1
44,10.46001,100.86.111.80,23.61.11.185,TCP,1514,51454  >  443 [ACK] Seq=23143 Ack=8856 Win=65536 Len=1460 [TCP segment of a reassembled PDU],1
45,10.46001,100.86.111.80,23.61.11.185,TCP,1514,51454  >  443 [ACK] Seq=24603 Ack=8856 Win=65536 Len=1460 [TCP segment of a reassembled PDU],1
46,10.46001,100.86.111.80,23.61.11.185,TCP,1514,51454  >  443 [ACK] Seq=26063 Ack=8856 Win=65536 Len=1460 [TCP segment of a reassembled PDU],1
47,10.46001,100.86.111.80,23.61.11.185,TCP,1514,51454  >  443 [ACK] Seq=27523 Ack=8856 Win=65536 Len=1460 [TCP segment of a reassembled PDU],1
48,10.46001,100.86.111.80,23.61.11.185,TCP,1514,51454  >  443 [ACK] Seq=28983 Ack=8856 Win=65536 Len=1460 [TCP segment of a reassembled PDU],1
49,10.46001,100.86.111.80,23.61.11.185,TCP,1514,51454  >  443 [ACK] Seq=30443 Ack=8856 Win=65536 Len=1460 [TCP segment of a reassembled PDU],1
50,10.46001,100.86.111.80,23.61.11.185,TCP,1514,51454  >  443 [ACK] Seq=31903 Ack=8856 Win=65536 Len=1460 [TCP segment of a reassembled PDU],1
51,10.46001,100.86.111.80,23.61.11.185,TCP,1514,51454  >  443 [ACK] Seq=33363 Ack=8856 Win=65536 Len=1460 [TCP segment of a reassembled PDU],1
52,10.46001,100.86.111.80,23.61.11.185,TCP,1514,51454  >  443 [ACK] Seq=34823 Ack=8856 Win=65536 Len=1460 [TCP segment of a reassembled PDU],1
53,10.46001,100.86.111.80,23.61.11.185,TCP,1514,51454  >  443 [ACK] Seq=36283 Ack=8856 Win=65536 Len=1460 [TCP segment of a reassembled PDU],1
54,10.46001,100.86.111.80,23.61.11.185,TLSv1.3,1514,Application Data,1
55,10.46001,100.86.111.80,23.61.11.185,TCP,1514,51454  >  443 [ACK] Seq=39203 Ack=8856 Win=65536 Len=1460 [TCP segment of a reassembled PDU],1
56,10.46001,100.86.111.80,23.61.11.185,TCP,1514,51454  >  443 [ACK] Seq=40663 Ack=8856 Win=65536 Len=1460 [TCP segment of a reassembled PDU],1
57,10.46001,100.86.111.80,23.61.11.185,TCP,1514,51454  >  443 [ACK] Seq=42123 Ack=8856 Win=65536 Len=1460 [TCP segment of a reassembled PDU],1
58,10.46001,100.86.111.80,23.61.11.185,TCP,1514,51454  >  443 [ACK] Seq=43583 Ack=8856 Win=65536 Len=1460 [TCP segment of a reassembled PDU],1
59,10.46001,100.86.111.80,23.61.11.185,TCP,1514,51454  >  443 [ACK] Seq=45043 Ack=8856 Win=65536 Len=1460 [TCP segment of a reassembled PDU],1
60,10.46001,100.86.111.80,23.61.11.185,TCP,1514,51454  >  443 [ACK] Seq=46503 Ack=8856 Win=65536 Len=1460 [TCP segment of a reassembled PDU],1
61,10.46001,100.86.111.80,23.61.11.185,TCP,1514,51454  >  443 [ACK] Seq=47963 Ack=8856 Win=65536 Len=1460 [TCP segment of a reassembled PDU],1
62,10.48577,100.86.111.80,23.61.11.185,TCP,1514,51454  >  443 [ACK] Seq=49423 Ack=8856 Win=65536 Len=1460 [TCP segment of a reassembled PDU],1
63,10.524337,23.61.11.185,100.86.111.80,TCP,56,443  >  51454 [ACK] Seq=8856 Ack=19181 Win=64128 Len=0,1
64,10.524437,100.86.111.80,23.61.11.185,TCP,1514,51454  >  443 [ACK] Seq=50883 Ack=8856 Win=65536 Len=1460 [TCP segment of a reassembled PDU],1
65,10.529099,23.61.11.185,100.86.111.80,TCP,56,443  >  51454 [ACK] Seq=8856 Ack=23143 Win=64128 Len=0,1
66,10.529099,23.61.11.185,100.86.111.80,TCP,56,443  >  51454 [ACK] Seq=8856 Ack=27523 Win=61312 Len=0,1
67,10.529346,100.86.111.80,23.61.11.185,TCP,1514,51454  >  443 [ACK] Seq=52343 Ack=8856 Win=65536 Len=1460 [TCP segment of a reassembled PDU],1
68,10.529346,100.86.111.80,23.61.11.185,TLSv1.3,1514,Application Data,1
69,10.529346,100.86.111.80,23.61.11.185,TCP,1514,51454  >  443 [ACK] Seq=55263 Ack=8856 Win=65536 Len=1460 [TCP segment of a reassembled PDU],1
70,10.529346,100.86.111.80,23.61.11.185,TLSv1.3,871,Application Data,1
71,10.529592,23.61.11.185,100.86.111.80,TCP,56,443  >  51454 [ACK] Seq=8856 Ack=36283 Win=55168 Len=0,1
72,10.529592,23.61.11.185,100.86.111.80,TCP,56,443  >  51454 [ACK] Seq=8856 Ack=40663 Win=52096 Len=0,1
73,10.529592,23.61.11.185,100.86.111.80,TCP,56,443  >  51454 [ACK] Seq=8856 Ack=43583 Win=50048 Len=0,1
74,10.529592,23.61.11.185,100.86.111.80,TCP,56,443  >  51454 [ACK] Seq=8856 Ack=50883 Win=44800 Len=0,1
75,10.541597,23.61.11.185,100.86.111.80,TCP,56,443  >  51454 [ACK] Seq=8856 Ack=53803 Win=63360 Len=0,1
76,10.542311,23.61.11.185,100.86.111.80,TCP,56,443  >  51454 [ACK] Seq=8856 Ack=57540 Win=60288 Len=0,1
77,10.651629,100.86.111.80,23.61.11.185,TCP,66,51475  >  443 [SYN] Seq=0 Win=64240 Len=0 MSS=1460 WS=256 SACK_PERM,1
78,10.730734,23.61.11.185,100.86.111.80,TCP,66,"443  >  51475 [SYN, ACK] Seq=0 Ack=1 Win=64240 Len=0 MSS=1460 SACK_PERM WS=128",1
79,10.731687,100.86.111.80,23.61.11.185,TCP,54,51475  >  443 [ACK] Seq=1 Ack=1 Win=65536 Len=0,1
80,10.734286,100.86.111.80,23.61.11.185,TCP,1514,51475  >  443 [ACK] Seq=1 Ack=1 Win=65536 Len=1460 [TCP segment of a reassembled PDU],1
81,10.734286,100.86.111.80,23.61.11.185,TLSv1.3,645,Client Hello (SNI=rubicon.wellsfargo.com),1
82,10.794873,23.61.11.185,100.86.111.80,TCP,56,443  >  51475 [ACK] Seq=1 Ack=2052 Win=63616 Len=0,1
83,10.794873,23.61.11.185,100.86.111.80,TLSv1.3,324,"Server Hello, Change Cipher Spec, Application Data, Application Data",1
84,10.79866,100.86.111.80,23.61.11.185,TLSv1.3,134,"Change Cipher Spec, Application Data",1
85,10.802566,100.86.111.80,23.61.11.185,TCP,1514,51475  >  443 [ACK] Seq=2132 Ack=271 Win=65280 Len=1460 [TCP segment of a reassembled PDU],1
86,10.802566,100.86.111.80,23.61.11.185,TCP,1514,51475  >  443 [ACK] Seq=3592 Ack=271 Win=65280 Len=1460 [TCP segment of a reassembled PDU],1
87,10.802566,100.86.111.80,23.61.11.185,TLSv1.3,1183,Application Data,1
88,10.803156,100.86.111.80,23.61.11.185,TCP,1514,51475  >  443 [ACK] Seq=6181 Ack=271 Win=65280 Len=1460 [TCP segment of a reassembled PDU],1
89,10.803156,100.86.111.80,23.61.11.185,TCP,1514,51475  >  443 [ACK] Seq=7641 Ack=271 Win=65280 Len=1460 [TCP segment of a reassembled PDU],1
90,10.803156,100.86.111.80,23.61.11.185,TCP,1514,51475  >  443 [ACK] Seq=9101 Ack=271 Win=65280 Len=1460 [TCP segment of a reassembled PDU],1
91,10.803156,100.86.111.80,23.61.11.185,TCP,1514,51475  >  443 [ACK] Seq=10561 Ack=271 Win=65280 Len=1460 [TCP segment of a reassembled PDU],1
92,10.803156,100.86.111.80,23.61.11.185,TCP,1514,51475  >  443 [ACK] Seq=12021 Ack=271 Win=65280 Len=1460 [TCP segment of a reassembled PDU],1
93,10.803156,100.86.111.80,23.61.11.185,TCP,1514,51475  >  443 [ACK] Seq=13481 Ack=271 Win=65280 Len=1460 [TCP segment of a reassembled PDU],1
94,10.803156,100.86.111.80,23.61.11.185,TCP,1514,51475  >  443 [ACK] Seq=14941 Ack=271 Win=65280 Len=1460 [TCP segment of a reassembled PDU],1
95,10.803156,100.86.111.80,23.61.11.185,TCP,1514,51475  >  443 [ACK] Seq=16401 Ack=271 Win=65280 Len=1460 [TCP segment of a reassembled PDU],1
96,10.852394,23.61.11.185,100.86.111.80,TCP,56,443  >  51475 [ACK] Seq=271 Ack=9101 Win=59264 Len=0,1
97,10.852394,23.61.11.185,100.86.111.80,TLSv1.3,357,Application Data,1
98,10.852719,100.86.111.80,23.61.11.185,TCP,1514,51475  >  443 [ACK] Seq=17861 Ack=574 Win=65024 Len=1460 [TCP segment of a reassembled PDU],1
99,10.852719,100.86.111.80,23.61.11.185,TCP,1514,51475  >  443 [ACK] Seq=19321 Ack=574 Win=65024 Len=1460 [TCP segment of a reassembled PDU],1
100,10.852719,100.86.111.80,23.61.11.185,TCP,1514,51475  >  443 [ACK] Seq=20781 Ack=574 Win=65024 Len=1460 [TCP segment of a reassembled PDU],1
101,10.852719,100.86.111.80,23.61.11.185,TLSv1.3,1514,Application Data,1
102,10.852719,100.86.111.80,23.61.11.185,TCP,1514,51475  >  443 [ACK] Seq=23701 Ack=574 Win=65024 Len=1460 [TCP segment of a reassembled PDU],1
103,10.852719,100.86.111.80,23.61.11.185,TCP,1514,51475  >  443 [ACK] Seq=25161 Ack=574 Win=65024 Len=1460 [TCP segment of a reassembled PDU],1
104,10.852719,100.86.111.80,23.61.11.185,TCP,1514,51475  >  443 [ACK] Seq=26621 Ack=574 Win=65024 Len=1460 [TCP segment of a reassembled PDU],1
105,10.852719,100.86.111.80,23.61.11.185,TCP,1514,51475  >  443 [ACK] Seq=28081 Ack=574 Win=65024 Len=1460 [TCP segment of a reassembled PDU],1
106,10.852719,100.86.111.80,23.61.11.185,TCP,1514,51475  >  443 [ACK] Seq=29541 Ack=574 Win=65024 Len=1460 [TCP segment of a reassembled PDU],1
107,10.852719,100.86.111.80,23.61.11.185,TCP,1514,51475  >  443 [ACK] Seq=31001 Ack=574 Win=65024 Len=1460 [TCP segment of a reassembled PDU],1
108,10.852719,100.86.111.80,23.61.11.185,TCP,1514,51475  >  443 [ACK] Seq=32461 Ack=574 Win=65024 Len=1460 [TCP segment of a reassembled PDU],1
109,10.852719,100.86.111.80,23.61.11.185,TCP,1514,51475  >  443 [ACK] Seq=33921 Ack=574 Win=65024 Len=1460 [TCP segment of a reassembled PDU],1
110,10.873286,23.61.11.185,100.86.111.80,TCP,56,443  >  51475 [ACK] Seq=574 Ack=13481 Win=56192 Len=0,1
111,10.873507,100.86.111.80,23.61.11.185,TCP,1514,51475  >  443 [ACK] Seq=35381 Ack=574 Win=65024 Len=1460 [TCP segment of a reassembled PDU],1
112,10.873507,100.86.111.80,23.61.11.185,TCP,1514,51475  >  443 [ACK] Seq=36841 Ack=574 Win=65024 Len=1460 [TCP segment of a reassembled PDU],1
113,10.873507,100.86.111.80,23.61.11.185,TLSv1.3,1514,Application Data,1
114,10.873507,100.86.111.80,23.61.11.185,TCP,1514,51475  >  443 [ACK] Seq=39761 Ack=574 Win=65024 Len=1460 [TCP segment of a reassembled PDU],1
115,10.873774,23.61.11.185,100.86.111.80,TCP,56,443  >  51475 [ACK] Seq=574 Ack=17861 Win=53120 Len=0,1
116,10.873774,23.61.11.185,100.86.111.80,TLSv1.3,938,Application Data,1
117,10.874081,100.86.111.80,23.61.11.185,TCP,1514,51475  >  443 [ACK] Seq=41221 Ack=574 Win=65024 Len=1460 [TCP segment of a reassembled PDU],1
118,10.874081,100.86.111.80,23.61.11.185,TCP,1514,51475  >  443 [ACK] Seq=42681 Ack=574 Win=65024 Len=1460 [TCP segment of a reassembled PDU],1
119,10.874081,100.86.111.80,23.61.11.185,TCP,1514,51475  >  443 [ACK] Seq=44141 Ack=574 Win=65024 Len=1460 [TCP segment of a reassembled PDU],1
120,10.874081,100.86.111.80,23.61.11.185,TCP,1514,51475  >  443 [ACK] Seq=45601 Ack=574 Win=65024 Len=1460 [TCP segment of a reassembled PDU],1
121,10.874081,100.86.111.80,23.61.11.185,TCP,1514,51475  >  443 [ACK] Seq=47061 Ack=574 Win=65024 Len=1460 [TCP segment of a reassembled PDU],1
122,10.874081,100.86.111.80,23.61.11.185,TCP,1514,51475  >  443 [ACK] Seq=48521 Ack=574 Win=65024 Len=1460 [TCP segment of a reassembled PDU],1
123,10.884127,23.61.11.185,100.86.111.80,TCP,56,443  >  51475 [ACK] Seq=574 Ack=20781 Win=63360 Len=0,1
124,10.884296,100.86.111.80,23.61.11.185,TCP,1514,51475  >  443 [ACK] Seq=49981 Ack=574 Win=65024 Len=1460 [TCP segment of a reassembled PDU],1
125,10.884296,100.86.111.80,23.61.11.185,TCP,1514,51475  >  443 [ACK] Seq=51441 Ack=574 Win=65024 Len=1460 [TCP segment of a reassembled PDU],1
126,10.884296,100.86.111.80,23.61.11.185,TCP,1514,51475  >  443 [ACK] Seq=52901 Ack=574 Win=65024 Len=1460 [TCP segment of a reassembled PDU],1
127,10.884296,100.86.111.80,23.61.11.185,TLSv1.3,1514,Application Data,1
128,10.928646,100.86.111.80,23.61.11.185,TCP,54,51454  >  443 [ACK] Seq=57540 Ack=9740 Win=64768 Len=0,1
129,10.935491,23.61.11.185,100.86.111.80,TCP,56,443  >  51475 [ACK] Seq=574 Ack=26621 Win=59264 Len=0,1
130,10.935491,23.61.11.185,100.86.111.80,TCP,56,443  >  51475 [ACK] Seq=574 Ack=49981 Win=42752 Len=0,1
131,10.935659,100.86.111.80,23.61.11.185,TCP,1514,51475  >  443 [ACK] Seq=55821 Ack=574 Win=65024 Len=1460 [TCP segment of a reassembled PDU],1
132,10.935659,100.86.111.80,23.61.11.185,TCP,1514,51475  >  443 [ACK] Seq=57281 Ack=574 Win=65024 Len=1460 [TCP segment of a reassembled PDU],1
133,10.935659,100.86.111.80,23.61.11.185,TCP,1514,51475  >  443 [ACK] Seq=58741 Ack=574 Win=65024 Len=1460 [TCP segment of a reassembled PDU],1
134,10.935659,100.86.111.80,23.61.11.185,TCP,1514,51475  >  443 [ACK] Seq=60201 Ack=574 Win=65024 Len=1460 [TCP segment of a reassembled PDU],1
135,10.935659,100.86.111.80,23.61.11.185,TCP,1514,51475  >  443 [ACK] Seq=61661 Ack=574 Win=65024 Len=1460 [TCP segment of a reassembled PDU],1
136,10.935659,100.86.111.80,23.61.11.185,TCP,1514,51475  >  443 [ACK] Seq=63121 Ack=574 Win=65024 Len=1460 [TCP segment of a reassembled PDU],1
137,10.935659,100.86.111.80,23.61.11.185,TLSv1.3,95,Application Data,1
138,10.942233,23.61.11.185,100.86.111.80,TCP,56,443  >  51475 [ACK] Seq=574 Ack=55821 Win=61312 Len=0,1
139,10.954101,23.61.11.185,100.86.111.80,TCP,56,443  >  51475 [ACK] Seq=574 Ack=58741 Win=63360 Len=0,1
140,10.959189,23.61.11.185,100.86.111.80,TCP,56,443  >  51475 [ACK] Seq=574 Ack=64622 Win=64128 Len=0,1
141,11.018714,23.61.11.185,100.86.111.80,TCP,1514,443  >  51475 [ACK] Seq=574 Ack=64622 Win=64128 Len=1460 [TCP segment of a reassembled PDU],1
142,11.018714,23.61.11.185,100.86.111.80,TLSv1.3,489,Application Data,1
143,11.019023,100.86.111.80,23.61.11.185,TCP,54,51475  >  443 [ACK] Seq=64622 Ack=2469 Win=65536 Len=0,1
144,12.552244,100.86.111.80,23.61.11.185,TCP,1514,51475  >  443 [ACK] Seq=64622 Ack=2469 Win=65536 Len=1460 [TCP segment of a reassembled PDU],1
145,12.552244,100.86.111.80,23.61.11.185,TCP,1514,51475  >  443 [ACK] Seq=66082 Ack=2469 Win=65536 Len=1460 [TCP segment of a reassembled PDU],1
146,12.552244,100.86.111.80,23.61.11.185,TLSv1.3,1077,Application Data,1
147,12.593114,23.61.11.185,100.86.111.80,TCP,56,443  >  51475 [ACK] Seq=2469 Ack=68565 Win=64128 Len=0,1
148,12.650484,100.86.111.80,23.61.11.185,TCP,1514,51454  >  443 [ACK] Seq=57540 Ack=9740 Win=64768 Len=1460 [TCP segment of a reassembled PDU],1
149,12.650484,100.86.111.80,23.61.11.185,TCP,1514,51454  >  443 [ACK] Seq=59000 Ack=9740 Win=64768 Len=1460 [TCP segment of a reassembled PDU],1
150,12.650484,100.86.111.80,23.61.11.185,TLSv1.3,1231,Application Data,1
151,12.650682,100.86.111.80,23.61.11.185,TCP,1514,51454  >  443 [ACK] Seq=61637 Ack=9740 Win=64768 Len=1460 [TCP segment of a reassembled PDU],1
152,12.650682,100.86.111.80,23.61.11.185,TCP,1514,51454  >  443 [ACK] Seq=63097 Ack=9740 Win=64768 Len=1460 [TCP segment of a reassembled PDU],1
153,12.650682,100.86.111.80,23.61.11.185,TCP,1514,51454  >  443 [ACK] Seq=64557 Ack=9740 Win=64768 Len=1460 [TCP segment of a reassembled PDU],1
154,12.650682,100.86.111.80,23.61.11.185,TCP,1514,51454  >  443 [ACK] Seq=66017 Ack=9740 Win=64768 Len=1460 [TCP segment of a reassembled PDU],1
155,12.650682,100.86.111.80,23.61.11.185,TCP,1514,51454  >  443 [ACK] Seq=67477 Ack=9740 Win=64768 Len=1460 [TCP segment of a reassembled PDU],1
156,12.650682,100.86.111.80,23.61.11.185,TCP,1514,51454  >  443 [ACK] Seq=68937 Ack=9740 Win=64768 Len=1460 [TCP segment of a reassembled PDU],1
157,12.650682,100.86.111.80,23.61.11.185,TCP,1514,51454  >  443 [ACK] Seq=70397 Ack=9740 Win=64768 Len=1460 [TCP segment of a reassembled PDU],1
158,12.650682,100.86.111.80,23.61.11.185,TCP,1514,51454  >  443 [ACK] Seq=71857 Ack=9740 Win=64768 Len=1460 [TCP segment of a reassembled PDU],1
159,12.650682,100.86.111.80,23.61.11.185,TCP,1514,51454  >  443 [ACK] Seq=73317 Ack=9740 Win=64768 Len=1460 [TCP segment of a reassembled PDU],1
160,12.650682,100.86.111.80,23.61.11.185,TCP,1514,51454  >  443 [ACK] Seq=74777 Ack=9740 Win=64768 Len=1460 [TCP segment of a reassembled PDU],1
161,12.650682,100.86.111.80,23.61.11.185,TCP,1514,51454  >  443 [ACK] Seq=76237 Ack=9740 Win=64768 Len=1460 [TCP segment of a reassembled PDU],1
162,12.650682,100.86.111.80,23.61.11.185,TLSv1.3,1514,Application Data,1
163,12.650682,100.86.111.80,23.61.11.185,TCP,1514,51454  >  443 [ACK] Seq=79157 Ack=9740 Win=64768 Len=1460 [TCP segment of a reassembled PDU],1
164,12.650682,100.86.111.80,23.61.11.185,TCP,1514,51454  >  443 [ACK] Seq=80617 Ack=9740 Win=64768 Len=1460 [TCP segment of a reassembled PDU],1
165,12.650682,100.86.111.80,23.61.11.185,TCP,1514,51454  >  443 [ACK] Seq=82077 Ack=9740 Win=64768 Len=1460 [TCP segment of a reassembled PDU],1
166,12.650682,100.86.111.80,23.61.11.185,TCP,1514,51454  >  443 [ACK] Seq=83537 Ack=9740 Win=64768 Len=1460 [TCP segment of a reassembled PDU],1
167,12.650682,100.86.111.80,23.61.11.185,TCP,1514,51454  >  443 [ACK] Seq=84997 Ack=9740 Win=64768 Len=1460 [TCP segment of a reassembled PDU],1
168,12.650682,100.86.111.80,23.61.11.185,TCP,1514,51454  >  443 [ACK] Seq=86457 Ack=9740 Win=64768 Len=1460 [TCP segment of a reassembled PDU],1
169,12.650682,100.86.111.80,23.61.11.185,TCP,1514,51454  >  443 [ACK] Seq=87917 Ack=9740 Win=64768 Len=1460 [TCP segment of a reassembled PDU],1
170,12.650682,100.86.111.80,23.61.11.185,TCP,1514,51454  >  443 [ACK] Seq=89377 Ack=9740 Win=64768 Len=1460 [TCP segment of a reassembled PDU],1
171,12.650682,100.86.111.80,23.61.11.185,TCP,1514,51454  >  443 [ACK] Seq=90837 Ack=9740 Win=64768 Len=1460 [TCP segment of a reassembled PDU],1
172,12.650682,100.86.111.80,23.61.11.185,TCP,1514,51454  >  443 [ACK] Seq=92297 Ack=9740 Win=64768 Len=1460 [TCP segment of a reassembled PDU],1
173,12.650682,100.86.111.80,23.61.11.185,TLSv1.3,1514,Application Data,1
174,12.650682,100.86.111.80,23.61.11.185,TCP,1514,51454  >  443 [ACK] Seq=95217 Ack=9740 Win=64768 Len=1460 [TCP segment of a reassembled PDU],1
175,12.650682,100.86.111.80,23.61.11.185,TLSv1.3,871,Application Data,1
176,12.67153,23.61.11.185,100.86.111.80,TCP,56,443  >  51454 [ACK] Seq=9740 Ack=61637 Win=64128 Len=0,1
177,12.67153,23.61.11.185,100.86.111.80,TCP,56,443  >  51454 [ACK] Seq=9740 Ack=66017 Win=62336 Len=0,1
178,12.67153,23.61.11.185,100.86.111.80,TCP,56,443  >  51454 [ACK] Seq=9740 Ack=70397 Win=59264 Len=0,1
179,12.67153,23.61.11.185,100.86.111.80,TCP,56,443  >  51454 [ACK] Seq=9740 Ack=76237 Win=55168 Len=0,1
180,12.67153,23.61.11.185,100.86.111.80,TCP,56,443  >  51454 [ACK] Seq=9740 Ack=82077 Win=51072 Len=0,1
181,12.673324,23.61.11.185,100.86.111.80,TCP,56,443  >  51454 [ACK] Seq=9740 Ack=97494 Win=64128 Len=0,1
182,12.715024,100.86.111.80,23.61.11.185,TCP,66,51493  >  443 [SYN] Seq=0 Win=64240 Len=0 MSS=1460 WS=256 SACK_PERM,1
183,12.741782,23.61.11.185,100.86.111.80,TCP,1514,443  >  51475 [ACK] Seq=2469 Ack=68565 Win=64128 Len=1460 [TCP segment of a reassembled PDU],1
184,12.741967,23.61.11.185,100.86.111.80,TLSv1.3,681,Application Data,1
185,12.741967,23.61.11.185,100.86.111.80,TCP,66,"443  >  51493 [SYN, ACK] Seq=0 Ack=1 Win=64240 Len=0 MSS=1460 SACK_PERM WS=128",1
186,12.742316,100.86.111.80,23.61.11.185,TCP,54,51475  >  443 [ACK] Seq=68565 Ack=4556 Win=65536 Len=0,1
187,12.742403,100.86.111.80,23.61.11.185,TCP,54,51493  >  443 [ACK] Seq=1 Ack=1 Win=65536 Len=0,1
188,12.743911,100.86.111.80,23.61.11.185,TCP,1514,51493  >  443 [ACK] Seq=1 Ack=1 Win=65536 Len=1460 [TCP segment of a reassembled PDU],1
189,12.743911,100.86.111.80,23.61.11.185,TLSv1.3,677,Client Hello (SNI=rubicon.wellsfargo.com),1
190,12.750468,100.86.111.80,23.61.11.185,TCP,1514,51475  >  443 [ACK] Seq=68565 Ack=4556 Win=65536 Len=1460 [TCP segment of a reassembled PDU],1
191,12.750468,100.86.111.80,23.61.11.185,TCP,1514,51475  >  443 [ACK] Seq=70025 Ack=4556 Win=65536 Len=1460 [TCP segment of a reassembled PDU],1
192,12.750468,100.86.111.80,23.61.11.185,TLSv1.3,1514,Application Data,1
193,12.750468,100.86.111.80,23.61.11.185,TCP,1514,51475  >  443 [ACK] Seq=72945 Ack=4556 Win=65536 Len=1460 [TCP segment of a reassembled PDU],1
194,12.750468,100.86.111.80,23.61.11.185,TCP,1514,51475  >  443 [ACK] Seq=74405 Ack=4556 Win=65536 Len=1460 [TCP segment of a reassembled PDU],1
195,12.750468,100.86.111.80,23.61.11.185,TCP,1514,51475  >  443 [ACK] Seq=75865 Ack=4556 Win=65536 Len=1460 [TCP segment of a reassembled PDU],1
196,12.750468,100.86.111.80,23.61.11.185,TCP,1514,51475  >  443 [ACK] Seq=77325 Ack=4556 Win=65536 Len=1460 [TCP segment of a reassembled PDU],1
197,12.750468,100.86.111.80,23.61.11.185,TCP,1514,51475  >  443 [ACK] Seq=78785 Ack=4556 Win=65536 Len=1460 [TCP segment of a reassembled PDU],1
198,12.750468,100.86.111.80,23.61.11.185,TCP,1514,51475  >  443 [ACK] Seq=80245 Ack=4556 Win=65536 Len=1460 [TCP segment of a reassembled PDU],1
199,12.750468,100.86.111.80,23.61.11.185,TCP,1514,51475  >  443 [ACK] Seq=81705 Ack=4556 Win=65536 Len=1460 [TCP segment of a reassembled PDU],1
200,12.750468,100.86.111.80,23.61.11.185,TCP,1514,51475  >  443 [ACK] Seq=83165 Ack=4556 Win=65536 Len=1460 [TCP segment of a reassembled PDU],1
201,12.750468,100.86.111.80,23.61.11.185,TCP,1514,51475  >  443 [ACK] Seq=84625 Ack=4556 Win=65536 Len=1460 [TCP segment of a reassembled PDU],1
202,12.750468,100.86.111.80,23.61.11.185,TCP,1514,51475  >  443 [ACK] Seq=86085 Ack=4556 Win=65536 Len=1460 [TCP segment of a reassembled PDU],1
203,12.750468,100.86.111.80,23.61.11.185,TCP,1514,51475  >  443 [ACK] Seq=87545 Ack=4556 Win=65536 Len=1460 [TCP segment of a reassembled PDU],1
204,12.750468,100.86.111.80,23.61.11.185,TLSv1.3,1514,Application Data,1
205,12.750468,100.86.111.80,23.61.11.185,TCP,1514,51475  >  443 [ACK] Seq=90465 Ack=4556 Win=65536 Len=1460 [TCP segment of a reassembled PDU],1
206,12.750468,100.86.111.80,23.61.11.185,TCP,1514,51475  >  443 [ACK] Seq=91925 Ack=4556 Win=65536 Len=1460 [TCP segment of a reassembled PDU],1
207,12.750468,100.86.111.80,23.61.11.185,TCP,1514,51475  >  443 [ACK] Seq=93385 Ack=4556 Win=65536 Len=1460 [TCP segment of a reassembled PDU],1
208,12.750468,100.86.111.80,23.61.11.185,TCP,1514,51475  >  443 [ACK] Seq=94845 Ack=4556 Win=65536 Len=1460 [TCP segment of a reassembled PDU],1
209,12.750468,100.86.111.80,23.61.11.185,TCP,1514,51475  >  443 [ACK] Seq=96305 Ack=4556 Win=65536 Len=1460 [TCP segment of a reassembled PDU],1
210,12.750468,100.86.111.80,23.61.11.185,TCP,1514,51475  >  443 [ACK] Seq=97765 Ack=4556 Win=65536 Len=1460 [TCP segment of a reassembled PDU],1
211,12.750468,100.86.111.80,23.61.11.185,TCP,1514,51475  >  443 [ACK] Seq=99225 Ack=4556 Win=65536 Len=1460 [TCP segment of a reassembled PDU],1
212,12.750468,100.86.111.80,23.61.11.185,TCP,1514,51475  >  443 [ACK] Seq=100685 Ack=4556 Win=65536 Len=1460 [TCP segment of a reassembled PDU],1
213,12.750468,100.86.111.80,23.61.11.185,TCP,1514,51475  >  443 [ACK] Seq=102145 Ack=4556 Win=65536 Len=1460 [TCP segment of a reassembled PDU],1
214,12.750468,100.86.111.80,23.61.11.185,TCP,1514,51475  >  443 [ACK] Seq=103605 Ack=4556 Win=65536 Len=1460 [TCP segment of a reassembled PDU],1
215,12.750468,100.86.111.80,23.61.11.185,TLSv1.3,1514,Application Data,1
216,12.750468,100.86.111.80,23.61.11.185,TCP,1514,51475  >  443 [ACK] Seq=106525 Ack=4556 Win=65536 Len=1460 [TCP segment of a reassembled PDU],1
217,12.750468,100.86.111.80,23.61.11.185,TCP,1514,51475  >  443 [ACK] Seq=107985 Ack=4556 Win=65536 Len=1460 [TCP segment of a reassembled PDU],1
218,12.750468,100.86.111.80,23.61.11.185,TCP,1514,51475  >  443 [ACK] Seq=109445 Ack=4556 Win=65536 Len=1460 [TCP segment of a reassembled PDU],1
219,12.750468,100.86.111.80,23.61.11.185,TCP,1514,51475  >  443 [ACK] Seq=110905 Ack=4556 Win=65536 Len=1460 [TCP segment of a reassembled PDU],1
220,12.750468,100.86.111.80,23.61.11.185,TCP,1514,51475  >  443 [ACK] Seq=112365 Ack=4556 Win=65536 Len=1460 [TCP segment of a reassembled PDU],1
221,12.750468,100.86.111.80,23.61.11.185,TCP,1514,51475  >  443 [ACK] Seq=113825 Ack=4556 Win=65536 Len=1460 [TCP segment of a reassembled PDU],1
222,12.750468,100.86.111.80,23.61.11.185,TCP,1514,51475  >  443 [ACK] Seq=115285 Ack=4556 Win=65536 Len=1460 [TCP segment of a reassembled PDU],1
223,12.750468,100.86.111.80,23.61.11.185,TCP,1514,51475  >  443 [ACK] Seq=116745 Ack=4556 Win=65536 Len=1460 [TCP segment of a reassembled PDU],1
224,12.750468,100.86.111.80,23.61.11.185,TCP,1514,51475  >  443 [ACK] Seq=118205 Ack=4556 Win=65536 Len=1460 [TCP segment of a reassembled PDU],1
225,12.750468,100.86.111.80,23.61.11.185,TCP,1514,51475  >  443 [ACK] Seq=119665 Ack=4556 Win=65536 Len=1460 [TCP segment of a reassembled PDU],1
226,12.750468,100.86.111.80,23.61.11.185,TLSv1.3,1514,Application Data,1
227,12.750468,100.86.111.80,23.61.11.185,TCP,1514,51475  >  443 [ACK] Seq=122585 Ack=4556 Win=65536 Len=1460 [TCP segment of a reassembled PDU],1
228,12.750468,100.86.111.80,23.61.11.185,TCP,1514,51475  >  443 [ACK] Seq=124045 Ack=4556 Win=65536 Len=1460 [TCP segment of a reassembled PDU],1
229,12.750468,100.86.111.80,23.61.11.185,TCP,1514,51475  >  443 [ACK] Seq=125505 Ack=4556 Win=65536 Len=1460 [TCP segment of a reassembled PDU],1
230,12.750468,100.86.111.80,23.61.11.185,TCP,1514,51475  >  443 [ACK] Seq=126965 Ack=4556 Win=65536 Len=1460 [TCP segment of a reassembled PDU],1
231,12.750468,100.86.111.80,23.61.11.185,TCP,1514,51475  >  443 [ACK] Seq=128425 Ack=4556 Win=65536 Len=1460 [TCP segment of a reassembled PDU],1
232,12.750468,100.86.111.80,23.61.11.185,TCP,1514,51475  >  443 [ACK] Seq=129885 Ack=4556 Win=65536 Len=1460 [TCP segment of a reassembled PDU],1
233,12.765666,23.61.11.185,100.86.111.80,TCP,56,443  >  51493 [ACK] Seq=1 Ack=1461 Win=64128 Len=0,1
234,12.765666,23.61.11.185,100.86.111.80,TCP,56,443  >  51493 [ACK] Seq=1 Ack=2084 Win=64128 Len=0,1
235,12.766552,23.61.11.185,100.86.111.80,TLSv1.3,324,"Server Hello, Change Cipher Spec, Application Data, Application Data",1
236,12.766552,23.61.11.185,100.86.111.80,TCP,56,443  >  51475 [ACK] Seq=4556 Ack=78785 Win=84608 Len=0,1
237,12.766552,23.61.11.185,100.86.111.80,TCP,56,443  >  51475 [ACK] Seq=4556 Ack=84625 Win=96256 Len=0,1
238,12.766734,100.86.111.80,23.61.11.185,TCP,1514,51475  >  443 [ACK] Seq=131345 Ack=4556 Win=65536 Len=1460 [TCP segment of a reassembled PDU],1
239,12.766734,100.86.111.80,23.61.11.185,TLSv1.3,299,Application Data,1
240,12.768021,100.86.111.80,23.61.11.185,TLSv1.3,134,"Change Cipher Spec, Application Data",1
241,12.768731,23.61.11.185,100.86.111.80,TCP,56,443  >  51475 [ACK] Seq=4556 Ack=87545 Win=102144 Len=0,1
242,12.768731,23.61.11.185,100.86.111.80,TCP,56,443  >  51475 [ACK] Seq=4556 Ack=90465 Win=107904 Len=0,1
243,12.770867,23.61.11.185,100.86.111.80,TCP,56,443  >  51475 [ACK] Seq=4556 Ack=99225 Win=125440 Len=0,1
244,12.770867,23.61.11.185,100.86.111.80,TCP,56,443  >  51475 [ACK] Seq=4556 Ack=105065 Win=137088 Len=0,1
245,12.77097,23.61.11.185,100.86.111.80,TCP,56,443  >  51475 [ACK] Seq=4556 Ack=113825 Win=154624 Len=0,1
246,12.77097,23.61.11.185,100.86.111.80,TCP,56,443  >  51475 [ACK] Seq=4556 Ack=116745 Win=160512 Len=0,1
247,12.77097,23.61.11.185,100.86.111.80,TCP,56,443  >  51475 [ACK] Seq=4556 Ack=122585 Win=172160 Len=0,1
248,12.77097,23.61.11.185,100.86.111.80,TCP,56,443  >  51475 [ACK] Seq=4556 Ack=125505 Win=178048 Len=0,1
249,12.771981,23.61.11.185,100.86.111.80,TCP,56,443  >  51475 [ACK] Seq=4556 Ack=128425 Win=183808 Len=0,1
250,12.772054,23.61.11.185,100.86.111.80,TCP,56,443  >  51475 [ACK] Seq=4556 Ack=131345 Win=189696 Len=0,1
251,12.779283,23.61.11.185,100.86.111.80,TCP,56,443  >  51475 [ACK] Seq=4556 Ack=133050 Win=193152 Len=0,1
252,12.795685,23.61.11.185,100.86.111.80,TLSv1.3,940,Application Data,1
253,12.816839,23.61.11.185,100.86.111.80,TLSv1.3,357,Application Data,1
254,12.846,100.86.111.80,23.61.11.185,TCP,54,51454  >  443 [ACK] Seq=97494 Ack=10626 Win=65536 Len=0,1
255,12.860996,100.86.111.80,23.61.11.185,TCP,54,51493  >  443 [ACK] Seq=2164 Ack=574 Win=65024 Len=0,1
256,12.888342,23.61.11.185,100.86.111.80,TLSv1.3,938,Application Data,1
257,12.938494,100.86.111.80,23.61.11.185,TCP,54,51475  >  443 [ACK] Seq=133050 Ack=5440 Win=64768 Len=0,1
258,20.00917,100.86.111.80,23.61.11.185,TCP,1514,51475  >  443 [ACK] Seq=133050 Ack=5440 Win=64768 Len=1460 [TCP segment of a reassembled PDU],1
259,20.00917,100.86.111.80,23.61.11.185,TCP,1514,51475  >  443 [ACK] Seq=134510 Ack=5440 Win=64768 Len=1460 [TCP segment of a reassembled PDU],1
260,20.00917,100.86.111.80,23.61.11.185,TLSv1.3,1189,Application Data,1
261,20.020449,23.61.11.185,100.86.111.80,TCP,56,443  >  51475 [ACK] Seq=5440 Ack=137105 Win=201216 Len=0,1
262,20.099065,23.61.11.185,100.86.111.80,TCP,1514,443  >  51475 [ACK] Seq=5440 Ack=137105 Win=201216 Len=1460 [TCP segment of a reassembled PDU],1
263,20.099065,23.61.11.185,100.86.111.80,TLSv1.3,683,Application Data,1
264,20.099278,100.86.111.80,23.61.11.185,TCP,54,51475  >  443 [ACK] Seq=137105 Ack=7529 Win=65536 Len=0,1
265,20.215519,100.86.111.80,23.61.11.185,TCP,1514,51475  >  443 [ACK] Seq=137105 Ack=7529 Win=65536 Len=1460 [TCP segment of a reassembled PDU],1
266,20.215519,100.86.111.80,23.61.11.185,TCP,1514,51475  >  443 [ACK] Seq=138565 Ack=7529 Win=65536 Len=1460 [TCP segment of a reassembled PDU],1
267,20.215519,100.86.111.80,23.61.11.185,TLSv1.3,1514,Application Data,1
268,20.215519,100.86.111.80,23.61.11.185,TCP,1514,51475  >  443 [ACK] Seq=141485 Ack=7529 Win=65536 Len=1460 [TCP segment of a reassembled PDU],1
269,20.215519,100.86.111.80,23.61.11.185,TCP,1514,51475  >  443 [ACK] Seq=142945 Ack=7529 Win=65536 Len=1460 [TCP segment of a reassembled PDU],1
270,20.215519,100.86.111.80,23.61.11.185,TLSv1.3,303,Application Data[Illegal Segments],1
271,20.223273,100.86.111.80,23.61.11.185,TCP,1514,51454  >  443 [ACK] Seq=97494 Ack=10626 Win=65536 Len=1460 [TCP segment of a reassembled PDU],1
272,20.223273,100.86.111.80,23.61.11.185,TCP,1514,51454  >  443 [ACK] Seq=98954 Ack=10626 Win=65536 Len=1460 [TCP segment of a reassembled PDU],1
273,20.223273,100.86.111.80,23.61.11.185,TLSv1.3,1347,Application Data,1
274,20.22367,100.86.111.80,23.61.11.185,TCP,1514,51454  >  443 [ACK] Seq=101707 Ack=10626 Win=65536 Len=1460 [TCP segment of a reassembled PDU],1
275,20.22367,100.86.111.80,23.61.11.185,TCP,1514,51454  >  443 [ACK] Seq=103167 Ack=10626 Win=65536 Len=1460 [TCP segment of a reassembled PDU],1
276,20.22367,100.86.111.80,23.61.11.185,TCP,1514,51454  >  443 [ACK] Seq=104627 Ack=10626 Win=65536 Len=1460 [TCP segment of a reassembled PDU],1
277,20.22367,100.86.111.80,23.61.11.185,TCP,1514,51454  >  443 [ACK] Seq=106087 Ack=10626 Win=65536 Len=1460 [TCP segment of a reassembled PDU],1
278,20.22367,100.86.111.80,23.61.11.185,TCP,1514,51454  >  443 [ACK] Seq=107547 Ack=10626 Win=65536 Len=1460 [TCP segment of a reassembled PDU],1
279,20.22367,100.86.111.80,23.61.11.185,TCP,1514,51454  >  443 [ACK] Seq=109007 Ack=10626 Win=65536 Len=1460 [TCP segment of a reassembled PDU],1
280,20.22367,100.86.111.80,23.61.11.185,TCP,1514,51454  >  443 [ACK] Seq=110467 Ack=10626 Win=65536 Len=1460 [TCP segment of a reassembled PDU],1
281,20.22367,100.86.111.80,23.61.11.185,TCP,1514,51454  >  443 [ACK] Seq=111927 Ack=10626 Win=65536 Len=1460 [TCP segment of a reassembled PDU],1
282,20.22367,100.86.111.80,23.61.11.185,TCP,1514,51454  >  443 [ACK] Seq=113387 Ack=10626 Win=65536 Len=1460 [TCP segment of a reassembled PDU],1
283,20.22367,100.86.111.80,23.61.11.185,TCP,1514,51454  >  443 [ACK] Seq=114847 Ack=10626 Win=65536 Len=1460 [TCP segment of a reassembled PDU],1
284,20.22367,100.86.111.80,23.61.11.185,TCP,1514,51454  >  443 [ACK] Seq=116307 Ack=10626 Win=65536 Len=1460 [TCP segment of a reassembled PDU],1
285,20.22367,100.86.111.80,23.61.11.185,TLSv1.3,923,"Application Data, Application Data",1
286,20.22736,23.61.11.185,100.86.111.80,TCP,56,443  >  51475 [ACK] Seq=7529 Ack=140025 Win=207104 Len=0,1
287,20.22736,23.61.11.185,100.86.111.80,TCP,56,443  >  51475 [ACK] Seq=7529 Ack=144654 Win=216320 Len=0,1
288,20.234501,23.61.11.185,100.86.111.80,TCP,56,443  >  51454 [ACK] Seq=10626 Ack=98954 Win=67072 Len=0,1
289,20.237247,23.61.11.185,100.86.111.80,TCP,56,443  >  51454 [ACK] Seq=10626 Ack=101707 Win=72960 Len=0,1
290,20.237247,23.61.11.185,100.86.111.80,TCP,56,443  >  51454 [ACK] Seq=10626 Ack=103167 Win=75776 Len=0,1
291,20.237387,23.61.11.185,100.86.111.80,TCP,56,443  >  51454 [ACK] Seq=10626 Ack=109007 Win=87552 Len=0,1
292,20.237387,23.61.11.185,100.86.111.80,TCP,56,443  >  51454 [ACK] Seq=10626 Ack=113387 Win=96256 Len=0,1
293,20.237387,23.61.11.185,100.86.111.80,TCP,56,443  >  51454 [ACK] Seq=10626 Ack=118636 Win=106752 Len=0,1
294,20.285132,100.86.111.80,23.61.11.185,TCP,1514,51493  >  443 [ACK] Seq=2164 Ack=574 Win=65024 Len=1460 [TCP segment of a reassembled PDU],1
295,20.285132,100.86.111.80,23.61.11.185,TCP,1514,51493  >  443 [ACK] Seq=3624 Ack=574 Win=65024 Len=1460 [TCP segment of a reassembled PDU],1
296,20.285132,100.86.111.80,23.61.11.185,TLSv1.3,1514,Application Data,1
297,20.285132,100.86.111.80,23.61.11.185,TCP,1514,51493  >  443 [ACK] Seq=6544 Ack=574 Win=65024 Len=1460 [TCP segment of a reassembled PDU],1
298,20.285132,100.86.111.80,23.61.11.185,TCP,1514,51493  >  443 [ACK] Seq=8004 Ack=574 Win=65024 Len=1460 [TCP segment of a reassembled PDU],1
299,20.285132,100.86.111.80,23.61.11.185,TCP,1514,51493  >  443 [ACK] Seq=9464 Ack=574 Win=65024 Len=1460 [TCP segment of a reassembled PDU],1
300,20.285132,100.86.111.80,23.61.11.185,TCP,1514,51493  >  443 [ACK] Seq=10924 Ack=574 Win=65024 Len=1460 [TCP segment of a reassembled PDU],1
301,20.285132,100.86.111.80,23.61.11.185,TCP,1514,51493  >  443 [ACK] Seq=12384 Ack=574 Win=65024 Len=1460 [TCP segment of a reassembled PDU],1
302,20.285132,100.86.111.80,23.61.11.185,TCP,1514,51493  >  443 [ACK] Seq=13844 Ack=574 Win=65024 Len=1460 [TCP segment of a reassembled PDU],1
303,20.285132,100.86.111.80,23.61.11.185,TCP,1514,51493  >  443 [ACK] Seq=15304 Ack=574 Win=65024 Len=1460 [TCP segment of a reassembled PDU],1
304,20.285132,100.86.111.80,23.61.11.185,TCP,1514,51493  >  443 [ACK] Seq=16764 Ack=574 Win=65024 Len=1460 [TCP segment of a reassembled PDU],1
305,20.297276,23.61.11.185,100.86.111.80,TCP,56,443  >  51493 [ACK] Seq=574 Ack=9464 Win=60288 Len=0,1
306,20.297378,100.86.111.80,23.61.11.185,TLSv1.3,959,Application Data,1
307,20.305318,23.61.11.185,100.86.111.80,TCP,56,443  >  51493 [ACK] Seq=574 Ack=18224 Win=54144 Len=0,1
308,20.345287,23.61.11.185,100.86.111.80,TLSv1.3,938,Application Data,1
309,20.348692,23.61.11.185,100.86.111.80,TCP,56,443  >  51493 [ACK] Seq=574 Ack=19129 Win=64128 Len=0,1
310,20.367816,23.61.11.185,100.86.111.80,TLSv1.3,938,Application Data,1
311,20.398372,100.86.111.80,23.61.11.185,TCP,54,51475  >  443 [ACK] Seq=144654 Ack=8413 Win=64768 Len=0,1
312,20.413853,100.86.111.80,23.61.11.185,TCP,54,51454  >  443 [ACK] Seq=118636 Ack=11510 Win=64768 Len=0,1
313,20.46278,23.61.11.185,100.86.111.80,TLSv1.3,940,Application Data,1
314,20.509278,100.86.111.80,23.61.11.185,TCP,54,51493  >  443 [ACK] Seq=19129 Ack=1460 Win=64000 Len=0,1
315,29.73949,100.86.111.80,23.61.11.185,TCP,1514,51493  >  443 [ACK] Seq=19129 Ack=1460 Win=64000 Len=1460 [TCP segment of a reassembled PDU],1
316,29.73949,100.86.111.80,23.61.11.185,TCP,1514,51493  >  443 [ACK] Seq=20589 Ack=1460 Win=64000 Len=1460 [TCP segment of a reassembled PDU],1
317,29.73949,100.86.111.80,23.61.11.185,TLSv1.3,1514,Application Data,1
318,29.73949,100.86.111.80,23.61.11.185,TCP,1514,51493  >  443 [ACK] Seq=23509 Ack=1460 Win=64000 Len=1460 [TCP segment of a reassembled PDU],1
319,29.73949,100.86.111.80,23.61.11.185,TCP,1514,51493  >  443 [ACK] Seq=24969 Ack=1460 Win=64000 Len=1460 [TCP segment of a reassembled PDU],1
320,29.73949,100.86.111.80,23.61.11.185,TCP,1514,51493  >  443 [ACK] Seq=26429 Ack=1460 Win=64000 Len=1460 [TCP segment of a reassembled PDU],1
321,29.73949,100.86.111.80,23.61.11.185,TCP,1514,51493  >  443 [ACK] Seq=27889 Ack=1460 Win=64000 Len=1460 [TCP segment of a reassembled PDU],1
322,29.73949,100.86.111.80,23.61.11.185,TCP,1514,51493  >  443 [ACK] Seq=29349 Ack=1460 Win=64000 Len=1460 [TCP segment of a reassembled PDU],1
323,29.73949,100.86.111.80,23.61.11.185,TCP,1514,51493  >  443 [ACK] Seq=30809 Ack=1460 Win=64000 Len=1460 [TCP segment of a reassembled PDU],1
324,29.73949,100.86.111.80,23.61.11.185,TCP,1514,51493  >  443 [ACK] Seq=32269 Ack=1460 Win=64000 Len=1460 [TCP segment of a reassembled PDU],1
